a8w8_blockscale_tuned_gemm.csv
cu_num,M,N,K,kernelId,splitK,us,kernelName,tflops,bw,errRatio
304,16,1536,7168,8,0,19.3027,a8w8_blockscale_1x128x128_256x16x64x256_16x16_16x16_16x16x1_16x16x1_1x16x1x16_4_1x1_intrawave_v1,18.25,578.88,0.0
304,16,3072,1536,8,0,6.3665,a8w8_blockscale_1x128x128_256x16x64x256_16x16_16x16_16x16x1_16x16x1_1x16x1x16_4_1x1_intrawave_v1,23.72,760.46,0.0
304,16,576,7168,8,0,18.445,a8w8_blockscale_1x128x128_256x16x64x256_16x16_16x16_16x16x1_16x16x1_1x16x1x16_4_1x1_intrawave_v1,7.16,231.06,0.0
304,16,7168,256,8,0,3.6821,a8w8_blockscale_1x128x128_256x16x64x256_16x16_16x16_16x16x1_16x16x1_1x16x1x16_4_1x1_intrawave_v1,15.95,561.77,0.0
304,16,7168,2048,8,0,8.4152,a8w8_blockscale_1x128x128_256x16x64x256_16x16_16x16_16x16x1_16x16x1_1x16x1x16_4_1x1_intrawave_v1,55.82,1775.62,0.0
304,16,4608,7168,8,0,20.1448,a8w8_blockscale_1x128x128_256x16x64x256_16x16_16x16_16x16x1_16x16x1_1x16x1x16_4_1x1_intrawave_v1,52.47,1652.65,0.0
304,16,7168,2304,8,0,8.5899,a8w8_blockscale_1x128x128_256x16x64x256_16x16_16x16_16x16x1_16x16x1_1x16x1x16_4_1x1_intrawave_v1,61.52,1953.61,0.0
304,16,512,7168,8,0,18.3741,a8w8_blockscale_1x128x128_256x16x64x256_16x16_16x16_16x16x1_16x16x1_1x16x1x16_4_1x1_intrawave_v1,6.39,206.87,0.0
304,16,4096,512,8,0,4.0887,a8w8_blockscale_1x128x128_256x16x64x256_16x16_16x16_16x16x1_16x16x1_1x16x1x16_4_1x1_intrawave_v1,16.41,546.97,0.0
304,32,1536,7168,8,0,19.3628,a8w8_blockscale_1x128x128_256x16x64x256_16x16_16x16_16x16x1_16x16x1_1x16x1x16_4_1x1_intrawave_v1,36.39,585.54,0.0
304,32,3072,1536,8,0,7.7334,a8w8_blockscale_1x128x128_256x16x64x256_16x16_16x16_16x16x1_16x16x1_1x16x1x16_4_1x1_intrawave_v1,39.05,641.94,0.0
304,32,576,7168,8,0,18.3357,a8w8_blockscale_1x128x128_256x16x64x256_16x16_16x16_16x16x1_16x16x1_1x16x1x16_4_1x1_intrawave_v1,14.41,239.7,0.0
304,32,7168,256,8,0,3.9485,a8w8_blockscale_1x128x128_256x16x64x256_16x16_16x16_16x16x1_16x16x1_1x16x1x16_4_1x1_intrawave_v1,29.74,582.99,0.0
304,32,7168,2048,8,0,8.6275,a8w8_blockscale_1x128x128_256x16x64x256_16x16_16x16_16x16x1_16x16x1_1x16x1x16_4_1x1_intrawave_v1,108.9,1762.31,0.0
304,32,4608,7168,8,0,20.0214,a8w8_blockscale_1x128x128_256x16x64x256_16x16_16x16_16x16x1_16x16x1_1x16x1x16_4_1x1_intrawave_v1,105.58,1675.93,0.0
304,32,7168,2304,8,0,9.2396,a8w8_blockscale_1x128x128_256x16x64x256_16x16_16x16_16x16x1_16x16x1_1x16x1x16_4_1x1_intrawave_v1,114.4,1845.05,0.0
304,32,512,7168,8,0,18.2864,a8w8_blockscale_1x128x128_256x16x64x256_16x16_16x16_16x16x1_16x16x1_1x16x1x16_4_1x1_intrawave_v1,12.84,215.03,0.0
304,32,4096,512,11,0,4.0919,a8w8_blockscale_1x128x128_256x32x64x128_16x16_16x16_8x32x1_8x32x1_1x32x1x8_8_2x1_intrawave_v1,32.8,580.58,0.0
304,64,1536,7168,8,0,18.7255,a8w8_blockscale_1x128x128_256x16x64x256_16x16_16x16_16x16x1_16x16x1_1x16x1x16_4_1x1_intrawave_v1,75.26,622.97,0.0
304,64,3072,1536,8,0,7.6681,a8w8_blockscale_1x128x128_256x16x64x256_16x16_16x16_16x16x1_16x16x1_1x16x1x16_4_1x1_intrawave_v1,78.77,679.45,0.0
304,64,576,7168,8,0,17.8133,a8w8_blockscale_1x128x128_256x16x64x256_16x16_16x16_16x16x1_16x16x1_1x16x1x16_4_1x1_intrawave_v1,29.67,261.67,0.0
304,64,7168,256,13,0,4.0987,a8w8_blockscale_1x128x128_256x32x64x256_16x16_16x16_16x16x1_16x16x1_1x32x1x8_8_2x1_intrawave_v1,57.31,675.55,0.0
304,64,7168,2048,7,0,11.4514,a8w8_blockscale_1x128x128_256x16x128x256_16x16_16x16_16x16x1_16x16x1_1x16x1x16_8_1x2_intrawave_v1,164.09,1373.51,0.0
304,64,4608,7168,8,0,22.0564,a8w8_blockscale_1x128x128_256x16x64x256_16x16_16x16_16x16x1_16x16x1_1x16x1x16_4_1x1_intrawave_v1,191.68,1545.07,0.0
304,64,7168,2304,18,0,10.5805,a8w8_blockscale_1x128x128_256x64x64x256_16x16_32x32_16x16x1_16x16x1_1x32x1x8_8_1x1_intrawave_v1,199.79,1661.55,0.0
304,64,512,7168,8,0,17.8974,a8w8_blockscale_1x128x128_256x16x64x256_16x16_16x16_16x16x1_16x16x1_1x16x1x16_4_1x1_intrawave_v1,26.25,234.35,0.0
304,64,4096,512,13,0,4.2947,a8w8_blockscale_1x128x128_256x32x64x256_16x16_16x16_16x16x1_16x16x1_1x32x1x8_8_2x1_intrawave_v1,62.5,618.02,0.0
304,128,1536,7168,8,0,18.2772,a8w8_blockscale_1x128x128_256x16x64x256_16x16_16x16_16x16x1_16x16x1_1x16x1x16_4_1x1_intrawave_v1,154.21,674.11,0.0
304,128,3072,1536,7,0,8.1941,a8w8_blockscale_1x128x128_256x16x128x256_16x16_16x16_16x16x1_16x16x1_1x16x1x16_8_1x2_intrawave_v1,147.42,695.82,0.0
304,128,576,7168,8,0,17.3911,a8w8_blockscale_1x128x128_256x16x64x256_16x16_16x16_16x16x1_16x16x1_1x16x1x16_4_1x1_intrawave_v1,60.78,298.64,0.0
304,128,7168,256,13,0,4.2878,a8w8_blockscale_1x128x128_256x32x64x256_16x16_16x16_16x16x1_16x16x1_1x32x1x8_8_2x1_intrawave_v1,109.56,863.56,0.0
304,128,7168,2048,18,0,13.5886,a8w8_blockscale_1x128x128_256x64x64x256_16x16_32x32_16x16x1_16x16x1_1x32x1x8_8_1x1_intrawave_v1,276.56,1234.65,0.0
304,128,4608,7168,18,0,28.3855,a8w8_blockscale_1x128x128_256x64x64x256_16x16_32x32_16x16x1_16x16x1_1x32x1x8_8_1x1_intrawave_v1,297.89,1237.51,0.0
304,128,7168,2304,18,0,13.5457,a8w8_blockscale_1x128x128_256x64x64x256_16x16_32x32_16x16x1_16x16x1_1x32x1x8_8_1x1_intrawave_v1,312.12,1376.45,0.0
304,128,512,7168,8,0,17.3418,a8w8_blockscale_1x128x128_256x16x64x256_16x16_16x16_16x16x1_16x16x1_1x16x1x16_4_1x1_intrawave_v1,54.18,272.09,0.0
304,128,4096,512,13,0,4.0266,a8w8_blockscale_1x128x128_256x32x64x256_16x16_16x16_16x16x1_16x16x1_1x32x1x8_8_2x1_intrawave_v1,133.33,797.51,0.0
304,256,1536,7168,18,0,26.135,a8w8_blockscale_1x128x128_256x64x64x256_16x16_32x32_16x16x1_16x16x1_1x32x1x8_8_1x1_intrawave_v1,215.69,521.58,0.0
304,256,3072,1536,18,0,9.313,a8w8_blockscale_1x128x128_256x64x64x256_16x16_32x32_16x16x1_16x16x1_1x32x1x8_8_1x1_intrawave_v1,259.41,717.78,0.0
304,256,576,7168,8,0,17.5869,a8w8_blockscale_1x128x128_256x16x64x256_16x16_16x16_16x16x1_16x16x1_1x16x1x16_4_1x1_intrawave_v1,120.2,355.87,0.0
304,256,7168,256,11,0,5.4367,a8w8_blockscale_1x128x128_256x32x64x128_16x16_16x16_8x32x1_8x32x1_1x32x1x8_8_2x1_intrawave_v1,172.81,1024.62,0.0
304,256,7168,2048,18,0,20.3643,a8w8_blockscale_1x128x128_256x64x64x256_16x16_32x32_16x16x1_16x16x1_1x32x1x8_8_1x1_intrawave_v1,369.09,926.84,0.0
304,256,4608,7168,18,0,35.1072,a8w8_blockscale_1x128x128_256x64x64x256_16x16_32x32_16x16x1_16x16x1_1x32x1x8_8_1x1_intrawave_v1,481.71,1060.31,0.0
304,256,7168,2304,18,0,21.373,a8w8_blockscale_1x128x128_256x64x64x256_16x16_32x32_16x16x1_16x16x1_1x32x1x8_8_1x1_intrawave_v1,395.63,972.02,0.0
304,256,512,7168,8,0,17.3458,a8w8_blockscale_1x128x128_256x16x64x256_16x16_16x16_16x16x1_16x16x1_1x16x1x16_4_1x1_intrawave_v1,108.33,332.48,0.0
304,256,4096,512,13,0,5.527,a8w8_blockscale_1x128x128_256x32x64x256_16x16_16x16_16x16x1_16x16x1_1x32x1x8_8_2x1_intrawave_v1,194.27,782.59,0.0
304,512,1536,7168,18,0,29.0497,a8w8_blockscale_1x128x128_256x64x64x256_16x16_32x32_16x16x1_16x16x1_1x32x1x8_8_1x1_intrawave_v1,388.1,559.49,0.0
304,512,3072,1536,18,0,15.4449,a8w8_blockscale_1x128x128_256x64x64x256_16x16_32x32_16x16x1_16x16x1_1x32x1x8_8_1x1_intrawave_v1,312.84,560.1,0.0
304,512,576,7168,8,0,19.9201,a8w8_blockscale_1x128x128_256x16x64x256_16x16_16x16_16x16x1_16x16x1_1x16x1x16_4_1x1_intrawave_v1,212.24,421.11,0.0
304,512,7168,256,16,0,9.2368,a8w8_blockscale_1x128x128_256x64x64x128_16x16_32x32_8x32x1_8x32x1_1x32x1x8_8_1x1_intrawave_v1,203.43,1007.5,0.0
304,512,7168,2048,18,0,32.1588,a8w8_blockscale_1x128x128_256x64x64x256_16x16_32x32_16x16x1_16x16x1_1x32x1x8_8_1x1_intrawave_v1,467.44,717.34,0.0
304,512,4608,7168,18,0,63.1725,a8w8_blockscale_1x128x128_256x64x64x256_16x16_32x32_16x16x1_16x16x1_1x32x1x8_8_1x1_intrawave_v1,535.4,655.65,0.0
304,512,7168,2304,18,0,34.578,a8w8_blockscale_1x128x128_256x64x64x256_16x16_32x32_16x16x1_16x16x1_1x32x1x8_8_1x1_intrawave_v1,489.08,724.01,0.0
304,512,512,7168,8,0,18.6974,a8w8_blockscale_1x128x128_256x16x64x256_16x16_16x16_16x16x1_16x16x1_1x16x1x16_4_1x1_intrawave_v1,201.0,420.61,0.0
304,512,4096,512,18,0,8.938,a8w8_blockscale_1x128x128_256x64x64x256_16x16_32x32_16x16x1_16x16x1_1x32x1x8_8_1x1_intrawave_v1,240.26,733.23,0.0
304,1024,1536,7168,18,0,51.3271,a8w8_blockscale_1x128x128_256x64x64x256_16x16_32x32_16x16x1_16x16x1_1x32x1x8_8_1x1_intrawave_v1,439.31,418.8,0.0
304,1024,3072,1536,18,0,23.725,a8w8_blockscale_1x128x128_256x64x64x256_16x16_32x32_16x16x1_16x16x1_1x32x1x8_8_1x1_intrawave_v1,407.32,530.37,0.0
304,1024,576,7168,18,0,26.3561,a8w8_blockscale_1x128x128_256x64x64x256_16x16_32x32_16x16x1_16x16x1_1x32x1x8_8_1x1_intrawave_v1,320.83,479.91,0.0
304,1024,7168,256,16,0,14.7972,a8w8_blockscale_1x128x128_256x64x64x128_16x16_32x32_8x32x1_8x32x1_1x32x1x8_8_1x1_intrawave_v1,253.97,1133.81,0.0
304,1024,7168,2048,2,0,58.8708,a8w8_blockscale_1x128x128_256x64x128x128_16x16_32x32_8x32x1_8x32x1_1x32x1x8_8_1x1_intrawave_v3,510.69,534.34,0.0
304,1024,4608,7168,2,0,118.318,a8w8_blockscale_1x128x128_256x64x128x128_16x16_32x32_8x32x1_8x32x1_1x32x1x8_8_1x1_intrawave_v3,571.73,420.96,0.0
304,1024,7168,2304,2,0,61.0958,a8w8_blockscale_1x128x128_256x64x128x128_16x16_32x32_8x32x1_8x32x1_1x32x1x8_8_1x1_intrawave_v3,553.6,549.21,0.0
304,1024,512,7168,18,0,26.3088,a8w8_blockscale_1x128x128_256x64x64x256_16x16_32x32_16x16x1_16x16x1_1x32x1x8_8_1x1_intrawave_v1,285.69,458.35,0.0
304,1024,4096,512,1,0,15.3172,a8w8_blockscale_1x128x128_256x128x64x128_16x16_32x32_8x32x1_8x32x1_1x32x1x8_8_1x1_intrawave_v3,280.4,718.8,0.0
304,1536,1536,7168,18,0,62.5624,a8w8_blockscale_1x128x128_256x64x64x256_16x16_32x32_16x16x1_16x16x1_1x32x1x8_8_1x1_intrawave_v1,540.63,427.39,0.0
304,1536,3072,1536,2,0,31.4025,a8w8_blockscale_1x128x128_256x64x128x128_16x16_32x32_8x32x1_8x32x1_1x32x1x8_8_1x1_intrawave_v3,461.6,525.92,0.0
304,1536,576,7168,18,0,30.4839,a8w8_blockscale_1x128x128_256x64x64x256_16x16_32x32_16x16x1_16x16x1_1x32x1x8_8_1x1_intrawave_v1,416.07,554.66,0.0
304,1536,7168,256,16,0,20.3699,a8w8_blockscale_1x128x128_256x64x64x128_16x16_32x32_8x32x1_8x32x1_1x32x1x8_8_1x1_intrawave_v1,276.74,1190.4,0.0
304,1536,7168,2048,2,0,86.6485,a8w8_blockscale_1x128x128_256x64x128x128_16x16_32x32_8x32x1_8x32x1_1x32x1x8_8_1x1_intrawave_v3,520.46,459.86,0.0
304,1536,4608,7168,18,0,168.7271,a8w8_blockscale_1x128x128_256x64x64x256_16x16_32x32_16x16x1_16x16x1_1x32x1x8_8_1x1_intrawave_v1,601.38,344.91,0.0
304,1536,7168,2304,1,0,90.2419,a8w8_blockscale_1x128x128_256x128x64x128_16x16_32x32_8x32x1_8x32x1_1x32x1x8_8_1x1_intrawave_v3,562.2,466.24,0.0
304,1536,512,7168,18,0,29.3534,a8w8_blockscale_1x128x128_256x64x64x256_16x16_32x32_16x16x1_16x16x1_1x32x1x8_8_1x1_intrawave_v1,384.09,553.7,0.0
304,1536,4096,512,16,0,20.8282,a8w8_blockscale_1x128x128_256x64x64x128_16x16_32x32_8x32x1_8x32x1_1x32x1x8_8_1x1_intrawave_v1,309.31,742.57,0.0
304,2048,1536,7168,18,0,85.1823,a8w8_blockscale_1x128x128_256x64x64x256_16x16_32x32_16x16x1_16x16x1_1x32x1x8_8_1x1_intrawave_v1,529.42,375.45,0.0
304,2048,3072,1536,1,0,43.0399,a8w8_blockscale_1x128x128_256x128x64x128_16x16_32x32_8x32x1_8x32x1_1x32x1x8_8_1x1_intrawave_v3,449.06,475.08,0.0
304,2048,576,7168,18,0,33.8141,a8w8_blockscale_1x128x128_256x64x64x256_16x16_32x32_16x16x1_16x16x1_1x32x1x8_8_1x1_intrawave_v1,500.13,626.01,0.0
304,2048,7168,256,16,0,26.0316,a8w8_blockscale_1x128x128_256x64x64x128_16x16_32x32_8x32x1_8x32x1_1x32x1x8_8_1x1_intrawave_v1,288.73,1218.5,0.0
304,2048,7168,2048,0,0,100.0714,a8w8_blockscale_1x128x128_256x128x128x128_16x16_32x32_8x32x1_8x32x1_1x32x1x8_8_1x1_intrawave_v3,600.87,482.0,0.0
304,2048,4608,7168,0,0,195.6423,a8w8_blockscale_1x128x128_256x128x128x128_16x16_32x32_8x32x1_8x32x1_1x32x1x8_8_1x1_intrawave_v3,691.52,340.34,0.0
304,2048,7168,2304,0,0,104.2325,a8w8_blockscale_1x128x128_256x128x128x128_16x16_32x32_8x32x1_8x32x1_1x32x1x8_8_1x1_intrawave_v3,648.99,485.39,0.0
304,2048,512,7168,18,0,32.928,a8w8_blockscale_1x128x128_256x64x64x256_16x16_32x32_16x16x1_16x16x1_1x32x1x8_8_1x1_intrawave_v1,456.52,620.97,0.0
304,2048,4096,512,16,0,24.7433,a8w8_blockscale_1x128x128_256x64x64x128_16x16_32x32_8x32x1_8x32x1_1x32x1x8_8_1x1_intrawave_v1,347.16,805.19,0.0
304,4096,1536,7168,2,0,159.8759,a8w8_blockscale_1x128x128_256x64x128x128_16x16_32x32_8x32x1_8x32x1_1x32x1x8_8_1x1_intrawave_v3,564.15,331.21,0.0
304,4096,3072,1536,0,0,74.201,a8w8_blockscale_1x128x128_256x128x128x128_16x16_32x32_8x32x1_8x32x1_1x32x1x8_8_1x1_intrawave_v3,520.95,487.54,0.0
304,4096,576,7168,18,0,60.9716,a8w8_blockscale_1x128x128_256x64x64x256_16x16_32x32_16x16x1_16x16x1_1x32x1x8_8_1x1_intrawave_v1,554.73,626.64,0.0
304,4096,7168,256,16,0,47.0139,a8w8_blockscale_1x128x128_256x64x64x128_16x16_32x32_8x32x1_8x32x1_1x32x1x8_8_1x1_intrawave_v1,319.74,1310.33,0.0
304,4096,7168,2048,0,0,179.9207,a8w8_blockscale_1x128x128_256x128x128x128_16x16_32x32_8x32x1_8x32x1_1x32x1x8_8_1x1_intrawave_v3,668.4,454.58,0.0
304,4096,4608,7168,0,0,380.3572,a8w8_blockscale_1x128x128_256x128x128x128_16x16_32x32_8x32x1_8x32x1_1x32x1x8_8_1x1_intrawave_v3,711.39,263.28,0.0
304,4096,7168,2304,0,0,191.1207,a8w8_blockscale_1x128x128_256x128x128x128_16x16_32x32_8x32x1_8x32x1_1x32x1x8_8_1x1_intrawave_v3,707.88,443.03,0.0
304,4096,512,7168,18,0,57.6546,a8w8_blockscale_1x128x128_256x64x64x256_16x16_32x32_16x16x1_16x16x1_1x32x1x8_8_1x1_intrawave_v1,521.46,645.65,0.0
304,4096,4096,512,16,0,44.1624,a8w8_blockscale_1x128x128_256x64x64x128_16x16_32x32_8x32x1_8x32x1_1x32x1x8_8_1x1_intrawave_v1,389.02,854.77,0.0
304,8192,1536,7168,0,0,287.8441,a8w8_blockscale_1x128x128_256x128x128x128_16x16_32x32_8x32x1_8x32x1_1x32x1x8_8_1x1_intrawave_v3,626.69,329.68,0.0
304,8192,3072,1536,0,0,130.63,a8w8_blockscale_1x128x128_256x128x128x128_16x16_32x32_8x32x1_8x32x1_1x32x1x8_8_1x1_intrawave_v3,591.82,517.75,0.0
304,8192,576,7168,18,0,120.9992,a8w8_blockscale_1x128x128_256x64x64x256_16x16_32x32_16x16x1_16x16x1_1x32x1x8_8_1x1_intrawave_v1,559.06,597.41,0.0
304,8192,7168,256,16,0,90.8728,a8w8_blockscale_1x128x128_256x64x64x128_16x16_32x32_8x32x1_8x32x1_1x32x1x8_8_1x1_intrawave_v1,330.84,1335.63,0.0
304,8192,7168,2048,0,0,338.9763,a8w8_blockscale_1x128x128_256x128x128x128_16x16_32x32_8x32x1_8x32x1_1x32x1x8_8_1x1_intrawave_v3,709.54,439.26,0.0
304,8192,4608,7168,0,0,752.3135,a8w8_blockscale_1x128x128_256x128x128x128_16x16_32x32_8x32x1_8x32x1_1x32x1x8_8_1x1_intrawave_v3,719.34,222.31,0.0
304,8192,7168,2304,0,0,363.6814,a8w8_blockscale_1x128x128_256x128x128x128_16x16_32x32_8x32x1_8x32x1_1x32x1x8_8_1x1_intrawave_v3,744.01,420.23,0.0
304,8192,512,7168,2,0,106.6833,a8w8_blockscale_1x128x128_256x64x128x128_16x16_32x32_8x32x1_8x32x1_1x32x1x8_8_1x1_intrawave_v3,563.63,663.45,0.0
304,8192,4096,512,0,0,78.6845,a8w8_blockscale_1x128x128_256x128x128x128_16x16_32x32_8x32x1_8x32x1_1x32x1x8_8_1x1_intrawave_v3,436.68,932.84,0.0
304,16384,1536,7168,0,0,529.016,a8w8_blockscale_1x128x128_256x128x128x128_16x16_32x32_8x32x1_8x32x1_1x32x1x8_8_1x1_intrawave_v3,681.98,337.95,0.0
304,16384,3072,1536,0,0,239.4596,a8w8_blockscale_1x128x128_256x128x128x128_16x16_32x32_8x32x1_8x32x1_1x32x1x8_8_1x1_intrawave_v3,645.7,545.18,0.0
304,16384,576,7168,18,0,231.2541,a8w8_blockscale_1x128x128_256x64x64x256_16x16_32x32_16x16x1_16x16x1_1x32x1x8_8_1x1_intrawave_v1,585.03,607.31,0.0
304,16384,7168,256,16,0,179.2841,a8w8_blockscale_1x128x128_256x64x64x128_16x16_32x32_8x32x1_8x32x1_1x32x1x8_8_1x1_intrawave_v1,335.39,1343.74,0.0
304,16384,7168,2048,0,0,662.6852,a8w8_blockscale_1x128x128_256x128x128x128_16x16_32x32_8x32x1_8x32x1_1x32x1x8_8_1x1_intrawave_v3,725.89,427.22,0.0
304,16384,4608,7168,0,0,1496.6221,a8w8_blockscale_1x128x128_256x128x128x128_16x16_32x32_8x32x1_8x32x1_1x32x1x8_8_1x1_intrawave_v3,723.18,201.43,0.0
304,16384,7168,2304,0,0,701.1592,a8w8_blockscale_1x128x128_256x128x128x128_16x16_32x32_8x32x1_8x32x1_1x32x1x8_8_1x1_intrawave_v3,771.82,412.38,0.0
304,16384,512,7168,0,0,188.661,a8w8_blockscale_1x128x128_256x128x128x128_16x16_32x32_8x32x1_8x32x1_1x32x1x8_8_1x1_intrawave_v3,637.43,730.88,0.0
304,16384,4096,512,0,0,147.6227,a8w8_blockscale_1x128x128_256x128x128x128_16x16_32x32_8x32x1_8x32x1_1x32x1x8_8_1x1_intrawave_v3,465.51,980.23,0.0
304,20480,1536,7168,0,0,658.6636,a8w8_blockscale_1x128x128_256x128x128x128_16x16_32x32_8x32x1_8x32x1_1x32x1x8_8_1x1_intrawave_v3,684.68,335.11,0.0
304,20480,3072,1536,0,0,290.4131,a8w8_blockscale_1x128x128_256x128x128x128_16x16_32x32_8x32x1_8x32x1_1x32x1x8_8_1x1_intrawave_v3,665.51,557.84,0.0
304,20480,576,7168,18,0,284.82,a8w8_blockscale_1x128x128_256x64x64x256_16x16_32x32_16x16x1_16x16x1_1x32x1x8_8_1x1_intrawave_v1,593.76,612.75,0.0
304,20480,7168,256,16,0,224.572,a8w8_blockscale_1x128x128_256x64x64x128_16x16_32x32_8x32x1_8x32x1_1x32x1x8_8_1x1_intrawave_v1,334.69,1338.9,0.0
304,20480,7168,2048,0,0,821.1443,a8w8_blockscale_1x128x128_256x128x128x128_16x16_32x32_8x32x1_8x32x1_1x32x1x8_8_1x1_intrawave_v3,732.27,426.51,0.0
304,20480,4608,7168,0,0,1892.5384,a8w8_blockscale_1x128x128_256x128x128x128_16x16_32x32_8x32x1_8x32x1_1x32x1x8_8_1x1_intrawave_v3,714.87,194.75,0.0
304,20480,7168,2304,0,0,871.9052,a8w8_blockscale_1x128x128_256x128x128x128_16x16_32x32_8x32x1_8x32x1_1x32x1x8_8_1x1_intrawave_v3,775.84,409.79,0.0
304,20480,512,7168,2,0,256.7931,a8w8_blockscale_1x128x128_256x64x128x128_16x16_32x32_8x32x1_8x32x1_1x32x1x8_8_1x1_intrawave_v3,585.39,667.63,0.0
304,20480,4096,512,0,0,183.337,a8w8_blockscale_1x128x128_256x128x128x128_16x16_32x32_8x32x1_8x32x1_1x32x1x8_8_1x1_intrawave_v3,468.53,983.74,0.0
256,16,1536,7168,8,0,20.8535,a8w8_blockscale_1x128x128_256x16x64x256_16x16_16x16_16x16x1_16x16x1_1x16x1x16_4_1x1_intrawave_v1,16.9,535.83,0.0
256,16,576,7168,8,0,19.9031,a8w8_blockscale_1x128x128_256x16x64x256_16x16_16x16_16x16x1_16x16x1_1x16x1x16_4_1x1_intrawave_v1,6.64,214.13,0.0
256,16,7168,256,8,0,3.6287,a8w8_blockscale_1x128x128_256x16x64x256_16x16_16x16_16x16x1_16x16x1_1x16x1x16_4_1x1_intrawave_v1,16.18,570.03,0.0
256,16,4608,7168,8,0,21.2231,a8w8_blockscale_1x128x128_256x16x64x256_16x16_16x16_16x16x1_16x16x1_1x16x1x16_4_1x1_intrawave_v1,49.8,1568.68,0.0
256,16,7168,2304,8,0,8.6748,a8w8_blockscale_1x128x128_256x16x64x256_16x16_16x16_16x16x1_16x16x1_1x16x1x16_4_1x1_intrawave_v1,60.92,1934.49,0.0
256,16,512,7168,8,0,19.9419,a8w8_blockscale_1x128x128_256x16x64x256_16x16_16x16_16x16x1_16x16x1_1x16x1x16_4_1x1_intrawave_v1,5.89,190.61,0.0
256,32,1536,7168,8,0,20.7843,a8w8_blockscale_1x128x128_256x16x64x256_16x16_16x16_16x16x1_16x16x1_1x16x1x16_4_1x1_intrawave_v1,33.9,545.49,0.0
256,32,576,7168,8,0,19.9519,a8w8_blockscale_1x128x128_256x16x64x256_16x16_16x16_16x16x1_16x16x1_1x16x1x16_4_1x1_intrawave_v1,13.24,220.28,0.0
256,32,7168,256,7,0,3.6839,a8w8_blockscale_1x128x128_256x16x128x256_16x16_16x16_16x16x1_16x16x1_1x16x1x16_8_1x2_intrawave_v1,31.88,624.87,0.0
256,32,4608,7168,8,0,21.1971,a8w8_blockscale_1x128x128_256x16x64x256_16x16_16x16_16x16x1_16x16x1_1x16x1x16_4_1x1_intrawave_v1,99.73,1582.97,0.0
256,32,7168,2304,8,0,8.942,a8w8_blockscale_1x128x128_256x16x64x256_16x16_16x16_16x16x1_16x16x1_1x16x1x16_4_1x1_intrawave_v1,118.2,1906.46,0.0
256,32,512,7168,8,0,19.9219,a8w8_blockscale_1x128x128_256x16x64x256_16x16_16x16_16x16x1_16x16x1_1x16x1x16_4_1x1_intrawave_v1,11.79,197.38,0.0
256,64,1536,7168,8,0,20.5651,a8w8_blockscale_1x128x128_256x16x64x256_16x16_16x16_16x16x1_16x16x1_1x16x1x16_4_1x1_intrawave_v1,68.53,567.24,0.0
256,64,576,7168,8,0,19.7455,a8w8_blockscale_1x128x128_256x16x64x256_16x16_16x16_16x16x1_16x16x1_1x16x1x16_4_1x1_intrawave_v1,26.76,236.07,0.0
256,64,7168,256,11,0,3.7547,a8w8_blockscale_1x128x128_256x32x64x128_16x16_16x16_8x32x1_8x32x1_1x32x1x8_8_2x1_intrawave_v1,62.56,737.45,0.0
256,64,4608,7168,7,0,24.0952,a8w8_blockscale_1x128x128_256x16x128x256_16x16_16x16_16x16x1_16x16x1_1x16x1x16_8_1x2_intrawave_v1,175.46,1414.34,0.0
256,64,7168,2304,7,0,10.0892,a8w8_blockscale_1x128x128_256x16x128x256_16x16_16x16_16x16x1_16x16x1_1x16x1x16_8_1x2_intrawave_v1,209.52,1742.46,0.0
256,64,512,7168,8,0,19.6915,a8w8_blockscale_1x128x128_256x16x64x256_16x16_16x16_16x16x1_16x16x1_1x16x1x16_4_1x1_intrawave_v1,23.86,213.0,0.0
256,128,1536,7168,8,0,20.1019,a8w8_blockscale_1x128x128_256x16x64x256_16x16_16x16_16x16x1_16x16x1_1x16x1x16_4_1x1_intrawave_v1,140.21,612.92,0.0
256,128,576,7168,8,0,19.3303,a8w8_blockscale_1x128x128_256x16x64x256_16x16_16x16_16x16x1_16x16x1_1x16x1x16_4_1x1_intrawave_v1,54.68,268.68,0.0
256,128,7168,256,7,0,3.9827,a8w8_blockscale_1x128x128_256x16x128x256_16x16_16x16_16x16x1_16x16x1_1x16x1x16_8_1x2_intrawave_v1,117.95,929.72,0.0
256,128,4608,7168,18,0,24.7832,a8w8_blockscale_1x128x128_256x64x64x256_16x16_32x32_16x16x1_16x16x1_1x32x1x8_8_1x1_intrawave_v1,341.19,1417.38,0.0
256,128,7168,2304,18,0,11.0009,a8w8_blockscale_1x128x128_256x64x64x256_16x16_32x32_16x16x1_16x16x1_1x32x1x8_8_1x1_intrawave_v1,384.32,1694.86,0.0
256,128,512,7168,8,0,19.0891,a8w8_blockscale_1x128x128_256x16x64x256_16x16_16x16_16x16x1_16x16x1_1x16x1x16_4_1x1_intrawave_v1,49.22,247.19,0.0
256,256,1536,7168,7,0,23.4904,a8w8_blockscale_1x128x128_256x16x128x256_16x16_16x16_16x16x1_16x16x1_1x16x1x16_8_1x2_intrawave_v1,239.98,580.3,0.0
256,256,576,7168,8,0,19.6847,a8w8_blockscale_1x128x128_256x16x64x256_16x16_16x16_16x16x1_16x16x1_1x16x1x16_4_1x1_intrawave_v1,107.39,317.95,0.0
256,256,7168,256,18,0,5.6643,a8w8_blockscale_1x128x128_256x64x64x256_16x16_32x32_16x16x1_16x16x1_1x32x1x8_8_1x1_intrawave_v1,165.87,983.45,0.0
256,256,4608,7168,18,0,36.4007,a8w8_blockscale_1x128x128_256x64x64x256_16x16_32x32_16x16x1_16x16x1_1x32x1x8_8_1x1_intrawave_v1,464.59,1022.63,0.0
256,256,7168,2304,18,0,15.9582,a8w8_blockscale_1x128x128_256x64x64x256_16x16_32x32_16x16x1_16x16x1_1x32x1x8_8_1x1_intrawave_v1,529.87,1301.83,0.0
256,256,512,7168,8,0,19.4919,a8w8_blockscale_1x128x128_256x16x64x256_16x16_16x16_16x16x1_16x16x1_1x16x1x16_4_1x1_intrawave_v1,96.4,295.88,0.0
256,512,1536,7168,18,0,24.5324,a8w8_blockscale_1x128x128_256x64x64x256_16x16_32x32_16x16x1_16x16x1_1x32x1x8_8_1x1_intrawave_v1,459.57,662.51,0.0
256,512,576,7168,18,0,23.3536,a8w8_blockscale_1x128x128_256x64x64x256_16x16_32x32_16x16x1_16x16x1_1x32x1x8_8_1x1_intrawave_v1,181.04,359.2,0.0
256,512,7168,256,13,0,8.214,a8w8_blockscale_1x128x128_256x32x64x256_16x16_16x16_16x16x1_16x16x1_1x32x1x8_8_2x1_intrawave_v1,228.76,1132.96,0.0
256,512,4608,7168,18,0,58.822,a8w8_blockscale_1x128x128_256x64x64x256_16x16_32x32_16x16x1_16x16x1_1x32x1x8_8_1x1_intrawave_v1,575.0,704.14,0.0
256,512,7168,2304,18,0,28.4393,a8w8_blockscale_1x128x128_256x64x64x256_16x16_32x32_16x16x1_16x16x1_1x32x1x8_8_1x1_intrawave_v1,594.65,880.29,0.0
256,512,512,7168,8,0,20.1543,a8w8_blockscale_1x128x128_256x16x64x256_16x16_16x16_16x16x1_16x16x1_1x16x1x16_4_1x1_intrawave_v1,186.47,390.21,0.0
256,1024,1536,7168,18,0,36.4647,a8w8_blockscale_1x128x128_256x64x64x256_16x16_32x32_16x16x1_16x16x1_1x32x1x8_8_1x1_intrawave_v1,618.37,589.5,0.0
256,1024,576,7168,18,0,23.9404,a8w8_blockscale_1x128x128_256x64x64x256_16x16_32x32_16x16x1_16x16x1_1x32x1x8_8_1x1_intrawave_v1,353.2,528.33,0.0
256,1024,7168,256,16,0,12.6589,a8w8_blockscale_1x128x128_256x64x64x128_16x16_32x32_8x32x1_8x32x1_1x32x1x8_8_1x1_intrawave_v1,296.87,1325.33,0.0
256,1024,4608,7168,18,0,99.4691,a8w8_blockscale_1x128x128_256x64x64x256_16x16_32x32_16x16x1_16x16x1_1x32x1x8_8_1x1_intrawave_v1,680.07,500.73,0.0
256,1024,7168,2304,0,0,49.965,a8w8_blockscale_1x128x128_256x128x128x128_16x16_32x32_8x32x1_8x32x1_1x32x1x8_8_1x1_intrawave_v3,676.93,671.56,0.0
256,1024,512,7168,7,0,23.5068,a8w8_blockscale_1x128x128_256x16x128x256_16x16_16x16_16x16x1_16x16x1_1x16x1x16_8_1x2_intrawave_v1,319.75,512.98,0.0
256,1536,1536,7168,18,0,58.096,a8w8_blockscale_1x128x128_256x64x64x256_16x16_32x32_16x16x1_16x16x1_1x32x1x8_8_1x1_intrawave_v1,582.19,460.25,0.0
256,1536,576,7168,18,0,25.1476,a8w8_blockscale_1x128x128_256x64x64x256_16x16_32x32_16x16x1_16x16x1_1x32x1x8_8_1x1_intrawave_v1,504.37,672.36,0.0
256,1536,7168,256,18,0,16.5106,a8w8_blockscale_1x128x128_256x64x64x256_16x16_32x32_16x16x1_16x16x1_1x32x1x8_8_1x1_intrawave_v1,341.43,1468.65,0.0
256,1536,4608,7168,18,0,139.826,a8w8_blockscale_1x128x128_256x64x64x256_16x16_32x32_16x16x1_16x16x1_1x32x1x8_8_1x1_intrawave_v1,725.68,416.2,0.0
256,1536,7168,2304,0,0,73.8284,a8w8_blockscale_1x128x128_256x128x128x128_16x16_32x32_8x32x1_8x32x1_1x32x1x8_8_1x1_intrawave_v3,687.19,569.89,0.0
256,1536,512,7168,18,0,24.7692,a8w8_blockscale_1x128x128_256x64x64x256_16x16_32x32_16x16x1_16x16x1_1x32x1x8_8_1x1_intrawave_v1,455.17,656.17,0.0
256,2048,1536,7168,18,0,64.5154,a8w8_blockscale_1x128x128_256x64x64x256_16x16_32x32_16x16x1_16x16x1_1x32x1x8_8_1x1_intrawave_v1,699.01,495.72,0.0
256,2048,576,7168,18,0,35.1627,a8w8_blockscale_1x128x128_256x64x64x256_16x16_32x32_16x16x1_16x16x1_1x32x1x8_8_1x1_intrawave_v1,480.95,602.01,0.0
256,2048,7168,256,11,0,21.3779,a8w8_blockscale_1x128x128_256x32x64x128_16x16_16x16_8x32x1_8x32x1_1x32x1x8_8_2x1_intrawave_v1,351.59,1483.75,0.0
256,2048,4608,7168,18,0,180.0698,a8w8_blockscale_1x128x128_256x64x64x256_16x16_32x32_16x16x1_16x16x1_1x32x1x8_8_1x1_intrawave_v1,751.33,369.77,0.0
256,2048,7168,2304,0,0,92.2125,a8w8_blockscale_1x128x128_256x128x128x128_16x16_32x32_8x32x1_8x32x1_1x32x1x8_8_1x1_intrawave_v3,733.59,548.67,0.0
256,2048,512,7168,18,0,25.826,a8w8_blockscale_1x128x128_256x64x64x256_16x16_32x32_16x16x1_16x16x1_1x32x1x8_8_1x1_intrawave_v1,582.06,791.73,0.0
256,4096,1536,7168,18,0,124.0493,a8w8_blockscale_1x128x128_256x64x64x256_16x16_32x32_16x16x1_16x16x1_1x32x1x8_8_1x1_intrawave_v1,727.08,426.87,0.0
256,4096,576,7168,18,0,57.2232,a8w8_blockscale_1x128x128_256x64x64x256_16x16_32x32_16x16x1_16x16x1_1x32x1x8_8_1x1_intrawave_v1,591.07,667.69,0.0
256,4096,7168,256,18,0,37.2575,a8w8_blockscale_1x128x128_256x64x64x256_16x16_32x32_16x16x1_16x16x1_1x32x1x8_8_1x1_intrawave_v1,403.47,1653.46,0.0
256,4096,4608,7168,0,0,310.9487,a8w8_blockscale_1x128x128_256x128x128x128_16x16_32x32_8x32x1_8x32x1_1x32x1x8_8_1x1_intrawave_v3,870.19,322.04,0.0
256,4096,7168,2304,0,0,161.8222,a8w8_blockscale_1x128x128_256x128x128x128_16x16_32x32_8x32x1_8x32x1_1x32x1x8_8_1x1_intrawave_v3,836.05,523.24,0.0
256,4096,512,7168,18,0,44.5137,a8w8_blockscale_1x128x128_256x64x64x256_16x16_32x32_16x16x1_16x16x1_1x32x1x8_8_1x1_intrawave_v1,675.4,836.25,0.0
256,8192,1536,7168,0,0,210.661,a8w8_blockscale_1x128x128_256x128x128x128_16x16_32x32_8x32x1_8x32x1_1x32x1x8_8_1x1_intrawave_v3,856.3,450.47,0.0
256,8192,576,7168,18,0,101.6527,a8w8_blockscale_1x128x128_256x64x64x256_16x16_32x32_16x16x1_16x16x1_1x32x1x8_8_1x1_intrawave_v1,665.46,711.11,0.0
256,8192,7168,256,17,0,73.9508,a8w8_blockscale_1x128x128_256x64x128x256_16x16_32x32_16x16x1_16x16x1_1x32x1x8_8_1x1_intrawave_v1,406.55,1641.26,0.0
256,8192,4608,7168,0,0,539.5795,a8w8_blockscale_1x128x128_256x128x128x128_16x16_32x32_8x32x1_8x32x1_1x32x1x8_8_1x1_intrawave_v3,1002.94,309.96,0.0
256,8192,7168,2304,0,0,285.6152,a8w8_blockscale_1x128x128_256x128x128x128_16x16_32x32_8x32x1_8x32x1_1x32x1x8_8_1x1_intrawave_v3,947.37,535.09,0.0
256,8192,512,7168,18,0,86.0755,a8w8_blockscale_1x128x128_256x64x64x256_16x16_32x32_16x16x1_16x16x1_1x32x1x8_8_1x1_intrawave_v1,698.57,822.29,0.0
256,16384,1536,7168,0,0,371.4478,a8w8_blockscale_1x128x128_256x128x128x128_16x16_32x32_8x32x1_8x32x1_1x32x1x8_8_1x1_intrawave_v3,971.27,481.31,0.0
256,16384,576,7168,18,0,186.7632,a8w8_blockscale_1x128x128_256x64x64x256_16x16_32x32_16x16x1_16x16x1_1x32x1x8_8_1x1_intrawave_v1,724.4,751.99,0.0
256,16384,7168,256,17,0,141.6637,a8w8_blockscale_1x128x128_256x64x128x256_16x16_32x32_16x16x1_16x16x1_1x32x1x8_8_1x1_intrawave_v1,424.45,1700.58,0.0
256,16384,4608,7168,0,0,1046.6928,a8w8_blockscale_1x128x128_256x128x128x128_16x16_32x32_8x32x1_8x32x1_1x32x1x8_8_1x1_intrawave_v3,1034.05,288.02,0.0
256,16384,7168,2304,0,0,539.2895,a8w8_blockscale_1x128x128_256x128x128x128_16x16_32x32_8x32x1_8x32x1_1x32x1x8_8_1x1_intrawave_v3,1003.48,536.16,0.0
256,16384,512,7168,0,0,143.7706,a8w8_blockscale_1x128x128_256x128x128x128_16x16_32x32_8x32x1_8x32x1_1x32x1x8_8_1x1_intrawave_v3,836.47,959.08,0.0
256,20480,1536,7168,0,0,464.4401,a8w8_blockscale_1x128x128_256x128x128x128_16x16_32x32_8x32x1_8x32x1_1x32x1x8_8_1x1_intrawave_v3,971.0,475.25,0.0
256,20480,576,7168,18,0,230.9895,a8w8_blockscale_1x128x128_256x64x64x256_16x16_32x32_16x16x1_16x16x1_1x32x1x8_8_1x1_intrawave_v1,732.13,755.54,0.0
256,20480,7168,256,18,0,167.1547,a8w8_blockscale_1x128x128_256x64x64x256_16x16_32x32_16x16x1_16x16x1_1x32x1x8_8_1x1_intrawave_v1,449.65,1798.81,0.0
256,20480,4608,7168,0,0,1309.3769,a8w8_blockscale_1x128x128_256x128x128x128_16x16_32x32_8x32x1_8x32x1_1x32x1x8_8_1x1_intrawave_v3,1033.25,281.49,0.0
256,20480,7168,2304,0,0,670.7196,a8w8_blockscale_1x128x128_256x128x128x128_16x16_32x32_8x32x1_8x32x1_1x32x1x8_8_1x1_intrawave_v3,1008.55,532.71,0.0
256,20480,512,7168,2,0,193.5078,a8w8_blockscale_1x128x128_256x64x128x128_16x16_32x32_8x32x1_8x32x1_1x32x1x8_8_1x1_intrawave_v3,776.84,885.97,0.0
80,16,1536,7168,8,0,23.9251,a8w8_blockscale_1x128x128_256x16x64x256_16x16_16x16_16x16x1_16x16x1_1x16x1x16_4_1x1_intrawave_v1,14.73,467.04,0.0
80,16,3072,1536,8,0,8.4118,a8w8_blockscale_1x128x128_256x16x64x256_16x16_16x16_16x16x1_16x16x1_1x16x1x16_4_1x1_intrawave_v1,17.95,575.56,0.0
80,16,576,7168,8,0,23.4551,a8w8_blockscale_1x128x128_256x16x64x256_16x16_16x16_16x16x1_16x16x1_1x16x1x16_4_1x1_intrawave_v1,5.63,181.7,0.0
80,16,7168,256,8,0,4.0534,a8w8_blockscale_1x128x128_256x16x64x256_16x16_16x16_16x16x1_16x16x1_1x16x1x16_4_1x1_intrawave_v1,14.49,510.31,0.0
80,16,7168,2048,8,0,12.9347,a8w8_blockscale_1x128x128_256x16x64x256_16x16_16x16_16x16x1_16x16x1_1x16x1x16_4_1x1_intrawave_v1,36.32,1155.2,0.0
80,16,4608,7168,8,0,24.6427,a8w8_blockscale_1x128x128_256x16x64x256_16x16_16x16_16x16x1_16x16x1_1x16x1x16_4_1x1_intrawave_v1,42.89,1351.0,0.0
80,16,7168,2304,7,0,12.2382,a8w8_blockscale_1x128x128_256x16x128x256_16x16_16x16_16x16x1_16x16x1_1x16x1x16_8_1x2_intrawave_v1,43.18,1371.22,0.0
80,16,512,7168,8,0,23.3487,a8w8_blockscale_1x128x128_256x16x64x256_16x16_16x16_16x16x1_16x16x1_1x16x1x16_4_1x1_intrawave_v1,5.03,162.8,0.0
80,16,4096,512,8,0,4.2662,a8w8_blockscale_1x128x128_256x16x64x256_16x16_16x16_16x16x1_16x16x1_1x16x1x16_4_1x1_intrawave_v1,15.73,524.22,0.0
80,32,1536,7168,8,0,23.8595,a8w8_blockscale_1x128x128_256x16x64x256_16x16_16x16_16x16x1_16x16x1_1x16x1x16_4_1x1_intrawave_v1,29.53,475.19,0.0
80,32,3072,1536,8,0,10.1678,a8w8_blockscale_1x128x128_256x16x64x256_16x16_16x16_16x16x1_16x16x1_1x16x1x16_4_1x1_intrawave_v1,29.7,488.24,0.0
80,32,576,7168,8,0,23.4111,a8w8_blockscale_1x128x128_256x16x64x256_16x16_16x16_16x16x1_16x16x1_1x16x1x16_4_1x1_intrawave_v1,11.29,187.73,0.0
80,32,7168,256,11,0,4.8618,a8w8_blockscale_1x128x128_256x32x64x128_16x16_16x16_8x32x1_8x32x1_1x32x1x8_8_2x1_intrawave_v1,24.16,473.48,0.0
80,32,7168,2048,12,0,15.0959,a8w8_blockscale_1x128x128_256x32x128x256_16x16_32x32_16x16x1_16x16x1_1x32x1x8_8_1x1_intrawave_v1,62.24,1007.18,0.0
80,32,4608,7168,7,0,32.9403,a8w8_blockscale_1x128x128_256x16x128x256_16x16_16x16_16x16x1_16x16x1_1x16x1x16_8_1x2_intrawave_v1,64.17,1018.64,0.0
80,32,7168,2304,12,0,14.9967,a8w8_blockscale_1x128x128_256x32x128x256_16x16_32x32_16x16x1_16x16x1_1x32x1x8_8_1x1_intrawave_v1,70.48,1136.75,0.0
80,32,512,7168,8,0,23.3303,a8w8_blockscale_1x128x128_256x16x64x256_16x16_16x16_16x16x1_16x16x1_1x16x1x16_4_1x1_intrawave_v1,10.07,168.54,0.0
80,32,4096,512,13,0,4.8618,a8w8_blockscale_1x128x128_256x32x64x256_16x16_16x16_16x16x1_16x16x1_1x32x1x8_8_2x1_intrawave_v1,27.61,488.64,0.0
80,64,1536,7168,8,0,27.2559,a8w8_blockscale_1x128x128_256x16x64x256_16x16_16x16_16x16x1_16x16x1_1x16x1x16_4_1x1_intrawave_v1,51.71,428.0,0.0
80,64,3072,1536,18,0,10.6566,a8w8_blockscale_1x128x128_256x64x64x256_16x16_32x32_16x16x1_16x16x1_1x32x1x8_8_1x1_intrawave_v1,56.68,488.91,0.0
80,64,576,7168,8,0,23.0827,a8w8_blockscale_1x128x128_256x16x64x256_16x16_16x16_16x16x1_16x16x1_1x16x1x16_4_1x1_intrawave_v1,22.9,201.94,0.0
80,64,7168,256,11,0,7.015,a8w8_blockscale_1x128x128_256x32x64x128_16x16_16x16_8x32x1_8x32x1_1x32x1x8_8_2x1_intrawave_v1,33.48,394.71,0.0
80,64,7168,2048,18,0,21.5203,a8w8_blockscale_1x128x128_256x64x64x256_16x16_32x32_16x16x1_16x16x1_1x32x1x8_8_1x1_intrawave_v1,87.32,730.87,0.0
80,64,4608,7168,18,0,33.4247,a8w8_blockscale_1x128x128_256x64x64x256_16x16_32x32_16x16x1_16x16x1_1x32x1x8_8_1x1_intrawave_v1,126.49,1019.57,0.0
80,64,7168,2304,18,0,20.1871,a8w8_blockscale_1x128x128_256x64x64x256_16x16_32x32_16x16x1_16x16x1_1x32x1x8_8_1x1_intrawave_v1,104.72,870.85,0.0
80,64,512,7168,8,0,23.1571,a8w8_blockscale_1x128x128_256x16x64x256_16x16_16x16_16x16x1_16x16x1_1x16x1x16_4_1x1_intrawave_v1,20.29,181.12,0.0
80,64,4096,512,18,0,6.7134,a8w8_blockscale_1x128x128_256x64x64x256_16x16_32x32_16x16x1_16x16x1_1x32x1x8_8_1x1_intrawave_v1,39.99,395.36,0.0
80,128,1536,7168,18,0,32.4591,a8w8_blockscale_1x128x128_256x64x64x256_16x16_32x32_16x16x1_16x16x1_1x32x1x8_8_1x1_intrawave_v1,86.83,379.58,0.0
80,128,3072,1536,18,0,16.6331,a8w8_blockscale_1x128x128_256x64x64x256_16x16_32x32_16x16x1_16x16x1_1x32x1x8_8_1x1_intrawave_v1,72.62,342.79,0.0
80,128,576,7168,8,0,22.7915,a8w8_blockscale_1x128x128_256x16x64x256_16x16_16x16_16x16x1_16x16x1_1x16x1x16_4_1x1_intrawave_v1,46.38,227.88,0.0
80,128,7168,256,16,0,9.5886,a8w8_blockscale_1x128x128_256x64x64x128_16x16_32x32_8x32x1_8x32x1_1x32x1x8_8_1x1_intrawave_v1,48.99,386.17,0.0
80,128,7168,2048,18,0,29.8219,a8w8_blockscale_1x128x128_256x64x64x256_16x16_32x32_16x16x1_16x16x1_1x32x1x8_8_1x1_intrawave_v1,126.02,562.58,0.0
80,128,4608,7168,18,0,52.1776,a8w8_blockscale_1x128x128_256x64x64x256_16x16_32x32_16x16x1_16x16x1_1x32x1x8_8_1x1_intrawave_v1,162.06,673.23,0.0
80,128,7168,2304,18,0,30.3515,a8w8_blockscale_1x128x128_256x64x64x256_16x16_32x32_16x16x1_16x16x1_1x32x1x8_8_1x1_intrawave_v1,139.3,614.3,0.0
80,128,512,7168,8,0,23.0299,a8w8_blockscale_1x128x128_256x16x64x256_16x16_16x16_16x16x1_16x16x1_1x16x1x16_4_1x1_intrawave_v1,40.8,204.89,0.0
80,128,4096,512,18,0,9.695,a8w8_blockscale_1x128x128_256x64x64x256_16x16_32x32_16x16x1_16x16x1_1x32x1x8_8_1x1_intrawave_v1,55.38,331.23,0.0
80,256,1536,7168,18,0,48.3696,a8w8_blockscale_1x128x128_256x64x64x256_16x16_32x32_16x16x1_16x16x1_1x32x1x8_8_1x1_intrawave_v1,116.54,281.82,0.0
80,256,3072,1536,18,0,23.6371,a8w8_blockscale_1x128x128_256x64x64x256_16x16_32x32_16x16x1_16x16x1_1x32x1x8_8_1x1_intrawave_v1,102.21,282.8,0.0
80,256,576,7168,8,0,29.3363,a8w8_blockscale_1x128x128_256x16x64x256_16x16_16x16_16x16x1_16x16x1_1x16x1x16_4_1x1_intrawave_v1,72.06,213.34,0.0
80,256,7168,256,16,0,14.5362,a8w8_blockscale_1x128x128_256x64x64x128_16x16_32x32_8x32x1_8x32x1_1x32x1x8_8_1x1_intrawave_v1,64.63,383.22,0.0
80,256,7168,2048,18,0,53.1296,a8w8_blockscale_1x128x128_256x64x64x256_16x16_32x32_16x16x1_16x16x1_1x32x1x8_8_1x1_intrawave_v1,141.47,355.25,0.0
80,256,4608,7168,18,0,97.8358,a8w8_blockscale_1x128x128_256x64x64x256_16x16_32x32_16x16x1_16x16x1_1x32x1x8_8_1x1_intrawave_v1,172.86,380.48,0.0
80,256,7168,2304,18,0,55.3696,a8w8_blockscale_1x128x128_256x64x64x256_16x16_32x32_16x16x1_16x16x1_1x32x1x8_8_1x1_intrawave_v1,152.71,375.2,0.0
80,256,512,7168,8,0,28.7031,a8w8_blockscale_1x128x128_256x16x64x256_16x16_16x16_16x16x1_16x16x1_1x16x1x16_4_1x1_intrawave_v1,65.46,200.92,0.0
80,256,4096,512,16,0,15.7294,a8w8_blockscale_1x128x128_256x64x64x128_16x16_32x32_8x32x1_8x32x1_1x32x1x8_8_1x1_intrawave_v1,68.26,274.99,0.0
80,512,1536,7168,18,0,78.2381,a8w8_blockscale_1x128x128_256x64x64x256_16x16_32x32_16x16x1_16x16x1_1x32x1x8_8_1x1_intrawave_v1,144.1,207.74,0.0
80,512,3072,1536,18,0,36.9459,a8w8_blockscale_1x128x128_256x64x64x256_16x16_32x32_16x16x1_16x16x1_1x32x1x8_8_1x1_intrawave_v1,130.78,234.15,0.0
80,512,576,7168,18,0,32.2327,a8w8_blockscale_1x128x128_256x64x64x256_16x16_32x32_16x16x1_16x16x1_1x32x1x8_8_1x1_intrawave_v1,131.17,260.25,0.0
80,512,7168,256,16,0,24.5763,a8w8_blockscale_1x128x128_256x64x64x128_16x16_32x32_8x32x1_8x32x1_1x32x1x8_8_1x1_intrawave_v1,76.46,378.66,0.0
80,512,7168,2048,18,0,100.9298,a8w8_blockscale_1x128x128_256x64x64x256_16x16_32x32_16x16x1_16x16x1_1x32x1x8_8_1x1_intrawave_v1,148.94,228.56,0.0
80,512,4608,7168,18,0,188.8186,a8w8_blockscale_1x128x128_256x64x64x256_16x16_32x32_16x16x1_16x16x1_1x32x1x8_8_1x1_intrawave_v1,179.13,219.36,0.0
80,512,7168,2304,3,0,101.0378,a8w8_blockscale_1x128x128_256x64x64x128_16x16_32x32_8x32x1_8x32x1_1x32x1x8_8_1x1_intrawave_v3,167.38,247.78,0.0
80,512,512,7168,18,0,32.1923,a8w8_blockscale_1x128x128_256x64x64x256_16x16_32x32_16x16x1_16x16x1_1x32x1x8_8_1x1_intrawave_v1,116.74,244.29,0.0
80,512,4096,512,16,0,24.0675,a8w8_blockscale_1x128x128_256x64x64x128_16x16_32x32_8x32x1_8x32x1_1x32x1x8_8_1x1_intrawave_v1,89.23,272.3,0.0
80,1024,1536,7168,18,0,123.7307,a8w8_blockscale_1x128x128_256x64x64x256_16x16_32x32_16x16x1_16x16x1_1x32x1x8_8_1x1_intrawave_v1,182.24,173.73,0.0
80,1024,3072,1536,16,0,65.0637,a8w8_blockscale_1x128x128_256x64x64x128_16x16_32x32_8x32x1_8x32x1_1x32x1x8_8_1x1_intrawave_v1,148.53,193.39,0.0
80,1024,576,7168,18,0,49.8928,a8w8_blockscale_1x128x128_256x64x64x256_16x16_32x32_16x16x1_16x16x1_1x32x1x8_8_1x1_intrawave_v1,169.48,253.51,0.0
80,1024,7168,256,16,0,42.6144,a8w8_blockscale_1x128x128_256x64x64x128_16x16_32x32_8x32x1_8x32x1_1x32x1x8_8_1x1_intrawave_v1,88.19,393.7,0.0
80,1024,7168,2048,18,0,188.3418,a8w8_blockscale_1x128x128_256x64x64x256_16x16_32x32_16x16x1_16x16x1_1x32x1x8_8_1x1_intrawave_v1,159.63,167.02,0.0
80,1024,4608,7168,18,0,350.2185,a8w8_blockscale_1x128x128_256x64x64x256_16x16_32x32_16x16x1_16x16x1_1x32x1x8_8_1x1_intrawave_v1,193.15,142.22,0.0
80,1024,7168,2304,3,0,183.7845,a8w8_blockscale_1x128x128_256x64x64x128_16x16_32x32_8x32x1_8x32x1_1x32x1x8_8_1x1_intrawave_v3,184.04,182.57,0.0
80,1024,512,7168,18,0,49.1544,a8w8_blockscale_1x128x128_256x64x64x256_16x16_32x32_16x16x1_16x16x1_1x32x1x8_8_1x1_intrawave_v1,152.91,245.32,0.0
80,1024,4096,512,16,0,39.5012,a8w8_blockscale_1x128x128_256x64x64x128_16x16_32x32_8x32x1_8x32x1_1x32x1x8_8_1x1_intrawave_v1,108.73,278.73,0.0
80,1536,1536,7168,18,0,189.361,a8w8_blockscale_1x128x128_256x64x64x256_16x16_32x32_16x16x1_16x16x1_1x32x1x8_8_1x1_intrawave_v1,178.62,141.2,0.0
80,1536,3072,1536,16,0,92.7146,a8w8_blockscale_1x128x128_256x64x64x128_16x16_32x32_8x32x1_8x32x1_1x32x1x8_8_1x1_intrawave_v1,156.35,178.13,0.0
80,1536,576,7168,18,0,78.9361,a8w8_blockscale_1x128x128_256x64x64x256_16x16_32x32_16x16x1_16x16x1_1x32x1x8_8_1x1_intrawave_v1,160.68,214.2,0.0
80,1536,7168,256,16,0,60.2732,a8w8_blockscale_1x128x128_256x64x64x128_16x16_32x32_8x32x1_8x32x1_1x32x1x8_8_1x1_intrawave_v1,93.53,402.31,0.0
80,1536,7168,2048,2,0,264.6833,a8w8_blockscale_1x128x128_256x64x128x128_16x16_32x32_8x32x1_8x32x1_1x32x1x8_8_1x1_intrawave_v3,170.38,150.54,0.0
80,1536,4608,7168,18,0,510.7043,a8w8_blockscale_1x128x128_256x64x64x256_16x16_32x32_16x16x1_16x16x1_1x32x1x8_8_1x1_intrawave_v1,198.68,113.95,0.0
80,1536,7168,2304,3,0,265.1321,a8w8_blockscale_1x128x128_256x64x64x128_16x16_32x32_8x32x1_8x32x1_1x32x1x8_8_1x1_intrawave_v3,191.35,158.69,0.0
80,1536,512,7168,18,0,78.5197,a8w8_blockscale_1x128x128_256x64x64x256_16x16_32x32_16x16x1_16x16x1_1x32x1x8_8_1x1_intrawave_v1,143.59,206.99,0.0
80,1536,4096,512,16,0,56.6284,a8w8_blockscale_1x128x128_256x64x64x128_16x16_32x32_8x32x1_8x32x1_1x32x1x8_8_1x1_intrawave_v1,113.77,273.12,0.0
80,2048,1536,7168,18,0,235.344,a8w8_blockscale_1x128x128_256x64x64x256_16x16_32x32_16x16x1_16x16x1_1x32x1x8_8_1x1_intrawave_v1,191.62,135.89,0.0
80,2048,3072,1536,16,0,120.9511,a8w8_blockscale_1x128x128_256x64x64x128_16x16_32x32_8x32x1_8x32x1_1x32x1x8_8_1x1_intrawave_v1,159.79,169.05,0.0
80,2048,576,7168,18,0,97.8062,a8w8_blockscale_1x128x128_256x64x64x256_16x16_32x32_16x16x1_16x16x1_1x32x1x8_8_1x1_intrawave_v1,172.91,216.43,0.0
80,2048,7168,256,16,0,77.9877,a8w8_blockscale_1x128x128_256x64x64x128_16x16_32x32_8x32x1_8x32x1_1x32x1x8_8_1x1_intrawave_v1,96.38,406.72,0.0
80,2048,7168,2048,2,0,352.5768,a8w8_blockscale_1x128x128_256x64x128x128_16x16_32x32_8x32x1_8x32x1_1x32x1x8_8_1x1_intrawave_v3,170.54,136.81,0.0
80,2048,4608,7168,18,0,668.9049,a8w8_blockscale_1x128x128_256x64x64x256_16x16_32x32_16x16x1_16x16x1_1x32x1x8_8_1x1_intrawave_v1,202.26,99.54,0.0
80,2048,7168,2304,3,0,347.5556,a8w8_blockscale_1x128x128_256x64x64x128_16x16_32x32_8x32x1_8x32x1_1x32x1x8_8_1x1_intrawave_v3,194.63,145.57,0.0
80,2048,512,7168,18,0,96.7626,a8w8_blockscale_1x128x128_256x64x64x256_16x16_32x32_16x16x1_16x16x1_1x32x1x8_8_1x1_intrawave_v1,155.35,211.31,0.0
80,2048,4096,512,16,0,71.9193,a8w8_blockscale_1x128x128_256x64x64x128_16x16_32x32_8x32x1_8x32x1_1x32x1x8_8_1x1_intrawave_v1,119.44,277.02,0.0
80,4096,1536,7168,18,0,463.9265,a8w8_blockscale_1x128x128_256x64x64x256_16x16_32x32_16x16x1_16x16x1_1x32x1x8_8_1x1_intrawave_v1,194.42,114.14,0.0
80,4096,3072,1536,16,0,226.6147,a8w8_blockscale_1x128x128_256x64x64x128_16x16_32x32_8x32x1_8x32x1_1x32x1x8_8_1x1_intrawave_v1,170.57,159.64,0.0
80,4096,576,7168,18,0,188.7622,a8w8_blockscale_1x128x128_256x64x64x256_16x16_32x32_16x16x1_16x16x1_1x32x1x8_8_1x1_intrawave_v1,179.18,202.41,0.0
80,4096,7168,256,16,0,149.8256,a8w8_blockscale_1x128x128_256x64x64x128_16x16_32x32_8x32x1_8x32x1_1x32x1x8_8_1x1_intrawave_v1,100.33,411.17,0.0
80,4096,7168,2048,2,0,677.8042,a8w8_blockscale_1x128x128_256x64x128x128_16x16_32x32_8x32x1_8x32x1_1x32x1x8_8_1x1_intrawave_v3,177.42,120.67,0.0
80,4096,4608,7168,2,0,1326.7729,a8w8_blockscale_1x128x128_256x64x128x128_16x16_32x32_8x32x1_8x32x1_1x32x1x8_8_1x1_intrawave_v3,203.94,75.48,0.0
80,4096,7168,2304,3,0,680.0186,a8w8_blockscale_1x128x128_256x64x64x128_16x16_32x32_8x32x1_8x32x1_1x32x1x8_8_1x1_intrawave_v3,198.95,124.51,0.0
80,4096,512,7168,18,0,170.3257,a8w8_blockscale_1x128x128_256x64x64x256_16x16_32x32_16x16x1_16x16x1_1x32x1x8_8_1x1_intrawave_v1,176.51,218.55,0.0
80,4096,4096,512,16,0,135.4396,a8w8_blockscale_1x128x128_256x64x64x128_16x16_32x32_8x32x1_8x32x1_1x32x1x8_8_1x1_intrawave_v1,126.85,278.71,0.0
80,8192,1536,7168,18,0,900.4323,a8w8_blockscale_1x128x128_256x64x64x256_16x16_32x32_16x16x1_16x16x1_1x32x1x8_8_1x1_intrawave_v1,200.34,105.39,0.0
80,8192,3072,1536,16,0,438.686,a8w8_blockscale_1x128x128_256x64x64x128_16x16_32x32_8x32x1_8x32x1_1x32x1x8_8_1x1_intrawave_v1,176.23,154.17,0.0
80,8192,576,7168,18,0,353.3597,a8w8_blockscale_1x128x128_256x64x64x256_16x16_32x32_16x16x1_16x16x1_1x32x1x8_8_1x1_intrawave_v1,191.44,204.57,0.0
80,8192,7168,256,16,0,293.267,a8w8_blockscale_1x128x128_256x64x64x128_16x16_32x32_8x32x1_8x32x1_1x32x1x8_8_1x1_intrawave_v1,102.52,413.86,0.0
80,8192,7168,2048,0,0,1332.8349,a8w8_blockscale_1x128x128_256x128x128x128_16x16_32x32_8x32x1_8x32x1_1x32x1x8_8_1x1_intrawave_v3,180.46,111.72,0.0
80,8192,4608,7168,2,0,2612.1569,a8w8_blockscale_1x128x128_256x64x128x128_16x16_32x32_8x32x1_8x32x1_1x32x1x8_8_1x1_intrawave_v3,207.17,64.03,0.0
80,8192,7168,2304,3,0,1342.3805,a8w8_blockscale_1x128x128_256x64x64x128_16x16_32x32_8x32x1_8x32x1_1x32x1x8_8_1x1_intrawave_v3,201.57,113.85,0.0
80,8192,512,7168,18,0,312.3499,a8w8_blockscale_1x128x128_256x64x64x256_16x16_32x32_16x16x1_16x16x1_1x32x1x8_8_1x1_intrawave_v1,192.51,226.6,0.0
80,8192,4096,512,16,0,262.4441,a8w8_blockscale_1x128x128_256x64x64x128_16x16_32x32_8x32x1_8x32x1_1x32x1x8_8_1x1_intrawave_v1,130.92,279.68,0.0
80,16384,1536,7168,18,0,1774.7531,a8w8_blockscale_1x128x128_256x64x64x256_16x16_32x32_16x16x1_16x16x1_1x32x1x8_8_1x1_intrawave_v1,203.28,100.74,0.0
80,16384,3072,1536,16,0,862.8613,a8w8_blockscale_1x128x128_256x64x64x128_16x16_32x32_8x32x1_8x32x1_1x32x1x8_8_1x1_intrawave_v1,179.19,151.3,0.0
80,16384,576,7168,18,0,679.861,a8w8_blockscale_1x128x128_256x64x64x256_16x16_32x32_16x16x1_16x16x1_1x32x1x8_8_1x1_intrawave_v1,199.0,206.58,0.0
80,16384,7168,256,16,0,579.5334,a8w8_blockscale_1x128x128_256x64x64x128_16x16_32x32_8x32x1_8x32x1_1x32x1x8_8_1x1_intrawave_v1,103.76,415.7,0.0
80,16384,7168,2048,0,0,2650.6467,a8w8_blockscale_1x128x128_256x128x128x128_16x16_32x32_8x32x1_8x32x1_1x32x1x8_8_1x1_intrawave_v3,181.48,106.81,0.0
80,16384,4608,7168,2,0,5184.7895,a8w8_blockscale_1x128x128_256x64x128x128_16x16_32x32_8x32x1_8x32x1_1x32x1x8_8_1x1_intrawave_v3,208.75,58.14,0.0
80,16384,7168,2304,3,0,2670.4624,a8w8_blockscale_1x128x128_256x64x64x128_16x16_32x32_8x32x1_8x32x1_1x32x1x8_8_1x1_intrawave_v3,202.65,108.28,0.0
80,16384,512,7168,18,0,612.0559,a8w8_blockscale_1x128x128_256x64x64x256_16x16_32x32_16x16x1_16x16x1_1x32x1x8_8_1x1_intrawave_v1,196.48,225.29,0.0
80,16384,4096,512,16,0,517.0127,a8w8_blockscale_1x128x128_256x64x64x128_16x16_32x32_8x32x1_8x32x1_1x32x1x8_8_1x1_intrawave_v1,132.92,279.88,0.0
80,20480,1536,7168,2,0,2192.846,a8w8_blockscale_1x128x128_256x64x128x128_16x16_32x32_8x32x1_8x32x1_1x32x1x8_8_1x1_intrawave_v3,205.66,100.66,0.0
80,20480,3072,1536,16,0,1076.861,a8w8_blockscale_1x128x128_256x64x64x128_16x16_32x32_8x32x1_8x32x1_1x32x1x8_8_1x1_intrawave_v1,179.48,150.44,0.0
80,20480,576,7168,18,0,844.2841,a8w8_blockscale_1x128x128_256x64x64x256_16x16_32x32_16x16x1_16x16x1_1x32x1x8_8_1x1_intrawave_v1,200.31,206.71,0.0
80,20480,7168,256,16,0,723.218,a8w8_blockscale_1x128x128_256x64x64x128_16x16_32x32_8x32x1_8x32x1_1x32x1x8_8_1x1_intrawave_v1,103.93,415.75,0.0
80,20480,7168,2048,0,0,3312.2434,a8w8_blockscale_1x128x128_256x128x128x128_16x16_32x32_8x32x1_8x32x1_1x32x1x8_8_1x1_intrawave_v3,181.54,105.74,0.0
80,20480,4608,7168,2,0,6440.0431,a8w8_blockscale_1x128x128_256x64x128x128_16x16_32x32_8x32x1_8x32x1_1x32x1x8_8_1x1_intrawave_v3,210.08,57.23,0.0
80,20480,7168,2304,3,0,3334.2791,a8w8_blockscale_1x128x128_256x64x64x128_16x16_32x32_8x32x1_8x32x1_1x32x1x8_8_1x1_intrawave_v3,202.88,107.16,0.0
80,20480,512,7168,18,0,758.3905,a8w8_blockscale_1x128x128_256x64x64x256_16x16_32x32_16x16x1_16x16x1_1x32x1x8_8_1x1_intrawave_v1,198.21,226.06,0.0
80,20480,4096,512,16,0,643.2625,a8w8_blockscale_1x128x128_256x64x64x128_16x16_32x32_8x32x1_8x32x1_1x32x1x8_8_1x1_intrawave_v1,133.54,280.38,0.0
256,1,1280,8192,8,0,26.7354,a8w8_blockscale_1x128x128_256x16x64x256_16x16_16x16_16x16x1_16x16x1_1x16x1x16_4_1x1_intrawave_v1,0.78,392.61,0.0
256,1,2560,8192,8,0,26.3795,a8w8_blockscale_1x128x128_256x16x64x256_16x16_16x16_16x16x1_16x16x1_1x16x1x16_4_1x1_intrawave_v1,1.59,795.5,0.0
256,1,7168,8192,8,0,27.4028,a8w8_blockscale_1x128x128_256x16x64x256_16x16_16x16_16x16x1_16x16x1_1x16x1x16_4_1x1_intrawave_v1,4.29,2143.68,0.0
256,1,8192,1024,8,0,6.0794,a8w8_blockscale_1x128x128_256x16x64x256_16x16_16x16_16x16x1_16x16x1_1x16x1x16_4_1x1_intrawave_v1,2.76,1382.7,0.0
256,1,8192,2048,18,0,9.7005,a8w8_blockscale_1x128x128_256x64x64x256_16x16_32x32_16x16x1_16x16x1_1x32x1x8_8_1x1_intrawave_v1,3.46,1731.42,0.0
256,1,8192,3584,8,0,13.1,a8w8_blockscale_1x128x128_256x16x64x256_16x16_16x16_16x16x1_16x16x1_1x16x1x16_4_1x1_intrawave_v1,4.48,2242.76,0.0
256,1,8192,7168,8,0,24.4903,a8w8_blockscale_1x128x128_256x16x64x256_16x16_16x16_16x16x1_16x16x1_1x16x1x16_4_1x1_intrawave_v1,4.8,2398.66,0.0
256,1,8192,8192,8,0,27.8749,a8w8_blockscale_1x128x128_256x16x64x256_16x16_16x16_16x16x1_16x16x1_1x16x1x16_4_1x1_intrawave_v1,4.82,2408.38,0.0
256,1,8192,28672,8,0,94.1079,a8w8_blockscale_1x128x128_256x16x64x256_16x16_16x16_16x16x1_16x16x1_1x16x1x16_4_1x1_intrawave_v1,4.99,2496.35,0.0
256,1,10240,8192,8,0,29.3514,a8w8_blockscale_1x128x128_256x16x64x256_16x16_16x16_16x16x1_16x16x1_1x16x1x16_4_1x1_intrawave_v1,5.72,2858.97,0.0
256,1,14336,8192,18,0,32.645,a8w8_blockscale_1x128x128_256x64x64x256_16x16_32x32_16x16x1_16x16x1_1x32x1x8_8_1x1_intrawave_v1,7.2,3598.63,0.0
256,1,57344,8192,7,0,95.7067,a8w8_blockscale_1x128x128_256x16x128x256_16x16_16x16_16x16x1_16x16x1_1x16x1x16_8_1x2_intrawave_v1,9.82,4909.63,0.0
256,16,1280,8192,8,0,23.8049,a8w8_blockscale_1x128x128_256x16x64x256_16x16_16x16_16x16x1_16x16x1_1x16x1x16_4_1x1_intrawave_v1,14.1,447.71,0.0
256,16,2560,8192,8,0,23.2359,a8w8_blockscale_1x128x128_256x16x64x256_16x16_16x16_16x16x1_16x16x1_1x16x1x16_4_1x1_intrawave_v1,28.88,911.71,0.0
256,16,7168,8192,8,0,24.927,a8w8_blockscale_1x128x128_256x16x64x256_16x16_16x16_16x16x1_16x16x1_1x16x1x16_4_1x1_intrawave_v1,75.38,2370.15,0.0
256,16,8192,1024,8,0,5.8893,a8w8_blockscale_1x128x128_256x16x64x256_16x16_16x16_16x16x1_16x16x1_1x16x1x16_4_1x1_intrawave_v1,45.58,1471.68,0.0
256,16,8192,2048,8,0,7.6546,a8w8_blockscale_1x128x128_256x16x64x256_16x16_16x16_16x16x1_16x16x1_1x16x1x16_4_1x1_intrawave_v1,70.14,2230.31,0.0
256,16,8192,3584,8,0,11.5088,a8w8_blockscale_1x128x128_256x16x64x256_16x16_16x16_16x16x1_16x16x1_1x16x1x16_4_1x1_intrawave_v1,81.64,2578.86,0.0
256,16,8192,7168,8,0,21.0912,a8w8_blockscale_1x128x128_256x16x64x256_16x16_16x16_16x16x1_16x16x1_1x16x1x16_4_1x1_intrawave_v1,89.09,2801.98,0.0
256,16,8192,8192,8,0,25.3059,a8w8_blockscale_1x128x128_256x16x64x256_16x16_16x16_16x16x1_16x16x1_1x16x1x16_4_1x1_intrawave_v1,84.86,2667.44,0.0
256,16,8192,28672,8,0,84.9003,a8w8_blockscale_1x128x128_256x16x64x256_16x16_16x16_16x16x1_16x16x1_1x16x1x16_4_1x1_intrawave_v1,88.53,2775.04,0.0
256,16,10240,8192,8,0,26.7988,a8w8_blockscale_1x128x128_256x16x64x256_16x16_16x16_16x16x1_16x16x1_1x16x1x16_4_1x1_intrawave_v1,100.17,3147.34,0.0
256,16,14336,8192,8,0,29.5335,a8w8_blockscale_1x128x128_256x16x64x256_16x16_16x16_16x16x1_16x16x1_1x16x1x16_4_1x1_intrawave_v1,127.25,3996.49,0.0
256,16,57344,8192,8,0,94.9502,a8w8_blockscale_1x128x128_256x16x64x256_16x16_16x16_16x16x1_16x16x1_1x16x1x16_4_1x1_intrawave_v1,158.32,4968.16,0.0
256,32,1280,8192,8,0,23.3176,a8w8_blockscale_1x128x128_256x16x64x256_16x16_16x16_16x16x1_16x16x1_1x16x1x16_4_1x1_intrawave_v1,28.78,464.45,0.0
256,32,2560,8192,8,0,22.6875,a8w8_blockscale_1x128x128_256x16x64x256_16x16_16x16_16x16x1_16x16x1_1x16x1x16_4_1x1_intrawave_v1,59.16,943.14,0.0
256,32,7168,8192,8,0,24.416,a8w8_blockscale_1x128x128_256x16x64x256_16x16_16x16_16x16x1_16x16x1_1x16x1x16_4_1x1_intrawave_v1,153.92,2434.52,0.0
256,32,8192,1024,8,0,5.9191,a8w8_blockscale_1x128x128_256x16x64x256_16x16_16x16_16x16x1_16x16x1_1x16x1x16_4_1x1_intrawave_v1,90.7,1511.32,0.0
256,32,8192,2048,8,0,9.2363,a8w8_blockscale_1x128x128_256x16x64x256_16x16_16x16_16x16x1_16x16x1_1x16x1x16_4_1x1_intrawave_v1,116.25,1880.3,0.0
256,32,8192,3584,8,0,11.7168,a8w8_blockscale_1x128x128_256x16x64x256_16x16_16x16_16x16x1_16x16x1_1x16x1x16_4_1x1_intrawave_v1,160.37,2560.35,0.0
256,32,8192,7168,8,0,21.1742,a8w8_blockscale_1x128x128_256x16x64x256_16x16_16x16_16x16x1_16x16x1_1x16x1x16_4_1x1_intrawave_v1,177.48,2808.79,0.0
256,32,8192,8192,8,0,24.6599,a8w8_blockscale_1x128x128_256x16x64x256_16x16_16x16_16x16x1_16x16x1_1x16x1x16_4_1x1_intrawave_v1,174.17,2753.27,0.0
256,32,8192,28672,8,0,84.347,a8w8_blockscale_1x128x128_256x16x64x256_16x16_16x16_16x16x1_16x16x1_1x16x1x16_4_1x1_intrawave_v1,178.22,2801.79,0.0
256,32,10240,8192,7,0,28.6534,a8w8_blockscale_1x128x128_256x16x128x256_16x16_16x16_16x16x1_16x16x1_1x16x1x16_8_1x2_intrawave_v1,187.37,2959.63,0.0
256,32,14336,8192,7,0,31.8955,a8w8_blockscale_1x128x128_256x16x128x256_16x16_16x16_16x16x1_16x16x1_1x16x1x16_8_1x2_intrawave_v1,235.65,3719.02,0.0
256,32,57344,8192,12,0,98.0583,a8w8_blockscale_1x128x128_256x32x128x256_16x16_32x32_16x16x1_16x16x1_1x32x1x8_8_1x1_intrawave_v1,306.6,4830.74,0.0
256,64,192,1024,8,0,4.6632,a8w8_blockscale_1x128x128_256x16x64x256_16x16_16x16_16x16x1_16x16x1_1x16x1x16_4_1x1_intrawave_v1,5.4,61.49,0.0
256,64,1280,8192,8,0,22.7332,a8w8_blockscale_1x128x128_256x16x64x256_16x16_16x16_16x16x1_16x16x1_1x16x1x16_4_1x1_intrawave_v1,59.04,491.52,0.0
256,64,2560,8192,8,0,22.2378,a8w8_blockscale_1x128x128_256x16x64x256_16x16_16x16_16x16x1_16x16x1_1x16x1x16_4_1x1_intrawave_v1,120.71,981.37,0.0
256,64,7168,8192,7,0,26.7943,a8w8_blockscale_1x128x128_256x16x128x256_16x16_16x16_16x16x1_16x16x1_1x16x1x16_8_1x2_intrawave_v1,280.51,2245.33,0.0
256,64,8192,2048,7,0,9.9235,a8w8_blockscale_1x128x128_256x16x128x256_16x16_16x16_16x16x1_16x16x1_1x16x1x16_8_1x2_intrawave_v1,216.4,1809.53,0.0
256,64,8192,3584,7,0,13.3348,a8w8_blockscale_1x128x128_256x16x128x256_16x16_16x16_16x16x1_16x16x1_1x16x1x16_8_1x2_intrawave_v1,281.83,2297.6,0.0
256,64,8192,7168,7,0,23.6118,a8w8_blockscale_1x128x128_256x16x128x256_16x16_16x16_16x16x1_16x16x1_1x16x1x16_8_1x2_intrawave_v1,318.32,2550.74,0.0
256,64,8192,8192,7,0,27.0402,a8w8_blockscale_1x128x128_256x16x128x256_16x16_16x16_16x16x1_16x16x1_1x16x1x16_8_1x2_intrawave_v1,317.67,2539.99,0.0
256,64,8192,28672,7,0,92.4831,a8w8_blockscale_1x128x128_256x16x128x256_16x16_16x16_16x16x1_16x16x1_1x16x1x16_8_1x2_intrawave_v1,325.08,2570.9,0.0
256,64,10240,8192,18,0,28.8785,a8w8_blockscale_1x128x128_256x64x64x256_16x16_32x32_16x16x1_16x16x1_1x32x1x8_8_1x1_intrawave_v1,371.81,2968.34,0.0
256,64,14336,8192,18,0,32.3867,a8w8_blockscale_1x128x128_256x64x64x256_16x16_32x32_16x16x1_16x16x1_1x32x1x8_8_1x1_intrawave_v1,464.15,3699.04,0.0
256,64,57344,8192,2,0,106.5436,a8w8_blockscale_1x128x128_256x64x128x128_16x16_32x32_8x32x1_8x32x1_1x32x1x8_8_1x1_intrawave_v3,564.37,4482.92,0.0
256,128,1280,8192,8,0,21.6838,a8w8_blockscale_1x128x128_256x16x64x256_16x16_16x16_16x16x1_16x16x1_1x16x1x16_4_1x1_intrawave_v1,123.8,547.05,0.0
256,128,2560,8192,7,0,24.6373,a8w8_blockscale_1x128x128_256x16x128x256_16x16_16x16_16x16x1_16x16x1_1x16x1x16_8_1x2_intrawave_v1,217.91,920.37,0.0
256,128,7168,8192,18,0,27.4045,a8w8_blockscale_1x128x128_256x64x64x256_16x16_32x32_16x16x1_16x16x1_1x32x1x8_8_1x1_intrawave_v1,548.54,2247.95,0.0
256,128,8192,1024,18,0,7.1878,a8w8_blockscale_1x128x128_256x64x64x256_16x16_32x32_16x16x1_16x16x1_1x32x1x8_8_1x1_intrawave_v1,298.77,1477.06,0.0
256,128,8192,2048,18,0,9.8229,a8w8_blockscale_1x128x128_256x64x64x256_16x16_32x32_16x16x1_16x16x1_1x32x1x8_8_1x1_intrawave_v1,437.24,1948.15,0.0
256,128,8192,3584,18,0,13.8161,a8w8_blockscale_1x128x128_256x64x64x256_16x16_32x32_16x16x1_16x16x1_1x32x1x8_8_1x1_intrawave_v1,544.02,2310.06,0.0
256,128,8192,7168,18,0,24.4428,a8w8_blockscale_1x128x128_256x64x64x256_16x16_32x32_16x16x1_16x16x1_1x32x1x8_8_1x1_intrawave_v1,615.0,2525.69,0.0
256,128,8192,8192,18,0,27.847,a8w8_blockscale_1x128x128_256x64x64x256_16x16_32x32_16x16x1_16x16x1_1x32x1x8_8_1x1_intrawave_v1,616.94,2522.88,0.0
256,128,8192,28672,18,0,91.9528,a8w8_blockscale_1x128x128_256x64x64x256_16x16_32x32_16x16x1_16x16x1_1x32x1x8_8_1x1_intrawave_v1,653.92,2617.08,0.0
256,128,10240,8192,18,0,44.2706,a8w8_blockscale_1x128x128_256x64x64x256_16x16_32x32_16x16x1_16x16x1_1x32x1x8_8_1x1_intrawave_v1,485.08,1977.75,0.0
256,128,14336,8192,18,0,47.1874,a8w8_blockscale_1x128x128_256x64x64x256_16x16_32x32_16x16x1_16x16x1_1x32x1x8_8_1x1_intrawave_v1,637.14,2588.81,0.0
256,128,57344,8192,0,0,130.9154,a8w8_blockscale_1x128x128_256x128x128x128_16x16_32x32_8x32x1_8x32x1_1x32x1x8_8_1x1_intrawave_v3,918.6,3708.43,0.0
256,256,1280,8192,7,0,25.0054,a8w8_blockscale_1x128x128_256x16x128x256_16x16_16x16_16x16x1_16x16x1_1x16x1x16_8_1x2_intrawave_v1,214.7,529.42,0.0
256,256,2560,8192,18,0,25.4684,a8w8_blockscale_1x128x128_256x64x64x256_16x16_32x32_16x16x1_16x16x1_1x32x1x8_8_1x1_intrawave_v1,421.6,957.24,0.0
256,256,7168,8192,18,0,42.4071,a8w8_blockscale_1x128x128_256x64x64x256_16x16_32x32_16x16x1_16x16x1_1x32x1x8_8_1x1_intrawave_v1,708.96,1520.68,0.0
256,256,8192,1024,18,0,9.7812,a8w8_blockscale_1x128x128_256x64x64x256_16x16_32x32_16x16x1_16x16x1_1x32x1x8_8_1x1_intrawave_v1,439.1,1313.24,0.0
256,256,8192,2048,18,0,13.445,a8w8_blockscale_1x128x128_256x64x64x256_16x16_32x32_16x16x1_16x16x1_1x32x1x8_8_1x1_intrawave_v1,638.89,1598.8,0.0
256,256,8192,3584,18,0,21.1007,a8w8_blockscale_1x128x128_256x64x64x256_16x16_32x32_16x16x1_16x16x1_1x32x1x8_8_1x1_intrawave_v1,712.41,1633.69,0.0
256,256,8192,7168,18,0,37.9087,a8w8_blockscale_1x128x128_256x64x64x256_16x16_32x32_16x16x1_16x16x1_1x32x1x8_8_1x1_intrawave_v1,793.08,1708.04,0.0
256,256,8192,8192,18,0,43.9693,a8w8_blockscale_1x128x128_256x64x64x256_16x16_32x32_16x16x1_16x16x1_1x32x1x8_8_1x1_intrawave_v1,781.45,1669.35,0.0
256,256,8192,28672,18,0,141.1654,a8w8_blockscale_1x128x128_256x64x64x256_16x16_32x32_16x16x1_16x16x1_1x32x1x8_8_1x1_intrawave_v1,851.9,1745.58,0.0
256,256,10240,8192,18,0,59.4072,a8w8_blockscale_1x128x128_256x64x64x256_16x16_32x32_16x16x1_16x16x1_1x32x1x8_8_1x1_intrawave_v1,722.97,1535.61,0.0
256,256,14336,8192,0,0,63.0915,a8w8_blockscale_1x128x128_256x128x128x128_16x16_32x32_8x32x1_8x32x1_1x32x1x8_8_1x1_intrawave_v3,953.05,2011.01,0.0
256,256,57344,8192,0,0,211.2697,a8w8_blockscale_1x128x128_256x128x128x128_16x16_32x32_8x32x1_8x32x1_1x32x1x8_8_1x1_intrawave_v3,1138.44,2372.41,0.0
256,512,1280,8192,18,0,24.7188,a8w8_blockscale_1x128x128_256x64x64x256_16x16_32x32_16x16x1_16x16x1_1x32x1x8_8_1x1_intrawave_v1,434.38,646.91,0.0
256,512,2560,8192,18,0,38.4771,a8w8_blockscale_1x128x128_256x64x64x256_16x16_32x32_16x16x1_16x16x1_1x32x1x8_8_1x1_intrawave_v1,558.12,722.18,0.0
256,512,7168,8192,0,0,58.7208,a8w8_blockscale_1x128x128_256x128x128x128_16x16_32x32_8x32x1_8x32x1_1x32x1x8_8_1x1_intrawave_v3,1023.99,1196.42,0.0
256,512,8192,1024,0,0,13.3266,a8w8_blockscale_1x128x128_256x128x128x128_16x16_32x32_8x32x1_8x32x1_1x32x1x8_8_1x1_intrawave_v3,644.57,1298.27,0.0
256,512,8192,2048,0,0,19.9322,a8w8_blockscale_1x128x128_256x128x128x128_16x16_32x32_8x32x1_8x32x1_1x32x1x8_8_1x1_intrawave_v3,861.92,1315.18,0.0
256,512,8192,3584,0,0,29.6451,a8w8_blockscale_1x128x128_256x128x128x128_16x16_32x32_8x32x1_8x32x1_1x32x1x8_8_1x1_intrawave_v3,1014.16,1335.25,0.0
256,512,8192,7168,0,0,55.2843,a8w8_blockscale_1x128x128_256x128x128x128_16x16_32x32_8x32x1_8x32x1_1x32x1x8_8_1x1_intrawave_v3,1087.64,1280.27,0.0
256,512,8192,8192,0,0,60.5112,a8w8_blockscale_1x128x128_256x128x128x128_16x16_32x32_8x32x1_8x32x1_1x32x1x8_8_1x1_intrawave_v3,1135.65,1316.98,0.0
256,512,8192,28672,0,0,194.8237,a8w8_blockscale_1x128x128_256x128x128x128_16x16_32x32_8x32x1_8x32x1_1x32x1x8_8_1x1_intrawave_v3,1234.54,1324.02,0.0
256,512,10240,8192,2,0,91.3121,a8w8_blockscale_1x128x128_256x64x128x128_16x16_32x32_8x32x1_8x32x1_1x32x1x8_8_1x1_intrawave_v3,940.72,1079.44,0.0
256,512,14336,8192,0,0,104.0816,a8w8_blockscale_1x128x128_256x128x128x128_16x16_32x32_8x32x1_8x32x1_1x32x1x8_8_1x1_intrawave_v3,1155.43,1309.69,0.0
256,512,57344,8192,0,0,349.1385,a8w8_blockscale_1x128x128_256x128x128x128_16x16_32x32_8x32x1_8x32x1_1x32x1x8_8_1x1_intrawave_v3,1377.78,1525.69,0.0
256,1024,1280,8192,18,0,38.1989,a8w8_blockscale_1x128x128_256x64x64x256_16x16_32x32_16x16x1_16x16x1_1x32x1x8_8_1x1_intrawave_v1,562.18,562.73,0.0
256,1024,2560,8192,18,0,55.7473,a8w8_blockscale_1x128x128_256x64x64x256_16x16_32x32_16x16x1_16x16x1_1x32x1x8_8_1x1_intrawave_v1,770.44,620.71,0.0
256,1024,7168,8192,0,0,101.4492,a8w8_blockscale_1x128x128_256x128x128x128_16x16_32x32_8x32x1_8x32x1_1x32x1x8_8_1x1_intrawave_v3,1185.41,806.21,0.0
256,1024,8192,1024,0,0,21.7234,a8w8_blockscale_1x128x128_256x128x128x128_16x16_32x32_8x32x1_8x32x1_1x32x1x8_8_1x1_intrawave_v3,790.85,1206.74,0.0
256,1024,8192,2048,0,0,32.4622,a8w8_blockscale_1x128x128_256x128x128x128_16x16_32x32_8x32x1_8x32x1_1x32x1x8_8_1x1_intrawave_v3,1058.45,1098.25,0.0
256,1024,8192,3584,0,0,49.8102,a8w8_blockscale_1x128x128_256x128x128x128_16x16_32x32_8x32x1_8x32x1_1x32x1x8_8_1x1_intrawave_v3,1207.17,999.94,0.0
256,1024,8192,7168,0,0,96.6608,a8w8_blockscale_1x128x128_256x128x128x128_16x16_32x32_8x32x1_8x32x1_1x32x1x8_8_1x1_intrawave_v3,1244.13,856.99,0.0
256,1024,8192,8192,0,0,104.9196,a8w8_blockscale_1x128x128_256x128x128x128_16x16_32x32_8x32x1_8x32x1_1x32x1x8_8_1x1_intrawave_v3,1309.95,879.48,0.0
256,1024,8192,28672,0,0,346.9324,a8w8_blockscale_1x128x128_256x128x128x128_16x16_32x32_8x32x1_8x32x1_1x32x1x8_8_1x1_intrawave_v3,1386.54,810.01,0.0
256,1024,10240,8192,0,0,143.3004,a8w8_blockscale_1x128x128_256x128x128x128_16x16_32x32_8x32x1_8x32x1_1x32x1x8_8_1x1_intrawave_v3,1198.87,790.27,0.0
256,1024,14336,8192,0,0,187.2939,a8w8_blockscale_1x128x128_256x128x128x128_16x16_32x32_8x32x1_8x32x1_1x32x1x8_8_1x1_intrawave_v3,1284.18,828.59,0.0
256,1024,57344,8192,0,0,653.3808,a8w8_blockscale_1x128x128_256x128x128x128_16x16_32x32_8x32x1_8x32x1_1x32x1x8_8_1x1_intrawave_v3,1472.45,911.55,0.0
256,2048,1280,8192,18,0,55.6189,a8w8_blockscale_1x128x128_256x64x64x256_16x16_32x32_16x16x1_16x16x1_1x32x1x8_8_1x1_intrawave_v1,772.21,584.44,0.0
256,2048,2560,8192,2,0,88.0894,a8w8_blockscale_1x128x128_256x64x128x128_16x16_32x32_8x32x1_8x32x1_1x32x1x8_8_1x1_intrawave_v3,975.14,547.56,0.0
256,2048,7168,8192,0,0,183.187,a8w8_blockscale_1x128x128_256x128x128x128_16x16_32x32_8x32x1_8x32x1_1x32x1x8_8_1x1_intrawave_v3,1312.97,572.41,0.0
256,2048,8192,1024,0,0,39.4439,a8w8_blockscale_1x128x128_256x128x128x128_16x16_32x32_8x32x1_8x32x1_1x32x1x8_8_1x1_intrawave_v3,871.1,1116.53,0.0
256,2048,8192,2048,0,0,60.0751,a8w8_blockscale_1x128x128_256x128x128x128_16x16_32x32_8x32x1_8x32x1_1x32x1x8_8_1x1_intrawave_v3,1143.89,907.63,0.0
256,2048,8192,3584,0,0,92.397,a8w8_blockscale_1x128x128_256x128x128x128_16x16_32x32_8x32x1_8x32x1_1x32x1x8_8_1x1_intrawave_v3,1301.55,760.36,0.0
256,2048,8192,7168,0,0,179.3602,a8w8_blockscale_1x128x128_256x128x128x128_16x16_32x32_8x32x1_8x32x1_1x32x1x8_8_1x1_intrawave_v3,1340.98,596.31,0.0
256,2048,8192,8192,0,0,194.4158,a8w8_blockscale_1x128x128_256x128x128x128_16x16_32x32_8x32x1_8x32x1_1x32x1x8_8_1x1_intrawave_v3,1413.87,604.07,0.0
256,2048,8192,28672,0,0,653.5844,a8w8_blockscale_1x128x128_256x128x128x128_16x16_32x32_8x32x1_8x32x1_1x32x1x8_8_1x1_intrawave_v3,1471.99,500.56,0.0
256,2048,10240,8192,0,0,243.7723,a8w8_blockscale_1x128x128_256x128x128x128_16x16_32x32_8x32x1_8x32x1_1x32x1x8_8_1x1_intrawave_v3,1409.5,585.0,0.0
256,2048,14336,8192,0,0,329.061,a8w8_blockscale_1x128x128_256x128x128x128_16x16_32x32_8x32x1_8x32x1_1x32x1x8_8_1x1_intrawave_v3,1461.85,586.33,0.0
256,2048,57344,8192,0,0,1248.0414,a8w8_blockscale_1x128x128_256x128x128x128_16x16_32x32_8x32x1_8x32x1_1x32x1x8_8_1x1_intrawave_v3,1541.73,578.04,0.0
256,4096,1280,8192,14,0,86.4331,a8w8_blockscale_1x128x128_256x64x256x128_16x16_32x32_8x32x1_8x32x1_1x32x1x8_8_1x1_intrawave_v1,993.82,630.85,0.0
256,4096,2560,8192,0,0,139.0304,a8w8_blockscale_1x128x128_256x128x128x128_16x16_32x32_8x32x1_8x32x1_1x32x1x8_8_1x1_intrawave_v3,1235.69,543.03,0.0
256,4096,7168,8192,0,0,324.97,a8w8_blockscale_1x128x128_256x128x128x128_16x16_32x32_8x32x1_8x32x1_1x32x1x8_8_1x1_intrawave_v3,1480.25,464.64,0.0
256,4096,8192,1024,0,0,71.6327,a8w8_blockscale_1x128x128_256x128x128x128_16x16_32x32_8x32x1_8x32x1_1x32x1x8_8_1x1_intrawave_v3,959.33,1112.51,0.0
256,4096,8192,2048,0,0,112.5789,a8w8_blockscale_1x128x128_256x128x128x128_16x16_32x32_8x32x1_8x32x1_1x32x1x8_8_1x1_intrawave_v3,1220.82,819.64,0.0
256,4096,8192,3584,0,0,168.6553,a8w8_blockscale_1x128x128_256x128x128x128_16x16_32x32_8x32x1_8x32x1_1x32x1x8_8_1x1_intrawave_v3,1426.09,659.03,0.0
256,4096,8192,7168,0,0,324.0622,a8w8_blockscale_1x128x128_256x128x128x128_16x16_32x32_8x32x1_8x32x1_1x32x1x8_8_1x1_intrawave_v3,1484.4,478.89,0.0
256,4096,8192,8192,0,0,359.2549,a8w8_blockscale_1x128x128_256x128x128x128_16x16_32x32_8x32x1_8x32x1_1x32x1x8_8_1x1_intrawave_v3,1530.27,467.0,0.0
256,4096,8192,28672,0,0,1321.9845,a8w8_blockscale_1x128x128_256x128x128x128_16x16_32x32_8x32x1_8x32x1_1x32x1x8_8_1x1_intrawave_v3,1455.5,317.27,0.0
256,4096,10240,8192,0,0,442.7455,a8w8_blockscale_1x128x128_256x128x128x128_16x16_32x32_8x32x1_8x32x1_1x32x1x8_8_1x1_intrawave_v3,1552.12,454.72,0.0
256,4096,14336,8192,0,0,611.4359,a8w8_blockscale_1x128x128_256x128x128x128_16x16_32x32_8x32x1_8x32x1_1x32x1x8_8_1x1_intrawave_v3,1573.46,439.02,0.0
256,4096,57344,8192,0,0,2541.7726,a8w8_blockscale_1x128x128_256x128x128x128_16x16_32x32_8x32x1_8x32x1_1x32x1x8_8_1x1_intrawave_v3,1514.02,382.83,0.0
256,8192,1280,8192,0,0,141.5584,a8w8_blockscale_1x128x128_256x128x128x128_16x16_32x32_8x32x1_8x32x1_1x32x1x8_8_1x1_intrawave_v3,1213.62,696.29,0.0
256,8192,2560,8192,0,0,237.3844,a8w8_blockscale_1x128x128_256x128x128x128_16x16_32x32_8x32x1_8x32x1_1x32x1x8_8_1x1_intrawave_v3,1447.43,547.73,0.0
256,8192,7168,8192,0,0,617.808,a8w8_blockscale_1x128x128_256x128x128x128_16x16_32x32_8x32x1_8x32x1_1x32x1x8_8_1x1_intrawave_v3,1557.24,393.76,0.0
256,8192,8192,1024,0,0,129.7768,a8w8_blockscale_1x128x128_256x128x128x128_16x16_32x32_8x32x1_8x32x1_1x32x1x8_8_1x1_intrawave_v3,1059.04,1163.5,0.0
256,8192,8192,2048,0,0,210.461,a8w8_blockscale_1x128x128_256x128x128x128_16x16_32x32_8x32x1_8x32x1_1x32x1x8_8_1x1_intrawave_v3,1306.08,797.17,0.0
256,8192,8192,3584,0,0,316.7246,a8w8_blockscale_1x128x128_256x128x128x128_16x16_32x32_8x32x1_8x32x1_1x32x1x8_8_1x1_intrawave_v3,1518.78,609.17,0.0
256,8192,8192,7168,0,0,619.8681,a8w8_blockscale_1x128x128_256x128x128x128_16x16_32x32_8x32x1_8x32x1_1x32x1x8_8_1x1_intrawave_v3,1552.06,405.99,0.0
256,8192,8192,8192,0,0,701.7376,a8w8_blockscale_1x128x128_256x128x128x128_16x16_32x32_8x32x1_8x32x1_1x32x1x8_8_1x1_intrawave_v3,1566.84,382.53,0.0
256,8192,8192,28672,0,0,2719.7599,a8w8_blockscale_1x128x128_256x128x128x128_16x16_32x32_8x32x1_8x32x1_1x32x1x8_8_1x1_intrawave_v3,1414.94,222.07,0.0
256,8192,10240,8192,0,0,871.5554,a8w8_blockscale_1x128x128_256x128x128x128_16x16_32x32_8x32x1_8x32x1_1x32x1x8_8_1x1_intrawave_v3,1576.94,365.75,0.0
256,8192,14336,8192,0,0,1212.4023,a8w8_blockscale_1x128x128_256x128x128x128_16x16_32x32_8x32x1_8x32x1_1x32x1x8_8_1x1_intrawave_v3,1587.05,345.95,0.0
256,8192,57344,8192,0,0,5023.1032,a8w8_blockscale_1x128x128_256x128x128x128_16x16_32x32_8x32x1_8x32x1_1x32x1x8_8_1x1_intrawave_v3,1532.24,293.92,0.0
256,16384,1280,8192,0,0,242.865,a8w8_blockscale_1x128x128_256x128x128x128_16x16_32x32_8x32x1_8x32x1_1x32x1x8_8_1x1_intrawave_v3,1414.77,768.52,0.0
256,16384,2560,8192,0,0,449.1566,a8w8_blockscale_1x128x128_256x128x128x128_16x16_32x32_8x32x1_8x32x1_1x32x1x8_8_1x1_intrawave_v3,1529.97,532.28,0.0
256,16384,7168,8192,0,0,1213.2002,a8w8_blockscale_1x128x128_256x128x128x128_16x16_32x32_8x32x1_8x32x1_1x32x1x8_8_1x1_intrawave_v3,1586.01,352.64,0.0
256,16384,8192,1024,0,0,242.172,a8w8_blockscale_1x128x128_256x128x128x128_16x16_32x32_8x32x1_8x32x1_1x32x1x8_8_1x1_intrawave_v3,1135.05,1212.37,0.0
256,16384,8192,2048,0,0,387.6755,a8w8_blockscale_1x128x128_256x128x128x128_16x16_32x32_8x32x1_8x32x1_1x32x1x8_8_1x1_intrawave_v3,1418.08,822.25,0.0
256,16384,8192,3584,0,0,609.2243,a8w8_blockscale_1x128x128_256x128x128x128_16x16_32x32_8x32x1_8x32x1_1x32x1x8_8_1x1_intrawave_v3,1579.18,585.2,0.0
256,16384,8192,7168,0,0,1238.5961,a8w8_blockscale_1x128x128_256x128x128x128_16x16_32x32_8x32x1_8x32x1_1x32x1x8_8_1x1_intrawave_v3,1553.49,358.95,0.0
256,16384,8192,8192,0,0,1425.7696,a8w8_blockscale_1x128x128_256x128x128x128_16x16_32x32_8x32x1_8x32x1_1x32x1x8_8_1x1_intrawave_v3,1542.34,329.48,0.0
256,16384,8192,28672,0,0,5548.0298,a8w8_blockscale_1x128x128_256x128x128x128_16x16_32x32_8x32x1_8x32x1_1x32x1x8_8_1x1_intrawave_v3,1387.26,175.39,0.0
256,16384,10240,8192,0,0,1780.9915,a8w8_blockscale_1x128x128_256x128x128x128_16x16_32x32_8x32x1_8x32x1_1x32x1x8_8_1x1_intrawave_v3,1543.4,310.87,0.0
256,16384,14336,8192,0,0,2528.4664,a8w8_blockscale_1x128x128_256x128x128x128_16x16_32x32_8x32x1_8x32x1_1x32x1x8_8_1x1_intrawave_v3,1521.99,285.32,0.0
256,16384,57344,8192,0,0,9916.7065,a8w8_blockscale_1x128x128_256x128x128x128_16x16_32x32_8x32x1_8x32x1_1x32x1x8_8_1x1_intrawave_v3,1552.25,250.39,0.0
256,32768,1280,8192,0,0,465.5363,a8w8_blockscale_1x128x128_256x128x128x128_16x16_32x32_8x32x1_8x32x1_1x32x1x8_8_1x1_intrawave_v3,1476.14,779.33,0.0
256,32768,2560,8192,0,0,897.4122,a8w8_blockscale_1x128x128_256x128x128x128_16x16_32x32_8x32x1_8x32x1_1x32x1x8_8_1x1_intrawave_v3,1531.5,509.44,0.0
256,32768,7168,8192,0,0,2556.5477,a8w8_blockscale_1x128x128_256x128x128x128_16x16_32x32_8x32x1_8x32x1_1x32x1x8_8_1x1_intrawave_v3,1505.27,311.72,0.0
256,32768,8192,1024,0,0,459.5829,a8w8_blockscale_1x128x128_256x128x128x128_16x16_32x32_8x32x1_8x32x1_1x32x1x8_8_1x1_intrawave_v3,1196.21,1259.43,0.0
256,32768,8192,2048,0,0,749.1456,a8w8_blockscale_1x128x128_256x128x128x128_16x16_32x32_8x32x1_8x32x1_1x32x1x8_8_1x1_intrawave_v3,1467.69,828.62,0.0
256,32768,8192,3584,0,0,1251.717,a8w8_blockscale_1x128x128_256x128x128x128_16x16_32x32_8x32x1_8x32x1_1x32x1x8_8_1x1_intrawave_v3,1537.2,546.19,0.0
256,32768,8192,7168,0,0,2579.4122,a8w8_blockscale_1x128x128_256x128x128x128_16x16_32x32_8x32x1_8x32x1_1x32x1x8_8_1x1_intrawave_v3,1491.93,321.96,0.0
256,32768,8192,8192,0,0,2911.5823,a8w8_blockscale_1x128x128_256x128x128x128_16x16_32x32_8x32x1_8x32x1_1x32x1x8_8_1x1_intrawave_v3,1510.53,299.64,0.0
256,32768,8192,28672,14,0,11156.1826,a8w8_blockscale_1x128x128_256x64x256x128_16x16_32x32_8x32x1_8x32x1_1x32x1x8_8_1x1_intrawave_v1,1379.79,153.39,0.0
256,32768,10240,8192,0,0,3612.3136,a8w8_blockscale_1x128x128_256x128x128x128_16x16_32x32_8x32x1_8x32x1_1x32x1x8_8_1x1_intrawave_v3,1521.89,283.31,0.0
256,32768,14336,8192,0,0,5078.737,a8w8_blockscale_1x128x128_256x128x128x128_16x16_32x32_8x32x1_8x32x1_1x32x1x8_8_1x1_intrawave_v3,1515.45,260.97,0.0
256,32768,57344,8192,0,0,19837.1258,a8w8_blockscale_1x128x128_256x128x128x128_16x16_32x32_8x32x1_8x32x1_1x32x1x8_8_1x1_intrawave_v3,1551.95,226.66,0.0
256,1,2304,16384,8,0,77.0527,a8w8_blockscale_1x128x128_256x16x64x256_16x16_16x16_16x16x1_16x16x1_1x16x1x16_4_1x1_intrawave_v1,0.98,490.18,0.0
256,1,4608,16384,8,0,78.2532,a8w8_blockscale_1x128x128_256x16x64x256_16x16_16x16_16x16x1_16x16x1_1x16x1x16_4_1x1_intrawave_v1,1.93,965.11,0.0
256,1,9216,16384,8,0,81.7874,a8w8_blockscale_1x128x128_256x16x64x256_16x16_16x16_16x16x1_16x16x1_1x16x1x16_4_1x1_intrawave_v1,3.69,1846.61,0.0
256,1,13312,16384,8,0,86.7313,a8w8_blockscale_1x128x128_256x16x64x256_16x16_16x16_16x16x1_16x16x1_1x16x1x16_4_1x1_intrawave_v1,5.03,2515.2,0.0
256,1,16384,2048,8,0,12.7222,a8w8_blockscale_1x128x128_256x16x64x256_16x16_16x16_16x16x1_16x16x1_1x16x1x16_4_1x1_intrawave_v1,5.27,2640.21,0.0
256,1,16384,4096,8,0,24.3487,a8w8_blockscale_1x128x128_256x16x64x256_16x16_16x16_16x16x1_16x16x1_1x16x1x16_4_1x1_intrawave_v1,5.51,2757.67,0.0
256,1,16384,6656,8,0,36.8308,a8w8_blockscale_1x128x128_256x16x64x256_16x16_16x16_16x16x1_16x16x1_1x16x1x16_4_1x1_intrawave_v1,5.92,2961.96,0.0
256,1,16384,8192,8,0,46.9462,a8w8_blockscale_1x128x128_256x16x64x256_16x16_16x16_16x16x1_16x16x1_1x16x1x16_4_1x1_intrawave_v1,5.72,2859.84,0.0
256,1,16384,13312,8,0,71.4701,a8w8_blockscale_1x128x128_256x16x64x256_16x16_16x16_16x16x1_16x16x1_1x16x1x16_4_1x1_intrawave_v1,6.1,3052.32,0.0
256,1,16384,26624,8,0,139.8338,a8w8_blockscale_1x128x128_256x16x64x256_16x16_16x16_16x16x1_16x16x1_1x16x1x16_4_1x1_intrawave_v1,6.24,3119.9,0.0
256,1,26624,16384,8,0,109.776,a8w8_blockscale_1x128x128_256x16x64x256_16x16_16x16_16x16x1_16x16x1_1x16x1x16_4_1x1_intrawave_v1,7.95,3974.25,0.0
256,1,53248,16384,7,0,177.261,a8w8_blockscale_1x128x128_256x16x128x256_16x16_16x16_16x16x1_16x16x1_1x16x1x16_8_1x2_intrawave_v1,9.84,4922.34,0.0
256,16,2304,16384,8,0,59.0958,a8w8_blockscale_1x128x128_256x16x64x256_16x16_16x16_16x16x1_16x16x1_1x16x1x16_4_1x1_intrawave_v1,20.44,644.46,0.0
256,16,4608,16384,8,0,60.6736,a8w8_blockscale_1x128x128_256x16x64x256_16x16_16x16_16x16x1_16x16x1_1x16x1x16_4_1x1_intrawave_v1,39.82,1251.07,0.0
256,16,9216,16384,8,0,63.6471,a8w8_blockscale_1x128x128_256x16x64x256_16x16_16x16_16x16x1_16x16x1_1x16x1x16_4_1x1_intrawave_v1,75.92,2381.13,0.0
256,16,13312,16384,8,0,68.6268,a8w8_blockscale_1x128x128_256x16x64x256_16x16_16x16_16x16x1_16x16x1_1x16x1x16_4_1x1_intrawave_v1,101.7,3188.14,0.0
256,16,16384,2048,8,0,11.5848,a8w8_blockscale_1x128x128_256x16x64x256_16x16_16x16_16x16x1_16x16x1_1x16x1x16_4_1x1_intrawave_v1,92.69,2944.5,0.0
256,16,16384,4096,8,0,19.8194,a8w8_blockscale_1x128x128_256x16x64x256_16x16_16x16_16x16x1_16x16x1_1x16x1x16_4_1x1_intrawave_v1,108.35,3415.78,0.0
256,16,16384,6656,8,0,28.9746,a8w8_blockscale_1x128x128_256x16x64x256_16x16_16x16_16x16x1_16x16x1_1x16x1x16_4_1x1_intrawave_v1,120.44,3785.48,0.0
256,16,16384,8192,8,0,37.1133,a8w8_blockscale_1x128x128_256x16x64x256_16x16_16x16_16x16x1_16x16x1_1x16x1x16_4_1x1_intrawave_v1,115.73,3634.09,0.0
256,16,16384,13312,8,0,55.1626,a8w8_blockscale_1x128x128_256x16x64x256_16x16_16x16_16x16x1_16x16x1_1x16x1x16_4_1x1_intrawave_v1,126.52,3967.2,0.0
256,16,16384,26624,8,0,106.3298,a8w8_blockscale_1x128x128_256x16x64x256_16x16_16x16_16x16x1_16x16x1_1x16x1x16_4_1x1_intrawave_v1,131.28,4111.34,0.0
256,16,26624,16384,7,0,106.6492,a8w8_blockscale_1x128x128_256x16x128x256_16x16_16x16_16x16x1_16x16x1_1x16x1x16_8_1x2_intrawave_v1,130.88,4100.56,0.0
256,16,53248,16384,7,0,194.6868,a8w8_blockscale_1x128x128_256x16x128x256_16x16_16x16_16x16x1_16x16x1_1x16x1x16_8_1x2_intrawave_v1,143.4,4491.22,0.0
256,32,2304,16384,8,0,57.5331,a8w8_blockscale_1x128x128_256x16x64x256_16x16_16x16_16x16x1_16x16x1_1x16x1x16_4_1x1_intrawave_v1,41.99,667.8,0.0
256,32,4608,16384,8,0,59.2848,a8w8_blockscale_1x128x128_256x16x64x256_16x16_16x16_16x16x1_16x16x1_1x16x1x16_4_1x1_intrawave_v1,81.5,1287.29,0.0
256,32,9216,16384,7,0,87.5136,a8w8_blockscale_1x128x128_256x16x128x256_16x16_16x16_16x16x1_16x16x1_1x16x1x16_8_1x2_intrawave_v1,110.42,1738.12,0.0
256,32,13312,16384,7,0,89.7303,a8w8_blockscale_1x128x128_256x16x128x256_16x16_16x16_16x16x1_16x16x1_1x16x1x16_8_1x2_intrawave_v1,155.56,2446.0,0.0
256,32,16384,2048,7,0,14.3547,a8w8_blockscale_1x128x128_256x16x128x256_16x16_16x16_16x16x1_16x16x1_1x16x1x16_8_1x2_intrawave_v1,149.6,2415.14,0.0
256,32,16384,4096,7,0,26.4375,a8w8_blockscale_1x128x128_256x16x128x256_16x16_16x16_16x16x1_16x16x1_1x16x1x16_8_1x2_intrawave_v1,162.46,2583.02,0.0
256,32,16384,6656,7,0,39.3427,a8w8_blockscale_1x128x128_256x16x128x256_16x16_16x16_16x16x1_16x16x1_1x16x1x16_8_1x2_intrawave_v1,177.4,2803.91,0.0
256,32,16384,8192,7,0,48.81,a8w8_blockscale_1x128x128_256x16x128x256_16x16_16x16_16x16x1_16x16x1_1x16x1x16_8_1x2_intrawave_v1,175.99,2776.65,0.0
256,32,16384,13312,7,0,74.6893,a8w8_blockscale_1x128x128_256x16x128x256_16x16_16x16_16x16x1_16x16x1_1x16x1x16_8_1x2_intrawave_v1,186.89,2939.89,0.0
256,32,16384,26624,7,0,144.185,a8w8_blockscale_1x128x128_256x16x128x256_16x16_16x16_16x16x1_16x16x1_1x16x1x16_8_1x2_intrawave_v1,193.62,3038.51,0.0
256,32,26624,16384,13,0,141.4403,a8w8_blockscale_1x128x128_256x32x64x256_16x16_16x16_16x16x1_16x16x1_1x32x1x8_8_2x1_intrawave_v1,197.38,3099.79,0.0
256,32,53248,16384,13,0,274.8867,a8w8_blockscale_1x128x128_256x32x64x256_16x16_16x16_16x16x1_16x16x1_1x32x1x8_8_2x1_intrawave_v1,203.12,3188.03,0.0
256,64,2304,16384,8,0,57.1536,a8w8_blockscale_1x128x128_256x16x64x256_16x16_16x16_16x16x1_16x16x1_1x16x1x16_4_1x1_intrawave_v1,84.54,683.99,0.0
256,64,4608,16384,7,0,85.9235,a8w8_blockscale_1x128x128_256x16x128x256_16x16_16x16_16x16x1_16x16x1_1x16x1x16_8_1x2_intrawave_v1,112.47,897.73,0.0
256,64,9216,16384,8,0,118.2638,a8w8_blockscale_1x128x128_256x16x64x256_16x16_16x16_16x16x1_16x16x1_1x16x1x16_4_1x1_intrawave_v1,163.43,1295.6,0.0
256,64,13312,16384,3,0,130.4823,a8w8_blockscale_1x128x128_256x64x64x128_16x16_32x32_8x32x1_8x32x1_1x32x1x8_8_1x1_intrawave_v3,213.95,1692.62,0.0
256,64,16384,2048,3,0,19.2527,a8w8_blockscale_1x128x128_256x64x64x128_16x16_32x32_8x32x1_8x32x1_1x32x1x8_8_1x1_intrawave_v3,223.08,1858.58,0.0
256,64,16384,4096,3,0,35.4139,a8w8_blockscale_1x128x128_256x64x64x128_16x16_32x32_8x32x1_8x32x1_1x32x1x8_8_1x1_intrawave_v3,242.56,1961.61,0.0
256,64,16384,6656,3,0,52.5466,a8w8_blockscale_1x128x128_256x64x64x128_16x16_32x32_8x32x1_8x32x1_1x32x1x8_8_1x1_intrawave_v3,265.64,2123.35,0.0
256,64,16384,8192,3,0,67.5044,a8w8_blockscale_1x128x128_256x64x64x128_16x16_32x32_8x32x1_8x32x1_1x32x1x8_8_1x1_intrawave_v3,254.5,2027.11,0.0
256,64,16384,13312,3,0,103.4736,a8w8_blockscale_1x128x128_256x64x64x128_16x16_32x32_8x32x1_8x32x1_1x32x1x8_8_1x1_intrawave_v3,269.8,2136.32,0.0
256,64,16384,26624,3,0,203.0101,a8w8_blockscale_1x128x128_256x64x64x128_16x16_32x32_8x32x1_8x32x1_1x32x1x8_8_1x1_intrawave_v3,275.03,2167.42,0.0
256,64,26624,16384,2,0,200.5333,a8w8_blockscale_1x128x128_256x64x128x128_16x16_32x32_8x32x1_8x32x1_1x32x1x8_8_1x1_intrawave_v3,278.43,2197.46,0.0
256,64,53248,16384,2,0,359.5623,a8w8_blockscale_1x128x128_256x64x128x128_16x16_32x32_8x32x1_8x32x1_1x32x1x8_8_1x1_intrawave_v3,310.57,2448.2,0.0
256,128,2304,16384,8,0,83.6532,a8w8_blockscale_1x128x128_256x16x64x256_16x16_16x16_16x16x1_16x16x1_1x16x1x16_4_1x1_intrawave_v1,115.52,483.37,0.0
256,128,4608,16384,8,0,114.253,a8w8_blockscale_1x128x128_256x16x64x256_16x16_16x16_16x16x1_16x16x1_1x16x1x16_4_1x1_intrawave_v1,169.16,689.47,0.0
256,128,9216,16384,2,0,170.0953,a8w8_blockscale_1x128x128_256x64x128x128_16x16_32x32_8x32x1_8x32x1_1x32x1x8_8_1x1_intrawave_v3,227.25,913.91,0.0
256,128,13312,16384,2,0,173.0875,a8w8_blockscale_1x128x128_256x64x128x128_16x16_32x32_8x32x1_8x32x1_1x32x1x8_8_1x1_intrawave_v3,322.58,1291.88,0.0
256,128,16384,2048,2,0,26.8383,a8w8_blockscale_1x128x128_256x64x128x128_16x16_32x32_8x32x1_8x32x1_1x32x1x8_8_1x1_intrawave_v3,320.06,1416.29,0.0
256,128,16384,4096,2,0,47.0259,a8w8_blockscale_1x128x128_256x64x128x128_16x16_32x32_8x32x1_8x32x1_1x32x1x8_8_1x1_intrawave_v3,365.33,1527.4,0.0
256,128,16384,6656,2,0,70.6311,a8w8_blockscale_1x128x128_256x64x128x128_16x16_32x32_8x32x1_8x32x1_1x32x1x8_8_1x1_intrawave_v3,395.25,1615.41,0.0
256,128,16384,8192,2,0,87.5234,a8w8_blockscale_1x128x128_256x64x128x128_16x16_32x32_8x32x1_8x32x1_1x32x1x8_8_1x1_intrawave_v3,392.58,1593.41,0.0
256,128,16384,13312,2,0,136.0439,a8w8_blockscale_1x128x128_256x64x128x128_16x16_32x32_8x32x1_8x32x1_1x32x1x8_8_1x1_intrawave_v3,410.42,1646.54,0.0
256,128,16384,26624,2,0,263.2419,a8w8_blockscale_1x128x128_256x64x128x128_16x16_32x32_8x32x1_8x32x1_1x32x1x8_8_1x1_intrawave_v3,424.21,1685.94,0.0
256,128,26624,16384,2,0,287.2185,a8w8_blockscale_1x128x128_256x64x128x128_16x16_32x32_8x32x1_8x32x1_1x32x1x8_8_1x1_intrawave_v3,388.8,1549.76,0.0
256,128,53248,16384,2,0,553.4942,a8w8_blockscale_1x128x128_256x64x128x128_16x16_32x32_8x32x1_8x32x1_1x32x1x8_8_1x1_intrawave_v3,403.51,1604.61,0.0
256,256,2304,16384,8,0,113.4368,a8w8_blockscale_1x128x128_256x16x64x256_16x16_16x16_16x16x1_16x16x1_1x16x1x16_4_1x1_intrawave_v1,170.38,380.15,0.0
256,256,4608,16384,2,0,162.736,a8w8_blockscale_1x128x128_256x64x128x128_16x16_32x32_8x32x1_8x32x1_1x32x1x8_8_1x1_intrawave_v3,237.53,504.2,0.0
256,256,9216,16384,3,0,265.5334,a8w8_blockscale_1x128x128_256x64x64x128_16x16_32x32_8x32x1_8x32x1_1x32x1x8_8_1x1_intrawave_v3,291.15,602.21,0.0
256,256,13312,16384,2,0,267.7684,a8w8_blockscale_1x128x128_256x64x128x128_16x16_32x32_8x32x1_8x32x1_1x32x1x8_8_1x1_intrawave_v3,417.04,855.64,0.0
256,256,16384,2048,2,0,42.7868,a8w8_blockscale_1x128x128_256x64x128x128_16x16_32x32_8x32x1_8x32x1_1x32x1x8_8_1x1_intrawave_v3,401.52,992.53,0.0
256,256,16384,4096,2,0,76.8915,a8w8_blockscale_1x128x128_256x64x128x128_16x16_32x32_8x32x1_8x32x1_1x32x1x8_8_1x1_intrawave_v3,446.86,995.51,0.0
256,256,16384,6656,2,0,114.9487,a8w8_blockscale_1x128x128_256x64x128x128_16x16_32x32_8x32x1_8x32x1_1x32x1x8_8_1x1_intrawave_v3,485.73,1036.5,0.0
256,256,16384,8192,2,0,143.0835,a8w8_blockscale_1x128x128_256x64x128x128_16x16_32x32_8x32x1_8x32x1_1x32x1x8_8_1x1_intrawave_v3,480.28,1011.32,0.0
256,256,16384,13312,2,0,219.0848,a8w8_blockscale_1x128x128_256x64x128x128_16x16_32x32_8x32x1_8x32x1_1x32x1x8_8_1x1_intrawave_v3,509.71,1049.37,0.0
256,256,16384,26624,2,0,429.0916,a8w8_blockscale_1x128x128_256x64x128x128_16x16_32x32_8x32x1_8x32x1_1x32x1x8_8_1x1_intrawave_v3,520.49,1052.02,0.0
256,256,26624,16384,2,0,511.6655,a8w8_blockscale_1x128x128_256x64x128x128_16x16_32x32_8x32x1_8x32x1_1x32x1x8_8_1x1_intrawave_v3,436.49,887.36,0.0
256,256,53248,16384,2,0,871.2213,a8w8_blockscale_1x128x128_256x64x128x128_16x16_32x32_8x32x1_8x32x1_1x32x1x8_8_1x1_intrawave_v3,512.7,1037.48,0.0
256,512,2304,16384,2,0,160.372,a8w8_blockscale_1x128x128_256x64x128x128_16x16_32x32_8x32x1_8x32x1_1x32x1x8_8_1x1_intrawave_v3,241.03,302.4,0.0
256,512,4608,16384,2,0,259.0482,a8w8_blockscale_1x128x128_256x64x128x128_16x16_32x32_8x32x1_8x32x1_1x32x1x8_8_1x1_intrawave_v3,298.44,342.04,0.0
256,512,9216,16384,2,0,382.4099,a8w8_blockscale_1x128x128_256x64x128x128_16x16_32x32_8x32x1_8x32x1_1x32x1x8_8_1x1_intrawave_v3,404.33,441.47,0.0
256,512,13312,16384,2,0,488.7956,a8w8_blockscale_1x128x128_256x64x128x128_16x16_32x32_8x32x1_8x32x1_1x32x1x8_8_1x1_intrawave_v3,456.92,491.26,0.0
256,512,16384,2048,2,0,75.7869,a8w8_blockscale_1x128x128_256x64x128x128_16x16_32x32_8x32x1_8x32x1_1x32x1x8_8_1x1_intrawave_v3,453.37,677.96,0.0
256,512,16384,4096,2,0,137.2325,a8w8_blockscale_1x128x128_256x64x128x128_16x16_32x32_8x32x1_8x32x1_1x32x1x8_8_1x1_intrawave_v3,500.75,626.55,0.0
256,512,16384,6656,2,0,208.4561,a8w8_blockscale_1x128x128_256x64x128x128_16x16_32x32_8x32x1_8x32x1_1x32x1x8_8_1x1_intrawave_v3,535.7,619.97,0.0
256,512,16384,8192,2,0,258.1492,a8w8_blockscale_1x128x128_256x64x128x128_16x16_32x32_8x32x1_8x32x1_1x32x1x8_8_1x1_intrawave_v3,532.4,601.16,0.0
256,512,16384,13312,2,0,403.9264,a8w8_blockscale_1x128x128_256x64x128x128_16x16_32x32_8x32x1_8x32x1_1x32x1x8_8_1x1_intrawave_v3,552.92,598.37,0.0
256,512,16384,26624,2,0,797.4435,a8w8_blockscale_1x128x128_256x64x128x128_16x16_32x32_8x32x1_8x32x1_1x32x1x8_8_1x1_intrawave_v3,560.14,585.14,0.0
256,512,26624,16384,2,0,830.0664,a8w8_blockscale_1x128x128_256x64x128x128_16x16_32x32_8x32x1_8x32x1_1x32x1x8_8_1x1_intrawave_v3,538.12,568.46,0.0
256,512,53248,16384,2,0,1515.567,a8w8_blockscale_1x128x128_256x64x128x128_16x16_32x32_8x32x1_8x32x1_1x32x1x8_8_1x1_intrawave_v3,589.45,617.15,0.0
256,1024,2304,16384,2,0,252.8342,a8w8_blockscale_1x128x128_256x64x128x128_16x16_32x32_8x32x1_8x32x1_1x32x1x8_8_1x1_intrawave_v3,305.77,234.32,0.0
256,1024,4608,16384,2,0,375.0407,a8w8_blockscale_1x128x128_256x64x128x128_16x16_32x32_8x32x1_8x32x1_1x32x1x8_8_1x1_intrawave_v3,412.27,271.2,0.0
256,1024,9216,16384,2,0,596.4194,a8w8_blockscale_1x128x128_256x64x128x128_16x16_32x32_8x32x1_8x32x1_1x32x1x8_8_1x1_intrawave_v3,518.49,312.95,0.0
256,1024,13312,16384,2,0,814.9574,a8w8_blockscale_1x128x128_256x64x128x128_16x16_32x32_8x32x1_8x32x1_1x32x1x8_8_1x1_intrawave_v3,548.1,321.67,0.0
256,1024,16384,2048,2,0,138.6722,a8w8_blockscale_1x128x128_256x64x128x128_16x16_32x32_8x32x1_8x32x1_1x32x1x8_8_1x1_intrawave_v3,495.55,499.06,0.0
256,1024,16384,4096,2,0,254.119,a8w8_blockscale_1x128x128_256x64x128x128_16x16_32x32_8x32x1_8x32x1_1x32x1x8_8_1x1_intrawave_v3,540.84,412.63,0.0
256,1024,16384,6656,2,0,392.1357,a8w8_blockscale_1x128x128_256x64x128x128_16x16_32x32_8x32x1_8x32x1_1x32x1x8_8_1x1_intrawave_v3,569.54,381.05,0.0
256,1024,16384,8192,2,0,482.6855,a8w8_blockscale_1x128x128_256x64x128x128_16x16_32x32_8x32x1_8x32x1_1x32x1x8_8_1x1_intrawave_v3,569.48,364.96,0.0
256,1024,16384,13312,2,0,765.738,a8w8_blockscale_1x128x128_256x64x128x128_16x16_32x32_8x32x1_8x32x1_1x32x1x8_8_1x1_intrawave_v3,583.33,346.45,0.0
256,1024,16384,26624,2,0,1506.4402,a8w8_blockscale_1x128x128_256x64x128x128_16x16_32x32_8x32x1_8x32x1_1x32x1x8_8_1x1_intrawave_v3,593.02,329.93,0.0
256,1024,26624,16384,2,0,1486.4757,a8w8_blockscale_1x128x128_256x64x128x128_16x16_32x32_8x32x1_8x32x1_1x32x1x8_8_1x1_intrawave_v3,600.99,341.42,0.0
256,1024,53248,16384,2,0,2928.9446,a8w8_blockscale_1x128x128_256x64x128x128_16x16_32x32_8x32x1_8x32x1_1x32x1x8_8_1x1_intrawave_v3,610.02,340.82,0.0
256,2048,2304,16384,2,0,373.898,a8w8_blockscale_1x128x128_256x64x128x128_16x16_32x32_8x32x1_8x32x1_1x32x1x8_8_1x1_intrawave_v3,413.53,215.94,0.0
256,2048,4608,16384,2,0,590.7175,a8w8_blockscale_1x128x128_256x64x128x128_16x16_32x32_8x32x1_8x32x1_1x32x1x8_8_1x1_intrawave_v3,523.49,216.56,0.0
256,2048,9216,16384,2,0,1035.1456,a8w8_blockscale_1x128x128_256x64x128x128_16x16_32x32_8x32x1_8x32x1_1x32x1x8_8_1x1_intrawave_v3,597.48,214.75,0.0
256,2048,13312,16384,2,0,1474.9458,a8w8_blockscale_1x128x128_256x64x128x128_16x16_32x32_8x32x1_8x32x1_1x32x1x8_8_1x1_intrawave_v3,605.69,207.59,0.0
256,2048,16384,2048,2,0,260.6436,a8w8_blockscale_1x128x128_256x64x128x128_16x16_32x32_8x32x1_8x32x1_1x32x1x8_8_1x1_intrawave_v3,527.31,402.3,0.0
256,2048,16384,4096,2,0,488.3099,a8w8_blockscale_1x128x128_256x64x128x128_16x16_32x32_8x32x1_8x32x1_1x32x1x8_8_1x1_intrawave_v3,562.92,292.04,0.0
256,2048,16384,6656,2,0,759.1475,a8w8_blockscale_1x128x128_256x64x128x128_16x16_32x32_8x32x1_8x32x1_1x32x1x8_8_1x1_intrawave_v3,588.39,250.01,0.0
256,2048,16384,8192,2,0,928.8231,a8w8_blockscale_1x128x128_256x64x128x128_16x16_32x32_8x32x1_8x32x1_1x32x1x8_8_1x1_intrawave_v3,591.88,234.82,0.0
256,2048,16384,13312,2,0,1484.2395,a8w8_blockscale_1x128x128_256x64x128x128_16x16_32x32_8x32x1_8x32x1_1x32x1x8_8_1x1_intrawave_v3,601.89,210.53,0.0
256,2048,16384,26624,2,0,2921.171,a8w8_blockscale_1x128x128_256x64x128x128_16x16_32x32_8x32x1_8x32x1_1x32x1x8_8_1x1_intrawave_v3,611.64,190.97,0.0
256,2048,26624,16384,2,0,2903.558,a8w8_blockscale_1x128x128_256x64x128x128_16x16_32x32_8x32x1_8x32x1_1x32x1x8_8_1x1_intrawave_v3,615.35,199.35,0.0
256,2048,53248,16384,2,0,5762.4219,a8w8_blockscale_1x128x128_256x64x128x128_16x16_32x32_8x32x1_8x32x1_1x32x1x8_8_1x1_intrawave_v3,620.12,195.07,0.0
256,4096,2304,16384,2,0,596.2252,a8w8_blockscale_1x128x128_256x64x128x128_16x16_32x32_8x32x1_8x32x1_1x32x1x8_8_1x1_intrawave_v3,518.66,207.53,0.0
256,4096,4608,16384,2,0,1034.0419,a8w8_blockscale_1x128x128_256x64x128x128_16x16_32x32_8x32x1_8x32x1_1x32x1x8_8_1x1_intrawave_v3,598.11,174.42,0.0
256,4096,9216,16384,2,0,2012.0609,a8w8_blockscale_1x128x128_256x64x128x128_16x16_32x32_8x32x1_8x32x1_1x32x1x8_8_1x1_intrawave_v3,614.77,145.92,0.0
256,4096,13312,16384,2,0,2908.028,a8w8_blockscale_1x128x128_256x64x128x128_16x16_32x32_8x32x1_8x32x1_1x32x1x8_8_1x1_intrawave_v3,614.4,135.58,0.0
256,4096,16384,2048,2,0,500.5023,a8w8_blockscale_1x128x128_256x64x128x128_16x16_32x32_8x32x1_8x32x1_1x32x1x8_8_1x1_intrawave_v3,549.2,351.97,0.0
256,4096,16384,4096,2,0,947.3225,a8w8_blockscale_1x128x128_256x64x128x128_16x16_32x32_8x32x1_8x32x1_1x32x1x8_8_1x1_intrawave_v3,580.33,230.23,0.0
256,4096,16384,6656,2,0,1477.0741,a8w8_blockscale_1x128x128_256x64x128x128_16x16_32x32_8x32x1_8x32x1_1x32x1x8_8_1x1_intrawave_v3,604.81,183.15,0.0
256,4096,16384,8192,2,0,1811.2412,a8w8_blockscale_1x128x128_256x64x128x128_16x16_32x32_8x32x1_8x32x1_1x32x1x8_8_1x1_intrawave_v3,607.05,166.73,0.0
256,4096,16384,13312,2,0,2942.4425,a8w8_blockscale_1x128x128_256x64x128x128_16x16_32x32_8x32x1_8x32x1_1x32x1x8_8_1x1_intrawave_v3,607.22,138.27,0.0
256,4096,16384,26624,2,0,5781.3289,a8w8_blockscale_1x128x128_256x64x128x128_16x16_32x32_8x32x1_8x32x1_1x32x1x8_8_1x1_intrawave_v3,618.1,117.53,0.0
256,4096,26624,16384,2,0,5779.1042,a8w8_blockscale_1x128x128_256x64x128x128_16x16_32x32_8x32x1_8x32x1_1x32x1x8_8_1x1_intrawave_v3,618.33,124.83,0.0
256,4096,53248,16384,2,0,11486.1149,a8w8_blockscale_1x128x128_256x64x128x128_16x16_32x32_8x32x1_8x32x1_1x32x1x8_8_1x1_intrawave_v3,622.21,119.77,0.0
256,8192,2304,16384,2,0,1056.8417,a8w8_blockscale_1x128x128_256x64x128x128_16x16_32x32_8x32x1_8x32x1_1x32x1x8_8_1x1_intrawave_v3,585.21,198.44,0.0
256,8192,4608,16384,2,0,2008.6271,a8w8_blockscale_1x128x128_256x64x128x128_16x16_32x32_8x32x1_8x32x1_1x32x1x8_8_1x1_intrawave_v3,615.82,141.99,0.0
256,8192,9216,16384,2,0,3963.6781,a8w8_blockscale_1x128x128_256x64x128x128_16x16_32x32_8x32x1_8x32x1_1x32x1x8_8_1x1_intrawave_v3,624.14,110.05,0.0
256,8192,13312,16384,2,0,5793.2738,a8w8_blockscale_1x128x128_256x64x128x128_16x16_32x32_8x32x1_8x32x1_1x32x1x8_8_1x1_intrawave_v3,616.82,98.46,0.0
256,8192,16384,2048,2,0,981.2869,a8w8_blockscale_1x128x128_256x64x128x128_16x16_32x32_8x32x1_8x32x1_1x32x1x8_8_1x1_intrawave_v3,560.24,324.85,0.0
256,8192,16384,4096,2,0,1859.5258,a8w8_blockscale_1x128x128_256x64x128x128_16x16_32x32_8x32x1_8x32x1_1x32x1x8_8_1x1_intrawave_v3,591.29,198.49,0.0
256,8192,16384,6656,2,0,2915.9543,a8w8_blockscale_1x128x128_256x64x128x128_16x16_32x32_8x32x1_8x32x1_1x32x1x8_8_1x1_intrawave_v3,612.73,148.16,0.0
256,8192,16384,8192,2,0,3555.2418,a8w8_blockscale_1x128x128_256x64x128x128_16x16_32x32_8x32x1_8x32x1_1x32x1x8_8_1x1_intrawave_v3,618.53,132.13,0.0
256,8192,16384,13312,2,0,5848.5652,a8w8_blockscale_1x128x128_256x64x128x128_16x16_32x32_8x32x1_8x32x1_1x32x1x8_8_1x1_intrawave_v3,610.99,101.84,0.0
256,8192,16384,26624,2,0,11503.3184,a8w8_blockscale_1x128x128_256x64x128x128_16x16_32x32_8x32x1_8x32x1_1x32x1x8_8_1x1_intrawave_v3,621.28,80.22,0.0
256,8192,26624,16384,2,0,11516.6936,a8w8_blockscale_1x128x128_256x64x128x128_16x16_32x32_8x32x1_8x32x1_1x32x1x8_8_1x1_intrawave_v3,620.56,87.41,0.0
256,8192,53248,16384,2,0,22939.5454,a8w8_blockscale_1x128x128_256x64x128x128_16x16_32x32_8x32x1_8x32x1_1x32x1x8_8_1x1_intrawave_v3,623.1,81.91,0.0
256,16384,2304,16384,2,0,2048.4719,a8w8_blockscale_1x128x128_256x64x128x128_16x16_32x32_8x32x1_8x32x1_1x32x1x8_8_1x1_intrawave_v3,603.84,186.33,0.0
256,16384,4608,16384,2,0,3961.2624,a8w8_blockscale_1x128x128_256x64x128x128_16x16_32x32_8x32x1_8x32x1_1x32x1x8_8_1x1_intrawave_v3,624.52,124.94,0.0
256,16384,9216,16384,2,0,7859.9981,a8w8_blockscale_1x128x128_256x64x128x128_16x16_32x32_8x32x1_8x32x1_1x32x1x8_8_1x1_intrawave_v3,629.49,91.78,0.0
256,16384,13312,16384,2,0,11553.8542,a8w8_blockscale_1x128x128_256x64x128x128_16x16_32x32_8x32x1_8x32x1_1x32x1x8_8_1x1_intrawave_v3,618.57,79.86,0.0
256,16384,16384,2048,15,0,1933.1538,a8w8_blockscale_1x128x128_256x64x128x128_16x16_32x32_8x32x1_8x32x1_1x32x1x8_8_1x1_intrawave_v1,568.77,312.43,0.0
256,16384,16384,4096,2,0,3670.041,a8w8_blockscale_1x128x128_256x64x128x128_16x16_32x32_8x32x1_8x32x1_1x32x1x8_8_1x1_intrawave_v3,599.18,182.86,0.0
256,16384,16384,6656,2,0,5783.0273,a8w8_blockscale_1x128x128_256x64x128x128_16x16_32x32_8x32x1_8x32x1_1x32x1x8_8_1x1_intrawave_v3,617.91,130.55,0.0
256,16384,16384,8192,2,0,7072.6134,a8w8_blockscale_1x128x128_256x64x128x128_16x16_32x32_8x32x1_8x32x1_1x32x1x8_8_1x1_intrawave_v3,621.84,113.86,0.0
256,16384,16384,13312,2,0,11555.9374,a8w8_blockscale_1x128x128_256x64x128x128_16x16_32x32_8x32x1_8x32x1_1x32x1x8_8_1x1_intrawave_v3,618.45,84.21,0.0
256,16384,16384,26624,2,0,22955.2402,a8w8_blockscale_1x128x128_256x64x128x128_16x16_32x32_8x32x1_8x32x1_1x32x1x8_8_1x1_intrawave_v3,622.67,61.39,0.0
256,16384,26624,16384,2,0,22929.2293,a8w8_blockscale_1x128x128_256x64x128x128_16x16_32x32_8x32x1_8x32x1_1x32x1x8_8_1x1_intrawave_v3,623.38,68.78,0.0
256,16384,53248,16384,2,0,45925.9862,a8w8_blockscale_1x128x128_256x64x128x128_16x16_32x32_8x32x1_8x32x1_1x32x1x8_8_1x1_intrawave_v3,622.46,62.83,0.0
256,32768,2304,16384,2,0,4039.709,a8w8_blockscale_1x128x128_256x64x128x128_16x16_32x32_8x32x1_8x32x1_1x32x1x8_8_1x1_intrawave_v3,612.4,179.62,0.0
256,32768,4608,16384,2,0,7894.1957,a8w8_blockscale_1x128x128_256x64x128x128_16x16_32x32_8x32x1_8x32x1_1x32x1x8_8_1x1_intrawave_v3,626.76,115.83,0.0
256,32768,9216,16384,2,0,15626.4597,a8w8_blockscale_1x128x128_256x64x128x128_16x16_32x32_8x32x1_8x32x1_1x32x1x8_8_1x1_intrawave_v3,633.26,82.67,0.0
256,32768,13312,16384,2,0,22806.0507,a8w8_blockscale_1x128x128_256x64x128x128_16x16_32x32_8x32x1_8x32x1_1x32x1x8_8_1x1_intrawave_v3,626.75,71.36,0.0
256,32768,16384,2048,15,0,3841.5937,a8w8_blockscale_1x128x128_256x64x128x128_16x16_32x32_8x32x1_8x32x1_1x32x1x8_8_1x1_intrawave_v1,572.42,305.71,0.0
256,32768,16384,4096,2,0,7267.8026,a8w8_blockscale_1x128x128_256x64x128x128_16x16_32x32_8x32x1_8x32x1_1x32x1x8_8_1x1_intrawave_v3,605.14,175.44,0.0
256,32768,16384,6656,2,0,11525.2583,a8w8_blockscale_1x128x128_256x64x128x128_16x16_32x32_8x32x1_8x32x1_1x32x1x8_8_1x1_intrawave_v3,620.1,121.55,0.0
256,32768,16384,8192,2,0,14093.7868,a8w8_blockscale_1x128x128_256x64x128x128_16x16_32x32_8x32x1_8x32x1_1x32x1x8_8_1x1_intrawave_v3,624.11,104.76,0.0
256,32768,16384,13312,2,0,23101.7896,a8w8_blockscale_1x128x128_256x64x128x128_16x16_32x32_8x32x1_8x32x1_1x32x1x8_8_1x1_intrawave_v3,618.72,74.8,0.0
256,32768,16384,26624,2,0,45893.4625,a8w8_blockscale_1x128x128_256x64x128x128_16x16_32x32_8x32x1_8x32x1_1x32x1x8_8_1x1_intrawave_v3,622.91,51.91,0.0
256,32768,26624,16384,2,0,46011.2885,a8w8_blockscale_1x128x128_256x64x128x128_16x16_32x32_8x32x1_8x32x1_1x32x1x8_8_1x1_intrawave_v3,621.31,59.07,0.0
256,32768,53248,16384,2,0,91708.7147,a8w8_blockscale_1x128x128_256x64x128x128_16x16_32x32_8x32x1_8x32x1_1x32x1x8_8_1x1_intrawave_v3,623.44,53.42,0.0
256,1,100,5120,8,0,20.5629,a8w8_blockscale_1x128x128_256x16x64x256_16x16_16x16_16x16x1_16x16x1_1x16x1x16_4_1x1_intrawave_v1,0.05,25.16,0.0
256,1,200,5120,8,0,20.7831,a8w8_blockscale_1x128x128_256x16x64x256_16x16_16x16_16x16x1_16x16x1_1x16x1x16_4_1x1_intrawave_v1,0.1,49.54,0.0
256,1,800,5120,8,0,26.6635,a8w8_blockscale_1x128x128_256x16x64x256_16x16_16x16_16x16x1_16x16x1_1x16x1x16_4_1x1_intrawave_v1,0.31,153.87,0.0
256,1,5120,640,8,0,6.0162,a8w8_blockscale_1x128x128_256x16x64x256_16x16_16x16_16x16x1_16x16x1_1x16x1x16_4_1x1_intrawave_v1,1.09,546.47,0.0
256,1,5120,1280,8,0,7.7009,a8w8_blockscale_1x128x128_256x16x64x256_16x16_16x16_16x16x1_16x16x1_1x16x1x16_4_1x1_intrawave_v1,1.7,852.51,0.0
256,1,5120,3200,8,0,16.4917,a8w8_blockscale_1x128x128_256x16x64x256_16x16_16x16_16x16x1_16x16x1_1x16x1x16_4_1x1_intrawave_v1,1.99,994.28,0.0
256,1,5120,5120,8,0,26.9254,a8w8_blockscale_1x128x128_256x16x64x256_16x16_16x16_16x16x1_16x16x1_1x16x1x16_4_1x1_intrawave_v1,1.95,974.16,0.0
256,1,5120,6400,8,0,29.5876,a8w8_blockscale_1x128x128_256x16x64x256_16x16_16x16_16x16x1_16x16x1_1x16x1x16_4_1x1_intrawave_v1,2.21,1108.05,0.0
256,1,5120,25600,8,0,127.0431,a8w8_blockscale_1x128x128_256x16x64x256_16x16_16x16_16x16x1_16x16x1_1x16x1x16_4_1x1_intrawave_v1,2.06,1031.99,0.0
256,1,6400,5120,8,0,27.1669,a8w8_blockscale_1x128x128_256x16x64x256_16x16_16x16_16x16x1_16x16x1_1x16x1x16_4_1x1_intrawave_v1,2.41,1206.83,0.0
256,1,12800,5120,8,0,28.404,a8w8_blockscale_1x128x128_256x16x64x256_16x16_16x16_16x16x1_16x16x1_1x16x1x16_4_1x1_intrawave_v1,4.61,2308.36,0.0
256,1,51200,5120,7,0,59.3032,a8w8_blockscale_1x128x128_256x16x128x256_16x16_16x16_16x16x1_16x16x1_1x16x1x16_8_1x2_intrawave_v1,8.84,4422.22,0.0
256,16,100,5120,8,0,21.0887,a8w8_blockscale_1x128x128_256x16x64x256_16x16_16x16_16x16x1_16x16x1_1x16x1x16_4_1x1_intrawave_v1,0.78,28.31,0.0
256,16,200,5120,8,0,21.2891,a8w8_blockscale_1x128x128_256x16x64x256_16x16_16x16_16x16x1_16x16x1_1x16x1x16_4_1x1_intrawave_v1,1.54,52.25,0.0
256,16,800,5120,8,0,28.2821,a8w8_blockscale_1x128x128_256x16x64x256_16x16_16x16_16x16x1_16x16x1_1x16x1x16_4_1x1_intrawave_v1,4.63,148.63,0.0
256,16,5120,640,8,0,5.5586,a8w8_blockscale_1x128x128_256x16x64x256_16x16_16x16_16x16x1_16x16x1_1x16x1x16_4_1x1_intrawave_v1,18.86,620.82,0.0
256,16,5120,1280,8,0,7.5523,a8w8_blockscale_1x128x128_256x16x64x256_16x16_16x16_16x16x1_16x16x1_1x16x1x16_4_1x1_intrawave_v1,27.77,892.17,0.0
256,16,5120,3200,8,0,16.619,a8w8_blockscale_1x128x128_256x16x64x256_16x16_16x16_16x16x1_16x16x1_1x16x1x16_4_1x1_intrawave_v1,31.55,998.8,0.0
256,16,5120,5120,8,0,20.9939,a8w8_blockscale_1x128x128_256x16x64x256_16x16_16x16_16x16x1_16x16x1_1x16x1x16_4_1x1_intrawave_v1,39.96,1260.37,0.0
256,16,5120,6400,8,0,24.7474,a8w8_blockscale_1x128x128_256x16x64x256_16x16_16x16_16x16x1_16x16x1_1x16x1x16_4_1x1_intrawave_v1,42.37,1334.86,0.0
256,16,5120,25600,8,0,94.3261,a8w8_blockscale_1x128x128_256x16x64x256_16x16_16x16_16x16x1_16x16x1_1x16x1x16_4_1x1_intrawave_v1,44.47,1395.64,0.0
256,16,6400,5120,8,0,21.19,a8w8_blockscale_1x128x128_256x16x64x256_16x16_16x16_16x16x1_16x16x1_1x16x1x16_4_1x1_intrawave_v1,49.48,1559.92,0.0
256,16,12800,5120,8,0,22.8893,a8w8_blockscale_1x128x128_256x16x64x256_16x16_16x16_16x16x1_16x16x1_1x16x1x16_4_1x1_intrawave_v1,91.62,2884.65,0.0
256,16,51200,5120,7,0,59.4032,a8w8_blockscale_1x128x128_256x16x128x256_16x16_16x16_16x16x1_16x16x1_1x16x1x16_8_1x2_intrawave_v1,141.21,4441.92,0.0
256,32,100,5120,8,0,21.2636,a8w8_blockscale_1x128x128_256x16x64x256_16x16_16x16_16x16x1_16x16x1_1x16x1x16_4_1x1_intrawave_v1,1.54,32.08,0.0
256,32,200,5120,8,0,21.6456,a8w8_blockscale_1x128x128_256x16x64x256_16x16_16x16_16x16x1_16x16x1_1x16x1x16_4_1x1_intrawave_v1,3.03,55.47,0.0
256,32,800,5120,8,0,27.4697,a8w8_blockscale_1x128x128_256x16x64x256_16x16_16x16_16x16x1_16x16x1_1x16x1x16_4_1x1_intrawave_v1,9.54,156.94,0.0
256,32,5120,640,8,0,6.2607,a8w8_blockscale_1x128x128_256x16x64x256_16x16_16x16_16x16x1_16x16x1_1x16x1x16_4_1x1_intrawave_v1,33.5,579.0,0.0
256,32,5120,1280,8,0,6.5883,a8w8_blockscale_1x128x128_256x16x64x256_16x16_16x16_16x16x1_16x16x1_1x16x1x16_4_1x1_intrawave_v1,63.66,1050.69,0.0
256,32,5120,3200,8,0,16.91,a8w8_blockscale_1x128x128_256x16x64x256_16x16_16x16_16x16x1_16x16x1_1x16x1x16_4_1x1_intrawave_v1,62.01,994.33,0.0
256,32,5120,5120,8,0,20.9363,a8w8_blockscale_1x128x128_256x16x64x256_16x16_16x16_16x16x1_16x16x1_1x16x1x16_4_1x1_intrawave_v1,80.13,1275.58,0.0
256,32,5120,6400,8,0,25.0483,a8w8_blockscale_1x128x128_256x16x64x256_16x16_16x16_16x16x1_16x16x1_1x16x1x16_4_1x1_intrawave_v1,83.72,1329.45,0.0
256,32,5120,25600,8,0,92.4611,a8w8_blockscale_1x128x128_256x16x64x256_16x16_16x16_16x16x1_16x16x1_1x16x1x16_4_1x1_intrawave_v1,90.73,1429.99,0.0
256,32,6400,5120,8,0,21.2077,a8w8_blockscale_1x128x128_256x16x64x256_16x16_16x16_16x16x1_16x16x1_1x16x1x16_4_1x1_intrawave_v1,98.89,1572.14,0.0
256,32,12800,5120,7,0,30.5797,a8w8_blockscale_1x128x128_256x16x128x256_16x16_16x16_16x16x1_16x16x1_1x16x1x16_8_1x2_intrawave_v1,137.16,2175.27,0.0
256,32,51200,5120,13,0,86.9684,a8w8_blockscale_1x128x128_256x32x64x256_16x16_16x16_16x16x1_16x16x1_1x32x1x8_8_2x1_intrawave_v1,192.91,3053.81,0.0
256,64,100,5120,8,0,21.5586,a8w8_blockscale_1x128x128_256x16x64x256_16x16_16x16_16x16x1_16x16x1_1x16x1x16_4_1x1_intrawave_v1,3.04,39.54,0.0
256,64,200,5120,8,0,21.5216,a8w8_blockscale_1x128x128_256x16x64x256_16x16_16x16_16x16x1_16x16x1_1x16x1x16_4_1x1_intrawave_v1,6.09,64.0,0.0
256,64,800,5120,8,0,26.3125,a8w8_blockscale_1x128x128_256x16x64x256_16x16_16x16_16x16x1_16x16x1_1x16x1x16_4_1x1_intrawave_v1,19.93,172.01,0.0
256,64,5120,640,8,0,6.5358,a8w8_blockscale_1x128x128_256x16x64x256_16x16_16x16_16x16x1_16x16x1_1x16x1x16_4_1x1_intrawave_v1,64.17,607.9,0.0
256,64,5120,1280,7,0,9.0439,a8w8_blockscale_1x128x128_256x16x128x256_16x16_16x16_16x16x1_16x16x1_1x16x1x16_8_1x2_intrawave_v1,92.75,806.17,0.0
256,64,5120,3200,8,0,21.0938,a8w8_blockscale_1x128x128_256x16x64x256_16x16_16x16_16x16x1_16x16x1_1x16x1x16_4_1x1_intrawave_v1,99.42,817.5,0.0
256,64,5120,5120,8,0,29.1849,a8w8_blockscale_1x128x128_256x16x64x256_16x16_16x16_16x16x1_16x16x1_1x16x1x16_4_1x1_intrawave_v1,114.97,931.9,0.0
256,64,5120,6400,7,0,32.2352,a8w8_blockscale_1x128x128_256x16x128x256_16x16_16x16_16x16x1_16x16x1_1x16x1x16_8_1x2_intrawave_v1,130.12,1049.57,0.0
256,64,5120,25600,8,0,131.7158,a8w8_blockscale_1x128x128_256x16x64x256_16x16_16x16_16x16x1_16x16x1_1x16x1x16_4_1x1_intrawave_v1,127.37,1012.53,0.0
256,64,6400,5120,8,0,29.7697,a8w8_blockscale_1x128x128_256x16x64x256_16x16_16x16_16x16x1_16x16x1_1x16x1x16_4_1x1_intrawave_v1,140.89,1139.24,0.0
256,64,12800,5120,3,0,41.7304,a8w8_blockscale_1x128x128_256x64x64x128_16x16_32x32_8x32x1_8x32x1_1x32x1x8_8_1x1_intrawave_v3,201.02,1617.58,0.0
256,64,51200,5120,2,0,112.2017,a8w8_blockscale_1x128x128_256x64x128x128_16x16_32x32_8x32x1_8x32x1_1x32x1x8_8_1x1_intrawave_v3,299.05,2397.69,0.0
256,128,100,5120,8,0,21.4894,a8w8_blockscale_1x128x128_256x16x64x256_16x16_16x16_16x16x1_16x16x1_1x16x1x16_4_1x1_intrawave_v1,6.1,55.51,0.0
256,128,200,5120,8,0,21.3961,a8w8_blockscale_1x128x128_256x16x64x256_16x16_16x16_16x16x1_16x16x1_1x16x1x16_4_1x1_intrawave_v1,12.25,80.88,0.0
256,128,800,5120,8,0,24.7395,a8w8_blockscale_1x128x128_256x16x64x256_16x16_16x16_16x16x1_16x16x1_1x16x1x16_4_1x1_intrawave_v1,42.38,200.33,0.0
256,128,5120,640,3,0,7.825,a8w8_blockscale_1x128x128_256x64x64x128_16x16_32x32_8x32x1_8x32x1_1x32x1x8_8_1x1_intrawave_v3,107.2,596.73,0.0
256,128,5120,1280,8,0,11.0552,a8w8_blockscale_1x128x128_256x16x64x256_16x16_16x16_16x16x1_16x16x1_1x16x1x16_4_1x1_intrawave_v1,151.76,726.19,0.0
256,128,5120,3200,3,0,24.8519,a8w8_blockscale_1x128x128_256x64x64x128_16x16_32x32_8x32x1_8x32x1_1x32x1x8_8_1x1_intrawave_v3,168.77,728.49,0.0
256,128,5120,5120,8,0,38.6334,a8w8_blockscale_1x128x128_256x16x64x256_16x16_16x16_16x16x1_16x16x1_1x16x1x16_4_1x1_intrawave_v1,173.71,729.43,0.0
256,128,5120,6400,8,0,45.7789,a8w8_blockscale_1x128x128_256x16x64x256_16x16_16x16_16x16x1_16x16x1_1x16x1x16_4_1x1_intrawave_v1,183.24,762.31,0.0
256,128,5120,25600,8,0,174.3467,a8w8_blockscale_1x128x128_256x16x64x256_16x16_16x16_16x16x1_16x16x1_1x16x1x16_4_1x1_intrawave_v1,192.46,778.1,0.0
256,128,6400,5120,3,0,41.0637,a8w8_blockscale_1x128x128_256x64x64x128_16x16_32x32_8x32x1_8x32x1_1x32x1x8_8_1x1_intrawave_v3,204.28,853.84,0.0
256,128,12800,5120,2,0,56.6862,a8w8_blockscale_1x128x128_256x64x128x128_16x16_32x32_8x32x1_8x32x1_1x32x1x8_8_1x1_intrawave_v3,295.97,1225.49,0.0
256,128,51200,5120,2,0,175.747,a8w8_blockscale_1x128x128_256x64x128x128_16x16_32x32_8x32x1_8x32x1_1x32x1x8_8_1x1_intrawave_v3,381.85,1569.91,0.0
256,256,100,5120,8,0,21.3834,a8w8_blockscale_1x128x128_256x16x64x256_16x16_16x16_16x16x1_16x16x1_1x16x1x16_4_1x1_intrawave_v1,12.26,87.63,0.0
256,256,200,5120,8,0,22.2314,a8w8_blockscale_1x128x128_256x16x64x256_16x16_16x16_16x16x1_16x16x1_1x16x1x16_4_1x1_intrawave_v1,23.58,109.63,0.0
256,256,800,5120,8,0,24.7957,a8w8_blockscale_1x128x128_256x16x64x256_16x16_16x16_16x16x1_16x16x1_1x16x1x16_4_1x1_intrawave_v1,84.58,234.57,0.0
256,256,5120,640,15,0,10.3325,a8w8_blockscale_1x128x128_256x64x128x128_16x16_32x32_8x32x1_8x32x1_1x32x1x8_8_1x1_intrawave_v1,162.37,586.7,0.0
256,256,5120,1280,11,0,17.1324,a8w8_blockscale_1x128x128_256x32x64x128_16x16_16x16_8x32x1_8x32x1_1x32x1x8_8_2x1_intrawave_v1,195.85,554.66,0.0
256,256,5120,3200,15,0,33.7649,a8w8_blockscale_1x128x128_256x64x128x128_16x16_32x32_8x32x1_8x32x1_1x32x1x8_8_1x1_intrawave_v1,248.44,587.14,0.0
256,256,5120,5120,2,0,55.12,a8w8_blockscale_1x128x128_256x64x128x128_16x16_32x32_8x32x1_8x32x1_1x32x1x8_8_1x1_intrawave_v3,243.5,546.93,0.0
256,256,5120,6400,2,0,63.9744,a8w8_blockscale_1x128x128_256x64x128x128_16x16_32x32_8x32x1_8x32x1_1x32x1x8_8_1x1_intrawave_v3,262.25,578.79,0.0
256,256,5120,25600,2,0,248.4276,a8w8_blockscale_1x128x128_256x64x128x128_16x16_32x32_8x32x1_8x32x1_1x32x1x8_8_1x1_intrawave_v3,270.13,564.54,0.0
256,256,6400,5120,2,0,55.9002,a8w8_blockscale_1x128x128_256x64x128x128_16x16_32x32_8x32x1_8x32x1_1x32x1x8_8_1x1_intrawave_v3,300.13,668.25,0.0
256,256,12800,5120,2,0,88.329,a8w8_blockscale_1x128x128_256x64x128x128_16x16_32x32_8x32x1_8x32x1_1x32x1x8_8_1x1_intrawave_v3,379.88,830.99,0.0
256,256,51200,5120,2,0,280.5719,a8w8_blockscale_1x128x128_256x64x128x128_16x16_32x32_8x32x1_8x32x1_1x32x1x8_8_1x1_intrawave_v3,478.37,1032.42,0.0
256,512,100,5120,8,0,22.856,a8w8_blockscale_1x128x128_256x16x64x256_16x16_16x16_16x16x1_16x16x1_1x16x1x16_4_1x1_intrawave_v1,22.94,141.58,0.0
256,512,200,5120,8,0,23.748,a8w8_blockscale_1x128x128_256x16x64x256_16x16_16x16_16x16x1_16x16x1_1x16x1x16_4_1x1_intrawave_v1,44.15,162.13,0.0
256,512,800,5120,8,0,31.1327,a8w8_blockscale_1x128x128_256x16x64x256_16x16_16x16_16x16x1_16x16x1_1x16x1x16_4_1x1_intrawave_v1,134.72,242.08,0.0
256,512,5120,640,16,0,13.5819,a8w8_blockscale_1x128x128_256x64x64x128_16x16_32x32_8x32x1_8x32x1_1x32x1x8_8_1x1_intrawave_v1,247.05,651.41,0.0
256,512,5120,1280,16,0,23.49,a8w8_blockscale_1x128x128_256x64x64x128_16x16_32x32_8x32x1_8x32x1_1x32x1x8_8_1x1_intrawave_v1,285.69,530.09,0.0
256,512,5120,3200,16,0,50.3003,a8w8_blockscale_1x128x128_256x64x64x128_16x16_32x32_8x32x1_8x32x1_1x32x1x8_8_1x1_intrawave_v1,333.54,462.53,0.0
256,512,5120,5120,16,0,81.6994,a8w8_blockscale_1x128x128_256x64x64x128_16x16_32x32_8x32x1_8x32x1_1x32x1x8_8_1x1_intrawave_v1,328.56,417.12,0.0
256,512,5120,6400,16,0,95.3073,a8w8_blockscale_1x128x128_256x64x64x128_16x16_32x32_8x32x1_8x32x1_1x32x1x8_8_1x1_intrawave_v1,352.07,433.21,0.0
256,512,5120,25600,16,0,393.0973,a8w8_blockscale_1x128x128_256x64x64x128_16x16_32x32_8x32x1_8x32x1_1x32x1x8_8_1x1_intrawave_v1,341.44,380.11,0.0
256,512,6400,5120,2,0,87.2911,a8w8_blockscale_1x128x128_256x64x128x128_16x16_32x32_8x32x1_8x32x1_1x32x1x8_8_1x1_intrawave_v3,384.4,480.5,0.0
256,512,12800,5120,2,0,163.752,a8w8_blockscale_1x128x128_256x64x128x128_16x16_32x32_8x32x1_8x32x1_1x32x1x8_8_1x1_intrawave_v3,409.82,496.27,0.0
256,512,51200,5120,2,0,493.7976,a8w8_blockscale_1x128x128_256x64x128x128_16x16_32x32_8x32x1_8x32x1_1x32x1x8_8_1x1_intrawave_v3,543.61,642.36,0.0
256,1024,100,5120,8,0,23.5129,a8w8_blockscale_1x128x128_256x16x64x256_16x16_16x16_16x16x1_16x16x1_1x16x1x16_4_1x1_intrawave_v1,44.6,253.46,0.0
256,1024,200,5120,8,0,23.9853,a8w8_blockscale_1x128x128_256x16x64x256_16x16_16x16_16x16x1_16x16x1_1x16x1x16_4_1x1_intrawave_v1,87.43,278.36,0.0
256,1024,800,5120,13,0,44.1947,a8w8_blockscale_1x128x128_256x32x64x256_16x16_16x16_16x16x1_16x16x1_1x32x1x8_8_2x1_intrawave_v1,189.81,248.38,0.0
256,1024,5120,640,16,0,20.858,a8w8_blockscale_1x128x128_256x64x64x128_16x16_32x32_8x32x1_8x32x1_1x32x1x8_8_1x1_intrawave_v1,321.74,691.24,0.0
256,1024,5120,1280,16,0,36.2504,a8w8_blockscale_1x128x128_256x64x64x128_16x16_32x32_8x32x1_8x32x1_1x32x1x8_8_1x1_intrawave_v1,370.25,506.2,0.0
256,1024,5120,3200,15,0,77.3328,a8w8_blockscale_1x128x128_256x64x128x128_16x16_32x32_8x32x1_8x32x1_1x32x1x8_8_1x1_intrawave_v1,433.9,389.83,0.0
256,1024,5120,5120,2,0,126.0599,a8w8_blockscale_1x128x128_256x64x128x128_16x16_32x32_8x32x1_8x32x1_1x32x1x8_8_1x1_intrawave_v3,425.89,332.72,0.0
256,1024,5120,6400,2,0,146.6741,a8w8_blockscale_1x128x128_256x64x128x128_16x16_32x32_8x32x1_8x32x1_1x32x1x8_8_1x1_intrawave_v3,457.54,339.58,0.0
256,1024,5120,25600,2,0,577.2693,a8w8_blockscale_1x128x128_256x64x128x128_16x16_32x32_8x32x1_8x32x1_1x32x1x8_8_1x1_intrawave_v3,465.01,290.63,0.0
256,1024,6400,5120,2,0,161.8853,a8w8_blockscale_1x128x128_256x64x128x128_16x16_32x32_8x32x1_8x32x1_1x32x1x8_8_1x1_intrawave_v3,414.55,315.77,0.0
256,1024,12800,5120,2,0,270.1974,a8w8_blockscale_1x128x128_256x64x128x128_16x16_32x32_8x32x1_8x32x1_1x32x1x8_8_1x1_intrawave_v3,496.74,358.97,0.0
256,1024,51200,5120,2,0,930.5477,a8w8_blockscale_1x128x128_256x64x128x128_16x16_32x32_8x32x1_8x32x1_1x32x1x8_8_1x1_intrawave_v3,576.94,400.03,0.0
256,2048,100,5120,8,0,23.9096,a8w8_blockscale_1x128x128_256x16x64x256_16x16_16x16_16x16x1_16x16x1_1x16x1x16_4_1x1_intrawave_v1,87.71,477.1,0.0
256,2048,200,5120,13,0,31.3445,a8w8_blockscale_1x128x128_256x32x64x256_16x16_16x16_16x16x1_16x16x1_1x32x1x8_8_2x1_intrawave_v1,133.81,393.34,0.0
256,2048,800,5120,10,0,64.8436,a8w8_blockscale_1x128x128_256x32x128x128_16x16_32x32_8x32x1_8x32x1_1x32x1x8_8_1x1_intrawave_v1,258.73,275.41,0.0
256,2048,5120,640,15,0,33.357,a8w8_blockscale_1x128x128_256x64x128x128_16x16_32x32_8x32x1_8x32x1_1x32x1x8_8_1x1_intrawave_v1,402.37,766.23,0.0
256,2048,5120,1280,15,0,57.1651,a8w8_blockscale_1x128x128_256x64x128x128_16x16_32x32_8x32x1_8x32x1_1x32x1x8_8_1x1_intrawave_v1,469.58,527.36,0.0
256,2048,5120,3200,15,0,121.9973,a8w8_blockscale_1x128x128_256x64x128x128_16x16_32x32_8x32x1_8x32x1_1x32x1x8_8_1x1_intrawave_v1,550.08,359.92,0.0
256,2048,5120,5120,2,0,200.5041,a8w8_blockscale_1x128x128_256x64x128x128_16x16_32x32_8x32x1_8x32x1_1x32x1x8_8_1x1_intrawave_v3,535.52,287.63,0.0
256,2048,5120,6400,2,0,230.6187,a8w8_blockscale_1x128x128_256x64x128x128_16x16_32x32_8x32x1_8x32x1_1x32x1x8_8_1x1_intrawave_v3,581.99,289.86,0.0
256,2048,5120,25600,2,0,929.0202,a8w8_blockscale_1x128x128_256x64x128x128_16x16_32x32_8x32x1_8x32x1_1x32x1x8_8_1x1_intrawave_v3,577.89,220.09,0.0
256,2048,6400,5120,2,0,268.5865,a8w8_blockscale_1x128x128_256x64x128x128_16x16_32x32_8x32x1_8x32x1_1x32x1x8_8_1x1_intrawave_v3,499.72,258.64,0.0
256,2048,12800,5120,2,0,488.1405,a8w8_blockscale_1x128x128_256x64x128x128_16x16_32x32_8x32x1_8x32x1_1x32x1x8_8_1x1_intrawave_v3,549.91,263.14,0.0
256,2048,51200,5120,2,0,1829.8348,a8w8_blockscale_1x128x128_256x64x128x128_16x16_32x32_8x32x1_8x32x1_1x32x1x8_8_1x1_intrawave_v3,586.8,263.6,0.0
256,4096,100,5120,8,0,31.9893,a8w8_blockscale_1x128x128_256x16x64x256_16x16_16x16_16x16x1_16x16x1_1x16x1x16_4_1x1_intrawave_v1,131.12,697.19,0.0
256,4096,200,5120,13,0,45.1923,a8w8_blockscale_1x128x128_256x32x64x256_16x16_16x16_16x16x1_16x16x1_1x32x1x8_8_2x1_intrawave_v1,185.62,522.96,0.0
256,4096,800,5120,15,0,101.8224,a8w8_blockscale_1x128x128_256x64x128x128_16x16_32x32_8x32x1_8x32x1_1x32x1x8_8_1x1_intrawave_v1,329.54,310.55,0.0
256,4096,5120,640,15,0,59.2604,a8w8_blockscale_1x128x128_256x64x128x128_16x16_32x32_8x32x1_8x32x1_1x32x1x8_8_1x1_intrawave_v1,452.98,807.31,0.0
256,4096,5120,1280,15,0,104.6033,a8w8_blockscale_1x128x128_256x64x128x128_16x16_32x32_8x32x1_8x32x1_1x32x1x8_8_1x1_intrawave_v1,513.24,513.75,0.0
256,4096,5120,3200,15,0,227.0492,a8w8_blockscale_1x128x128_256x64x128x128_16x16_32x32_8x32x1_8x32x1_1x32x1x8_8_1x1_intrawave_v1,591.14,314.62,0.0
256,4096,5120,5120,2,0,375.2221,a8w8_blockscale_1x128x128_256x64x128x128_16x16_32x32_8x32x1_8x32x1_1x32x1x8_8_1x1_intrawave_v3,572.32,237.54,0.0
256,4096,5120,6400,2,0,441.2723,a8w8_blockscale_1x128x128_256x64x128x128_16x16_32x32_8x32x1_8x32x1_1x32x1x8_8_1x1_intrawave_v3,608.32,228.71,0.0
256,4096,5120,25600,2,0,1772.5774,a8w8_blockscale_1x128x128_256x64x128x128_16x16_32x32_8x32x1_8x32x1_1x32x1x8_8_1x1_intrawave_v3,605.75,156.76,0.0
256,4096,6400,5120,2,0,479.6073,a8w8_blockscale_1x128x128_256x64x128x128_16x16_32x32_8x32x1_8x32x1_1x32x1x8_8_1x1_intrawave_v3,559.7,221.37,0.0
256,4096,12800,5120,2,0,905.9733,a8w8_blockscale_1x128x128_256x64x128x128_16x16_32x32_8x32x1_8x32x1_1x32x1x8_8_1x1_intrawave_v3,592.59,211.23,0.0
256,4096,51200,5120,2,0,3639.3281,a8w8_blockscale_1x128x128_256x64x128x128_16x16_32x32_8x32x1_8x32x1_1x32x1x8_8_1x1_intrawave_v3,590.08,193.04,0.0
256,8192,100,5120,8,0,60.0787,a8w8_blockscale_1x128x128_256x16x64x256_16x16_16x16_16x16x1_16x16x1_1x16x1x16_4_1x1_intrawave_v1,139.63,733.93,0.0
256,8192,200,5120,3,0,68.3504,a8w8_blockscale_1x128x128_256x64x64x128_16x16_32x32_8x32x1_8x32x1_1x32x1x8_8_1x1_intrawave_v3,245.46,676.57,0.0
256,8192,800,5120,16,0,175.2122,a8w8_blockscale_1x128x128_256x64x64x128_16x16_32x32_8x32x1_8x32x1_1x32x1x8_8_1x1_intrawave_v1,383.01,337.57,0.0
256,8192,5120,640,15,0,110.1889,a8w8_blockscale_1x128x128_256x64x128x128_16x16_32x32_8x32x1_8x32x1_1x32x1x8_8_1x1_intrawave_v1,487.23,838.61,0.0
256,8192,5120,1280,15,0,196.6701,a8w8_blockscale_1x128x128_256x64x128x128_16x16_32x32_8x32x1_8x32x1_1x32x1x8_8_1x1_intrawave_v1,545.96,513.17,0.0
256,8192,5120,3200,15,0,439.1323,a8w8_blockscale_1x128x128_256x64x128x128_16x16_32x32_8x32x1_8x32x1_1x32x1x8_8_1x1_intrawave_v1,611.29,288.03,0.0
256,8192,5120,5120,2,0,727.8325,a8w8_blockscale_1x128x128_256x64x128x128_16x16_32x32_8x32x1_8x32x1_1x32x1x8_8_1x1_intrawave_v3,590.1,208.9,0.0
256,8192,5120,6400,2,0,863.2461,a8w8_blockscale_1x128x128_256x64x128x128_16x16_32x32_8x32x1_8x32x1_1x32x1x8_8_1x1_intrawave_v3,621.92,195.87,0.0
256,8192,5120,25600,2,0,3468.7676,a8w8_blockscale_1x128x128_256x64x128x128_16x16_32x32_8x32x1_8x32x1_1x32x1x8_8_1x1_intrawave_v3,619.09,122.43,0.0
256,8192,6400,5120,2,0,903.7238,a8w8_blockscale_1x128x128_256x64x128x128_16x16_32x32_8x32x1_8x32x1_1x32x1x8_8_1x1_intrawave_v3,594.07,198.7,0.0
256,8192,12800,5120,2,0,1779.8827,a8w8_blockscale_1x128x128_256x64x128x128_16x16_32x32_8x32x1_8x32x1_1x32x1x8_8_1x1_intrawave_v3,603.27,178.21,0.0
256,8192,51200,5120,2,0,7245.9382,a8w8_blockscale_1x128x128_256x64x128x128_16x16_32x32_8x32x1_8x32x1_1x32x1x8_8_1x1_intrawave_v3,592.74,157.74,0.0
256,16384,100,5120,8,0,111.1281,a8w8_blockscale_1x128x128_256x16x64x256_16x16_16x16_16x16x1_16x16x1_1x16x1x16_4_1x1_intrawave_v1,150.97,788.95,0.0
256,16384,200,5120,15,0,102.1366,a8w8_blockscale_1x128x128_256x64x128x128_16x16_32x32_8x32x1_8x32x1_1x32x1x8_8_1x1_intrawave_v1,328.53,895.5,0.0
256,16384,800,5120,16,0,316.1007,a8w8_blockscale_1x128x128_256x64x64x128_16x16_32x32_8x32x1_8x32x1_1x32x1x8_8_1x1_intrawave_v1,424.6,361.27,0.0
256,16384,5120,640,15,0,207.3893,a8w8_blockscale_1x128x128_256x64x128x128_16x16_32x32_8x32x1_8x32x1_1x32x1x8_8_1x1_intrawave_v1,517.74,875.33,0.0
256,16384,5120,1280,15,0,381.6221,a8w8_blockscale_1x128x128_256x64x128x128_16x16_32x32_8x32x1_8x32x1_1x32x1x8_8_1x1_intrawave_v1,562.73,511.76,0.0
256,16384,5120,3200,15,0,865.8813,a8w8_blockscale_1x128x128_256x64x128x128_16x16_32x32_8x32x1_8x32x1_1x32x1x8_8_1x1_intrawave_v1,620.03,273.23,0.0
256,16384,5120,5120,2,0,1431.2397,a8w8_blockscale_1x128x128_256x64x128x128_16x16_32x32_8x32x1_8x32x1_1x32x1x8_8_1x1_intrawave_v3,600.17,194.15,0.0
256,16384,5120,6400,2,0,1711.1912,a8w8_blockscale_1x128x128_256x64x128x128_16x16_32x32_8x32x1_8x32x1_1x32x1x8_8_1x1_intrawave_v3,627.48,178.47,0.0
256,16384,5120,25600,2,0,6828.9694,a8w8_blockscale_1x128x128_256x64x128x128_16x16_32x32_8x32x1_8x32x1_1x32x1x8_8_1x1_intrawave_v3,628.93,105.18,0.0
256,16384,6400,5120,2,0,1776.6961,a8w8_blockscale_1x128x128_256x64x128x128_16x16_32x32_8x32x1_8x32x1_1x32x1x8_8_1x1_intrawave_v3,604.35,183.69,0.0
256,16384,12800,5120,2,0,3524.9994,a8w8_blockscale_1x128x128_256x64x128x128_16x16_32x32_8x32x1_8x32x1_1x32x1x8_8_1x1_intrawave_v3,609.22,161.38,0.0
256,16384,51200,5120,2,0,14551.6538,a8w8_blockscale_1x128x128_256x64x128x128_16x16_32x32_8x32x1_8x32x1_1x32x1x8_8_1x1_intrawave_v3,590.31,139.07,0.0
256,32768,100,5120,8,0,211.0462,a8w8_blockscale_1x128x128_256x16x64x256_16x16_16x16_16x16x1_16x16x1_1x16x1x16_4_1x1_intrawave_v1,158.99,828.43,0.0
256,32768,200,5120,15,0,195.2361,a8w8_blockscale_1x128x128_256x64x128x128_16x16_32x32_8x32x1_8x32x1_1x32x1x8_8_1x1_intrawave_v1,343.73,931.71,0.0
256,32768,800,5120,16,0,602.666,a8w8_blockscale_1x128x128_256x64x64x128_16x16_32x32_8x32x1_8x32x1_1x32x1x8_8_1x1_intrawave_v1,445.41,372.17,0.0
256,32768,5120,640,15,0,406.4901,a8w8_blockscale_1x128x128_256x64x128x128_16x16_32x32_8x32x1_8x32x1_1x32x1x8_8_1x1_intrawave_v1,528.3,885.12,0.0
256,32768,5120,1280,15,0,751.9418,a8w8_blockscale_1x128x128_256x64x128x128_16x16_32x32_8x32x1_8x32x1_1x32x1x8_8_1x1_intrawave_v1,571.18,510.73,0.0
256,32768,5120,3200,15,0,1723.7148,a8w8_blockscale_1x128x128_256x64x128x128_16x16_32x32_8x32x1_8x32x1_1x32x1x8_8_1x1_intrawave_v1,622.92,265.0,0.0
256,32768,5120,5120,2,0,2838.2733,a8w8_blockscale_1x128x128_256x64x128x128_16x16_32x32_8x32x1_8x32x1_1x32x1x8_8_1x1_intrawave_v3,605.29,186.57,0.0
256,32768,5120,6400,2,0,3403.6121,a8w8_blockscale_1x128x128_256x64x128x128_16x16_32x32_8x32x1_8x32x1_1x32x1x8_8_1x1_intrawave_v3,630.94,169.83,0.0
256,32768,5120,25600,2,0,13642.3261,a8w8_blockscale_1x128x128_256x64x128x128_16x16_32x32_8x32x1_8x32x1_1x32x1x8_8_1x1_intrawave_v3,629.65,95.69,0.0
256,32768,6400,5120,2,0,3525.4628,a8w8_blockscale_1x128x128_256x64x128x128_16x16_32x32_8x32x1_8x32x1_1x32x1x8_8_1x1_intrawave_v3,609.14,175.86,0.0
256,32768,12800,5120,2,0,7008.7606,a8w8_blockscale_1x128x128_256x64x128x128_16x16_32x32_8x32x1_8x32x1_1x32x1x8_8_1x1_intrawave_v3,612.8,152.98,0.0
256,32768,51200,5120,2,0,29030.5493,a8w8_blockscale_1x128x128_256x64x128x128_16x16_32x32_8x32x1_8x32x1_1x32x1x8_8_1x1_intrawave_v3,591.79,130.39,0.0
256,73728,3584,6144,0,0,1993.4257,a8w8_blockscale_1x128x128_256x128x128x128_16x16_32x32_8x32x1_8x32x1_1x32x1x8_8_1x1_intrawave_v3,1628.85,503.4,0.0
256,73728,6144,3072,0,0,1746.9247,a8w8_blockscale_1x128x128_256x128x128x128_16x16_32x32_8x32x1_8x32x1_1x32x1x8_8_1x1_intrawave_v3,1593.16,659.06,0.0
256,73728,160,6144,0,0,199.015,a8w8_blockscale_1x128x128_256x128x128x128_16x16_32x32_8x32x1_8x32x1_1x32x1x8_8_1x1_intrawave_v3,728.36,2399.62,0.0
256,2048,37984,6144,0,0,646.937,a8w8_blockscale_1x128x128_256x128x128x128_16x16_32x32_8x32x1_8x32x1_1x32x1x8_8_1x1_intrawave_v3,1477.58,620.68,0.0
256,512,3584,6144,18,0,30.597,a8w8_blockscale_1x128x128_256x64x64x256_16x16_32x32_16x16x1_16x16x1_1x32x1x8_8_1x1_intrawave_v1,736.95,942.44,0.0
256,512,6144,3072,18,0,25.1818,a8w8_blockscale_1x128x128_256x64x64x256_16x16_32x32_16x16x1_16x16x1_1x32x1x8_8_1x1_intrawave_v1,767.51,1061.83,0.0
256,512,160,6144,8,0,19.3653,a8w8_blockscale_1x128x128_256x16x64x256_16x16_16x16_16x16x1_16x16x1_1x16x1x16_4_1x1_intrawave_v1,51.98,221.66,0.0
256,496,160,6144,8,0,19.3751,a8w8_blockscale_1x128x128_256x16x64x256_16x16_16x16_16x16x1_16x16x1_1x16x1x16_4_1x1_intrawave_v1,50.33,216.21,0.0
256,480,160,6144,8,0,19.4574,a8w8_blockscale_1x128x128_256x16x64x256_16x16_16x16_16x16x1_16x16x1_1x16x1x16_4_1x1_intrawave_v1,48.5,209.98,0.0
256,464,160,6144,8,0,19.2859,a8w8_blockscale_1x128x128_256x16x64x256_16x16_16x16_16x16x1_16x16x1_1x16x1x16_4_1x1_intrawave_v1,47.3,206.49,0.0
256,448,160,6144,8,0,19.3157,a8w8_blockscale_1x128x128_256x16x64x256_16x16_16x16_16x16x1_16x16x1_1x16x1x16_4_1x1_intrawave_v1,45.6,200.82,0.0
256,432,160,6144,8,0,19.4391,a8w8_blockscale_1x128x128_256x16x64x256_16x16_16x16_16x16x1_16x16x1_1x16x1x16_4_1x1_intrawave_v1,43.69,194.22,0.0
256,416,160,6144,8,0,19.4869,a8w8_blockscale_1x128x128_256x16x64x256_16x16_16x16_16x16x1_16x16x1_1x16x1x16_4_1x1_intrawave_v1,41.97,188.44,0.0
256,400,160,6144,8,0,19.2164,a8w8_blockscale_1x128x128_256x16x64x256_16x16_16x16_16x16x1_16x16x1_1x16x1x16_4_1x1_intrawave_v1,40.93,185.71,0.0
256,384,160,6144,8,0,19.2989,a8w8_blockscale_1x128x128_256x16x64x256_16x16_16x16_16x16x1_16x16x1_1x16x1x16_4_1x1_intrawave_v1,39.12,179.56,0.0
256,368,160,6144,8,0,19.2207,a8w8_blockscale_1x128x128_256x16x64x256_16x16_16x16_16x16x1_16x16x1_1x16x1x16_4_1x1_intrawave_v1,37.64,174.9,0.0
256,352,160,6144,8,0,19.0928,a8w8_blockscale_1x128x128_256x16x64x256_16x16_16x16_16x16x1_16x16x1_1x16x1x16_4_1x1_intrawave_v1,36.25,170.66,0.0
256,336,160,6144,8,0,18.8813,a8w8_blockscale_1x128x128_256x16x64x256_16x16_16x16_16x16x1_16x16x1_1x16x1x16_4_1x1_intrawave_v1,34.99,167.09,0.0
256,320,160,6144,8,0,19.0845,a8w8_blockscale_1x128x128_256x16x64x256_16x16_16x16_16x16x1_16x16x1_1x16x1x16_4_1x1_intrawave_v1,32.97,159.9,0.0
256,304,160,6144,8,0,19.1187,a8w8_blockscale_1x128x128_256x16x64x256_16x16_16x16_16x16x1_16x16x1_1x16x1x16_4_1x1_intrawave_v1,31.26,154.2,0.0
256,288,160,6144,8,0,19.2492,a8w8_blockscale_1x128x128_256x16x64x256_16x16_16x16_16x16x1_16x16x1_1x16x1x16_4_1x1_intrawave_v1,29.42,147.78,0.0
256,272,160,6144,8,0,19.008,a8w8_blockscale_1x128x128_256x16x64x256_16x16_16x16_16x16x1_16x16x1_1x16x1x16_4_1x1_intrawave_v1,28.13,144.22,0.0
256,256,160,6144,8,0,17.8203,a8w8_blockscale_1x128x128_256x16x64x256_16x16_16x16_16x16x1_16x16x1_1x16x1x16_4_1x1_intrawave_v1,28.24,148.02,0.0
256,248,160,6144,8,0,18.9523,a8w8_blockscale_1x128x128_256x16x64x256_16x16_16x16_16x16x1_16x16x1_1x16x1x16_4_1x1_intrawave_v1,25.73,136.45,0.0
256,240,160,6144,8,0,17.6411,a8w8_blockscale_1x128x128_256x16x64x256_16x16_16x16_16x16x1_16x16x1_1x16x1x16_4_1x1_intrawave_v1,26.75,143.66,0.0
256,232,160,6144,8,0,17.0955,a8w8_blockscale_1x128x128_256x16x64x256_16x16_16x16_16x16x1_16x16x1_1x16x1x16_4_1x1_intrawave_v1,26.68,145.22,0.0
256,224,160,6144,8,0,16.9275,a8w8_blockscale_1x128x128_256x16x64x256_16x16_16x16_16x16x1_16x16x1_1x16x1x16_4_1x1_intrawave_v1,26.02,143.61,0.0
256,216,160,6144,8,0,16.6211,a8w8_blockscale_1x128x128_256x16x64x256_16x16_16x16_16x16x1_16x16x1_1x16x1x16_4_1x1_intrawave_v1,25.55,143.15,0.0
256,208,160,6144,8,0,14.7229,a8w8_blockscale_1x128x128_256x16x64x256_16x16_16x16_16x16x1_16x16x1_1x16x1x16_4_1x1_intrawave_v1,27.78,158.09,0.0
256,200,160,6144,8,0,14.7366,a8w8_blockscale_1x128x128_256x16x64x256_16x16_16x16_16x16x1_16x16x1_1x16x1x16_4_1x1_intrawave_v1,26.68,154.43,0.0
256,192,160,6144,8,0,14.5624,a8w8_blockscale_1x128x128_256x16x64x256_16x16_16x16_16x16x1_16x16x1_1x16x1x16_4_1x1_intrawave_v1,25.92,152.73,0.0
256,184,160,6144,8,0,15.8599,a8w8_blockscale_1x128x128_256x16x64x256_16x16_16x16_16x16x1_16x16x1_1x16x1x16_4_1x1_intrawave_v1,22.81,136.98,0.0
256,176,160,6144,8,0,16.2419,a8w8_blockscale_1x128x128_256x16x64x256_16x16_16x16_16x16x1_16x16x1_1x16x1x16_4_1x1_intrawave_v1,21.3,130.57,0.0
256,168,160,6144,8,0,14.7399,a8w8_blockscale_1x128x128_256x16x64x256_16x16_16x16_16x16x1_16x16x1_1x16x1x16_4_1x1_intrawave_v1,22.41,140.37,0.0
256,160,160,6144,8,0,14.6503,a8w8_blockscale_1x128x128_256x16x64x256_16x16_16x16_16x16x1_16x16x1_1x16x1x16_4_1x1_intrawave_v1,21.47,137.7,0.0
256,152,160,6144,8,0,14.6133,a8w8_blockscale_1x128x128_256x16x64x256_16x16_16x16_16x16x1_16x16x1_1x16x1x16_4_1x1_intrawave_v1,20.45,134.51,0.0
256,144,160,6144,8,0,16.8031,a8w8_blockscale_1x128x128_256x16x64x256_16x16_16x16_16x16x1_16x16x1_1x16x1x16_4_1x1_intrawave_v1,16.85,113.9,0.0
256,136,160,6144,8,0,14.6848,a8w8_blockscale_1x128x128_256x16x64x256_16x16_16x16_16x16x1_16x16x1_1x16x1x16_4_1x1_intrawave_v1,18.21,126.81,0.0
256,128,160,6144,8,0,14.6656,a8w8_blockscale_1x128x128_256x16x64x256_16x16_16x16_16x16x1_16x16x1_1x16x1x16_4_1x1_intrawave_v1,17.16,123.45,0.0
256,120,160,6144,8,0,14.6335,a8w8_blockscale_1x128x128_256x16x64x256_16x16_16x16_16x16x1_16x16x1_1x16x1x16_4_1x1_intrawave_v1,16.12,120.18,0.0
256,112,160,6144,8,0,14.6367,a8w8_blockscale_1x128x128_256x16x64x256_16x16_16x16_16x16x1_16x16x1_1x16x1x16_4_1x1_intrawave_v1,15.04,116.63,0.0
256,104,160,6144,8,0,14.5721,a8w8_blockscale_1x128x128_256x16x64x256_16x16_16x16_16x16x1_16x16x1_1x16x1x16_4_1x1_intrawave_v1,14.03,113.59,0.0
256,96,160,6144,8,0,14.5897,a8w8_blockscale_1x128x128_256x16x64x256_16x16_16x16_16x16x1_16x16x1_1x16x1x16_4_1x1_intrawave_v1,12.94,109.91,0.0
256,88,160,6144,8,0,14.5583,a8w8_blockscale_1x128x128_256x16x64x256_16x16_16x16_16x16x1_16x16x1_1x16x1x16_4_1x1_intrawave_v1,11.88,106.6,0.0
256,80,160,6144,8,0,14.6547,a8w8_blockscale_1x128x128_256x16x64x256_16x16_16x16_16x16x1_16x16x1_1x16x1x16_4_1x1_intrawave_v1,10.73,102.37,0.0
256,72,160,6144,8,0,14.5966,a8w8_blockscale_1x128x128_256x16x64x256_16x16_16x16_16x16x1_16x16x1_1x16x1x16_4_1x1_intrawave_v1,9.7,99.23,0.0
256,64,160,6144,8,0,14.5961,a8w8_blockscale_1x128x128_256x16x64x256_16x16_16x16_16x16x1_16x16x1_1x16x1x16_4_1x1_intrawave_v1,8.62,95.69,0.0
256,56,160,6144,8,0,14.6243,a8w8_blockscale_1x128x128_256x16x64x256_16x16_16x16_16x16x1_16x16x1_1x16x1x16_4_1x1_intrawave_v1,7.53,91.97,0.0
256,48,160,6144,8,0,14.6678,a8w8_blockscale_1x128x128_256x16x64x256_16x16_16x16_16x16x1_16x16x1_1x16x1x16_4_1x1_intrawave_v1,6.43,88.17,0.0
256,40,160,6144,8,0,14.5819,a8w8_blockscale_1x128x128_256x16x64x256_16x16_16x16_16x16x1_16x16x1_1x16x1x16_4_1x1_intrawave_v1,5.39,85.15,0.0
256,32,160,6144,8,0,14.6375,a8w8_blockscale_1x128x128_256x16x64x256_16x16_16x16_16x16x1_16x16x1_1x16x1x16_4_1x1_intrawave_v1,4.3,81.29,0.0
256,24,160,6144,8,0,14.5918,a8w8_blockscale_1x128x128_256x16x64x256_16x16_16x16_16x16x1_16x16x1_1x16x1x16_4_1x1_intrawave_v1,3.23,78.0,0.0
256,16,160,6144,8,0,14.3134,a8w8_blockscale_1x128x128_256x16x64x256_16x16_16x16_16x16x1_16x16x1_1x16x1x16_4_1x1_intrawave_v1,2.2,75.91,0.0
256,8,160,6144,8,0,13.8443,a8w8_blockscale_1x128x128_256x16x64x256_16x16_16x16_16x16x1_16x16x1_1x16x1x16_4_1x1_intrawave_v1,1.14,74.74,0.0
256,4,160,6144,8,0,13.7375,a8w8_blockscale_1x128x128_256x16x64x256_16x16_16x16_16x16x1_16x16x1_1x16x1x16_4_1x1_intrawave_v1,0.57,73.44,0.0
256,2,160,6144,8,0,13.6347,a8w8_blockscale_1x128x128_256x16x64x256_16x16_16x16_16x16x1_16x16x1_1x16x1x16_4_1x1_intrawave_v1,0.29,73.05,0.0
256,1,160,6144,8,0,13.6275,a8w8_blockscale_1x128x128_256x16x64x256_16x16_16x16_16x16x1_16x16x1_1x16x1x16_4_1x1_intrawave_v1,0.14,72.61,0.0
256,2048,3584,6144,0,0,78.7488,a8w8_blockscale_1x128x128_256x128x128x128_16x16_32x32_8x32x1_8x32x1_1x32x1x8_8_1x1_intrawave_v3,1145.34,625.83,0.0
256,2048,6144,3072,0,0,67.6612,a8w8_blockscale_1x128x128_256x128x128x128_16x16_32x32_8x32x1_8x32x1_1x32x1x8_8_1x1_intrawave_v3,1142.6,743.88,0.0
256,2048,160,6144,8,0,22.7652,a8w8_blockscale_1x128x128_256x16x64x256_16x16_16x16_16x16x1_16x16x1_1x16x1x16_4_1x1_intrawave_v1,176.87,624.7,0.0
256,3563,3584,6144,0,0,142.0408,a8w8_blockscale_1x128x128_256x128x128x128_16x16_32x32_8x32x1_8x32x1_1x32x1x8_8_1x1_intrawave_v3,1104.72,488.95,0.0
256,3563,6144,3072,0,0,116.2856,a8w8_blockscale_1x128x128_256x128x128x128_16x16_32x32_8x32x1_8x32x1_1x32x1x8_8_1x1_intrawave_v3,1156.62,632.94,0.0
256,3563,160,6144,18,0,23.348,a8w8_blockscale_1x128x128_256x64x64x256_16x16_32x32_16x16x1_16x16x1_1x32x1x8_8_1x1_intrawave_v1,300.03,1028.54,0.0
256,24,37984,6144,13,0,52.9462,a8w8_blockscale_1x128x128_256x32x64x256_16x16_16x16_16x16x1_16x16x1_1x32x1x8_8_2x1_intrawave_v1,211.57,4444.97,0.0
256,46,37984,6144,16,0,65.4383,a8w8_blockscale_1x128x128_256x64x64x128_16x16_32x32_8x32x1_8x32x1_1x32x1x8_8_1x1_intrawave_v1,328.1,3624.04,0.0
256,69,37984,6144,2,0,75.1383,a8w8_blockscale_1x128x128_256x64x128x128_16x16_32x32_8x32x1_8x32x1_1x32x1x8_8_1x1_intrawave_v3,428.62,3181.33,0.0
256,38631,3584,6144,0,0,1132.0866,a8w8_blockscale_1x128x128_256x128x128x128_16x16_32x32_8x32x1_8x32x1_1x32x1x8_8_1x1_intrawave_v3,1502.81,473.71,0.0
256,38631,6144,3072,0,0,959.8327,a8w8_blockscale_1x128x128_256x128x128x128_16x16_32x32_8x32x1_8x32x1_1x32x1x8_8_1x1_intrawave_v3,1519.3,637.87,0.0
256,38631,160,6144,18,0,118.1979,a8w8_blockscale_1x128x128_256x64x64x256_16x16_32x32_16x16x1_16x16x1_1x32x1x8_8_1x1_intrawave_v1,642.58,2120.97,0.0
256,80,37984,6144,2,0,79.2712,a8w8_blockscale_1x128x128_256x64x128x128_16x16_32x32_8x32x1_8x32x1_1x32x1x8_8_1x1_intrawave_v3,471.04,3026.86,0.0
256,79,37984,6144,2,0,79.596,a8w8_blockscale_1x128x128_256x64x128x128_16x16_32x32_8x32x1_8x32x1_1x32x1x8_8_1x1_intrawave_v3,463.25,3013.47,0.0
256,3148,3584,6144,0,0,119.3807,a8w8_blockscale_1x128x128_256x128x128x128_16x16_32x32_8x32x1_8x32x1_1x32x1x8_8_1x1_intrawave_v3,1161.31,535.48,0.0
256,3148,6144,3072,0,0,102.5266,a8w8_blockscale_1x128x128_256x128x128x128_16x16_32x32_8x32x1_8x32x1_1x32x1x8_8_1x1_intrawave_v3,1159.05,655.71,0.0
256,3148,160,6144,18,0,23.3697,a8w8_blockscale_1x128x128_256x64x64x256_16x16_32x32_16x16x1_16x16x1_1x32x1x8_8_1x1_intrawave_v1,264.84,912.79,0.0
256,78,37984,6144,2,0,78.6444,a8w8_blockscale_1x128x128_256x64x128x128_16x16_32x32_8x32x1_8x32x1_1x32x1x8_8_1x1_intrawave_v3,462.92,3048.89,0.0
256,3601,3584,6144,0,0,144.0639,a8w8_blockscale_1x128x128_256x128x128x128_16x16_32x32_8x32x1_8x32x1_1x32x1x8_8_1x1_intrawave_v3,1100.82,485.59,0.0
256,3601,6144,3072,0,0,115.4708,a8w8_blockscale_1x128x128_256x128x128x128_16x16_32x32_8x32x1_8x32x1_1x32x1x8_8_1x1_intrawave_v3,1177.21,642.46,0.0
256,3601,160,6144,18,0,23.3857,a8w8_blockscale_1x128x128_256x64x64x256_16x16_32x32_16x16x1_16x16x1_1x32x1x8_8_1x1_intrawave_v1,302.74,1037.38,0.0
256,3661,3584,6144,0,0,144.6644,a8w8_blockscale_1x128x128_256x128x128x128_16x16_32x32_8x32x1_8x32x1_1x32x1x8_8_1x1_intrawave_v3,1114.52,489.1,0.0
256,3661,6144,3072,0,0,118.7031,a8w8_blockscale_1x128x128_256x128x128x128_16x16_32x32_8x32x1_8x32x1_1x32x1x8_8_1x1_intrawave_v3,1164.23,632.73,0.0
256,3661,160,6144,18,0,23.4464,a8w8_blockscale_1x128x128_256x64x64x256_16x16_32x32_16x16x1_16x16x1_1x32x1x8_8_1x1_intrawave_v1,306.99,1051.24,0.0
256,3553,3584,6144,0,0,142.6093,a8w8_blockscale_1x128x128_256x128x128x128_16x16_32x32_8x32x1_8x32x1_1x32x1x8_8_1x1_intrawave_v3,1097.23,486.07,0.0
256,3553,6144,3072,0,0,115.5023,a8w8_blockscale_1x128x128_256x128x128x128_16x16_32x32_8x32x1_8x32x1_1x32x1x8_8_1x1_intrawave_v3,1161.2,635.9,0.0
256,3553,160,6144,18,0,23.3982,a8w8_blockscale_1x128x128_256x64x64x256_16x16_32x32_16x16x1_16x16x1_1x32x1x8_8_1x1_intrawave_v1,298.55,1023.57,0.0
256,3352,3584,6144,0,0,120.7208,a8w8_blockscale_1x128x128_256x128x128x128_16x16_32x32_8x32x1_8x32x1_1x32x1x8_8_1x1_intrawave_v3,1222.84,552.03,0.0
256,3352,6144,3072,0,0,115.6599,a8w8_blockscale_1x128x128_256x128x128x128_16x16_32x32_8x32x1_8x32x1_1x32x1x8_8_1x1_intrawave_v3,1094.02,608.34,0.0
256,3352,160,6144,18,0,23.2615,a8w8_blockscale_1x128x128_256x64x64x256_16x16_32x32_16x16x1_16x16x1_1x32x1x8_8_1x1_intrawave_v1,283.31,973.73,0.0
256,3217,3584,6144,0,0,120.6087,a8w8_blockscale_1x128x128_256x128x128x128_16x16_32x32_8x32x1_8x32x1_1x32x1x8_8_1x1_intrawave_v3,1174.69,537.65,0.0
256,3217,6144,3072,0,0,106.1278,a8w8_blockscale_1x128x128_256x128x128x128_16x16_32x32_8x32x1_8x32x1_1x32x1x8_8_1x1_intrawave_v3,1144.26,643.45,0.0
256,3217,160,6144,18,0,23.1643,a8w8_blockscale_1x128x128_256x64x64x256_16x16_32x32_16x16x1_16x16x1_1x32x1x8_8_1x1_intrawave_v1,273.04,940.14,0.0
256,3535,3584,6144,0,0,141.4182,a8w8_blockscale_1x128x128_256x128x128x128_16x16_32x32_8x32x1_8x32x1_1x32x1x8_8_1x1_intrawave_v3,1100.86,488.47,0.0
256,3535,6144,3072,0,0,113.3422,a8w8_blockscale_1x128x128_256x128x128x128_16x16_32x32_8x32x1_8x32x1_1x32x1x8_8_1x1_intrawave_v3,1177.34,645.58,0.0
256,3535,160,6144,18,0,23.4951,a8w8_blockscale_1x128x128_256x64x64x256_16x16_32x32_16x16x1_16x16x1_1x32x1x8_8_1x1_intrawave_v1,295.81,1014.39,0.0
256,3317,3584,6144,0,0,122.1095,a8w8_blockscale_1x128x128_256x128x128x128_16x16_32x32_8x32x1_8x32x1_1x32x1x8_8_1x1_intrawave_v3,1196.31,541.94,0.0
256,3317,6144,3072,0,0,107.314,a8w8_blockscale_1x128x128_256x128x128x128_16x16_32x32_8x32x1_8x32x1_1x32x1x8_8_1x1_intrawave_v3,1166.79,650.65,0.0
256,3317,160,6144,18,0,23.3354,a8w8_blockscale_1x128x128_256x64x64x256_16x16_32x32_16x16x1_16x16x1_1x32x1x8_8_1x1_intrawave_v1,279.47,960.95,0.0
256,77,37984,6144,12,0,76.9608,a8w8_blockscale_1x128x128_256x32x128x256_16x16_32x32_16x16x1_16x16x1_1x32x1x8_8_1x1_intrawave_v1,466.99,3114.52,0.0
256,3558,3584,6144,0,0,143.1685,a8w8_blockscale_1x128x128_256x128x128x128_16x16_32x32_8x32x1_8x32x1_1x32x1x8_8_1x1_intrawave_v3,1094.48,484.63,0.0
256,3558,6144,3072,0,0,116.6991,a8w8_blockscale_1x128x128_256x128x128x128_16x16_32x32_8x32x1_8x32x1_1x32x1x8_8_1x1_intrawave_v3,1150.91,630.04,0.0
256,3558,160,6144,18,0,23.4218,a8w8_blockscale_1x128x128_256x64x64x256_16x16_32x32_16x16x1_16x16x1_1x32x1x8_8_1x1_intrawave_v1,298.67,1023.92,0.0
256,6851,3584,6144,0,0,224.1889,a8w8_blockscale_1x128x128_256x128x128x128_16x16_32x32_8x32x1_8x32x1_1x32x1x8_8_1x1_intrawave_v3,1345.83,505.02,0.0
256,6851,6144,3072,0,0,204.4217,a8w8_blockscale_1x128x128_256x128x128x128_16x16_32x32_8x32x1_8x32x1_1x32x1x8_8_1x1_intrawave_v3,1265.11,607.11,0.0
256,6851,160,6144,18,0,31.0822,a8w8_blockscale_1x128x128_256x64x64x256_16x16_32x32_16x16x1_16x16x1_1x32x1x8_8_1x1_intrawave_v1,433.35,1456.39,0.0
256,3432,3584,6144,0,0,122.0495,a8w8_blockscale_1x128x128_256x128x128x128_16x16_32x32_8x32x1_8x32x1_1x32x1x8_8_1x1_intrawave_v3,1238.4,554.75,0.0
256,3432,6144,3072,0,0,113.7358,a8w8_blockscale_1x128x128_256x128x128x128_16x16_32x32_8x32x1_8x32x1_1x32x1x8_8_1x1_intrawave_v3,1139.08,629.44,0.0
256,3432,160,6144,18,0,23.3394,a8w8_blockscale_1x128x128_256x64x64x256_16x16_32x32_16x16x1_16x16x1_1x32x1x8_8_1x1_intrawave_v1,289.11,992.63,0.0
256,3484,3584,6144,0,0,141.8521,a8w8_blockscale_1x128x128_256x128x128x128_16x16_32x32_8x32x1_8x32x1_1x32x1x8_8_1x1_intrawave_v3,1081.66,482.19,0.0
256,3484,6144,3072,0,0,117.6106,a8w8_blockscale_1x128x128_256x128x128x128_16x16_32x32_8x32x1_8x32x1_1x32x1x8_8_1x1_intrawave_v3,1118.24,615.49,0.0
256,3484,160,6144,18,0,23.3436,a8w8_blockscale_1x128x128_256x64x64x256_16x16_32x32_16x16x1_16x16x1_1x32x1x8_8_1x1_intrawave_v1,293.43,1006.85,0.0
256,6942,3584,6144,0,0,243.0959,a8w8_blockscale_1x128x128_256x128x128x128_16x16_32x32_8x32x1_8x32x1_1x32x1x8_8_1x1_intrawave_v3,1257.64,470.73,0.0
256,6942,6144,3072,0,0,207.4939,a8w8_blockscale_1x128x128_256x128x128x128_16x16_32x32_8x32x1_8x32x1_1x32x1x8_8_1x1_intrawave_v3,1262.94,604.85,0.0
256,6942,160,6144,18,0,31.3411,a8w8_blockscale_1x128x128_256x64x64x256_16x16_32x32_16x16x1_16x16x1_1x32x1x8_8_1x1_intrawave_v1,435.48,1463.13,0.0
256,3396,3584,6144,0,0,123.7239,a8w8_blockscale_1x128x128_256x128x128x128_16x16_32x32_8x32x1_8x32x1_1x32x1x8_8_1x1_intrawave_v3,1208.82,543.37,0.0
256,3396,6144,3072,0,0,117.9531,a8w8_blockscale_1x128x128_256x128x128x128_16x16_32x32_8x32x1_8x32x1_1x32x1x8_8_1x1_intrawave_v3,1086.83,602.25,0.0
256,3396,160,6144,18,0,23.262,a8w8_blockscale_1x128x128_256x64x64x256_16x16_32x32_16x16x1_16x16x1_1x32x1x8_8_1x1_intrawave_v1,287.03,985.93,0.0
256,7016,3584,6144,0,0,245.252,a8w8_blockscale_1x128x128_256x128x128x128_16x16_32x32_8x32x1_8x32x1_1x32x1x8_8_1x1_intrawave_v3,1259.87,470.61,0.0
256,7016,6144,3072,0,0,205.3392,a8w8_blockscale_1x128x128_256x128x128x128_16x16_32x32_8x32x1_8x32x1_1x32x1x8_8_1x1_intrawave_v3,1289.79,616.74,0.0
256,7016,160,6144,18,0,31.3876,a8w8_blockscale_1x128x128_256x64x64x256_16x16_32x32_16x16x1_16x16x1_1x32x1x8_8_1x1_intrawave_v1,439.47,1476.2,0.0
256,3172,3584,6144,0,0,118.5351,a8w8_blockscale_1x128x128_256x128x128x128_16x16_32x32_8x32x1_8x32x1_1x32x1x8_8_1x1_intrawave_v3,1178.52,542.0,0.0
256,3172,6144,3072,0,0,102.8557,a8w8_blockscale_1x128x128_256x128x128x128_16x16_32x32_8x32x1_8x32x1_1x32x1x8_8_1x1_intrawave_v3,1164.15,657.2,0.0
256,3172,160,6144,18,0,23.1992,a8w8_blockscale_1x128x128_256x64x64x256_16x16_32x32_16x16x1_16x16x1_1x32x1x8_8_1x1_intrawave_v1,268.82,926.19,0.0
256,3188,3584,6144,0,0,119.5499,a8w8_blockscale_1x128x128_256x128x128x128_16x16_32x32_8x32x1_8x32x1_1x32x1x8_8_1x1_intrawave_v3,1174.41,539.18,0.0
256,3188,6144,3072,0,0,101.9257,a8w8_blockscale_1x128x128_256x128x128x128_16x16_32x32_8x32x1_8x32x1_1x32x1x8_8_1x1_intrawave_v3,1180.69,665.6,0.0
256,3188,160,6144,18,0,23.3268,a8w8_blockscale_1x128x128_256x64x64x256_16x16_32x32_16x16x1_16x16x1_1x32x1x8_8_1x1_intrawave_v1,268.7,925.56,0.0
256,6645,3584,6144,0,0,224.0306,a8w8_blockscale_1x128x128_256x128x128x128_16x16_32x32_8x32x1_8x32x1_1x32x1x8_8_1x1_intrawave_v3,1306.28,493.14,0.0
256,6645,6144,3072,0,0,188.9315,a8w8_blockscale_1x128x128_256x128x128x128_16x16_32x32_8x32x1_8x32x1_1x32x1x8_8_1x1_intrawave_v3,1327.68,640.13,0.0
256,6645,160,6144,18,0,30.8057,a8w8_blockscale_1x128x128_256x64x64x256_16x16_32x32_16x16x1_16x16x1_1x32x1x8_8_1x1_intrawave_v1,424.1,1426.24,0.0
256,3669,3584,6144,0,0,144.5944,a8w8_blockscale_1x128x128_256x128x128x128_16x16_32x32_8x32x1_8x32x1_1x32x1x8_8_1x1_intrawave_v3,1117.49,490.07,0.0
256,3669,6144,3072,0,0,118.3422,a8w8_blockscale_1x128x128_256x128x128x128_16x16_32x32_8x32x1_8x32x1_1x32x1x8_8_1x1_intrawave_v3,1170.34,635.7,0.0
256,3669,160,6144,18,0,23.4957,a8w8_blockscale_1x128x128_256x64x64x256_16x16_32x32_16x16x1_16x16x1_1x32x1x8_8_1x1_intrawave_v1,307.02,1051.23,0.0
256,3314,3584,6144,0,0,119.7099,a8w8_blockscale_1x128x128_256x128x128x128_16x16_32x32_8x32x1_8x32x1_1x32x1x8_8_1x1_intrawave_v3,1219.19,552.47,0.0
256,3314,6144,3072,0,0,104.8001,a8w8_blockscale_1x128x128_256x128x128x128_16x16_32x32_8x32x1_8x32x1_1x32x1x8_8_1x1_intrawave_v3,1193.69,665.81,0.0
256,3314,160,6144,18,0,23.2966,a8w8_blockscale_1x128x128_256x64x64x256_16x16_32x32_16x16x1_16x16x1_1x32x1x8_8_1x1_intrawave_v1,279.68,961.72,0.0
256,3263,3584,6144,0,0,121.1751,a8w8_blockscale_1x128x128_256x128x128x128_16x16_32x32_8x32x1_8x32x1_1x32x1x8_8_1x1_intrawave_v3,1185.91,540.19,0.0
256,3263,6144,3072,0,0,103.1957,a8w8_blockscale_1x128x128_256x128x128x128_16x16_32x32_8x32x1_8x32x1_1x32x1x8_8_1x1_intrawave_v3,1193.6,668.57,0.0
256,3263,160,6144,18,0,23.3626,a8w8_blockscale_1x128x128_256x64x64x256_16x16_32x32_16x16x1_16x16x1_1x32x1x8_8_1x1_intrawave_v1,274.6,944.89,0.0
256,3667,3584,6144,0,0,143.4159,a8w8_blockscale_1x128x128_256x128x128x128_16x16_32x32_8x32x1_8x32x1_1x32x1x8_8_1x1_intrawave_v3,1126.06,493.91,0.0
256,3667,6144,3072,0,0,118.5099,a8w8_blockscale_1x128x128_256x128x128x128_16x16_32x32_8x32x1_8x32x1_1x32x1x8_8_1x1_intrawave_v3,1168.04,634.54,0.0
256,3667,160,6144,18,0,23.4462,a8w8_blockscale_1x128x128_256x64x64x256_16x16_32x32_16x16x1_16x16x1_1x32x1x8_8_1x1_intrawave_v1,307.5,1052.9,0.0
256,3597,3584,6144,0,0,143.5392,a8w8_blockscale_1x128x128_256x128x128x128_16x16_32x32_8x32x1_8x32x1_1x32x1x8_8_1x1_intrawave_v3,1103.62,487.0,0.0
256,3597,6144,3072,0,0,115.9171,a8w8_blockscale_1x128x128_256x128x128x128_16x16_32x32_8x32x1_8x32x1_1x32x1x8_8_1x1_intrawave_v3,1171.37,639.46,0.0
256,3597,160,6144,18,0,23.4759,a8w8_blockscale_1x128x128_256x64x64x256_16x16_32x32_16x16x1_16x16x1_1x32x1x8_8_1x1_intrawave_v1,301.24,1032.29,0.0
256,3655,3584,6144,0,0,143.3276,a8w8_blockscale_1x128x128_256x128x128x128_16x16_32x32_8x32x1_8x32x1_1x32x1x8_8_1x1_intrawave_v3,1123.07,493.1,0.0
256,3655,6144,3072,0,0,117.3962,a8w8_blockscale_1x128x128_256x128x128x128_16x16_32x32_8x32x1_8x32x1_1x32x1x8_8_1x1_intrawave_v3,1175.26,638.99,0.0
256,3655,160,6144,18,0,23.4279,a8w8_blockscale_1x128x128_256x64x64x256_16x16_32x32_16x16x1_16x16x1_1x32x1x8_8_1x1_intrawave_v1,306.73,1050.41,0.0
256,3511,3584,6144,0,0,138.535,a8w8_blockscale_1x128x128_256x128x128x128_16x16_32x32_8x32x1_8x32x1_1x32x1x8_8_1x1_intrawave_v3,1116.14,496.33,0.0
256,3511,6144,3072,0,0,115.4964,a8w8_blockscale_1x128x128_256x128x128x128_16x16_32x32_8x32x1_8x32x1_1x32x1x8_8_1x1_intrawave_v3,1147.53,630.35,0.0
256,3511,160,6144,18,0,23.4194,a8w8_blockscale_1x128x128_256x64x64x256_16x16_32x32_16x16x1_16x16x1_1x32x1x8_8_1x1_intrawave_v1,294.75,1011.05,0.0
256,6832,3584,6144,0,0,222.841,a8w8_blockscale_1x128x128_256x128x128x128_16x16_32x32_8x32x1_8x32x1_1x32x1x8_8_1x1_intrawave_v3,1350.21,506.94,0.0
256,6832,6144,3072,0,0,206.3305,a8w8_blockscale_1x128x128_256x128x128x128_16x16_32x32_8x32x1_8x32x1_1x32x1x8_8_1x1_intrawave_v3,1249.93,600.08,0.0
256,6832,160,6144,18,0,30.8979,a8w8_blockscale_1x128x128_256x64x64x256_16x16_32x32_16x16x1_16x16x1_1x32x1x8_8_1x1_intrawave_v1,434.73,1461.11,0.0
256,10194,3584,6144,0,0,316.7833,a8w8_blockscale_1x128x128_256x128x128x128_16x16_32x32_8x32x1_8x32x1_1x32x1x8_8_1x1_intrawave_v3,1417.2,497.89,0.0
256,10194,6144,3072,0,0,280.1552,a8w8_blockscale_1x128x128_256x128x128x128_16x16_32x32_8x32x1_8x32x1_1x32x1x8_8_1x1_intrawave_v3,1373.56,626.28,0.0
256,10194,160,6144,18,0,34.1613,a8w8_blockscale_1x128x128_256x64x64x256_16x16_32x32_16x16x1_16x16x1_1x32x1x8_8_1x1_intrawave_v1,586.69,1957.68,0.0
256,3350,3584,6144,0,0,123.9219,a8w8_blockscale_1x128x128_256x128x128x128_16x16_32x32_8x32x1_8x32x1_1x32x1x8_8_1x1_intrawave_v3,1190.55,537.56,0.0
256,3350,6144,3072,0,0,115.4006,a8w8_blockscale_1x128x128_256x128x128x128_16x16_32x32_8x32x1_8x32x1_1x32x1x8_8_1x1_intrawave_v3,1095.82,609.45,0.0
256,3350,160,6144,18,0,23.4438,a8w8_blockscale_1x128x128_256x64x64x256_16x16_32x32_16x16x1_16x16x1_1x32x1x8_8_1x1_intrawave_v1,280.94,965.6,0.0
256,6900,3584,6144,0,0,221.3277,a8w8_blockscale_1x128x128_256x128x128x128_16x16_32x32_8x32x1_8x32x1_1x32x1x8_8_1x1_intrawave_v3,1372.97,514.5,0.0
256,6900,6144,3072,0,0,207.1401,a8w8_blockscale_1x128x128_256x128x128x128_16x16_32x32_8x32x1_8x32x1_1x32x1x8_8_1x1_intrawave_v3,1257.44,602.77,0.0
256,6900,160,6144,18,0,31.2429,a8w8_blockscale_1x128x128_256x64x64x256_16x16_32x32_16x16x1_16x16x1_1x32x1x8_8_1x1_intrawave_v1,434.21,1459.04,0.0
256,3434,3584,6144,0,0,121.1919,a8w8_blockscale_1x128x128_256x128x128x128_16x16_32x32_8x32x1_8x32x1_1x32x1x8_8_1x1_intrawave_v3,1247.89,558.89,0.0
256,3434,6144,3072,0,0,113.5168,a8w8_blockscale_1x128x128_256x128x128x128_16x16_32x32_8x32x1_8x32x1_1x32x1x8_8_1x1_intrawave_v3,1141.94,630.93,0.0
256,3434,160,6144,18,0,23.3648,a8w8_blockscale_1x128x128_256x64x64x256_16x16_32x32_16x16x1_16x16x1_1x32x1x8_8_1x1_intrawave_v1,288.96,992.11,0.0
256,3214,3584,6144,0,0,119.7175,a8w8_blockscale_1x128x128_256x128x128x128_16x16_32x32_8x32x1_8x32x1_1x32x1x8_8_1x1_intrawave_v3,1182.33,541.31,0.0
256,3214,6144,3072,0,0,104.1149,a8w8_blockscale_1x128x128_256x128x128x128_16x16_32x32_8x32x1_8x32x1_1x32x1x8_8_1x1_intrawave_v3,1165.29,655.44,0.0
256,3214,160,6144,18,0,23.2978,a8w8_blockscale_1x128x128_256x64x64x256_16x16_32x32_16x16x1_16x16x1_1x32x1x8_8_1x1_intrawave_v1,271.23,933.92,0.0
256,3423,3584,6144,0,0,120.7535,a8w8_blockscale_1x128x128_256x128x128x128_16x16_32x32_8x32x1_8x32x1_1x32x1x8_8_1x1_intrawave_v3,1248.41,559.71,0.0
256,3423,6144,3072,0,0,111.9246,a8w8_blockscale_1x128x128_256x128x128x128_16x16_32x32_8x32x1_8x32x1_1x32x1x8_8_1x1_intrawave_v3,1154.47,638.39,0.0
256,3423,160,6144,18,0,23.3003,a8w8_blockscale_1x128x128_256x64x64x256_16x16_32x32_16x16x1_16x16x1_1x32x1x8_8_1x1_intrawave_v1,288.83,991.8,0.0
256,3575,3584,6144,0,0,140.9536,a8w8_blockscale_1x128x128_256x128x128x128_16x16_32x32_8x32x1_8x32x1_1x32x1x8_8_1x1_intrawave_v3,1116.99,493.85,0.0
256,3575,6144,3072,0,0,114.4079,a8w8_blockscale_1x128x128_256x128x128x128_16x16_32x32_8x32x1_8x32x1_1x32x1x8_8_1x1_intrawave_v3,1179.57,644.94,0.0
256,3575,160,6144,18,0,23.4106,a8w8_blockscale_1x128x128_256x64x64x256_16x16_32x32_16x16x1_16x16x1_1x32x1x8_8_1x1_intrawave_v1,300.24,1029.1,0.0
256,6547,3584,6144,0,0,219.2154,a8w8_blockscale_1x128x128_256x128x128x128_16x16_32x32_8x32x1_8x32x1_1x32x1x8_8_1x1_intrawave_v3,1315.29,498.02,0.0
256,6547,6144,3072,0,0,192.2868,a8w8_blockscale_1x128x128_256x128x128x128_16x16_32x32_8x32x1_8x32x1_1x32x1x8_8_1x1_intrawave_v3,1285.27,621.14,0.0
256,6547,160,6144,18,0,30.7925,a8w8_blockscale_1x128x128_256x64x64x256_16x16_32x32_16x16x1_16x16x1_1x32x1x8_8_1x1_intrawave_v1,418.02,1406.28,0.0
256,6884,3584,6144,0,0,225.3414,a8w8_blockscale_1x128x128_256x128x128x128_16x16_32x32_8x32x1_8x32x1_1x32x1x8_8_1x1_intrawave_v3,1345.39,504.39,0.0
256,6884,6144,3072,0,0,205.1817,a8w8_blockscale_1x128x128_256x128x128x128_16x16_32x32_8x32x1_8x32x1_1x32x1x8_8_1x1_intrawave_v3,1266.5,607.33,0.0
256,6884,160,6144,18,0,31.0774,a8w8_blockscale_1x128x128_256x64x64x256_16x16_32x32_16x16x1_16x16x1_1x32x1x8_8_1x1_intrawave_v1,435.51,1463.48,0.0
256,76,37984,6144,2,0,78.0292,a8w8_blockscale_1x128x128_256x64x128x128_16x16_32x32_8x32x1_8x32x1_1x32x1x8_8_1x1_intrawave_v3,454.61,3070.83,0.0
256,3476,3584,6144,0,0,139.6541,a8w8_blockscale_1x128x128_256x128x128x128_16x16_32x32_8x32x1_8x32x1_1x32x1x8_8_1x1_intrawave_v3,1096.16,489.01,0.0
256,3476,6144,3072,0,0,114.6998,a8w8_blockscale_1x128x128_256x128x128x128_16x16_32x32_8x32x1_8x32x1_1x32x1x8_8_1x1_intrawave_v3,1143.98,630.04,0.0
256,3476,160,6144,18,0,23.3658,a8w8_blockscale_1x128x128_256x64x64x256_16x16_32x32_16x16x1_16x16x1_1x32x1x8_8_1x1_intrawave_v1,292.48,1003.69,0.0
256,9999,3584,6144,0,0,318.5046,a8w8_blockscale_1x128x128_256x128x128x128_16x16_32x32_8x32x1_8x32x1_1x32x1x8_8_1x1_intrawave_v3,1382.58,487.05,0.0
256,9999,6144,3072,0,0,276.7631,a8w8_blockscale_1x128x128_256x128x128x128_16x16_32x32_8x32x1_8x32x1_1x32x1x8_8_1x1_intrawave_v3,1363.8,623.13,0.0
256,9999,160,6144,18,0,33.5369,a8w8_blockscale_1x128x128_256x64x64x256_16x16_32x32_16x16x1_16x16x1_1x32x1x8_8_1x1_intrawave_v1,586.19,1956.55,0.0
256,3278,3584,6144,0,0,120.7895,a8w8_blockscale_1x128x128_256x128x128x128_16x16_32x32_8x32x1_8x32x1_1x32x1x8_8_1x1_intrawave_v3,1195.17,543.56,0.0
256,3278,6144,3072,0,0,104.7998,a8w8_blockscale_1x128x128_256x128x128x128_16x16_32x32_8x32x1_8x32x1_1x32x1x8_8_1x1_intrawave_v3,1180.73,660.54,0.0
256,3278,160,6144,18,0,23.3518,a8w8_blockscale_1x128x128_256x64x64x256_16x16_32x32_16x16x1_16x16x1_1x32x1x8_8_1x1_intrawave_v1,275.99,949.48,0.0
256,3382,3584,6144,0,0,122.1903,a8w8_blockscale_1x128x128_256x128x128x128_16x16_32x32_8x32x1_8x32x1_1x32x1x8_8_1x1_intrawave_v3,1218.95,548.66,0.0
256,3382,6144,3072,0,0,114.9656,a8w8_blockscale_1x128x128_256x128x128x128_16x16_32x32_8x32x1_8x32x1_1x32x1x8_8_1x1_intrawave_v3,1110.47,616.03,0.0
256,3382,160,6144,18,0,23.3347,a8w8_blockscale_1x128x128_256x64x64x256_16x16_32x32_16x16x1_16x16x1_1x32x1x8_8_1x1_intrawave_v1,284.95,978.98,0.0
256,3282,3584,6144,0,0,121.7615,a8w8_blockscale_1x128x128_256x128x128x128_16x16_32x32_8x32x1_8x32x1_1x32x1x8_8_1x1_intrawave_v3,1187.07,539.66,0.0
256,3282,6144,3072,0,0,101.0577,a8w8_blockscale_1x128x128_256x128x128x128_16x16_32x32_8x32x1_8x32x1_1x32x1x8_8_1x1_intrawave_v3,1225.95,685.61,0.0
256,3282,160,6144,18,0,23.2564,a8w8_blockscale_1x128x128_256x64x64x256_16x16_32x32_16x16x1_16x16x1_1x32x1x8_8_1x1_intrawave_v1,277.46,954.49,0.0
256,3477,3584,6144,0,0,142.349,a8w8_blockscale_1x128x128_256x128x128x128_16x16_32x32_8x32x1_8x32x1_1x32x1x8_8_1x1_intrawave_v3,1075.72,479.85,0.0
256,3477,6144,3072,0,0,117.347,a8w8_blockscale_1x128x128_256x128x128x128_16x16_32x32_8x32x1_8x32x1_1x32x1x8_8_1x1_intrawave_v3,1118.5,615.96,0.0
256,3477,160,6144,18,0,23.3347,a8w8_blockscale_1x128x128_256x64x64x256_16x16_32x32_16x16x1_16x16x1_1x32x1x8_8_1x1_intrawave_v1,292.96,1005.3,0.0
256,3461,3584,6144,0,0,141.6808,a8w8_blockscale_1x128x128_256x128x128x128_16x16_32x32_8x32x1_8x32x1_1x32x1x8_8_1x1_intrawave_v3,1075.82,480.61,0.0
256,3461,6144,3072,0,0,116.9702,a8w8_blockscale_1x128x128_256x128x128x128_16x16_32x32_8x32x1_8x32x1_1x32x1x8_8_1x1_intrawave_v3,1116.94,615.84,0.0
256,3461,160,6144,18,0,23.4156,a8w8_blockscale_1x128x128_256x64x64x256_16x16_32x32_16x16x1_16x16x1_1x32x1x8_8_1x1_intrawave_v1,290.6,997.41,0.0
256,6702,3584,6144,0,0,228.6874,a8w8_blockscale_1x128x128_256x128x128x128_16x16_32x32_8x32x1_8x32x1_1x32x1x8_8_1x1_intrawave_v3,1290.66,486.42,0.0
256,6702,6144,3072,0,0,193.6823,a8w8_blockscale_1x128x128_256x128x128x128_16x16_32x32_8x32x1_8x32x1_1x32x1x8_8_1x1_intrawave_v3,1306.22,628.95,0.0
256,6702,160,6144,18,0,30.8221,a8w8_blockscale_1x128x128_256x64x64x256_16x16_32x32_16x16x1_16x16x1_1x32x1x8_8_1x1_intrawave_v1,427.51,1437.44,0.0
256,3213,3584,6144,0,0,119.5803,a8w8_blockscale_1x128x128_256x128x128x128_16x16_32x32_8x32x1_8x32x1_1x32x1x8_8_1x1_intrawave_v3,1183.31,541.82,0.0
256,3213,6144,3072,0,0,103.5885,a8w8_blockscale_1x128x128_256x128x128x128_16x16_32x32_8x32x1_8x32x1_1x32x1x8_8_1x1_intrawave_v3,1170.85,658.63,0.0
256,3213,160,6144,18,0,23.2587,a8w8_blockscale_1x128x128_256x64x64x256_16x16_32x32_16x16x1_16x16x1_1x32x1x8_8_1x1_intrawave_v1,271.6,935.21,0.0
256,6515,3584,6144,0,0,217.0217,a8w8_blockscale_1x128x128_256x128x128x128_16x16_32x32_8x32x1_8x32x1_1x32x1x8_8_1x1_intrawave_v3,1322.09,501.09,0.0
256,6515,6144,3072,0,0,192.7476,a8w8_blockscale_1x128x128_256x128x128x128_16x16_32x32_8x32x1_8x32x1_1x32x1x8_8_1x1_intrawave_v3,1275.93,617.1,0.0
256,6515,160,6144,18,0,30.6383,a8w8_blockscale_1x128x128_256x64x64x256_16x16_32x32_16x16x1_16x16x1_1x32x1x8_8_1x1_intrawave_v1,418.07,1406.61,0.0
256,3403,3584,6144,0,0,123.0205,a8w8_blockscale_1x128x128_256x128x128x128_16x16_32x32_8x32x1_8x32x1_1x32x1x8_8_1x1_intrawave_v3,1218.24,547.23,0.0
256,3403,6144,3072,0,0,114.5602,a8w8_blockscale_1x128x128_256x128x128x128_16x16_32x32_8x32x1_8x32x1_1x32x1x8_8_1x1_intrawave_v3,1121.32,621.02,0.0
256,3403,160,6144,18,0,23.4164,a8w8_blockscale_1x128x128_256x64x64x256_16x16_32x32_16x16x1_16x16x1_1x32x1x8_8_1x1_intrawave_v1,285.72,981.36,0.0
256,3473,3584,6144,0,0,142.2823,a8w8_blockscale_1x128x128_256x128x128x128_16x16_32x32_8x32x1_8x32x1_1x32x1x8_8_1x1_intrawave_v3,1074.99,479.7,0.0
256,3473,6144,3072,0,0,114.3176,a8w8_blockscale_1x128x128_256x128x128x128_16x16_32x32_8x32x1_8x32x1_1x32x1x8_8_1x1_intrawave_v3,1146.82,631.75,0.0
256,3473,160,6144,18,0,23.3351,a8w8_blockscale_1x128x128_256x64x64x256_16x16_32x32_16x16x1_16x16x1_1x32x1x8_8_1x1_intrawave_v1,292.61,1004.17,0.0
256,3520,3584,6144,0,0,141.6256,a8w8_blockscale_1x128x128_256x128x128x128_16x16_32x32_8x32x1_8x32x1_1x32x1x8_8_1x1_intrawave_v3,1094.59,486.34,0.0
256,3520,6144,3072,0,0,116.0166,a8w8_blockscale_1x128x128_256x128x128x128_16x16_32x32_8x32x1_8x32x1_1x32x1x8_8_1x1_intrawave_v3,1145.31,628.72,0.0
256,3520,160,6144,18,0,23.4636,a8w8_blockscale_1x128x128_256x64x64x256_16x16_32x32_16x16x1_16x16x1_1x32x1x8_8_1x1_intrawave_v1,294.95,1011.62,0.0
256,3242,3584,6144,0,0,119.9459,a8w8_blockscale_1x128x128_256x128x128x128_16x16_32x32_8x32x1_8x32x1_1x32x1x8_8_1x1_intrawave_v3,1190.36,543.39,0.0
256,3242,6144,3072,0,0,103.3641,a8w8_blockscale_1x128x128_256x128x128x128_16x16_32x32_8x32x1_8x32x1_1x32x1x8_8_1x1_intrawave_v3,1183.98,664.36,0.0
256,3242,160,6144,18,0,23.362,a8w8_blockscale_1x128x128_256x64x64x256_16x16_32x32_16x16x1_16x16x1_1x32x1x8_8_1x1_intrawave_v1,272.84,939.1,0.0
256,3309,3584,6144,0,0,121.1351,a8w8_blockscale_1x128x128_256x128x128x128_16x16_32x32_8x32x1_8x32x1_1x32x1x8_8_1x1_intrawave_v3,1203.03,545.42,0.0
256,3309,6144,3072,0,0,106.101,a8w8_blockscale_1x128x128_256x128x128x128_16x16_32x32_8x32x1_8x32x1_1x32x1x8_8_1x1_intrawave_v3,1177.28,656.93,0.0
256,3309,160,6144,18,0,23.2551,a8w8_blockscale_1x128x128_256x64x64x256_16x16_32x32_16x16x1_16x16x1_1x32x1x8_8_1x1_intrawave_v1,279.76,962.04,0.0
256,3368,3584,6144,0,0,121.0751,a8w8_blockscale_1x128x128_256x128x128x128_16x16_32x32_8x32x1_8x32x1_1x32x1x8_8_1x1_intrawave_v3,1225.09,552.18,0.0
256,3368,6144,3072,0,0,116.9374,a8w8_blockscale_1x128x128_256x128x128x128_16x16_32x32_8x32x1_8x32x1_1x32x1x8_8_1x1_intrawave_v3,1087.23,603.8,0.0
256,3368,160,6144,18,0,23.1738,a8w8_blockscale_1x128x128_256x64x64x256_16x16_32x32_16x16x1_16x16x1_1x32x1x8_8_1x1_intrawave_v1,285.74,981.88,0.0
256,6822,3584,6144,0,0,227.0548,a8w8_blockscale_1x128x128_256x128x128x128_16x16_32x32_8x32x1_8x32x1_1x32x1x8_8_1x1_intrawave_v3,1323.21,496.95,0.0
256,6822,6144,3072,0,0,204.1187,a8w8_blockscale_1x128x128_256x128x128x128_16x16_32x32_8x32x1_8x32x1_1x32x1x8_8_1x1_intrawave_v3,1261.63,605.83,0.0
256,6822,160,6144,18,0,31.0015,a8w8_blockscale_1x128x128_256x64x64x256_16x16_32x32_16x16x1_16x16x1_1x32x1x8_8_1x1_intrawave_v1,432.64,1454.14,0.0
256,3254,3584,6144,0,0,121.3099,a8w8_blockscale_1x128x128_256x128x128x128_16x16_32x32_8x32x1_8x32x1_1x32x1x8_8_1x1_intrawave_v3,1181.33,538.6,0.0
256,3254,6144,3072,0,0,103.1741,a8w8_blockscale_1x128x128_256x128x128x128_16x16_32x32_8x32x1_8x32x1_1x32x1x8_8_1x1_intrawave_v3,1190.55,667.37,0.0
256,3254,160,6144,18,0,23.3063,a8w8_blockscale_1x128x128_256x64x64x256_16x16_32x32_16x16x1_16x16x1_1x32x1x8_8_1x1_intrawave_v1,274.5,944.68,0.0
256,3364,3584,6144,0,0,121.0635,a8w8_blockscale_1x128x128_256x128x128x128_16x16_32x32_8x32x1_8x32x1_1x32x1x8_8_1x1_intrawave_v3,1223.75,551.79,0.0
256,3364,6144,3072,0,0,115.1884,a8w8_blockscale_1x128x128_256x128x128x128_16x16_32x32_8x32x1_8x32x1_1x32x1x8_8_1x1_intrawave_v3,1102.43,612.44,0.0
256,3364,160,6144,18,0,23.3982,a8w8_blockscale_1x128x128_256x64x64x256_16x16_32x32_16x16x1_16x16x1_1x32x1x8_8_1x1_intrawave_v1,282.67,971.35,0.0
256,3277,3584,6144,0,0,119.6699,a8w8_blockscale_1x128x128_256x128x128x128_16x16_32x32_8x32x1_8x32x1_1x32x1x8_8_1x1_intrawave_v3,1205.98,548.54,0.0
256,3277,6144,3072,0,0,105.3312,a8w8_blockscale_1x128x128_256x128x128x128_16x16_32x32_8x32x1_8x32x1_1x32x1x8_8_1x1_intrawave_v3,1174.42,657.06,0.0
256,3277,160,6144,18,0,23.2536,a8w8_blockscale_1x128x128_256x64x64x256_16x16_32x32_16x16x1_16x16x1_1x32x1x8_8_1x1_intrawave_v1,277.07,953.21,0.0
256,3547,3584,6144,0,0,142.1036,a8w8_blockscale_1x128x128_256x128x128x128_16x16_32x32_8x32x1_8x32x1_1x32x1x8_8_1x1_intrawave_v3,1099.27,487.23,0.0
256,3547,6144,3072,0,0,117.5142,a8w8_blockscale_1x128x128_256x128x128x128_16x16_32x32_8x32x1_8x32x1_1x32x1x8_8_1x1_intrawave_v3,1139.39,624.23,0.0
256,3547,160,6144,18,0,23.3669,a8w8_blockscale_1x128x128_256x64x64x256_16x16_32x32_16x16x1_16x16x1_1x32x1x8_8_1x1_intrawave_v1,298.44,1023.28,0.0
256,6438,3584,6144,0,0,218.9423,a8w8_blockscale_1x128x128_256x128x128x128_16x16_32x32_8x32x1_8x32x1_1x32x1x8_8_1x1_intrawave_v3,1295.0,492.01,0.0
256,6438,6144,3072,0,0,189.1421,a8w8_blockscale_1x128x128_256x128x128x128_16x16_32x32_8x32x1_8x32x1_1x32x1x8_8_1x1_intrawave_v3,1284.89,622.61,0.0
256,6438,160,6144,18,0,30.4818,a8w8_blockscale_1x128x128_256x64x64x256_16x16_32x32_16x16x1_16x16x1_1x32x1x8_8_1x1_intrawave_v1,415.25,1397.5,0.0
256,3302,3584,6144,0,0,121.0307,a8w8_blockscale_1x128x128_256x128x128x128_16x16_32x32_8x32x1_8x32x1_1x32x1x8_8_1x1_intrawave_v3,1201.52,545.12,0.0
256,3302,6144,3072,0,0,103.2982,a8w8_blockscale_1x128x128_256x128x128x128_16x16_32x32_8x32x1_8x32x1_1x32x1x8_8_1x1_intrawave_v3,1206.67,673.71,0.0
256,3302,160,6144,18,0,23.2592,a8w8_blockscale_1x128x128_256x64x64x256_16x16_32x32_16x16x1_16x16x1_1x32x1x8_8_1x1_intrawave_v1,279.12,959.93,0.0
256,3668,3584,6144,0,0,143.8453,a8w8_blockscale_1x128x128_256x128x128x128_16x16_32x32_8x32x1_8x32x1_1x32x1x8_8_1x1_intrawave_v3,1123.01,492.53,0.0
256,3668,6144,3072,0,0,115.7362,a8w8_blockscale_1x128x128_256x128x128x128_16x16_32x32_8x32x1_8x32x1_1x32x1x8_8_1x1_intrawave_v3,1196.36,649.88,0.0
256,3668,160,6144,18,0,23.4114,a8w8_blockscale_1x128x128_256x64x64x256_16x16_32x32_16x16x1_16x16x1_1x32x1x8_8_1x1_intrawave_v1,308.04,1054.74,0.0
256,3521,3584,6144,0,0,140.097,a8w8_blockscale_1x128x128_256x128x128x128_16x16_32x32_8x32x1_8x32x1_1x32x1x8_8_1x1_intrawave_v3,1106.84,491.74,0.0
256,3521,6144,3072,0,0,114.6215,a8w8_blockscale_1x128x128_256x128x128x128_16x16_32x32_8x32x1_8x32x1_1x32x1x8_8_1x1_intrawave_v3,1159.58,636.5,0.0
256,3521,160,6144,18,0,23.3799,a8w8_blockscale_1x128x128_256x64x64x256_16x16_32x32_16x16x1_16x16x1_1x32x1x8_8_1x1_intrawave_v1,296.09,1015.52,0.0
256,3392,3584,6144,0,0,120.7455,a8w8_blockscale_1x128x128_256x128x128x128_16x16_32x32_8x32x1_8x32x1_1x32x1x8_8_1x1_intrawave_v3,1237.18,556.33,0.0
256,3392,6144,3072,0,0,113.9954,a8w8_blockscale_1x128x128_256x128x128x128_16x16_32x32_8x32x1_8x32x1_1x32x1x8_8_1x1_intrawave_v3,1123.24,622.62,0.0
256,3392,160,6144,18,0,23.413,a8w8_blockscale_1x128x128_256x64x64x256_16x16_32x32_16x16x1_16x16x1_1x32x1x8_8_1x1_intrawave_v1,284.84,978.47,0.0
256,3193,3584,6144,0,0,117.5499,a8w8_blockscale_1x128x128_256x128x128x128_16x16_32x32_8x32x1_8x32x1_1x32x1x8_8_1x1_intrawave_v3,1196.26,548.92,0.0
256,3193,6144,3072,0,0,105.4386,a8w8_blockscale_1x128x128_256x128x128x128_16x16_32x32_8x32x1_8x32x1_1x32x1x8_8_1x1_intrawave_v3,1143.15,644.16,0.0
256,3193,160,6144,18,0,23.1761,a8w8_blockscale_1x128x128_256x64x64x256_16x16_32x32_16x16x1_16x16x1_1x32x1x8_8_1x1_intrawave_v1,270.87,932.97,0.0
256,3505,3584,6144,0,0,141.5408,a8w8_blockscale_1x128x128_256x128x128x128_16x16_32x32_8x32x1_8x32x1_1x32x1x8_8_1x1_intrawave_v3,1090.58,485.22,0.0
256,3505,6144,3072,0,0,116.9794,a8w8_blockscale_1x128x128_256x128x128x128_16x16_32x32_8x32x1_8x32x1_1x32x1x8_8_1x1_intrawave_v3,1131.05,621.57,0.0
256,3505,160,6144,18,0,23.4392,a8w8_blockscale_1x128x128_256x64x64x256_16x16_32x32_16x16x1_16x16x1_1x32x1x8_8_1x1_intrawave_v1,294.0,1008.54,0.0
256,3224,3584,6144,0,0,121.4795,a8w8_blockscale_1x128x128_256x128x128x128_16x16_32x32_8x32x1_8x32x1_1x32x1x8_8_1x1_intrawave_v3,1168.8,534.56,0.0
256,3224,6144,3072,0,0,102.849,a8w8_blockscale_1x128x128_256x128x128x128_16x16_32x32_8x32x1_8x32x1_1x32x1x8_8_1x1_intrawave_v3,1183.31,665.0,0.0
256,3224,160,6144,18,0,23.2599,a8w8_blockscale_1x128x128_256x64x64x256_16x16_32x32_16x16x1_16x16x1_1x32x1x8_8_1x1_intrawave_v1,272.51,938.22,0.0
256,3147,3584,6144,0,0,118.6495,a8w8_blockscale_1x128x128_256x128x128x128_16x16_32x32_8x32x1_8x32x1_1x32x1x8_8_1x1_intrawave_v3,1168.1,538.67,0.0
256,3147,6144,3072,0,0,99.4725,a8w8_blockscale_1x128x128_256x128x128x128_16x16_32x32_8x32x1_8x32x1_1x32x1x8_8_1x1_intrawave_v3,1194.25,675.69,0.0
256,3147,160,6144,18,0,23.202,a8w8_blockscale_1x128x128_256x64x64x256_16x16_32x32_16x16x1_16x16x1_1x32x1x8_8_1x1_intrawave_v1,266.67,919.11,0.0
256,3556,3584,6144,0,0,142.0882,a8w8_blockscale_1x128x128_256x128x128x128_16x16_32x32_8x32x1_8x32x1_1x32x1x8_8_1x1_intrawave_v3,1102.18,488.13,0.0
256,3556,6144,3072,0,0,114.0874,a8w8_blockscale_1x128x128_256x128x128x128_16x16_32x32_8x32x1_8x32x1_1x32x1x8_8_1x1_intrawave_v3,1176.59,644.19,0.0
256,3556,160,6144,18,0,23.4319,a8w8_blockscale_1x128x128_256x64x64x256_16x16_32x32_16x16x1_16x16x1_1x32x1x8_8_1x1_intrawave_v1,298.37,1022.92,0.0
256,3425,3584,6144,0,0,121.1839,a8w8_blockscale_1x128x128_256x128x128x128_16x16_32x32_8x32x1_8x32x1_1x32x1x8_8_1x1_intrawave_v3,1244.7,557.94,0.0
256,3425,6144,3072,0,0,116.619,a8w8_blockscale_1x128x128_256x128x128x128_16x16_32x32_8x32x1_8x32x1_1x32x1x8_8_1x1_intrawave_v3,1108.65,612.96,0.0
256,3425,160,6144,18,0,23.4175,a8w8_blockscale_1x128x128_256x64x64x256_16x16_32x32_16x16x1_16x16x1_1x32x1x8_8_1x1_intrawave_v1,287.56,987.39,0.0
256,3516,3584,6144,0,0,138.0222,a8w8_blockscale_1x128x128_256x128x128x128_16x16_32x32_8x32x1_8x32x1_1x32x1x8_8_1x1_intrawave_v3,1121.89,498.65,0.0
256,3516,6144,3072,0,0,116.5422,a8w8_blockscale_1x128x128_256x128x128x128_16x16_32x32_8x32x1_8x32x1_1x32x1x8_8_1x1_intrawave_v3,1138.85,625.35,0.0
256,3516,160,6144,18,0,23.4125,a8w8_blockscale_1x128x128_256x64x64x256_16x16_32x32_16x16x1_16x16x1_1x32x1x8_8_1x1_intrawave_v1,295.26,1012.73,0.0
256,3424,3584,6144,0,0,122.6669,a8w8_blockscale_1x128x128_256x128x128x128_16x16_32x32_8x32x1_8x32x1_1x32x1x8_8_1x1_intrawave_v3,1229.29,551.09,0.0
256,3424,6144,3072,0,0,114.2866,a8w8_blockscale_1x128x128_256x128x128x128_16x16_32x32_8x32x1_8x32x1_1x32x1x8_8_1x1_intrawave_v3,1130.94,625.33,0.0
256,3424,160,6144,18,0,23.3898,a8w8_blockscale_1x128x128_256x64x64x256_16x16_32x32_16x16x1_16x16x1_1x32x1x8_8_1x1_intrawave_v1,287.81,988.28,0.0
256,6706,3584,6144,0,0,224.4986,a8w8_blockscale_1x128x128_256x128x128x128_16x16_32x32_8x32x1_8x32x1_1x32x1x8_8_1x1_intrawave_v3,1315.53,495.73,0.0
256,6706,6144,3072,0,0,195.0472,a8w8_blockscale_1x128x128_256x128x128x128_16x16_32x32_8x32x1_8x32x1_1x32x1x8_8_1x1_intrawave_v3,1297.86,624.87,0.0
256,6706,160,6144,18,0,30.8678,a8w8_blockscale_1x128x128_256x64x64x256_16x16_32x32_16x16x1_16x16x1_1x32x1x8_8_1x1_intrawave_v1,427.13,1436.14,0.0
256,3223,3584,6144,0,0,120.8675,a8w8_blockscale_1x128x128_256x128x128x128_16x16_32x32_8x32x1_8x32x1_1x32x1x8_8_1x1_intrawave_v3,1174.36,537.16,0.0
256,3223,6144,3072,0,0,105.0262,a8w8_blockscale_1x128x128_256x128x128x128_16x16_32x32_8x32x1_8x32x1_1x32x1x8_8_1x1_intrawave_v3,1158.42,651.07,0.0
256,3223,160,6144,18,0,23.2952,a8w8_blockscale_1x128x128_256x64x64x256_16x16_32x32_16x16x1_16x16x1_1x32x1x8_8_1x1_intrawave_v1,272.02,936.52,0.0
256,6656,3584,6144,0,0,215.801,a8w8_blockscale_1x128x128_256x128x128x128_16x16_32x32_8x32x1_8x32x1_1x32x1x8_8_1x1_intrawave_v3,1358.34,512.62,0.0
256,6656,6144,3072,0,0,188.918,a8w8_blockscale_1x128x128_256x128x128x128_16x16_32x32_8x32x1_8x32x1_1x32x1x8_8_1x1_intrawave_v3,1329.97,641.07,0.0
256,6656,160,6144,18,0,30.7752,a8w8_blockscale_1x128x128_256x64x64x256_16x16_32x32_16x16x1_16x16x1_1x32x1x8_8_1x1_intrawave_v1,425.22,1429.96,0.0
256,3274,3584,6144,0,0,120.8423,a8w8_blockscale_1x128x128_256x128x128x128_16x16_32x32_8x32x1_8x32x1_1x32x1x8_8_1x1_intrawave_v3,1193.19,542.89,0.0
256,3274,6144,3072,0,0,104.8082,a8w8_blockscale_1x128x128_256x128x128x128_16x16_32x32_8x32x1_8x32x1_1x32x1x8_8_1x1_intrawave_v3,1179.2,659.9,0.0
256,3274,160,6144,18,0,23.1943,a8w8_blockscale_1x128x128_256x64x64x256_16x16_32x32_16x16x1_16x16x1_1x32x1x8_8_1x1_intrawave_v1,277.52,954.81,0.0
256,3380,3584,6144,0,0,121.4151,a8w8_blockscale_1x128x128_256x128x128x128_16x16_32x32_8x32x1_8x32x1_1x32x1x8_8_1x1_intrawave_v3,1226.01,551.95,0.0
256,3380,6144,3072,0,0,115.3578,a8w8_blockscale_1x128x128_256x128x128x128_16x16_32x32_8x32x1_8x32x1_1x32x1x8_8_1x1_intrawave_v3,1106.04,613.67,0.0
256,3380,160,6144,18,0,23.2501,a8w8_blockscale_1x128x128_256x64x64x256_16x16_32x32_16x16x1_16x16x1_1x32x1x8_8_1x1_intrawave_v1,285.82,981.99,0.0
256,3324,3584,6144,0,0,121.8254,a8w8_blockscale_1x128x128_256x128x128x128_16x16_32x32_8x32x1_8x32x1_1x32x1x8_8_1x1_intrawave_v3,1201.63,543.97,0.0
256,3324,6144,3072,0,0,104.8839,a8w8_blockscale_1x128x128_256x128x128x128_16x16_32x32_8x32x1_8x32x1_1x32x1x8_8_1x1_intrawave_v3,1196.34,666.75,0.0
256,3324,160,6144,18,0,23.3054,a8w8_blockscale_1x128x128_256x64x64x256_16x16_32x32_16x16x1_16x16x1_1x32x1x8_8_1x1_intrawave_v1,280.42,964.13,0.0
256,6371,3584,6144,0,0,215.2924,a8w8_blockscale_1x128x128_256x128x128x128_16x16_32x32_8x32x1_8x32x1_1x32x1x8_8_1x1_intrawave_v3,1303.25,496.21,0.0
256,6371,6144,3072,0,0,194.4964,a8w8_blockscale_1x128x128_256x128x128x128_16x16_32x32_8x32x1_8x32x1_1x32x1x8_8_1x1_intrawave_v3,1236.51,600.18,0.0
256,6371,160,6144,18,0,30.6328,a8w8_blockscale_1x128x128_256x64x64x256_16x16_32x32_16x16x1_16x16x1_1x32x1x8_8_1x1_intrawave_v1,408.9,1376.47,0.0
256,3470,3584,6144,0,0,137.34,a8w8_blockscale_1x128x128_256x128x128x128_16x16_32x32_8x32x1_8x32x1_1x32x1x8_8_1x1_intrawave_v3,1112.71,496.67,0.0
256,3470,6144,3072,0,0,118.7947,a8w8_blockscale_1x128x128_256x128x128x128_16x16_32x32_8x32x1_8x32x1_1x32x1x8_8_1x1_intrawave_v3,1102.64,607.55,0.0
256,3470,160,6144,18,0,23.3936,a8w8_blockscale_1x128x128_256x64x64x256_16x16_32x32_16x16x1_16x16x1_1x32x1x8_8_1x1_intrawave_v1,291.63,1000.83,0.0
256,3138,3584,6144,0,0,119.2035,a8w8_blockscale_1x128x128_256x128x128x128_16x16_32x32_8x32x1_8x32x1_1x32x1x8_8_1x1_intrawave_v3,1159.35,535.16,0.0
256,3138,6144,3072,0,0,99.9345,a8w8_blockscale_1x128x128_256x128x128x128_16x16_32x32_8x32x1_8x32x1_1x32x1x8_8_1x1_intrawave_v3,1185.33,671.18,0.0
256,3138,160,6144,18,0,23.3322,a8w8_blockscale_1x128x128_256x64x64x256_16x16_32x32_16x16x1_16x16x1_1x32x1x8_8_1x1_intrawave_v1,264.42,911.49,0.0
256,3209,3584,6144,0,0,118.9534,a8w8_blockscale_1x128x128_256x128x128x128_16x16_32x32_8x32x1_8x32x1_1x32x1x8_8_1x1_intrawave_v3,1188.07,544.23,0.0
256,3209,6144,3072,0,0,102.9693,a8w8_blockscale_1x128x128_256x128x128x128_16x16_32x32_8x32x1_8x32x1_1x32x1x8_8_1x1_intrawave_v3,1176.43,661.99,0.0
256,3209,160,6144,18,0,23.2734,a8w8_blockscale_1x128x128_256x64x64x256_16x16_32x32_16x16x1_16x16x1_1x32x1x8_8_1x1_intrawave_v1,271.09,933.51,0.0
256,6570,3584,6144,0,0,217.5004,a8w8_blockscale_1x128x128_256x128x128x128_16x16_32x32_8x32x1_8x32x1_1x32x1x8_8_1x1_intrawave_v3,1330.32,503.36,0.0
256,6570,6144,3072,0,0,193.4529,a8w8_blockscale_1x128x128_256x128x128x128_16x16_32x32_8x32x1_8x32x1_1x32x1x8_8_1x1_intrawave_v3,1282.01,619.22,0.0
256,6570,160,6144,18,0,30.903,a8w8_blockscale_1x128x128_256x64x64x256_16x16_32x32_16x16x1_16x16x1_1x32x1x8_8_1x1_intrawave_v1,417.99,1406.06,0.0
256,6715,3584,6144,0,0,222.1726,a8w8_blockscale_1x128x128_256x128x128x128_16x16_32x32_8x32x1_8x32x1_1x32x1x8_8_1x1_intrawave_v3,1331.08,501.46,0.0
256,6715,6144,3072,0,0,191.7612,a8w8_blockscale_1x128x128_256x128x128x128_16x16_32x32_8x32x1_8x32x1_1x32x1x8_8_1x1_intrawave_v3,1321.87,636.3,0.0
256,6715,160,6144,18,0,31.3632,a8w8_blockscale_1x128x128_256x64x64x256_16x16_32x32_16x16x1_16x16x1_1x32x1x8_8_1x1_intrawave_v1,420.95,1415.31,0.0
256,6710,3584,6144,0,0,220.843,a8w8_blockscale_1x128x128_256x128x128x128_16x16_32x32_8x32x1_8x32x1_1x32x1x8_8_1x1_intrawave_v3,1338.1,504.18,0.0
256,6710,6144,3072,0,0,193.6707,a8w8_blockscale_1x128x128_256x128x128x128_16x16_32x32_8x32x1_8x32x1_1x32x1x8_8_1x1_intrawave_v3,1307.86,629.63,0.0
256,6710,160,6144,18,0,30.8378,a8w8_blockscale_1x128x128_256x64x64x256_16x16_32x32_16x16x1_16x16x1_1x32x1x8_8_1x1_intrawave_v1,427.8,1438.38,0.0
256,6580,3584,6144,0,0,217.841,a8w8_blockscale_1x128x128_256x128x128x128_16x16_32x32_8x32x1_8x32x1_1x32x1x8_8_1x1_intrawave_v3,1330.26,503.18,0.0
256,6580,6144,3072,0,0,190.4487,a8w8_blockscale_1x128x128_256x128x128x128_16x16_32x32_8x32x1_8x32x1_1x32x1x8_8_1x1_intrawave_v3,1304.22,629.79,0.0
256,6580,160,6144,18,0,30.7709,a8w8_blockscale_1x128x128_256x64x64x256_16x16_32x32_16x16x1_16x16x1_1x32x1x8_8_1x1_intrawave_v1,420.42,1414.2,0.0
256,3494,3584,6144,0,0,142.9196,a8w8_blockscale_1x128x128_256x128x128x128_16x16_32x32_8x32x1_8x32x1_1x32x1x8_8_1x1_intrawave_v3,1076.66,479.52,0.0
256,3494,6144,3072,0,0,117.5818,a8w8_blockscale_1x128x128_256x128x128x128_16x16_32x32_8x32x1_8x32x1_1x32x1x8_8_1x1_intrawave_v3,1121.72,616.95,0.0
256,3494,160,6144,18,0,23.2854,a8w8_blockscale_1x128x128_256x64x64x256_16x16_32x32_16x16x1_16x16x1_1x32x1x8_8_1x1_intrawave_v1,295.01,1012.15,0.0
256,3501,3584,6144,0,0,142.0675,a8w8_blockscale_1x128x128_256x128x128x128_16x16_32x32_8x32x1_8x32x1_1x32x1x8_8_1x1_intrawave_v3,1085.29,483.05,0.0
256,3501,6144,3072,0,0,116.3374,a8w8_blockscale_1x128x128_256x128x128x128_16x16_32x32_8x32x1_8x32x1_1x32x1x8_8_1x1_intrawave_v3,1135.99,624.47,0.0
256,3501,160,6144,18,0,23.391,a8w8_blockscale_1x128x128_256x64x64x256_16x16_32x32_16x16x1_16x16x1_1x32x1x8_8_1x1_intrawave_v1,294.27,1009.51,0.0
256,3579,3584,6144,0,0,143.7914,a8w8_blockscale_1x128x128_256x128x128x128_16x16_32x32_8x32x1_8x32x1_1x32x1x8_8_1x1_intrawave_v3,1096.17,484.48,0.0
256,3579,6144,3072,0,0,112.1734,a8w8_blockscale_1x128x128_256x128x128x128_16x16_32x32_8x32x1_8x32x1_1x32x1x8_8_1x1_intrawave_v3,1204.41,658.34,0.0
256,3579,160,6144,18,0,23.5323,a8w8_blockscale_1x128x128_256x64x64x256_16x16_32x32_16x16x1_16x16x1_1x32x1x8_8_1x1_intrawave_v1,299.02,1024.88,0.0
256,3323,3584,6144,0,0,119.8599,a8w8_blockscale_1x128x128_256x128x128x128_16x16_32x32_8x32x1_8x32x1_1x32x1x8_8_1x1_intrawave_v3,1220.97,552.78,0.0
256,3323,6144,3072,0,0,103.7081,a8w8_blockscale_1x128x128_256x128x128x128_16x16_32x32_8x32x1_8x32x1_1x32x1x8_8_1x1_intrawave_v3,1209.54,674.16,0.0
256,3323,160,6144,18,0,23.2792,a8w8_blockscale_1x128x128_256x64x64x256_16x16_32x32_16x16x1_16x16x1_1x32x1x8_8_1x1_intrawave_v1,280.65,964.93,0.0
256,6803,3584,6144,0,0,219.5415,a8w8_blockscale_1x128x128_256x128x128x128_16x16_32x32_8x32x1_8x32x1_1x32x1x8_8_1x1_intrawave_v3,1364.69,512.8,0.0
256,6803,6144,3072,0,0,205.1129,a8w8_blockscale_1x128x128_256x128x128x128_16x16_32x32_8x32x1_8x32x1_1x32x1x8_8_1x1_intrawave_v3,1252.02,601.47,0.0
256,6803,160,6144,18,0,31.0533,a8w8_blockscale_1x128x128_256x64x64x256_16x16_32x32_16x16x1_16x16x1_1x32x1x8_8_1x1_intrawave_v1,430.72,1447.76,0.0
256,6866,3584,6144,0,0,222.7452,a8w8_blockscale_1x128x128_256x128x128x128_16x16_32x32_8x32x1_8x32x1_1x32x1x8_8_1x1_intrawave_v3,1357.52,509.19,0.0
256,6866,6144,3072,0,0,206.7213,a8w8_blockscale_1x128x128_256x128x128x128_16x16_32x32_8x32x1_8x32x1_1x32x1x8_8_1x1_intrawave_v3,1253.78,601.47,0.0
256,6866,160,6144,18,0,31.0553,a8w8_blockscale_1x128x128_256x64x64x256_16x16_32x32_16x16x1_16x16x1_1x32x1x8_8_1x1_intrawave_v1,434.68,1460.78,0.0
256,3134,3584,6144,0,0,118.6235,a8w8_blockscale_1x128x128_256x128x128x128_16x16_32x32_8x32x1_8x32x1_1x32x1x8_8_1x1_intrawave_v3,1163.53,537.33,0.0
256,3134,6144,3072,0,0,103.033,a8w8_blockscale_1x128x128_256x128x128x128_16x16_32x32_8x32x1_8x32x1_1x32x1x8_8_1x1_intrawave_v3,1148.22,650.4,0.0
256,3134,160,6144,18,0,23.2904,a8w8_blockscale_1x128x128_256x64x64x256_16x16_32x32_16x16x1_16x16x1_1x32x1x8_8_1x1_intrawave_v1,264.56,912.02,0.0
256,3372,3584,6144,0,0,122.2603,a8w8_blockscale_1x128x128_256x128x128x128_16x16_32x32_8x32x1_8x32x1_1x32x1x8_8_1x1_intrawave_v3,1214.65,547.26,0.0
256,3372,6144,3072,0,0,114.6919,a8w8_blockscale_1x128x128_256x128x128x128_16x16_32x32_8x32x1_8x32x1_1x32x1x8_8_1x1_intrawave_v3,1109.83,616.16,0.0
256,3372,160,6144,18,0,23.3228,a8w8_blockscale_1x128x128_256x64x64x256_16x16_32x32_16x16x1_16x16x1_1x32x1x8_8_1x1_intrawave_v1,284.25,976.71,0.0
256,9886,3584,6144,0,0,315.4885,a8w8_blockscale_1x128x128_256x128x128x128_16x16_32x32_8x32x1_8x32x1_1x32x1x8_8_1x1_intrawave_v3,1380.02,486.94,0.0
256,9886,6144,3072,0,0,274.7618,a8w8_blockscale_1x128x128_256x128x128x128_16x16_32x32_8x32x1_8x32x1_1x32x1x8_8_1x1_intrawave_v3,1358.21,621.35,0.0
256,9886,160,6144,18,0,35.1501,a8w8_blockscale_1x128x128_256x64x64x256_16x16_32x32_16x16x1_16x16x1_1x32x1x8_8_1x1_intrawave_v1,552.96,1845.97,0.0
256,3509,3584,6144,0,0,140.812,a8w8_blockscale_1x128x128_256x128x128x128_16x16_32x32_8x32x1_8x32x1_1x32x1x8_8_1x1_intrawave_v3,1097.47,488.11,0.0
256,3509,6144,3072,0,0,117.4307,a8w8_blockscale_1x128x128_256x128x128x128_16x16_32x32_8x32x1_8x32x1_1x32x1x8_8_1x1_intrawave_v3,1127.99,619.71,0.0
256,3509,160,6144,18,0,23.4119,a8w8_blockscale_1x128x128_256x64x64x256_16x16_32x32_16x16x1_16x16x1_1x32x1x8_8_1x1_intrawave_v1,294.68,1010.82,0.0
256,3426,3584,6144,0,0,122.1923,a8w8_blockscale_1x128x128_256x128x128x128_16x16_32x32_8x32x1_8x32x1_1x32x1x8_8_1x1_intrawave_v3,1234.79,553.45,0.0
256,3426,6144,3072,0,0,114.3367,a8w8_blockscale_1x128x128_256x128x128x128_16x16_32x32_8x32x1_8x32x1_1x32x1x8_8_1x1_intrawave_v3,1131.11,625.33,0.0
256,3426,160,6144,18,0,23.3582,a8w8_blockscale_1x128x128_256x64x64x256_16x16_32x32_16x16x1_16x16x1_1x32x1x8_8_1x1_intrawave_v1,288.37,990.17,0.0
256,6465,3584,6144,0,0,216.8319,a8w8_blockscale_1x128x128_256x128x128x128_16x16_32x32_8x32x1_8x32x1_1x32x1x8_8_1x1_intrawave_v3,1313.09,498.46,0.0
256,6465,6144,3072,0,0,191.9375,a8w8_blockscale_1x128x128_256x128x128x128_16x16_32x32_8x32x1_8x32x1_1x32x1x8_8_1x1_intrawave_v3,1271.48,615.7,0.0
256,6465,160,6144,18,0,30.6695,a8w8_blockscale_1x128x128_256x64x64x256_16x16_32x32_16x16x1_16x16x1_1x32x1x8_8_1x1_intrawave_v1,414.44,1394.64,0.0
256,3316,3584,6144,0,0,121.2275,a8w8_blockscale_1x128x128_256x128x128x128_16x16_32x32_8x32x1_8x32x1_1x32x1x8_8_1x1_intrawave_v3,1204.65,545.77,0.0
256,3316,6144,3072,0,0,100.6999,a8w8_blockscale_1x128x128_256x128x128x128_16x16_32x32_8x32x1_8x32x1_1x32x1x8_8_1x1_intrawave_v3,1243.05,693.23,0.0
256,3316,160,6144,18,0,23.2825,a8w8_blockscale_1x128x128_256x64x64x256_16x16_32x32_16x16x1_16x16x1_1x32x1x8_8_1x1_intrawave_v1,280.02,962.85,0.0
256,6728,3584,6144,0,0,229.0447,a8w8_blockscale_1x128x128_256x128x128x128_16x16_32x32_8x32x1_8x32x1_1x32x1x8_8_1x1_intrawave_v3,1293.64,487.17,0.0
256,6728,6144,3072,0,0,196.604,a8w8_blockscale_1x128x128_256x128x128x128_16x16_32x32_8x32x1_8x32x1_1x32x1x8_8_1x1_intrawave_v3,1291.8,621.64,0.0
256,6728,160,6144,18,0,30.9109,a8w8_blockscale_1x128x128_256x64x64x256_16x16_32x32_16x16x1_16x16x1_1x32x1x8_8_1x1_intrawave_v1,427.93,1438.74,0.0
256,3373,3584,6144,0,0,122.6615,a8w8_blockscale_1x128x128_256x128x128x128_16x16_32x32_8x32x1_8x32x1_1x32x1x8_8_1x1_intrawave_v3,1211.04,545.58,0.0
256,3373,6144,3072,0,0,115.4347,a8w8_blockscale_1x128x128_256x128x128x128_16x16_32x32_8x32x1_8x32x1_1x32x1x8_8_1x1_intrawave_v3,1103.02,612.33,0.0
256,3373,160,6144,18,0,23.4075,a8w8_blockscale_1x128x128_256x64x64x256_16x16_32x32_16x16x1_16x16x1_1x32x1x8_8_1x1_intrawave_v1,283.31,973.45,0.0
256,3231,3584,6144,0,0,120.4399,a8w8_blockscale_1x128x128_256x128x128x128_16x16_32x32_8x32x1_8x32x1_1x32x1x8_8_1x1_intrawave_v3,1181.45,539.95,0.0
256,3231,6144,3072,0,0,103.3018,a8w8_blockscale_1x128x128_256x128x128x128_16x16_32x32_8x32x1_8x32x1_1x32x1x8_8_1x1_intrawave_v3,1180.68,663.13,0.0
256,3231,160,6144,18,0,23.2853,a8w8_blockscale_1x128x128_256x64x64x256_16x16_32x32_16x16x1_16x16x1_1x32x1x8_8_1x1_intrawave_v1,272.81,939.14,0.0
256,6553,3584,6144,0,0,219.0114,a8w8_blockscale_1x128x128_256x128x128x128_16x16_32x32_8x32x1_8x32x1_1x32x1x8_8_1x1_intrawave_v3,1317.72,498.85,0.0
256,6553,6144,3072,0,0,189.5199,a8w8_blockscale_1x128x128_256x128x128x128_16x16_32x32_8x32x1_8x32x1_1x32x1x8_8_1x1_intrawave_v3,1305.23,630.69,0.0
256,6553,160,6144,18,0,30.8202,a8w8_blockscale_1x128x128_256x64x64x256_16x16_32x32_16x16x1_16x16x1_1x32x1x8_8_1x1_intrawave_v1,418.03,1406.27,0.0
256,3451,3584,6144,0,0,121.5591,a8w8_blockscale_1x128x128_256x128x128x128_16x16_32x32_8x32x1_8x32x1_1x32x1x8_8_1x1_intrawave_v3,1250.28,559.07,0.0
256,3451,6144,3072,0,0,118.8535,a8w8_blockscale_1x128x128_256x128x128x128_16x16_32x32_8x32x1_8x32x1_1x32x1x8_8_1x1_intrawave_v3,1096.06,604.79,0.0
256,3451,160,6144,18,0,23.4265,a8w8_blockscale_1x128x128_256x64x64x256_16x16_32x32_16x16x1_16x16x1_1x32x1x8_8_1x1_intrawave_v1,289.63,994.19,0.0
256,3146,3584,6144,0,0,117.8667,a8w8_blockscale_1x128x128_256x128x128x128_16x16_32x32_8x32x1_8x32x1_1x32x1x8_8_1x1_intrawave_v3,1175.48,542.13,0.0
256,3146,6144,3072,0,0,101.1509,a8w8_blockscale_1x128x128_256x128x128x128_16x16_32x32_8x32x1_8x32x1_1x32x1x8_8_1x1_intrawave_v3,1174.06,664.32,0.0
256,3146,160,6144,18,0,23.176,a8w8_blockscale_1x128x128_256x64x64x256_16x16_32x32_16x16x1_16x16x1_1x32x1x8_8_1x1_intrawave_v1,266.88,919.86,0.0
256,3387,3584,6144,0,0,122.4471,a8w8_blockscale_1x128x128_256x128x128x128_16x16_32x32_8x32x1_8x32x1_1x32x1x8_8_1x1_intrawave_v3,1218.19,548.06,0.0
256,3387,6144,3072,0,0,114.7242,a8w8_blockscale_1x128x128_256x128x128x128_16x16_32x32_8x32x1_8x32x1_1x32x1x8_8_1x1_intrawave_v3,1114.46,617.99,0.0
256,3387,160,6144,18,0,23.3663,a8w8_blockscale_1x128x128_256x64x64x256_16x16_32x32_16x16x1_16x16x1_1x32x1x8_8_1x1_intrawave_v1,284.99,979.04,0.0
256,3402,3584,6144,0,0,121.7837,a8w8_blockscale_1x128x128_256x128x128x128_16x16_32x32_8x32x1_8x32x1_1x32x1x8_8_1x1_intrawave_v3,1230.25,552.68,0.0
256,3402,6144,3072,0,0,113.2718,a8w8_blockscale_1x128x128_256x128x128x128_16x16_32x32_8x32x1_8x32x1_1x32x1x8_8_1x1_intrawave_v3,1133.74,627.95,0.0
256,3402,160,6144,18,0,23.3921,a8w8_blockscale_1x128x128_256x64x64x256_16x16_32x32_16x16x1_16x16x1_1x32x1x8_8_1x1_intrawave_v1,285.93,982.11,0.0
256,3407,3584,6144,0,0,122.1352,a8w8_blockscale_1x128x128_256x128x128x128_16x16_32x32_8x32x1_8x32x1_1x32x1x8_8_1x1_intrawave_v3,1228.52,551.64,0.0
256,3407,6144,3072,0,0,116.1187,a8w8_blockscale_1x128x128_256x128x128x128_16x16_32x32_8x32x1_8x32x1_1x32x1x8_8_1x1_intrawave_v3,1107.57,613.22,0.0
256,3407,160,6144,18,0,23.273,a8w8_blockscale_1x128x128_256x64x64x256_16x16_32x32_16x16x1_16x16x1_1x32x1x8_8_1x1_intrawave_v1,287.82,988.52,0.0
256,9630,3584,6144,0,0,309.4239,a8w8_blockscale_1x128x128_256x128x128x128_16x16_32x32_8x32x1_8x32x1_1x32x1x8_8_1x1_intrawave_v3,1370.63,485.47,0.0
256,9630,6144,3072,0,0,274.2766,a8w8_blockscale_1x128x128_256x128x128x128_16x16_32x32_8x32x1_8x32x1_1x32x1x8_8_1x1_intrawave_v3,1325.38,608.11,0.0
256,9630,160,6144,18,0,33.6197,a8w8_blockscale_1x128x128_256x64x64x256_16x16_32x32_16x16x1_16x16x1_1x32x1x8_8_1x1_intrawave_v1,563.16,1880.78,0.0
256,3301,3584,6144,0,0,120.3959,a8w8_blockscale_1x128x128_256x128x128x128_16x16_32x32_8x32x1_8x32x1_1x32x1x8_8_1x1_intrawave_v3,1207.49,547.88,0.0
256,3301,6144,3072,0,0,102.7698,a8w8_blockscale_1x128x128_256x128x128x128_16x16_32x32_8x32x1_8x32x1_1x32x1x8_8_1x1_intrawave_v3,1212.5,677.03,0.0
256,3301,160,6144,18,0,23.2387,a8w8_blockscale_1x128x128_256x64x64x256_16x16_32x32_16x16x1_16x16x1_1x32x1x8_8_1x1_intrawave_v1,279.28,960.5,0.0
256,3296,3584,6144,0,0,123.4911,a8w8_blockscale_1x128x128_256x128x128x128_16x16_32x32_8x32x1_8x32x1_1x32x1x8_8_1x1_intrawave_v3,1175.44,533.61,0.0
256,3296,6144,3072,0,0,103.5962,a8w8_blockscale_1x128x128_256x128x128x128_16x16_32x32_8x32x1_8x32x1_1x32x1x8_8_1x1_intrawave_v3,1201.01,670.88,0.0
256,3296,160,6144,18,0,23.3039,a8w8_blockscale_1x128x128_256x64x64x256_16x16_32x32_16x16x1_16x16x1_1x32x1x8_8_1x1_intrawave_v1,278.07,956.42,0.0
256,3441,3584,6144,0,0,122.6907,a8w8_blockscale_1x128x128_256x128x128x128_16x16_32x32_8x32x1_8x32x1_1x32x1x8_8_1x1_intrawave_v3,1235.16,552.83,0.0
256,3441,6144,3072,0,0,114.9325,a8w8_blockscale_1x128x128_256x128x128x128_16x16_32x32_8x32x1_8x32x1_1x32x1x8_8_1x1_intrawave_v3,1130.17,624.09,0.0
256,3441,160,6144,18,0,23.3661,a8w8_blockscale_1x128x128_256x64x64x256_16x16_32x32_16x16x1_16x16x1_1x32x1x8_8_1x1_intrawave_v1,289.53,993.99,0.0
256,6620,3584,6144,0,0,215.7455,a8w8_blockscale_1x128x128_256x128x128x128_16x16_32x32_8x32x1_8x32x1_1x32x1x8_8_1x1_intrawave_v3,1351.34,510.53,0.0
256,6620,6144,3072,0,0,189.1395,a8w8_blockscale_1x128x128_256x128x128x128_16x16_32x32_8x32x1_8x32x1_1x32x1x8_8_1x1_intrawave_v3,1321.23,637.4,0.0
256,6620,160,6144,18,0,30.8617,a8w8_blockscale_1x128x128_256x64x64x256_16x16_32x32_16x16x1_16x16x1_1x32x1x8_8_1x1_intrawave_v1,421.73,1418.42,0.0
256,6958,3584,6144,0,0,241.0486,a8w8_blockscale_1x128x128_256x128x128x128_16x16_32x32_8x32x1_8x32x1_1x32x1x8_8_1x1_intrawave_v3,1271.24,475.61,0.0
256,6958,6144,3072,0,0,203.4925,a8w8_blockscale_1x128x128_256x128x128x128_16x16_32x32_8x32x1_8x32x1_1x32x1x8_8_1x1_intrawave_v3,1290.74,617.96,0.0
256,6958,160,6144,18,0,31.6539,a8w8_blockscale_1x128x128_256x64x64x256_16x16_32x32_16x16x1_16x16x1_1x32x1x8_8_1x1_intrawave_v1,432.17,1451.94,0.0
256,3478,3584,6144,0,0,139.6249,a8w8_blockscale_1x128x128_256x128x128x128_16x16_32x32_8x32x1_8x32x1_1x32x1x8_8_1x1_intrawave_v3,1097.02,489.31,0.0
256,3478,6144,3072,0,0,115.6922,a8w8_blockscale_1x128x128_256x128x128x128_16x16_32x32_8x32x1_8x32x1_1x32x1x8_8_1x1_intrawave_v3,1134.82,624.9,0.0
256,3478,160,6144,18,0,23.3378,a8w8_blockscale_1x128x128_256x64x64x256_16x16_32x32_16x16x1_16x16x1_1x32x1x8_8_1x1_intrawave_v1,293.0,1005.44,0.0
256,3283,3584,6144,0,0,121.0763,a8w8_blockscale_1x128x128_256x128x128x128_16x16_32x32_8x32x1_8x32x1_1x32x1x8_8_1x1_intrawave_v3,1194.16,542.83,0.0
256,3283,6144,3072,0,0,101.8454,a8w8_blockscale_1x128x128_256x128x128x128_16x16_32x32_8x32x1_8x32x1_1x32x1x8_8_1x1_intrawave_v3,1216.84,680.46,0.0
256,3283,160,6144,18,0,23.3691,a8w8_blockscale_1x128x128_256x64x64x256_16x16_32x32_16x16x1_16x16x1_1x32x1x8_8_1x1_intrawave_v1,276.2,950.16,0.0
256,3318,3584,6144,0,0,120.4795,a8w8_blockscale_1x128x128_256x128x128x128_16x16_32x32_8x32x1_8x32x1_1x32x1x8_8_1x1_intrawave_v3,1212.86,549.38,0.0
256,3318,6144,3072,0,0,106.169,a8w8_blockscale_1x128x128_256x128x128x128_16x16_32x32_8x32x1_8x32x1_1x32x1x8_8_1x1_intrawave_v3,1179.73,657.81,0.0
256,3318,160,6144,18,0,23.2874,a8w8_blockscale_1x128x128_256x64x64x256_16x16_32x32_16x16x1_16x16x1_1x32x1x8_8_1x1_intrawave_v1,280.13,963.21,0.0
256,3357,3584,6144,0,0,121.0091,a8w8_blockscale_1x128x128_256x128x128x128_16x16_32x32_8x32x1_8x32x1_1x32x1x8_8_1x1_intrawave_v3,1221.75,551.27,0.0
256,3357,6144,3072,0,0,114.1844,a8w8_blockscale_1x128x128_256x128x128x128_16x16_32x32_8x32x1_8x32x1_1x32x1x8_8_1x1_intrawave_v3,1109.81,616.88,0.0
256,3357,160,6144,18,0,23.4424,a8w8_blockscale_1x128x128_256x64x64x256_16x16_32x32_16x16x1_16x16x1_1x32x1x8_8_1x1_intrawave_v1,281.55,967.59,0.0
256,3333,3584,6144,0,0,120.7352,a8w8_blockscale_1x128x128_256x128x128x128_16x16_32x32_8x32x1_8x32x1_1x32x1x8_8_1x1_intrawave_v3,1215.77,549.87,0.0
256,3333,6144,3072,0,0,116.3754,a8w8_blockscale_1x128x128_256x128x128x128_16x16_32x32_8x32x1_8x32x1_1x32x1x8_8_1x1_intrawave_v3,1081.13,602.1,0.0
256,3333,160,6144,18,0,23.3025,a8w8_blockscale_1x128x128_256x64x64x256_16x16_32x32_16x16x1_16x16x1_1x32x1x8_8_1x1_intrawave_v1,281.21,966.74,0.0
256,3332,3584,6144,0,0,120.6403,a8w8_blockscale_1x128x128_256x128x128x128_16x16_32x32_8x32x1_8x32x1_1x32x1x8_8_1x1_intrawave_v3,1216.36,550.19,0.0
256,3332,6144,3072,0,0,113.3054,a8w8_blockscale_1x128x128_256x128x128x128_16x16_32x32_8x32x1_8x32x1_1x32x1x8_8_1x1_intrawave_v3,1110.09,618.27,0.0
256,3332,160,6144,18,0,23.2801,a8w8_blockscale_1x128x128_256x64x64x256_16x16_32x32_16x16x1_16x16x1_1x32x1x8_8_1x1_intrawave_v1,281.4,967.4,0.0
256,3127,3584,6144,0,0,118.5767,a8w8_blockscale_1x128x128_256x128x128x128_16x16_32x32_8x32x1_8x32x1_1x32x1x8_8_1x1_intrawave_v3,1161.39,536.76,0.0
256,3127,6144,3072,0,0,103.0569,a8w8_blockscale_1x128x128_256x128x128x128_16x16_32x32_8x32x1_8x32x1_1x32x1x8_8_1x1_intrawave_v3,1145.39,649.21,0.0
256,3127,160,6144,18,0,23.2444,a8w8_blockscale_1x128x128_256x64x64x256_16x16_32x32_16x16x1_16x16x1_1x32x1x8_8_1x1_intrawave_v1,264.49,911.87,0.0
256,3551,3584,6144,0,0,141.7756,a8w8_blockscale_1x128x128_256x128x128x128_16x16_32x32_8x32x1_8x32x1_1x32x1x8_8_1x1_intrawave_v3,1103.06,488.74,0.0
256,3551,6144,3072,0,0,118.1254,a8w8_blockscale_1x128x128_256x128x128x128_16x16_32x32_8x32x1_8x32x1_1x32x1x8_8_1x1_intrawave_v3,1134.78,621.52,0.0
256,3551,160,6144,18,0,23.4457,a8w8_blockscale_1x128x128_256x64x64x256_16x16_32x32_16x16x1_16x16x1_1x32x1x8_8_1x1_intrawave_v1,297.78,1020.94,0.0
256,3540,3584,6144,0,0,141.8964,a8w8_blockscale_1x128x128_256x128x128x128_16x16_32x32_8x32x1_8x32x1_1x32x1x8_8_1x1_intrawave_v3,1098.7,487.29,0.0
256,3540,6144,3072,0,0,117.0247,a8w8_blockscale_1x128x128_256x128x128x128_16x16_32x32_8x32x1_8x32x1_1x32x1x8_8_1x1_intrawave_v3,1141.9,625.93,0.0
256,3540,160,6144,18,0,23.3926,a8w8_blockscale_1x128x128_256x64x64x256_16x16_32x32_16x16x1_16x16x1_1x32x1x8_8_1x1_intrawave_v1,297.53,1020.22,0.0
256,3642,3584,6144,0,0,144.88,a8w8_blockscale_1x128x128_256x128x128x128_16x16_32x32_8x32x1_8x32x1_1x32x1x8_8_1x1_intrawave_v3,1107.08,486.63,0.0
256,3642,6144,3072,0,0,116.1599,a8w8_blockscale_1x128x128_256x128x128x128_16x16_32x32_8x32x1_8x32x1_1x32x1x8_8_1x1_intrawave_v3,1183.55,644.07,0.0
256,3642,160,6144,18,0,23.4164,a8w8_blockscale_1x128x128_256x64x64x256_16x16_32x32_16x16x1_16x16x1_1x32x1x8_8_1x1_intrawave_v1,305.79,1047.34,0.0
256,3439,3584,6144,0,0,121.5015,a8w8_blockscale_1x128x128_256x128x128x128_16x16_32x32_8x32x1_8x32x1_1x32x1x8_8_1x1_intrawave_v3,1246.52,558.02,0.0
256,3439,6144,3072,0,0,114.8154,a8w8_blockscale_1x128x128_256x128x128x128_16x16_32x32_8x32x1_8x32x1_1x32x1x8_8_1x1_intrawave_v3,1130.67,624.46,0.0
256,3439,160,6144,18,0,23.2477,a8w8_blockscale_1x128x128_256x64x64x256_16x16_32x32_16x16x1_16x16x1_1x32x1x8_8_1x1_intrawave_v1,290.84,998.5,0.0
256,3525,3584,6144,0,0,142.3883,a8w8_blockscale_1x128x128_256x128x128x128_16x16_32x32_8x32x1_8x32x1_1x32x1x8_8_1x1_intrawave_v3,1090.27,484.2,0.0
256,3525,6144,3072,0,0,115.567,a8w8_blockscale_1x128x128_256x128x128x128_16x16_32x32_8x32x1_8x32x1_1x32x1x8_8_1x1_intrawave_v3,1151.4,631.83,0.0
256,3525,160,6144,18,0,23.3888,a8w8_blockscale_1x128x128_256x64x64x256_16x16_32x32_16x16x1_16x16x1_1x32x1x8_8_1x1_intrawave_v1,296.31,1016.24,0.0
256,3658,3584,6144,0,0,143.5869,a8w8_blockscale_1x128x128_256x128x128x128_16x16_32x32_8x32x1_8x32x1_1x32x1x8_8_1x1_intrawave_v3,1121.96,492.49,0.0
256,3658,6144,3072,0,0,119.6123,a8w8_blockscale_1x128x128_256x128x128x128_16x16_32x32_8x32x1_8x32x1_1x32x1x8_8_1x1_intrawave_v3,1154.44,627.54,0.0
256,3658,160,6144,18,0,23.3118,a8w8_blockscale_1x128x128_256x64x64x256_16x16_32x32_16x16x1_16x16x1_1x32x1x8_8_1x1_intrawave_v1,308.51,1056.48,0.0
256,3232,3584,6144,0,0,121.5538,a8w8_blockscale_1x128x128_256x128x128x128_16x16_32x32_8x32x1_8x32x1_1x32x1x8_8_1x1_intrawave_v3,1170.99,535.11,0.0
256,3232,6144,3072,0,0,100.745,a8w8_blockscale_1x128x128_256x128x128x128_16x16_32x32_8x32x1_8x32x1_1x32x1x8_8_1x1_intrawave_v3,1211.02,680.11,0.0
256,3232,160,6144,18,0,23.2829,a8w8_blockscale_1x128x128_256x64x64x256_16x16_32x32_16x16x1_16x16x1_1x32x1x8_8_1x1_intrawave_v1,272.92,939.52,0.0
256,3356,3584,6144,0,0,122.0015,a8w8_blockscale_1x128x128_256x128x128x128_16x16_32x32_8x32x1_8x32x1_1x32x1x8_8_1x1_intrawave_v3,1211.45,546.67,0.0
256,3356,6144,3072,0,0,114.5998,a8w8_blockscale_1x128x128_256x128x128x128_16x16_32x32_8x32x1_8x32x1_1x32x1x8_8_1x1_intrawave_v3,1105.45,614.51,0.0
256,3356,160,6144,18,0,23.3433,a8w8_blockscale_1x128x128_256x64x64x256_16x16_32x32_16x16x1_16x16x1_1x32x1x8_8_1x1_intrawave_v1,282.66,971.42,0.0
256,3362,3584,6144,0,0,121.3224,a8w8_blockscale_1x128x128_256x128x128x128_16x16_32x32_8x32x1_8x32x1_1x32x1x8_8_1x1_intrawave_v3,1220.41,550.39,0.0
256,3362,6144,3072,0,0,113.4738,a8w8_blockscale_1x128x128_256x128x128x128_16x16_32x32_8x32x1_8x32x1_1x32x1x8_8_1x1_intrawave_v3,1118.42,621.42,0.0
256,3362,160,6144,18,0,23.2694,a8w8_blockscale_1x128x128_256x64x64x256_16x16_32x32_16x16x1_16x16x1_1x32x1x8_8_1x1_intrawave_v1,284.06,976.18,0.0
256,3438,3584,6144,0,0,123.0587,a8w8_blockscale_1x128x128_256x128x128x128_16x16_32x32_8x32x1_8x32x1_1x32x1x8_8_1x1_intrawave_v3,1230.39,550.85,0.0
256,3438,6144,3072,0,0,113.0122,a8w8_blockscale_1x128x128_256x128x128x128_16x16_32x32_8x32x1_8x32x1_1x32x1x8_8_1x1_intrawave_v3,1148.37,634.29,0.0
256,3438,160,6144,18,0,23.3177,a8w8_blockscale_1x128x128_256x64x64x256_16x16_32x32_16x16x1_16x16x1_1x32x1x8_8_1x1_intrawave_v1,289.88,995.22,0.0
256,3399,3584,6144,0,0,122.0763,a8w8_blockscale_1x128x128_256x128x128x128_16x16_32x32_8x32x1_8x32x1_1x32x1x8_8_1x1_intrawave_v3,1226.22,551.03,0.0
256,3399,6144,3072,0,0,114.3818,a8w8_blockscale_1x128x128_256x128x128x128_16x16_32x32_8x32x1_8x32x1_1x32x1x8_8_1x1_intrawave_v3,1121.75,621.45,0.0
256,3399,160,6144,18,0,23.3341,a8w8_blockscale_1x128x128_256x64x64x256_16x16_32x32_16x16x1_16x16x1_1x32x1x8_8_1x1_intrawave_v1,286.39,983.72,0.0
256,3595,3584,6144,0,0,143.1734,a8w8_blockscale_1x128x128_256x128x128x128_16x16_32x32_8x32x1_8x32x1_1x32x1x8_8_1x1_intrawave_v3,1105.82,488.06,0.0
256,3595,6144,3072,0,0,119.8871,a8w8_blockscale_1x128x128_256x128x128x128_16x16_32x32_8x32x1_8x32x1_1x32x1x8_8_1x1_intrawave_v3,1131.95,618.03,0.0
256,3595,160,6144,18,0,23.3135,a8w8_blockscale_1x128x128_256x64x64x256_16x16_32x32_16x16x1_16x16x1_1x32x1x8_8_1x1_intrawave_v1,303.17,1038.93,0.0
256,3493,3584,6144,0,0,140.6444,a8w8_blockscale_1x128x128_256x128x128x128_16x16_32x32_8x32x1_8x32x1_1x32x1x8_8_1x1_intrawave_v3,1093.77,487.18,0.0
256,3493,6144,3072,0,0,118.3939,a8w8_blockscale_1x128x128_256x128x128x128_16x16_32x32_8x32x1_8x32x1_1x32x1x8_8_1x1_intrawave_v3,1113.71,612.59,0.0
256,3493,160,6144,18,0,23.4488,a8w8_blockscale_1x128x128_256x64x64x256_16x16_32x32_16x16x1_16x16x1_1x32x1x8_8_1x1_intrawave_v1,292.87,1004.82,0.0
256,6761,3584,6144,0,0,219.7975,a8w8_blockscale_1x128x128_256x128x128x128_16x16_32x32_8x32x1_8x32x1_1x32x1x8_8_1x1_intrawave_v3,1354.68,509.66,0.0
256,6761,6144,3072,0,0,194.4383,a8w8_blockscale_1x128x128_256x128x128x128_16x16_32x32_8x32x1_8x32x1_1x32x1x8_8_1x1_intrawave_v3,1312.6,631.17,0.0
256,6761,160,6144,18,0,31.0451,a8w8_blockscale_1x128x128_256x64x64x256_16x16_32x32_16x16x1_16x16x1_1x32x1x8_8_1x1_intrawave_v1,428.17,1439.39,0.0
256,3428,3584,6144,0,0,124.3059,a8w8_blockscale_1x128x128_256x128x128x128_16x16_32x32_8x32x1_8x32x1_1x32x1x8_8_1x1_intrawave_v3,1214.5,544.25,0.0
256,3428,6144,3072,0,0,114.8278,a8w8_blockscale_1x128x128_256x128x128x128_16x16_32x32_8x32x1_8x32x1_1x32x1x8_8_1x1_intrawave_v3,1126.93,622.92,0.0
256,3428,160,6144,18,0,23.3281,a8w8_blockscale_1x128x128_256x64x64x256_16x16_32x32_16x16x1_16x16x1_1x32x1x8_8_1x1_intrawave_v1,288.91,992.01,0.0
256,3345,3584,6144,0,0,122.0795,a8w8_blockscale_1x128x128_256x128x128x128_16x16_32x32_8x32x1_8x32x1_1x32x1x8_8_1x1_intrawave_v3,1206.71,545.13,0.0
256,3345,6144,3072,0,0,114.9026,a8w8_blockscale_1x128x128_256x128x128x128_16x16_32x32_8x32x1_8x32x1_1x32x1x8_8_1x1_intrawave_v3,1098.93,611.42,0.0
256,3345,160,6144,18,0,23.2044,a8w8_blockscale_1x128x128_256x64x64x256_16x16_32x32_16x16x1_16x16x1_1x32x1x8_8_1x1_intrawave_v1,283.42,974.17,0.0
256,3250,3584,6144,0,0,119.5759,a8w8_blockscale_1x128x128_256x128x128x128_16x16_32x32_8x32x1_8x32x1_1x32x1x8_8_1x1_intrawave_v3,1196.99,545.96,0.0
256,3250,6144,3072,0,0,104.4382,a8w8_blockscale_1x128x128_256x128x128x128_16x16_32x32_8x32x1_8x32x1_1x32x1x8_8_1x1_intrawave_v3,1174.7,658.71,0.0
256,3250,160,6144,18,0,23.2606,a8w8_blockscale_1x128x128_256x64x64x256_16x16_32x32_16x16x1_16x16x1_1x32x1x8_8_1x1_intrawave_v1,274.7,945.42,0.0
256,3502,3584,6144,0,0,141.2256,a8w8_blockscale_1x128x128_256x128x128x128_16x16_32x32_8x32x1_8x32x1_1x32x1x8_8_1x1_intrawave_v3,1092.07,486.02,0.0
256,3502,6144,3072,0,0,118.3743,a8w8_blockscale_1x128x128_256x128x128x128_16x16_32x32_8x32x1_8x32x1_1x32x1x8_8_1x1_intrawave_v3,1116.76,613.86,0.0
256,3502,160,6144,18,0,23.3547,a8w8_blockscale_1x128x128_256x64x64x256_16x16_32x32_16x16x1_16x16x1_1x32x1x8_8_1x1_intrawave_v1,294.81,1011.36,0.0
256,6346,3584,6144,0,0,213.6559,a8w8_blockscale_1x128x128_256x128x128x128_16x16_32x32_8x32x1_8x32x1_1x32x1x8_8_1x1_intrawave_v3,1308.08,498.46,0.0
256,6346,6144,3072,0,0,187.5657,a8w8_blockscale_1x128x128_256x128x128x128_16x16_32x32_8x32x1_8x32x1_1x32x1x8_8_1x1_intrawave_v3,1277.17,620.31,0.0
256,6346,160,6144,18,0,30.6729,a8w8_blockscale_1x128x128_256x64x64x256_16x16_32x32_16x16x1_16x16x1_1x32x1x8_8_1x1_intrawave_v1,406.77,1369.4,0.0
256,3384,3584,6144,0,0,122.8812,a8w8_blockscale_1x128x128_256x128x128x128_16x16_32x32_8x32x1_8x32x1_1x32x1x8_8_1x1_intrawave_v3,1212.81,545.79,0.0
256,3384,6144,3072,0,0,114.9066,a8w8_blockscale_1x128x128_256x128x128x128_16x16_32x32_8x32x1_8x32x1_1x32x1x8_8_1x1_intrawave_v3,1111.7,616.61,0.0
256,3384,160,6144,18,0,23.297,a8w8_blockscale_1x128x128_256x64x64x256_16x16_32x32_16x16x1_16x16x1_1x32x1x8_8_1x1_intrawave_v1,285.58,981.12,0.0
256,75,37984,6144,2,0,77.0085,a8w8_blockscale_1x128x128_256x64x128x128_16x16_32x32_8x32x1_8x32x1_1x32x1x8_8_1x1_intrawave_v3,454.57,3110.46,0.0
256,6873,3584,6144,0,0,222.3823,a8w8_blockscale_1x128x128_256x128x128x128_16x16_32x32_8x32x1_8x32x1_1x32x1x8_8_1x1_intrawave_v3,1361.12,510.44,0.0
256,6873,6144,3072,0,0,207.2245,a8w8_blockscale_1x128x128_256x128x128x128_16x16_32x32_8x32x1_8x32x1_1x32x1x8_8_1x1_intrawave_v3,1252.01,600.53,0.0
256,6873,160,6144,18,0,31.1742,a8w8_blockscale_1x128x128_256x64x64x256_16x16_32x32_16x16x1_16x16x1_1x32x1x8_8_1x1_intrawave_v1,433.46,1456.66,0.0
256,10267,3584,6144,0,0,325.9539,a8w8_blockscale_1x128x128_256x128x128x128_16x16_32x32_8x32x1_8x32x1_1x32x1x8_8_1x1_intrawave_v3,1387.19,486.86,0.0
256,10267,6144,3072,0,0,281.1703,a8w8_blockscale_1x128x128_256x128x128x128_16x16_32x32_8x32x1_8x32x1_1x32x1x8_8_1x1_intrawave_v3,1378.4,628.0,0.0
256,10267,160,6144,18,0,34.5147,a8w8_blockscale_1x128x128_256x64x64x256_16x16_32x32_16x16x1_16x16x1_1x32x1x8_8_1x1_intrawave_v1,584.84,1951.31,0.0
256,3243,3584,6144,0,0,119.0771,a8w8_blockscale_1x128x128_256x128x128x128_16x16_32x32_8x32x1_8x32x1_1x32x1x8_8_1x1_intrawave_v3,1199.41,547.47,0.0
256,3243,6144,3072,0,0,103.0409,a8w8_blockscale_1x128x128_256x128x128x128_16x16_32x32_8x32x1_8x32x1_1x32x1x8_8_1x1_intrawave_v3,1188.06,666.6,0.0
256,3243,160,6144,18,0,23.3112,a8w8_blockscale_1x128x128_256x64x64x256_16x16_32x32_16x16x1_16x16x1_1x32x1x8_8_1x1_intrawave_v1,273.52,941.43,0.0
256,3081,3584,6144,0,0,119.2823,a8w8_blockscale_1x128x128_256x128x128x128_16x16_32x32_8x32x1_8x32x1_1x32x1x8_8_1x1_intrawave_v3,1137.54,528.45,0.0
256,3081,6144,3072,0,0,98.6334,a8w8_blockscale_1x128x128_256x128x128x128_16x16_32x32_8x32x1_8x32x1_1x32x1x8_8_1x1_intrawave_v3,1179.15,671.16,0.0
256,3081,160,6144,18,0,23.122,a8w8_blockscale_1x128x128_256x64x64x256_16x16_32x32_16x16x1_16x16x1_1x32x1x8_8_1x1_intrawave_v1,261.98,903.84,0.0
256,3401,3584,6144,0,0,122.9863,a8w8_blockscale_1x128x128_256x128x128x128_16x16_32x32_8x32x1_8x32x1_1x32x1x8_8_1x1_intrawave_v3,1217.86,547.17,0.0
256,3401,6144,3072,0,0,116.277,a8w8_blockscale_1x128x128_256x128x128x128_16x16_32x32_8x32x1_8x32x1_1x32x1x8_8_1x1_intrawave_v3,1104.12,611.59,0.0
256,3401,160,6144,18,0,23.2206,a8w8_blockscale_1x128x128_256x64x64x256_16x16_32x32_16x16x1_16x16x1_1x32x1x8_8_1x1_intrawave_v1,287.96,989.08,0.0
256,3562,3584,6144,0,0,142.7019,a8w8_blockscale_1x128x128_256x128x128x128_16x16_32x32_8x32x1_8x32x1_1x32x1x8_8_1x1_intrawave_v3,1099.29,486.59,0.0
256,3562,6144,3072,0,0,117.0657,a8w8_blockscale_1x128x128_256x128x128x128_16x16_32x32_8x32x1_8x32x1_1x32x1x8_8_1x1_intrawave_v3,1148.59,628.59,0.0
256,3562,160,6144,18,0,23.5032,a8w8_blockscale_1x128x128_256x64x64x256_16x16_32x32_16x16x1_16x16x1_1x32x1x8_8_1x1_intrawave_v1,297.97,1021.47,0.0
256,6798,3584,6144,0,0,221.3258,a8w8_blockscale_1x128x128_256x128x128x128_16x16_32x32_8x32x1_8x32x1_1x32x1x8_8_1x1_intrawave_v3,1352.69,508.37,0.0
256,6798,6144,3072,0,0,204.5314,a8w8_blockscale_1x128x128_256x128x128x128_16x16_32x32_8x32x1_8x32x1_1x32x1x8_8_1x1_intrawave_v3,1254.65,602.8,0.0
256,6798,160,6144,18,0,31.1377,a8w8_blockscale_1x128x128_256x64x64x256_16x16_32x32_16x16x1_16x16x1_1x32x1x8_8_1x1_intrawave_v1,429.24,1442.79,0.0
256,3331,3584,6144,0,0,121.0947,a8w8_blockscale_1x128x128_256x128x128x128_16x16_32x32_8x32x1_8x32x1_1x32x1x8_8_1x1_intrawave_v3,1211.43,548.02,0.0
256,3331,6144,3072,0,0,116.6322,a8w8_blockscale_1x128x128_256x128x128x128_16x16_32x32_8x32x1_8x32x1_1x32x1x8_8_1x1_intrawave_v3,1078.1,600.51,0.0
256,3331,160,6144,18,0,23.2278,a8w8_blockscale_1x128x128_256x64x64x256_16x16_32x32_16x16x1_16x16x1_1x32x1x8_8_1x1_intrawave_v1,281.95,969.3,0.0
256,3219,3584,6144,0,0,121.4339,a8w8_blockscale_1x128x128_256x128x128x128_16x16_32x32_8x32x1_8x32x1_1x32x1x8_8_1x1_intrawave_v3,1167.43,534.21,0.0
256,3219,6144,3072,0,0,106.0393,a8w8_blockscale_1x128x128_256x128x128x128_16x16_32x32_8x32x1_8x32x1_1x32x1x8_8_1x1_intrawave_v3,1145.93,644.27,0.0
256,3219,160,6144,18,0,23.2411,a8w8_blockscale_1x128x128_256x64x64x256_16x16_32x32_16x16x1_16x16x1_1x32x1x8_8_1x1_intrawave_v1,272.31,937.59,0.0
256,3165,3584,6144,0,0,116.9358,a8w8_blockscale_1x128x128_256x128x128x128_16x16_32x32_8x32x1_8x32x1_1x32x1x8_8_1x1_intrawave_v3,1192.0,548.61,0.0
256,3165,6144,3072,0,0,101.3485,a8w8_blockscale_1x128x128_256x128x128x128_16x16_32x32_8x32x1_8x32x1_1x32x1x8_8_1x1_intrawave_v3,1178.85,665.91,0.0
256,3165,160,6144,18,0,23.2165,a8w8_blockscale_1x128x128_256x64x64x256_16x16_32x32_16x16x1_16x16x1_1x32x1x8_8_1x1_intrawave_v1,268.03,923.55,0.0
256,3120,3584,6144,0,0,117.7863,a8w8_blockscale_1x128x128_256x128x128x128_16x16_32x32_8x32x1_8x32x1_1x32x1x8_8_1x1_intrawave_v3,1166.57,539.57,0.0
256,3120,6144,3072,0,0,104.9454,a8w8_blockscale_1x128x128_256x128x128x128_16x16_32x32_8x32x1_8x32x1_1x32x1x8_8_1x1_intrawave_v3,1122.26,636.5,0.0
256,3120,160,6144,18,0,23.2985,a8w8_blockscale_1x128x128_256x64x64x256_16x16_32x32_16x16x1_16x16x1_1x32x1x8_8_1x1_intrawave_v1,263.29,907.81,0.0
256,3298,3584,6144,0,0,119.3385,a8w8_blockscale_1x128x128_256x128x128x128_16x16_32x32_8x32x1_8x32x1_1x32x1x8_8_1x1_intrawave_v3,1217.08,552.4,0.0
256,3298,6144,3072,0,0,105.0171,a8w8_blockscale_1x128x128_256x128x128x128_16x16_32x32_8x32x1_8x32x1_1x32x1x8_8_1x1_intrawave_v3,1185.48,662.1,0.0
256,3298,160,6144,18,0,23.2504,a8w8_blockscale_1x128x128_256x64x64x256_16x16_32x32_16x16x1_16x16x1_1x32x1x8_8_1x1_intrawave_v1,278.88,959.18,0.0
256,3311,3584,6144,0,0,119.0239,a8w8_blockscale_1x128x128_256x128x128x128_16x16_32x32_8x32x1_8x32x1_1x32x1x8_8_1x1_intrawave_v3,1225.11,555.32,0.0
256,3311,6144,3072,0,0,101.4998,a8w8_blockscale_1x128x128_256x128x128x128_16x16_32x32_8x32x1_8x32x1_1x32x1x8_8_1x1_intrawave_v3,1231.39,687.01,0.0
256,3311,160,6144,18,0,23.2919,a8w8_blockscale_1x128x128_256x64x64x256_16x16_32x32_16x16x1_16x16x1_1x32x1x8_8_1x1_intrawave_v1,279.48,961.08,0.0
256,3191,3584,6144,0,0,118.3423,a8w8_blockscale_1x128x128_256x128x128x128_16x16_32x32_8x32x1_8x32x1_1x32x1x8_8_1x1_intrawave_v3,1187.51,545.02,0.0
256,3191,6144,3072,0,0,102.1845,a8w8_blockscale_1x128x128_256x128x128x128_16x16_32x32_8x32x1_8x32x1_1x32x1x8_8_1x1_intrawave_v3,1178.81,664.37,0.0
256,3191,160,6144,18,0,23.218,a8w8_blockscale_1x128x128_256x64x64x256_16x16_32x32_16x16x1_16x16x1_1x32x1x8_8_1x1_intrawave_v1,270.21,930.73,0.0
256,3344,3584,6144,0,0,121.4639,a8w8_blockscale_1x128x128_256x128x128x128_16x16_32x32_8x32x1_8x32x1_1x32x1x8_8_1x1_intrawave_v3,1212.46,547.78,0.0
256,3344,6144,3072,0,0,114.4811,a8w8_blockscale_1x128x128_256x128x128x128_16x16_32x32_8x32x1_8x32x1_1x32x1x8_8_1x1_intrawave_v3,1102.64,613.54,0.0
256,3344,160,6144,18,0,23.3764,a8w8_blockscale_1x128x128_256x64x64x256_16x16_32x32_16x16x1_16x16x1_1x32x1x8_8_1x1_intrawave_v1,281.25,966.73,0.0
256,6597,3584,6144,0,0,218.2006,a8w8_blockscale_1x128x128_256x128x128x128_16x16_32x32_8x32x1_8x32x1_1x32x1x8_8_1x1_intrawave_v3,1331.5,503.39,0.0
256,6597,6144,3072,0,0,190.5973,a8w8_blockscale_1x128x128_256x128x128x128_16x16_32x32_8x32x1_8x32x1_1x32x1x8_8_1x1_intrawave_v3,1306.57,630.67,0.0
256,6597,160,6144,18,0,30.8246,a8w8_blockscale_1x128x128_256x64x64x256_16x16_32x32_16x16x1_16x16x1_1x32x1x8_8_1x1_intrawave_v1,420.78,1415.3,0.0
256,3300,3584,6144,0,0,119.0735,a8w8_blockscale_1x128x128_256x128x128x128_16x16_32x32_8x32x1_8x32x1_1x32x1x8_8_1x1_intrawave_v3,1220.53,553.86,0.0
256,3300,6144,3072,0,0,101.0297,a8w8_blockscale_1x128x128_256x128x128x128_16x16_32x32_8x32x1_8x32x1_1x32x1x8_8_1x1_intrawave_v3,1233.01,688.53,0.0
256,3300,160,6144,18,0,23.3172,a8w8_blockscale_1x128x128_256x64x64x256_16x16_32x32_16x16x1_16x16x1_1x32x1x8_8_1x1_intrawave_v1,278.25,956.99,0.0
256,6493,3584,6144,0,0,219.2364,a8w8_blockscale_1x128x128_256x128x128x128_16x16_32x32_8x32x1_8x32x1_1x32x1x8_8_1x1_intrawave_v3,1304.31,494.69,0.0
256,6493,6144,3072,0,0,189.8444,a8w8_blockscale_1x128x128_256x128x128x128_16x16_32x32_8x32x1_8x32x1_1x32x1x8_8_1x1_intrawave_v3,1291.07,624.76,0.0
256,6493,160,6144,18,0,30.7704,a8w8_blockscale_1x128x128_256x64x64x256_16x16_32x32_16x16x1_16x16x1_1x32x1x8_8_1x1_intrawave_v1,414.87,1395.95,0.0
256,3440,3584,6144,0,0,122.9851,a8w8_blockscale_1x128x128_256x128x128x128_16x16_32x32_8x32x1_8x32x1_1x32x1x8_8_1x1_intrawave_v3,1231.84,551.4,0.0
256,3440,6144,3072,0,0,116.5159,a8w8_blockscale_1x128x128_256x128x128x128_16x16_32x32_8x32x1_8x32x1_1x32x1x8_8_1x1_intrawave_v3,1114.49,615.48,0.0
256,3440,160,6144,18,0,23.266,a8w8_blockscale_1x128x128_256x64x64x256_16x16_32x32_16x16x1_16x16x1_1x32x1x8_8_1x1_intrawave_v1,290.7,997.99,0.0
256,3419,3584,6144,0,0,121.5151,a8w8_blockscale_1x128x128_256x128x128x128_16x16_32x32_8x32x1_8x32x1_1x32x1x8_8_1x1_intrawave_v3,1239.13,555.76,0.0
256,3419,6144,3072,0,0,115.4306,a8w8_blockscale_1x128x128_256x128x128x128_16x16_32x32_8x32x1_8x32x1_1x32x1x8_8_1x1_intrawave_v3,1118.1,618.47,0.0
256,3419,160,6144,18,0,23.377,a8w8_blockscale_1x128x128_256x64x64x256_16x16_32x32_16x16x1_16x16x1_1x32x1x8_8_1x1_intrawave_v1,287.55,987.44,0.0
256,6523,3584,6144,0,0,218.4022,a8w8_blockscale_1x128x128_256x128x128x128_16x16_32x32_8x32x1_8x32x1_1x32x1x8_8_1x1_intrawave_v3,1315.34,498.41,0.0
256,6523,6144,3072,0,0,190.3534,a8w8_blockscale_1x128x128_256x128x128x128_16x16_32x32_8x32x1_8x32x1_1x32x1x8_8_1x1_intrawave_v3,1293.57,625.51,0.0
256,6523,160,6144,18,0,30.6538,a8w8_blockscale_1x128x128_256x64x64x256_16x16_32x32_16x16x1_16x16x1_1x32x1x8_8_1x1_intrawave_v1,418.37,1407.58,0.0
256,6500,3584,6144,0,0,219.2458,a8w8_blockscale_1x128x128_256x128x128x128_16x16_32x32_8x32x1_8x32x1_1x32x1x8_8_1x1_intrawave_v3,1305.66,495.1,0.0
256,6500,6144,3072,0,0,192.9788,a8w8_blockscale_1x128x128_256x128x128x128_16x16_32x32_8x32x1_8x32x1_1x32x1x8_8_1x1_intrawave_v3,1271.47,615.17,0.0
256,6500,160,6144,18,0,30.6467,a8w8_blockscale_1x128x128_256x64x64x256_16x16_32x32_16x16x1_16x16x1_1x32x1x8_8_1x1_intrawave_v1,416.99,1403.06,0.0
256,3119,3584,6144,0,0,117.6595,a8w8_blockscale_1x128x128_256x128x128x128_16x16_32x32_8x32x1_8x32x1_1x32x1x8_8_1x1_intrawave_v3,1167.45,540.03,0.0
256,3119,6144,3072,0,0,104.635,a8w8_blockscale_1x128x128_256x128x128x128_16x16_32x32_8x32x1_8x32x1_1x32x1x8_8_1x1_intrawave_v3,1125.23,638.24,0.0
256,3119,160,6144,18,0,23.3088,a8w8_blockscale_1x128x128_256x64x64x256_16x16_32x32_16x16x1_16x16x1_1x32x1x8_8_1x1_intrawave_v1,263.09,907.14,0.0
256,3404,3584,6144,0,0,123.1963,a8w8_blockscale_1x128x128_256x128x128x128_16x16_32x32_8x32x1_8x32x1_1x32x1x8_8_1x1_intrawave_v3,1216.86,546.56,0.0
256,3404,6144,3072,0,0,116.0603,a8w8_blockscale_1x128x128_256x128x128x128_16x16_32x32_8x32x1_8x32x1_1x32x1x8_8_1x1_intrawave_v3,1107.15,613.13,0.0
256,3404,160,6144,18,0,23.302,a8w8_blockscale_1x128x128_256x64x64x256_16x16_32x32_16x16x1_16x16x1_1x32x1x8_8_1x1_intrawave_v1,287.21,986.46,0.0
256,3129,3584,6144,0,0,118.6299,a8w8_blockscale_1x128x128_256x128x128x128_16x16_32x32_8x32x1_8x32x1_1x32x1x8_8_1x1_intrawave_v3,1161.61,536.74,0.0
256,3129,6144,3072,0,0,101.8021,a8w8_blockscale_1x128x128_256x128x128x128_16x16_32x32_8x32x1_8x32x1_1x32x1x8_8_1x1_intrawave_v3,1160.25,657.51,0.0
256,3129,160,6144,18,0,23.3262,a8w8_blockscale_1x128x128_256x64x64x256_16x16_32x32_16x16x1_16x16x1_1x32x1x8_8_1x1_intrawave_v1,263.73,909.23,0.0
256,6606,3584,6144,0,0,222.8067,a8w8_blockscale_1x128x128_256x128x128x128_16x16_32x32_8x32x1_8x32x1_1x32x1x8_8_1x1_intrawave_v3,1305.75,493.52,0.0
256,6606,6144,3072,0,0,190.9402,a8w8_blockscale_1x128x128_256x128x128x128_16x16_32x32_8x32x1_8x32x1_1x32x1x8_8_1x1_intrawave_v3,1306.0,630.26,0.0
256,6606,160,6144,18,0,30.9845,a8w8_blockscale_1x128x128_256x64x64x256_16x16_32x32_16x16x1_16x16x1_1x32x1x8_8_1x1_intrawave_v1,419.17,1409.87,0.0
256,6793,3584,6144,0,0,223.1611,a8w8_blockscale_1x128x128_256x128x128x128_16x16_32x32_8x32x1_8x32x1_1x32x1x8_8_1x1_intrawave_v3,1340.58,503.89,0.0
256,6793,6144,3072,0,0,204.7357,a8w8_blockscale_1x128x128_256x128x128x128_16x16_32x32_8x32x1_8x32x1_1x32x1x8_8_1x1_intrawave_v3,1252.48,601.82,0.0
256,6793,160,6144,18,0,30.8818,a8w8_blockscale_1x128x128_256x64x64x256_16x16_32x32_16x16x1_16x16x1_1x32x1x8_8_1x1_intrawave_v1,432.47,1453.7,0.0
256,3397,3584,6144,0,0,121.3632,a8w8_blockscale_1x128x128_256x128x128x128_16x16_32x32_8x32x1_8x32x1_1x32x1x8_8_1x1_intrawave_v3,1232.7,554.05,0.0
256,3397,6144,3072,0,0,114.6551,a8w8_blockscale_1x128x128_256x128x128x128_16x16_32x32_8x32x1_8x32x1_1x32x1x8_8_1x1_intrawave_v3,1118.42,619.7,0.0
256,3397,160,6144,18,0,23.3475,a8w8_blockscale_1x128x128_256x64x64x256_16x16_32x32_16x16x1_16x16x1_1x32x1x8_8_1x1_intrawave_v1,286.06,982.6,0.0
256,3545,3584,6144,0,0,137.78,a8w8_blockscale_1x128x128_256x128x128x128_16x16_32x32_8x32x1_8x32x1_1x32x1x8_8_1x1_intrawave_v3,1133.13,502.33,0.0
256,3545,6144,3072,0,0,115.7939,a8w8_blockscale_1x128x128_256x128x128x128_16x16_32x32_8x32x1_8x32x1_1x32x1x8_8_1x1_intrawave_v3,1155.67,633.24,0.0
256,3545,160,6144,18,0,23.4433,a8w8_blockscale_1x128x128_256x64x64x256_16x16_32x32_16x16x1_16x16x1_1x32x1x8_8_1x1_intrawave_v1,297.3,1019.39,0.0
256,3276,3584,6144,0,0,120.1863,a8w8_blockscale_1x128x128_256x128x128x128_16x16_32x32_8x32x1_8x32x1_1x32x1x8_8_1x1_intrawave_v3,1200.43,546.07,0.0
256,3276,6144,3072,0,0,103.0302,a8w8_blockscale_1x128x128_256x128x128x128_16x16_32x32_8x32x1_8x32x1_1x32x1x8_8_1x1_intrawave_v3,1200.28,671.59,0.0
256,3276,160,6144,18,0,23.2543,a8w8_blockscale_1x128x128_256x64x64x256_16x16_32x32_16x16x1_16x16x1_1x32x1x8_8_1x1_intrawave_v1,276.98,952.9,0.0
256,3246,3584,6144,0,0,121.2991,a8w8_blockscale_1x128x128_256x128x128x128_16x16_32x32_8x32x1_8x32x1_1x32x1x8_8_1x1_intrawave_v3,1178.53,537.77,0.0
256,3246,6144,3072,0,0,104.775,a8w8_blockscale_1x128x128_256x128x128x128_16x16_32x32_8x32x1_8x32x1_1x32x1x8_8_1x1_intrawave_v3,1169.48,656.01,0.0
256,3246,160,6144,18,0,23.2057,a8w8_blockscale_1x128x128_256x64x64x256_16x16_32x32_16x16x1_16x16x1_1x32x1x8_8_1x1_intrawave_v1,275.01,946.54,0.0
256,3291,3584,6144,0,0,118.9167,a8w8_blockscale_1x128x128_256x128x128x128_16x16_32x32_8x32x1_8x32x1_1x32x1x8_8_1x1_intrawave_v3,1218.81,553.58,0.0
256,3291,6144,3072,0,0,104.4574,a8w8_blockscale_1x128x128_256x128x128x128_16x16_32x32_8x32x1_8x32x1_1x32x1x8_8_1x1_intrawave_v3,1189.3,664.62,0.0
256,3291,160,6144,18,0,23.2633,a8w8_blockscale_1x128x128_256x64x64x256_16x16_32x32_16x16x1_16x16x1_1x32x1x8_8_1x1_intrawave_v1,278.14,956.7,0.0
256,6638,3584,6144,0,0,221.1942,a8w8_blockscale_1x128x128_256x128x128x128_16x16_32x32_8x32x1_8x32x1_1x32x1x8_8_1x1_intrawave_v3,1321.64,499.04,0.0
256,6638,6144,3072,0,0,193.1225,a8w8_blockscale_1x128x128_256x128x128x128_16x16_32x32_8x32x1_8x32x1_1x32x1x8_8_1x1_intrawave_v3,1297.5,625.69,0.0
256,6638,160,6144,18,0,30.8469,a8w8_blockscale_1x128x128_256x64x64x256_16x16_32x32_16x16x1_16x16x1_1x32x1x8_8_1x1_intrawave_v1,423.08,1422.87,0.0
256,3199,3584,6144,0,0,119.4619,a8w8_blockscale_1x128x128_256x128x128x128_16x16_32x32_8x32x1_8x32x1_1x32x1x8_8_1x1_intrawave_v3,1179.33,540.8,0.0
256,3199,6144,3072,0,0,103.3026,a8w8_blockscale_1x128x128_256x128x128x128_16x16_32x32_8x32x1_8x32x1_1x32x1x8_8_1x1_intrawave_v3,1168.98,658.37,0.0
256,3199,160,6144,18,0,23.2655,a8w8_blockscale_1x128x128_256x64x64x256_16x16_32x32_16x16x1_16x16x1_1x32x1x8_8_1x1_intrawave_v1,270.34,931.05,0.0
256,3512,3584,6144,0,0,140.2782,a8w8_blockscale_1x128x128_256x128x128x128_16x16_32x32_8x32x1_8x32x1_1x32x1x8_8_1x1_intrawave_v3,1102.59,490.25,0.0
256,3512,6144,3072,0,0,114.9161,a8w8_blockscale_1x128x128_256x128x128x128_16x16_32x32_8x32x1_8x32x1_1x32x1x8_8_1x1_intrawave_v3,1153.66,633.67,0.0
256,3512,160,6144,18,0,23.3992,a8w8_blockscale_1x128x128_256x64x64x256_16x16_32x32_16x16x1_16x16x1_1x32x1x8_8_1x1_intrawave_v1,295.09,1012.2,0.0
256,3447,3584,6144,0,0,121.3579,a8w8_blockscale_1x128x128_256x128x128x128_16x16_32x32_8x32x1_8x32x1_1x32x1x8_8_1x1_intrawave_v3,1250.9,559.56,0.0
256,3447,6144,3072,0,0,115.8386,a8w8_blockscale_1x128x128_256x128x128x128_16x16_32x32_8x32x1_8x32x1_1x32x1x8_8_1x1_intrawave_v3,1123.29,620.0,0.0
256,3447,160,6144,18,0,23.4511,a8w8_blockscale_1x128x128_256x64x64x256_16x16_32x32_16x16x1_16x16x1_1x32x1x8_8_1x1_intrawave_v1,288.99,992.04,0.0
256,74,37984,6144,12,0,77.4586,a8w8_blockscale_1x128x128_256x32x128x256_16x16_32x32_16x16x1_16x16x1_1x32x1x8_8_1x1_intrawave_v1,445.91,3091.33,0.0
256,73,37984,6144,2,0,75.874,a8w8_blockscale_1x128x128_256x64x128x128_16x16_32x32_8x32x1_8x32x1_1x32x1x8_8_1x1_intrawave_v3,449.07,3154.81,0.0
256,71,37984,6144,2,0,76.226,a8w8_blockscale_1x128x128_256x64x128x128_16x16_32x32_8x32x1_8x32x1_1x32x1x8_8_1x1_intrawave_v3,434.75,3138.08,0.0
256,70,37984,6144,12,0,76.2485,a8w8_blockscale_1x128x128_256x32x128x256_16x16_32x32_16x16x1_16x16x1_1x32x1x8_8_1x1_intrawave_v1,428.5,3136.08,0.0
256,68,37984,6144,2,0,75.0585,a8w8_blockscale_1x128x128_256x64x128x128_16x16_32x32_8x32x1_8x32x1_1x32x1x8_8_1x1_intrawave_v3,422.85,3183.61,0.0
256,67,37984,6144,2,0,75.1289,a8w8_blockscale_1x128x128_256x64x128x128_16x16_32x32_8x32x1_8x32x1_1x32x1x8_8_1x1_intrawave_v3,416.25,3179.54,0.0
256,66,37984,6144,2,0,75.3627,a8w8_blockscale_1x128x128_256x64x128x128_16x16_32x32_8x32x1_8x32x1_1x32x1x8_8_1x1_intrawave_v3,408.76,3168.58,0.0
256,64,37984,6144,18,0,64.2469,a8w8_blockscale_1x128x128_256x64x64x256_16x16_32x32_16x16x1_16x16x1_1x32x1x8_8_1x1_intrawave_v1,464.95,3714.25,0.0
256,63,37984,6144,18,0,63.9995,a8w8_blockscale_1x128x128_256x64x64x256_16x16_32x32_16x16x1_16x16x1_1x32x1x8_8_1x1_intrawave_v1,459.46,3727.32,0.0
256,62,37984,6144,18,0,63.8158,a8w8_blockscale_1x128x128_256x64x64x256_16x16_32x32_16x16x1_16x16x1_1x32x1x8_8_1x1_intrawave_v1,453.47,3736.76,0.0
256,61,37984,6144,18,0,66.3067,a8w8_blockscale_1x128x128_256x64x64x256_16x16_32x32_16x16x1_16x16x1_1x32x1x8_8_1x1_intrawave_v1,429.39,3595.15,0.0
256,60,37984,6144,18,0,66.3955,a8w8_blockscale_1x128x128_256x64x64x256_16x16_32x32_16x16x1_16x16x1_1x32x1x8_8_1x1_intrawave_v1,421.79,3589.1,0.0
256,59,37984,6144,18,0,66.2195,a8w8_blockscale_1x128x128_256x64x64x256_16x16_32x32_16x16x1_16x16x1_1x32x1x8_8_1x1_intrawave_v1,415.86,3597.4,0.0
256,58,37984,6144,18,0,66.6415,a8w8_blockscale_1x128x128_256x64x64x256_16x16_32x32_16x16x1_16x16x1_1x32x1x8_8_1x1_intrawave_v1,406.22,3573.39,0.0
256,57,37984,6144,18,0,66.5119,a8w8_blockscale_1x128x128_256x64x64x256_16x16_32x32_16x16x1_16x16x1_1x32x1x8_8_1x1_intrawave_v1,400.0,3579.12,0.0
256,56,37984,6144,18,0,67.7743,a8w8_blockscale_1x128x128_256x64x64x256_16x16_32x32_16x16x1_16x16x1_1x32x1x8_8_1x1_intrawave_v1,385.66,3511.24,0.0
256,55,37984,6144,18,0,66.3011,a8w8_blockscale_1x128x128_256x64x64x256_16x16_32x32_16x16x1_16x16x1_1x32x1x8_8_1x1_intrawave_v1,387.19,3588.02,0.0
256,54,37984,6144,18,0,66.8763,a8w8_blockscale_1x128x128_256x64x64x256_16x16_32x32_16x16x1_16x16x1_1x32x1x8_8_1x1_intrawave_v1,376.88,3555.93,0.0
256,53,37984,6144,18,0,66.6783,a8w8_blockscale_1x128x128_256x64x64x256_16x16_32x32_16x16x1_16x16x1_1x32x1x8_8_1x1_intrawave_v1,371.0,3565.26,0.0
256,52,37984,6144,18,0,66.7663,a8w8_blockscale_1x128x128_256x64x64x256_16x16_32x32_16x16x1_16x16x1_1x32x1x8_8_1x1_intrawave_v1,363.52,3559.33,0.0
256,51,37984,6144,18,0,67.1859,a8w8_blockscale_1x128x128_256x64x64x256_16x16_32x32_16x16x1_16x16x1_1x32x1x8_8_1x1_intrawave_v1,354.3,3535.88,0.0
256,50,37984,6144,18,0,66.9291,a8w8_blockscale_1x128x128_256x64x64x256_16x16_32x32_16x16x1_16x16x1_1x32x1x8_8_1x1_intrawave_v1,348.69,3548.22,0.0
256,49,37984,6144,16,0,66.5871,a8w8_blockscale_1x128x128_256x64x64x128_16x16_32x32_8x32x1_8x32x1_1x32x1x8_8_1x1_intrawave_v1,343.47,3565.21,0.0
256,48,37984,6144,16,0,66.2771,a8w8_blockscale_1x128x128_256x64x64x128_16x16_32x32_8x32x1_8x32x1_1x32x1x8_8_1x1_intrawave_v1,338.03,3580.65,0.0
256,47,37984,6144,16,0,65.5093,a8w8_blockscale_1x128x128_256x64x64x128_16x16_32x32_8x32x1_8x32x1_1x32x1x8_8_1x1_intrawave_v1,334.87,3621.36,0.0
256,45,37984,6144,16,0,64.6632,a8w8_blockscale_1x128x128_256x64x64x128_16x16_32x32_8x32x1_8x32x1_1x32x1x8_8_1x1_intrawave_v1,324.82,3666.21,0.0
256,43,37984,6144,16,0,63.2135,a8w8_blockscale_1x128x128_256x64x64x128_16x16_32x32_8x32x1_8x32x1_1x32x1x8_8_1x1_intrawave_v1,317.5,3747.69,0.0
256,42,37984,6144,16,0,63.3401,a8w8_blockscale_1x128x128_256x64x64x128_16x16_32x32_8x32x1_8x32x1_1x32x1x8_8_1x1_intrawave_v1,309.49,3738.9,0.0
256,41,37984,6144,16,0,62.6532,a8w8_blockscale_1x128x128_256x64x64x128_16x16_32x32_8x32x1_8x32x1_1x32x1x8_8_1x1_intrawave_v1,305.44,3778.58,0.0
256,40,37984,6144,16,0,62.4052,a8w8_blockscale_1x128x128_256x64x64x128_16x16_32x32_8x32x1_8x32x1_1x32x1x8_8_1x1_intrawave_v1,299.17,3792.28,0.0
256,39,37984,6144,16,0,61.3034,a8w8_blockscale_1x128x128_256x64x64x128_16x16_32x32_8x32x1_8x32x1_1x32x1x8_8_1x1_intrawave_v1,296.94,3859.1,0.0
256,38,37984,6144,16,0,61.2258,a8w8_blockscale_1x128x128_256x64x64x128_16x16_32x32_8x32x1_8x32x1_1x32x1x8_8_1x1_intrawave_v1,289.69,3862.65,0.0
256,37,37984,6144,16,0,61.098,a8w8_blockscale_1x128x128_256x64x64x128_16x16_32x32_8x32x1_8x32x1_1x32x1x8_8_1x1_intrawave_v1,282.65,3869.39,0.0
256,36,37984,6144,16,0,60.7373,a8w8_blockscale_1x128x128_256x64x64x128_16x16_32x32_8x32x1_8x32x1_1x32x1x8_8_1x1_intrawave_v1,276.65,3891.01,0.0
256,35,37984,6144,16,0,60.3673,a8w8_blockscale_1x128x128_256x64x64x128_16x16_32x32_8x32x1_8x32x1_1x32x1x8_8_1x1_intrawave_v1,270.61,3913.5,0.0
256,33,37984,6144,16,0,59.1631,a8w8_blockscale_1x128x128_256x64x64x128_16x16_32x32_8x32x1_8x32x1_1x32x1x8_8_1x1_intrawave_v1,260.34,3990.38,0.0
256,32,37984,6144,12,0,55.4202,a8w8_blockscale_1x128x128_256x32x128x256_16x16_32x32_16x16x1_16x16x1_1x32x1x8_8_1x1_intrawave_v1,269.5,4258.4,0.0
256,31,37984,6144,12,0,55.2472,a8w8_blockscale_1x128x128_256x32x128x256_16x16_32x32_16x16x1_16x16x1_1x32x1x8_8_1x1_intrawave_v1,261.9,4270.25,0.0
256,30,37984,6144,13,0,54.5285,a8w8_blockscale_1x128x128_256x32x64x256_16x16_16x16_16x16x1_16x16x1_1x32x1x8_8_2x1_intrawave_v1,256.79,4325.02,0.0
256,29,37984,6144,13,0,54.6688,a8w8_blockscale_1x128x128_256x32x64x256_16x16_16x16_16x16x1_16x16x1_1x32x1x8_8_2x1_intrawave_v1,247.59,4312.42,0.0
256,28,37984,6144,12,0,54.236,a8w8_blockscale_1x128x128_256x32x128x256_16x16_32x32_16x16x1_16x16x1_1x32x1x8_8_1x1_intrawave_v1,240.96,4345.32,0.0
256,27,37984,6144,12,0,53.8864,a8w8_blockscale_1x128x128_256x32x128x256_16x16_32x32_16x16x1_16x16x1_1x32x1x8_8_1x1_intrawave_v1,233.87,4371.99,0.0
256,26,37984,6144,13,0,53.3589,a8w8_blockscale_1x128x128_256x32x64x256_16x16_16x16_16x16x1_16x16x1_1x32x1x8_8_2x1_intrawave_v1,227.43,4413.67,0.0
256,25,37984,6144,13,0,52.8892,a8w8_blockscale_1x128x128_256x32x64x256_16x16_16x16_16x16x1_16x16x1_1x32x1x8_8_2x1_intrawave_v1,220.63,4451.32,0.0
256,23,37984,6144,13,0,52.3468,a8w8_blockscale_1x128x128_256x32x64x256_16x16_16x16_16x16x1_16x16x1_1x32x1x8_8_2x1_intrawave_v1,205.08,4494.3,0.0
256,21,37984,6144,13,0,51.5396,a8w8_blockscale_1x128x128_256x32x64x256_16x16_16x16_16x16x1_16x16x1_1x32x1x8_8_2x1_intrawave_v1,190.18,4561.5,0.0
256,20,37984,6144,13,0,51.3326,a8w8_blockscale_1x128x128_256x32x64x256_16x16_16x16_16x16x1_16x16x1_1x32x1x8_8_2x1_intrawave_v1,181.85,4578.3,0.0
256,18,37984,6144,13,0,50.8185,a8w8_blockscale_1x128x128_256x32x64x256_16x16_16x16_16x16x1_16x16x1_1x32x1x8_8_2x1_intrawave_v1,165.32,4621.38,0.0
256,17,37984,6144,13,0,50.648,a8w8_blockscale_1x128x128_256x32x64x256_16x16_16x16_16x16x1_16x16x1_1x32x1x8_8_2x1_intrawave_v1,156.66,4635.32,0.0
256,15,37984,6144,8,0,47.2832,a8w8_blockscale_1x128x128_256x16x64x256_16x16_16x16_16x16x1_16x16x1_1x16x1x16_4_1x1_intrawave_v1,148.07,4961.71,0.0
256,14,37984,6144,8,0,47.1248,a8w8_blockscale_1x128x128_256x16x64x256_16x16_16x16_16x16x1_16x16x1_1x16x1x16_4_1x1_intrawave_v1,138.66,4976.64,0.0
256,13,37984,6144,8,0,46.4647,a8w8_blockscale_1x128x128_256x16x64x256_16x16_16x16_16x16x1_16x16x1_1x16x1x16_4_1x1_intrawave_v1,130.59,5045.58,0.0
256,12,37984,6144,8,0,46.4302,a8w8_blockscale_1x128x128_256x16x64x256_16x16_16x16_16x16x1_16x16x1_1x16x1x16_4_1x1_intrawave_v1,120.63,5047.56,0.0
256,11,37984,6144,8,0,45.9307,a8w8_blockscale_1x128x128_256x16x64x256_16x16_16x16_16x16x1_16x16x1_1x16x1x16_4_1x1_intrawave_v1,111.78,5100.66,0.0
256,10,37984,6144,8,0,45.8406,a8w8_blockscale_1x128x128_256x16x64x256_16x16_16x16_16x16x1_16x16x1_1x16x1x16_4_1x1_intrawave_v1,101.82,5108.9,0.0
256,9,37984,6144,8,0,45.8447,a8w8_blockscale_1x128x128_256x16x64x256_16x16_16x16_16x16x1_16x16x1_1x16x1x16_4_1x1_intrawave_v1,91.63,5106.65,0.0
256,8,37984,6144,8,0,45.3802,a8w8_blockscale_1x128x128_256x16x64x256_16x16_16x16_16x16x1_16x16x1_1x16x1x16_4_1x1_intrawave_v1,82.28,5157.11,0.0
256,7,37984,6144,8,0,45.1146,a8w8_blockscale_1x128x128_256x16x64x256_16x16_16x16_16x16x1_16x16x1_1x16x1x16_4_1x1_intrawave_v1,72.42,5185.65,0.0
256,6,37984,6144,8,0,44.9358,a8w8_blockscale_1x128x128_256x16x64x256_16x16_16x16_16x16x1_16x16x1_1x16x1x16_4_1x1_intrawave_v1,62.32,5204.46,0.0
256,5,37984,6144,8,0,44.5378,a8w8_blockscale_1x128x128_256x16x64x256_16x16_16x16_16x16x1_16x16x1_1x16x1x16_4_1x1_intrawave_v1,52.4,5249.12,0.0
256,32905,3584,6144,0,0,950.8162,a8w8_blockscale_1x128x128_256x128x128x128_16x16_32x32_8x32x1_8x32x1_1x32x1x8_8_1x1_intrawave_v3,1524.1,483.85,0.0
256,32905,6144,3072,0,0,826.7319,a8w8_blockscale_1x128x128_256x128x128x128_16x16_32x32_8x32x1_8x32x1_1x32x1x8_8_1x1_intrawave_v3,1502.45,634.18,0.0
256,32905,160,6144,18,0,106.4135,a8w8_blockscale_1x128x128_256x64x64x256_16x16_32x32_16x16x1_16x16x1_1x32x1x8_8_1x1_intrawave_v1,607.95,2008.02,0.0
256,72872,3584,6144,0,0,2057.3919,a8w8_blockscale_1x128x128_256x128x128x128_16x16_32x32_8x32x1_8x32x1_1x32x1x8_8_1x1_intrawave_v3,1559.89,482.21,0.0
256,72872,6144,3072,0,0,1833.2502,a8w8_blockscale_1x128x128_256x128x128x128_16x16_32x32_8x32x1_8x32x1_1x32x1x8_8_1x1_intrawave_v3,1500.52,620.86,0.0
256,72872,160,6144,0,0,201.7279,a8w8_blockscale_1x128x128_256x128x128x128_16x16_32x32_8x32x1_8x32x1_1x32x1x8_8_1x1_intrawave_v3,710.22,2339.92,0.0
256,100,37984,6144,18,0,84.7488,a8w8_blockscale_1x128x128_256x64x64x256_16x16_32x32_16x16x1_16x16x1_1x32x1x8_8_1x1_intrawave_v1,550.74,2850.6,0.0
256,99,37984,6144,2,0,82.139,a8w8_blockscale_1x128x128_256x64x128x128_16x16_32x32_8x32x1_8x32x1_1x32x1x8_8_1x1_intrawave_v3,562.56,2940.17,0.0
256,3544,3584,6144,0,0,142.9109,a8w8_blockscale_1x128x128_256x128x128x128_16x16_32x32_8x32x1_8x32x1_1x32x1x8_8_1x1_intrawave_v3,1092.14,484.2,0.0
256,3544,6144,3072,0,0,115.9703,a8w8_blockscale_1x128x128_256x128x128x128_16x16_32x32_8x32x1_8x32x1_1x32x1x8_8_1x1_intrawave_v3,1153.58,632.15,0.0
256,3544,160,6144,18,0,23.3462,a8w8_blockscale_1x128x128_256x64x64x256_16x16_32x32_16x16x1_16x16x1_1x32x1x8_8_1x1_intrawave_v1,298.45,1023.36,0.0
256,98,37984,6144,2,0,83.3584,a8w8_blockscale_1x128x128_256x64x128x128_16x16_32x32_8x32x1_8x32x1_1x32x1x8_8_1x1_intrawave_v3,548.73,2896.18,0.0
256,6811,3584,6144,0,0,223.3719,a8w8_blockscale_1x128x128_256x128x128x128_16x16_32x32_8x32x1_8x32x1_1x32x1x8_8_1x1_intrawave_v3,1342.86,504.49,0.0
256,6811,6144,3072,0,0,205.8313,a8w8_blockscale_1x128x128_256x128x128x128_16x16_32x32_8x32x1_8x32x1_1x32x1x8_8_1x1_intrawave_v3,1249.11,599.96,0.0
256,6811,160,6144,18,0,31.2235,a8w8_blockscale_1x128x128_256x64x64x256_16x16_32x32_16x16x1_16x16x1_1x32x1x8_8_1x1_intrawave_v1,428.87,1441.52,0.0
256,3284,3584,6144,0,0,121.3531,a8w8_blockscale_1x128x128_256x128x128x128_16x16_32x32_8x32x1_8x32x1_1x32x1x8_8_1x1_intrawave_v3,1191.79,541.7,0.0
256,3284,6144,3072,0,0,105.6174,a8w8_blockscale_1x128x128_256x128x128x128_16x16_32x32_8x32x1_8x32x1_1x32x1x8_8_1x1_intrawave_v3,1173.74,656.3,0.0
256,3284,160,6144,18,0,23.2893,a8w8_blockscale_1x128x128_256x64x64x256_16x16_32x32_16x16x1_16x16x1_1x32x1x8_8_1x1_intrawave_v1,277.23,953.69,0.0
256,3686,3584,6144,0,0,143.3637,a8w8_blockscale_1x128x128_256x128x128x128_16x16_32x32_8x32x1_8x32x1_1x32x1x8_8_1x1_intrawave_v3,1132.31,495.86,0.0
256,3686,6144,3072,0,0,118.627,a8w8_blockscale_1x128x128_256x128x128x128_16x16_32x32_8x32x1_8x32x1_1x32x1x8_8_1x1_intrawave_v3,1172.94,636.38,0.0
256,3686,160,6144,18,0,23.3675,a8w8_blockscale_1x128x128_256x64x64x256_16x16_32x32_16x16x1_16x16x1_1x32x1x8_8_1x1_intrawave_v1,310.13,1061.7,0.0
256,3618,3584,6144,0,0,144.5923,a8w8_blockscale_1x128x128_256x128x128x128_16x16_32x32_8x32x1_8x32x1_1x32x1x8_8_1x1_intrawave_v3,1101.98,485.38,0.0
256,3618,6144,3072,0,0,118.3311,a8w8_blockscale_1x128x128_256x128x128x128_16x16_32x32_8x32x1_8x32x1_1x32x1x8_8_1x1_intrawave_v3,1154.18,629.14,0.0
256,3618,160,6144,18,0,23.4546,a8w8_blockscale_1x128x128_256x64x64x256_16x16_32x32_16x16x1_16x16x1_1x32x1x8_8_1x1_intrawave_v1,303.28,1039.02,0.0
256,3678,3584,6144,0,0,144.7363,a8w8_blockscale_1x128x128_256x128x128x128_16x16_32x32_8x32x1_8x32x1_1x32x1x8_8_1x1_intrawave_v3,1119.14,490.42,0.0
256,3678,6144,3072,0,0,119.8895,a8w8_blockscale_1x128x128_256x128x128x128_16x16_32x32_8x32x1_8x32x1_1x32x1x8_8_1x1_intrawave_v3,1158.07,628.65,0.0
256,3678,160,6144,18,0,23.4751,a8w8_blockscale_1x128x128_256x64x64x256_16x16_32x32_16x16x1_16x16x1_1x32x1x8_8_1x1_intrawave_v1,308.04,1054.63,0.0
256,3533,3584,6144,0,0,141.6121,a8w8_blockscale_1x128x128_256x128x128x128_16x16_32x32_8x32x1_8x32x1_1x32x1x8_8_1x1_intrawave_v3,1098.73,487.61,0.0
256,3533,6144,3072,0,0,115.2681,a8w8_blockscale_1x128x128_256x128x128x128_16x16_32x32_8x32x1_8x32x1_1x32x1x8_8_1x1_intrawave_v3,1157.01,634.53,0.0
256,3533,160,6144,18,0,23.4677,a8w8_blockscale_1x128x128_256x64x64x256_16x16_32x32_16x16x1_16x16x1_1x32x1x8_8_1x1_intrawave_v1,295.99,1015.03,0.0
256,3268,3584,6144,0,0,121.2199,a8w8_blockscale_1x128x128_256x128x128x128_16x16_32x32_8x32x1_8x32x1_1x32x1x8_8_1x1_intrawave_v3,1187.29,540.54,0.0
256,3268,6144,3072,0,0,103.4514,a8w8_blockscale_1x128x128_256x128x128x128_16x16_32x32_8x32x1_8x32x1_1x32x1x8_8_1x1_intrawave_v3,1192.47,667.66,0.0
256,3268,160,6144,18,0,23.1568,a8w8_blockscale_1x128x128_256x64x64x256_16x16_32x32_16x16x1_16x16x1_1x32x1x8_8_1x1_intrawave_v1,277.46,954.68,0.0
256,3683,3584,6144,0,0,145.1745,a8w8_blockscale_1x128x128_256x128x128x128_16x16_32x32_8x32x1_8x32x1_1x32x1x8_8_1x1_intrawave_v3,1117.28,489.4,0.0
256,3683,6144,3072,0,0,118.0899,a8w8_blockscale_1x128x128_256x128x128x128_16x16_32x32_8x32x1_8x32x1_1x32x1x8_8_1x1_intrawave_v3,1177.31,638.88,0.0
256,3683,160,6144,18,0,23.2587,a8w8_blockscale_1x128x128_256x64x64x256_16x16_32x32_16x16x1_16x16x1_1x32x1x8_8_1x1_intrawave_v1,311.33,1065.84,0.0
256,3355,3584,6144,0,0,121.15,a8w8_blockscale_1x128x128_256x128x128x128_16x16_32x32_8x32x1_8x32x1_1x32x1x8_8_1x1_intrawave_v3,1219.6,550.41,0.0
256,3355,6144,3072,0,0,114.3306,a8w8_blockscale_1x128x128_256x128x128x128_16x16_32x32_8x32x1_8x32x1_1x32x1x8_8_1x1_intrawave_v3,1107.73,615.82,0.0
256,3355,160,6144,18,0,23.4419,a8w8_blockscale_1x128x128_256x64x64x256_16x16_32x32_16x16x1_16x16x1_1x32x1x8_8_1x1_intrawave_v1,281.38,967.06,0.0
256,3518,3584,6144,0,0,142.1633,a8w8_blockscale_1x128x128_256x128x128x128_16x16_32x32_8x32x1_8x32x1_1x32x1x8_8_1x1_intrawave_v3,1089.83,484.31,0.0
256,3518,6144,3072,0,0,116.0407,a8w8_blockscale_1x128x128_256x128x128x128_16x16_32x32_8x32x1_8x32x1_1x32x1x8_8_1x1_intrawave_v3,1144.43,628.32,0.0
256,3518,160,6144,18,0,23.3331,a8w8_blockscale_1x128x128_256x64x64x256_16x16_32x32_16x16x1_16x16x1_1x32x1x8_8_1x1_intrawave_v1,296.43,1016.73,0.0
256,3370,3584,6144,0,0,121.5963,a8w8_blockscale_1x128x128_256x128x128x128_16x16_32x32_8x32x1_8x32x1_1x32x1x8_8_1x1_intrawave_v3,1220.56,550.03,0.0
256,3370,6144,3072,0,0,117.5374,a8w8_blockscale_1x128x128_256x128x128x128_16x16_32x32_8x32x1_8x32x1_1x32x1x8_8_1x1_intrawave_v3,1082.32,600.98,0.0
256,3370,160,6144,18,0,23.3832,a8w8_blockscale_1x128x128_256x64x64x256_16x16_32x32_16x16x1_16x16x1_1x32x1x8_8_1x1_intrawave_v1,283.35,973.64,0.0
256,3487,3584,6144,0,0,139.5148,a8w8_blockscale_1x128x128_256x128x128x128_16x16_32x32_8x32x1_8x32x1_1x32x1x8_8_1x1_intrawave_v3,1100.73,490.55,0.0
256,3487,6144,3072,0,0,116.6091,a8w8_blockscale_1x128x128_256x128x128x128_16x16_32x32_8x32x1_8x32x1_1x32x1x8_8_1x1_intrawave_v3,1128.81,621.18,0.0
256,3487,160,6144,18,0,23.3728,a8w8_blockscale_1x128x128_256x64x64x256_16x16_32x32_16x16x1_16x16x1_1x32x1x8_8_1x1_intrawave_v1,293.32,1006.43,0.0
256,3452,3584,6144,0,0,123.0943,a8w8_blockscale_1x128x128_256x128x128x128_16x16_32x32_8x32x1_8x32x1_1x32x1x8_8_1x1_intrawave_v3,1235.04,552.2,0.0
256,3452,6144,3072,0,0,115.1709,a8w8_blockscale_1x128x128_256x128x128x128_16x16_32x32_8x32x1_8x32x1_1x32x1x8_8_1x1_intrawave_v3,1131.44,624.26,0.0
256,3452,160,6144,18,0,23.43,a8w8_blockscale_1x128x128_256x64x64x256_16x16_32x32_16x16x1_16x16x1_1x32x1x8_8_1x1_intrawave_v1,289.67,994.31,0.0
256,97,37984,6144,2,0,80.8004,a8w8_blockscale_1x128x128_256x64x128x128_16x16_32x32_8x32x1_8x32x1_1x32x1x8_8_1x1_intrawave_v3,560.33,2986.85,0.0
256,6939,3584,6144,0,0,240.686,a8w8_blockscale_1x128x128_256x128x128x128_16x16_32x32_8x32x1_8x32x1_1x32x1x8_8_1x1_intrawave_v3,1269.68,475.28,0.0
256,6939,6144,3072,0,0,205.4585,a8w8_blockscale_1x128x128_256x128x128x128_16x16_32x32_8x32x1_8x32x1_1x32x1x8_8_1x1_intrawave_v3,1274.9,610.62,0.0
256,6939,160,6144,18,0,31.3015,a8w8_blockscale_1x128x128_256x64x64x256_16x16_32x32_16x16x1_16x16x1_1x32x1x8_8_1x1_intrawave_v1,435.85,1464.36,0.0
256,3293,3584,6144,0,0,119.8915,a8w8_blockscale_1x128x128_256x128x128x128_16x16_32x32_8x32x1_8x32x1_1x32x1x8_8_1x1_intrawave_v3,1209.63,549.3,0.0
256,3293,6144,3072,0,0,102.028,a8w8_blockscale_1x128x128_256x128x128x128_16x16_32x32_8x32x1_8x32x1_1x32x1x8_8_1x1_intrawave_v3,1218.36,680.74,0.0
256,3293,160,6144,18,0,23.1843,a8w8_blockscale_1x128x128_256x64x64x256_16x16_32x32_16x16x1_16x16x1_1x32x1x8_8_1x1_intrawave_v1,279.25,960.52,0.0
256,3375,3584,6144,0,0,119.7023,a8w8_blockscale_1x128x128_256x128x128x128_16x16_32x32_8x32x1_8x32x1_1x32x1x8_8_1x1_intrawave_v3,1241.71,559.29,0.0
256,3375,6144,3072,0,0,111.3736,a8w8_blockscale_1x128x128_256x128x128x128_16x16_32x32_8x32x1_8x32x1_1x32x1x8_8_1x1_intrawave_v3,1143.92,634.93,0.0
256,3375,160,6144,18,0,23.3766,a8w8_blockscale_1x128x128_256x64x64x256_16x16_32x32_16x16x1_16x16x1_1x32x1x8_8_1x1_intrawave_v1,283.85,975.29,0.0
256,3675,3584,6144,0,0,142.6629,a8w8_blockscale_1x128x128_256x128x128x128_16x16_32x32_8x32x1_8x32x1_1x32x1x8_8_1x1_intrawave_v3,1134.48,497.27,0.0
256,3675,6144,3072,0,0,118.6083,a8w8_blockscale_1x128x128_256x128x128x128_16x16_32x32_8x32x1_8x32x1_1x32x1x8_8_1x1_intrawave_v3,1169.62,635.05,0.0
256,3675,160,6144,18,0,23.4358,a8w8_blockscale_1x128x128_256x64x64x256_16x16_32x32_16x16x1_16x16x1_1x32x1x8_8_1x1_intrawave_v1,308.3,1055.57,0.0
256,3498,3584,6144,0,0,142.7485,a8w8_blockscale_1x128x128_256x128x128x128_16x16_32x32_8x32x1_8x32x1_1x32x1x8_8_1x1_intrawave_v3,1079.19,480.46,0.0
256,3498,6144,3072,0,0,115.7834,a8w8_blockscale_1x128x128_256x128x128x128_16x16_32x32_8x32x1_8x32x1_1x32x1x8_8_1x1_intrawave_v3,1140.45,627.06,0.0
256,3498,160,6144,18,0,23.3082,a8w8_blockscale_1x128x128_256x64x64x256_16x16_32x32_16x16x1_16x16x1_1x32x1x8_8_1x1_intrawave_v1,295.06,1012.27,0.0
256,3460,3584,6144,0,0,139.5188,a8w8_blockscale_1x128x128_256x128x128x128_16x16_32x32_8x32x1_8x32x1_1x32x1x8_8_1x1_intrawave_v3,1092.18,487.96,0.0
256,3460,6144,3072,0,0,116.9587,a8w8_blockscale_1x128x128_256x128x128x128_16x16_32x32_8x32x1_8x32x1_1x32x1x8_8_1x1_intrawave_v3,1116.72,615.77,0.0
256,3460,160,6144,18,0,23.3758,a8w8_blockscale_1x128x128_256x64x64x256_16x16_32x32_16x16x1_16x16x1_1x32x1x8_8_1x1_intrawave_v1,291.01,998.83,0.0
256,3281,3584,6144,0,0,120.8523,a8w8_blockscale_1x128x128_256x128x128x128_16x16_32x32_8x32x1_8x32x1_1x32x1x8_8_1x1_intrawave_v3,1195.64,543.61,0.0
256,3281,6144,3072,0,0,105.4206,a8w8_blockscale_1x128x128_256x128x128x128_16x16_32x32_8x32x1_8x32x1_1x32x1x8_8_1x1_intrawave_v3,1174.85,657.09,0.0
256,3281,160,6144,18,0,23.3507,a8w8_blockscale_1x128x128_256x64x64x256_16x16_32x32_16x16x1_16x16x1_1x32x1x8_8_1x1_intrawave_v1,276.25,950.35,0.0
256,95,37984,6144,12,0,78.7572,a8w8_blockscale_1x128x128_256x32x128x256_16x16_32x32_16x16x1_16x16x1_1x32x1x8_8_1x1_intrawave_v1,563.01,3062.25,0.0
256,6700,3584,6144,0,0,219.6693,a8w8_blockscale_1x128x128_256x128x128x128_16x16_32x32_8x32x1_8x32x1_1x32x1x8_8_1x1_intrawave_v3,1343.24,506.26,0.0
256,6700,6144,3072,0,0,193.027,a8w8_blockscale_1x128x128_256x128x128x128_16x16_32x32_8x32x1_8x32x1_1x32x1x8_8_1x1_intrawave_v3,1310.27,630.93,0.0
256,6700,160,6144,18,0,30.8736,a8w8_blockscale_1x128x128_256x64x64x256_16x16_32x32_16x16x1_16x16x1_1x32x1x8_8_1x1_intrawave_v1,426.67,1434.62,0.0
256,10108,3584,6144,0,0,321.5798,a8w8_blockscale_1x128x128_256x128x128x128_16x16_32x32_8x32x1_8x32x1_1x32x1x8_8_1x1_intrawave_v3,1384.29,486.9,0.0
256,10108,6144,3072,0,0,274.4823,a8w8_blockscale_1x128x128_256x128x128x128_16x16_32x32_8x32x1_8x32x1_1x32x1x8_8_1x1_intrawave_v3,1390.12,634.41,0.0
256,10108,160,6144,18,0,33.3976,a8w8_blockscale_1x128x128_256x64x64x256_16x16_32x32_16x16x1_16x16x1_1x32x1x8_8_1x1_intrawave_v1,595.05,1985.81,0.0
256,3233,3584,6144,0,0,118.9707,a8w8_blockscale_1x128x128_256x128x128x128_16x16_32x32_8x32x1_8x32x1_1x32x1x8_8_1x1_intrawave_v3,1196.78,546.84,0.0
256,3233,6144,3072,0,0,103.6606,a8w8_blockscale_1x128x128_256x128x128x128_16x16_32x32_8x32x1_8x32x1_1x32x1x8_8_1x1_intrawave_v3,1177.32,661.13,0.0
256,3233,160,6144,18,0,23.3263,a8w8_blockscale_1x128x128_256x64x64x256_16x16_32x32_16x16x1_16x16x1_1x32x1x8_8_1x1_intrawave_v1,272.5,938.05,0.0
256,6536,3584,6144,0,0,218.2339,a8w8_blockscale_1x128x128_256x128x128x128_16x16_32x32_8x32x1_8x32x1_1x32x1x8_8_1x1_intrawave_v3,1318.98,499.59,0.0
256,6536,6144,3072,0,0,188.8834,a8w8_blockscale_1x128x128_256x128x128x128_16x16_32x32_8x32x1_8x32x1_1x32x1x8_8_1x1_intrawave_v3,1306.23,631.43,0.0
256,6536,160,6144,18,0,30.8077,a8w8_blockscale_1x128x128_256x64x64x256_16x16_32x32_16x16x1_16x16x1_1x32x1x8_8_1x1_intrawave_v1,417.11,1403.28,0.0
256,3492,3584,6144,0,0,140.4065,a8w8_blockscale_1x128x128_256x128x128x128_16x16_32x32_8x32x1_8x32x1_1x32x1x8_8_1x1_intrawave_v3,1095.31,487.91,0.0
256,3492,6144,3072,0,0,115.5415,a8w8_blockscale_1x128x128_256x128x128x128_16x16_32x32_8x32x1_8x32x1_1x32x1x8_8_1x1_intrawave_v3,1140.88,627.58,0.0
256,3492,160,6144,18,0,23.3518,a8w8_blockscale_1x128x128_256x64x64x256_16x16_32x32_16x16x1_16x16x1_1x32x1x8_8_1x1_intrawave_v1,294.01,1008.72,0.0
256,6701,3584,6144,0,0,220.0178,a8w8_blockscale_1x128x128_256x128x128x128_16x16_32x32_8x32x1_8x32x1_1x32x1x8_8_1x1_intrawave_v3,1341.32,505.52,0.0
256,6701,6144,3072,0,0,192.1546,a8w8_blockscale_1x128x128_256x128x128x128_16x16_32x32_8x32x1_8x32x1_1x32x1x8_8_1x1_intrawave_v3,1316.41,633.87,0.0
256,6701,160,6144,18,0,30.8923,a8w8_blockscale_1x128x128_256x64x64x256_16x16_32x32_16x16x1_16x16x1_1x32x1x8_8_1x1_intrawave_v1,426.47,1433.96,0.0
256,3564,3584,6144,0,0,141.3027,a8w8_blockscale_1x128x128_256x128x128x128_16x16_32x32_8x32x1_8x32x1_1x32x1x8_8_1x1_intrawave_v3,1110.8,491.6,0.0
256,3564,6144,3072,0,0,115.7586,a8w8_blockscale_1x128x128_256x128x128x128_16x16_32x32_8x32x1_8x32x1_1x32x1x8_8_1x1_intrawave_v3,1162.22,635.96,0.0
256,3564,160,6144,18,0,23.2635,a8w8_blockscale_1x128x128_256x64x64x256_16x16_32x32_16x16x1_16x16x1_1x32x1x8_8_1x1_intrawave_v1,301.21,1032.55,0.0
256,3201,3584,6144,0,0,120.3707,a8w8_blockscale_1x128x128_256x128x128x128_16x16_32x32_8x32x1_8x32x1_1x32x1x8_8_1x1_intrawave_v3,1171.15,536.94,0.0
256,3201,6144,3072,0,0,105.2166,a8w8_blockscale_1x128x128_256x128x128x128_16x16_32x32_8x32x1_8x32x1_1x32x1x8_8_1x1_intrawave_v3,1148.43,646.68,0.0
256,3201,160,6144,18,0,23.1938,a8w8_blockscale_1x128x128_256x64x64x256_16x16_32x32_16x16x1_16x16x1_1x32x1x8_8_1x1_intrawave_v1,271.34,934.49,0.0
256,3328,3584,6144,0,0,119.8059,a8w8_blockscale_1x128x128_256x128x128x128_16x16_32x32_8x32x1_8x32x1_1x32x1x8_8_1x1_intrawave_v3,1223.36,553.58,0.0
256,3328,6144,3072,0,0,101.4666,a8w8_blockscale_1x128x128_256x128x128x128_16x16_32x32_8x32x1_8x32x1_1x32x1x8_8_1x1_intrawave_v3,1238.12,689.81,0.0
256,3328,160,6144,18,0,23.2699,a8w8_blockscale_1x128x128_256x64x64x256_16x16_32x32_16x16x1_16x16x1_1x32x1x8_8_1x1_intrawave_v1,281.18,966.71,0.0
256,3386,3584,6144,0,0,119.0747,a8w8_blockscale_1x128x128_256x128x128x128_16x16_32x32_8x32x1_8x32x1_1x32x1x8_8_1x1_intrawave_v3,1252.32,563.47,0.0
256,3386,6144,3072,0,0,115.9015,a8w8_blockscale_1x128x128_256x128x128x128_16x16_32x32_8x32x1_8x32x1_1x32x1x8_8_1x1_intrawave_v3,1102.81,611.58,0.0
256,3386,160,6144,18,0,23.3144,a8w8_blockscale_1x128x128_256x64x64x256_16x16_32x32_16x16x1_16x16x1_1x32x1x8_8_1x1_intrawave_v1,285.54,980.94,0.0
256,96,37984,6144,12,0,80.0812,a8w8_blockscale_1x128x128_256x32x128x256_16x16_32x32_16x16x1_16x16x1_1x32x1x8_8_1x1_intrawave_v1,559.53,3012.65,0.0
256,6840,3584,6144,0,0,222.6687,a8w8_blockscale_1x128x128_256x128x128x128_16x16_32x32_8x32x1_8x32x1_1x32x1x8_8_1x1_intrawave_v3,1352.84,507.81,0.0
256,6840,6144,3072,0,0,205.9234,a8w8_blockscale_1x128x128_256x128x128x128_16x16_32x32_8x32x1_8x32x1_1x32x1x8_8_1x1_intrawave_v3,1253.87,601.86,0.0
256,6840,160,6144,18,0,31.0761,a8w8_blockscale_1x128x128_256x64x64x256_16x16_32x32_16x16x1_16x16x1_1x32x1x8_8_1x1_intrawave_v1,432.74,1454.39,0.0
256,6556,3584,6144,0,0,218.6798,a8w8_blockscale_1x128x128_256x128x128x128_16x16_32x32_8x32x1_8x32x1_1x32x1x8_8_1x1_intrawave_v3,1320.32,499.79,0.0
256,6556,6144,3072,0,0,191.5722,a8w8_blockscale_1x128x128_256x128x128x128_16x16_32x32_8x32x1_8x32x1_1x32x1x8_8_1x1_intrawave_v3,1291.84,624.17,0.0
256,6556,160,6144,18,0,30.7516,a8w8_blockscale_1x128x128_256x64x64x256_16x16_32x32_16x16x1_16x16x1_1x32x1x8_8_1x1_intrawave_v1,419.15,1410.04,0.0
256,3295,3584,6144,0,0,120.2151,a8w8_blockscale_1x128x128_256x128x128x128_16x16_32x32_8x32x1_8x32x1_1x32x1x8_8_1x1_intrawave_v3,1207.11,548.04,0.0
256,3295,6144,3072,0,0,103.1554,a8w8_blockscale_1x128x128_256x128x128x128_16x16_32x32_8x32x1_8x32x1_1x32x1x8_8_1x1_intrawave_v3,1205.77,673.6,0.0
256,3295,160,6144,18,0,23.2906,a8w8_blockscale_1x128x128_256x64x64x256_16x16_32x32_16x16x1_16x16x1_1x32x1x8_8_1x1_intrawave_v1,278.15,956.69,0.0
256,6358,3584,6144,0,0,217.2867,a8w8_blockscale_1x128x128_256x128x128x128_16x16_32x32_8x32x1_8x32x1_1x32x1x8_8_1x1_intrawave_v3,1288.65,490.86,0.0
256,6358,6144,3072,0,0,188.5348,a8w8_blockscale_1x128x128_256x128x128x128_16x16_32x32_8x32x1_8x32x1_1x32x1x8_8_1x1_intrawave_v3,1273.01,618.1,0.0
256,6358,160,6144,18,0,30.3948,a8w8_blockscale_1x128x128_256x64x64x256_16x16_32x32_16x16x1_16x16x1_1x32x1x8_8_1x1_intrawave_v1,411.27,1384.49,0.0
256,3330,3584,6144,0,0,122.5027,a8w8_blockscale_1x128x128_256x128x128x128_16x16_32x32_8x32x1_8x32x1_1x32x1x8_8_1x1_intrawave_v3,1197.15,541.61,0.0
256,3330,6144,3072,0,0,115.0536,a8w8_blockscale_1x128x128_256x128x128x128_16x16_32x32_8x32x1_8x32x1_1x32x1x8_8_1x1_intrawave_v3,1092.56,608.61,0.0
256,3330,160,6144,18,0,23.172,a8w8_blockscale_1x128x128_256x64x64x256_16x16_32x32_16x16x1_16x16x1_1x32x1x8_8_1x1_intrawave_v1,282.54,971.35,0.0
256,6910,3584,6144,0,0,221.9893,a8w8_blockscale_1x128x128_256x128x128x128_16x16_32x32_8x32x1_8x32x1_1x32x1x8_8_1x1_intrawave_v3,1370.87,513.57,0.0
256,6910,6144,3072,0,0,203.064,a8w8_blockscale_1x128x128_256x128x128x128_16x16_32x32_8x32x1_8x32x1_1x32x1x8_8_1x1_intrawave_v3,1284.54,615.63,0.0
256,6910,160,6144,18,0,30.9457,a8w8_blockscale_1x128x128_256x64x64x256_16x16_32x32_16x16x1_16x16x1_1x32x1x8_8_1x1_intrawave_v1,439.01,1475.14,0.0
256,3539,3584,6144,0,0,139.6825,a8w8_blockscale_1x128x128_256x128x128x128_16x16_32x32_8x32x1_8x32x1_1x32x1x8_8_1x1_intrawave_v3,1115.8,494.92,0.0
256,3539,6144,3072,0,0,117.0155,a8w8_blockscale_1x128x128_256x128x128x128_16x16_32x32_8x32x1_8x32x1_1x32x1x8_8_1x1_intrawave_v3,1141.67,625.84,0.0
256,3539,160,6144,18,0,23.312,a8w8_blockscale_1x128x128_256x64x64x256_16x16_32x32_16x16x1_16x16x1_1x32x1x8_8_1x1_intrawave_v1,298.47,1023.47,0.0
256,3410,3584,6144,0,0,123.1179,a8w8_blockscale_1x128x128_256x128x128x128_16x16_32x32_8x32x1_8x32x1_1x32x1x8_8_1x1_intrawave_v3,1219.78,547.56,0.0
256,3410,6144,3072,0,0,114.3811,a8w8_blockscale_1x128x128_256x128x128x128_16x16_32x32_8x32x1_8x32x1_1x32x1x8_8_1x1_intrawave_v3,1125.39,622.93,0.0
256,3410,160,6144,18,0,23.3992,a8w8_blockscale_1x128x128_256x64x64x256_16x16_32x32_16x16x1_16x16x1_1x32x1x8_8_1x1_intrawave_v1,286.52,984.02,0.0
256,3212,3584,6144,0,0,119.9403,a8w8_blockscale_1x128x128_256x128x128x128_16x16_32x32_8x32x1_8x32x1_1x32x1x8_8_1x1_intrawave_v3,1179.4,540.09,0.0
256,3212,6144,3072,0,0,104.2054,a8w8_blockscale_1x128x128_256x128x128x128_16x16_32x32_8x32x1_8x32x1_1x32x1x8_8_1x1_intrawave_v3,1163.56,654.58,0.0
256,3212,160,6144,18,0,23.2215,a8w8_blockscale_1x128x128_256x64x64x256_16x16_32x32_16x16x1_16x16x1_1x32x1x8_8_1x1_intrawave_v1,271.95,936.43,0.0
256,3524,3584,6144,0,0,140.6215,a8w8_blockscale_1x128x128_256x128x128x128_16x16_32x32_8x32x1_8x32x1_1x32x1x8_8_1x1_intrawave_v3,1103.66,490.19,0.0
256,3524,6144,3072,0,0,115.9555,a8w8_blockscale_1x128x128_256x128x128x128_16x16_32x32_8x32x1_8x32x1_1x32x1x8_8_1x1_intrawave_v3,1147.22,629.58,0.0
256,3524,160,6144,18,0,23.4867,a8w8_blockscale_1x128x128_256x64x64x256_16x16_32x32_16x16x1_16x16x1_1x32x1x8_8_1x1_intrawave_v1,295.0,1011.73,0.0
256,3240,3584,6144,0,0,118.8735,a8w8_blockscale_1x128x128_256x128x128x128_16x16_32x32_8x32x1_8x32x1_1x32x1x8_8_1x1_intrawave_v3,1200.35,548.07,0.0
256,3240,6144,3072,0,0,104.8798,a8w8_blockscale_1x128x128_256x128x128x128_16x16_32x32_8x32x1_8x32x1_1x32x1x8_8_1x1_intrawave_v3,1166.15,654.47,0.0
256,3240,160,6144,18,0,23.3319,a8w8_blockscale_1x128x128_256x64x64x256_16x16_32x32_16x16x1_16x16x1_1x32x1x8_8_1x1_intrawave_v1,273.02,939.76,0.0
256,6640,3584,6144,0,0,219.1776,a8w8_blockscale_1x128x128_256x128x128x128_16x16_32x32_8x32x1_8x32x1_1x32x1x8_8_1x1_intrawave_v3,1334.2,503.75,0.0
256,6640,6144,3072,0,0,191.5516,a8w8_blockscale_1x128x128_256x128x128x128_16x16_32x32_8x32x1_8x32x1_1x32x1x8_8_1x1_intrawave_v3,1308.53,630.98,0.0
256,6640,160,6144,18,0,31.1251,a8w8_blockscale_1x128x128_256x64x64x256_16x16_32x32_16x16x1_16x16x1_1x32x1x8_8_1x1_intrawave_v1,419.43,1410.57,0.0
256,6879,3584,6144,0,0,221.5298,a8w8_blockscale_1x128x128_256x128x128x128_16x16_32x32_8x32x1_8x32x1_1x32x1x8_8_1x1_intrawave_v3,1367.55,512.77,0.0
256,6879,6144,3072,0,0,206.5977,a8w8_blockscale_1x128x128_256x128x128x128_16x16_32x32_8x32x1_8x32x1_1x32x1x8_8_1x1_intrawave_v3,1256.9,602.79,0.0
256,6879,160,6144,18,0,30.9713,a8w8_blockscale_1x128x128_256x64x64x256_16x16_32x32_16x16x1_16x16x1_1x32x1x8_8_1x1_intrawave_v1,436.68,1467.45,0.0
256,3443,3584,6144,0,0,122.7391,a8w8_blockscale_1x128x128_256x128x128x128_16x16_32x32_8x32x1_8x32x1_1x32x1x8_8_1x1_intrawave_v3,1235.39,552.83,0.0
256,3443,6144,3072,0,0,116.3943,a8w8_blockscale_1x128x128_256x128x128x128_16x16_32x32_8x32x1_8x32x1_1x32x1x8_8_1x1_intrawave_v3,1116.63,616.52,0.0
256,3443,160,6144,18,0,23.4094,a8w8_blockscale_1x128x128_256x64x64x256_16x16_32x32_16x16x1_16x16x1_1x32x1x8_8_1x1_intrawave_v1,289.17,992.7,0.0
256,3523,3584,6144,0,0,141.6256,a8w8_blockscale_1x128x128_256x128x128x128_16x16_32x32_8x32x1_8x32x1_1x32x1x8_8_1x1_intrawave_v3,1095.52,486.62,0.0
256,3523,6144,3072,0,0,115.317,a8w8_blockscale_1x128x128_256x128x128x128_16x16_32x32_8x32x1_8x32x1_1x32x1x8_8_1x1_intrawave_v3,1153.25,632.93,0.0
256,3523,160,6144,18,0,23.4828,a8w8_blockscale_1x128x128_256x64x64x256_16x16_32x32_16x16x1_16x16x1_1x32x1x8_8_1x1_intrawave_v1,294.96,1011.62,0.0
256,6443,3584,6144,0,0,215.2318,a8w8_blockscale_1x128x128_256x128x128x128_16x16_32x32_8x32x1_8x32x1_1x32x1x8_8_1x1_intrawave_v3,1318.35,500.81,0.0
256,6443,6144,3072,0,0,188.5333,a8w8_blockscale_1x128x128_256x128x128x128_16x16_32x32_8x32x1_8x32x1_1x32x1x8_8_1x1_intrawave_v3,1290.04,625.03,0.0
256,6443,160,6144,18,0,30.7362,a8w8_blockscale_1x128x128_256x64x64x256_16x16_32x32_16x16x1_16x16x1_1x32x1x8_8_1x1_intrawave_v1,412.13,1386.98,0.0
256,3294,3584,6144,0,0,119.7843,a8w8_blockscale_1x128x128_256x128x128x128_16x16_32x32_8x32x1_8x32x1_1x32x1x8_8_1x1_intrawave_v3,1211.08,549.9,0.0
256,3294,6144,3072,0,0,103.9554,a8w8_blockscale_1x128x128_256x128x128x128_16x16_32x32_8x32x1_8x32x1_1x32x1x8_8_1x1_intrawave_v3,1196.13,668.27,0.0
256,3294,160,6144,18,0,23.2941,a8w8_blockscale_1x128x128_256x64x64x256_16x16_32x32_16x16x1_16x16x1_1x32x1x8_8_1x1_intrawave_v1,278.02,956.27,0.0
256,6630,3584,6144,0,0,218.0481,a8w8_blockscale_1x128x128_256x128x128x128_16x16_32x32_8x32x1_8x32x1_1x32x1x8_8_1x1_intrawave_v3,1339.09,505.75,0.0
256,6630,6144,3072,0,0,191.6796,a8w8_blockscale_1x128x128_256x128x128x128_16x16_32x32_8x32x1_8x32x1_1x32x1x8_8_1x1_intrawave_v3,1305.69,629.75,0.0
256,6630,160,6144,18,0,30.8492,a8w8_blockscale_1x128x128_256x64x64x256_16x16_32x32_16x16x1_16x16x1_1x32x1x8_8_1x1_intrawave_v1,422.54,1421.09,0.0
256,3343,3584,6144,0,0,122.9854,a8w8_blockscale_1x128x128_256x128x128x128_16x16_32x32_8x32x1_8x32x1_1x32x1x8_8_1x1_intrawave_v3,1197.1,540.89,0.0
256,3343,6144,3072,0,0,115.5639,a8w8_blockscale_1x128x128_256x128x128x128_16x16_32x32_8x32x1_8x32x1_1x32x1x8_8_1x1_intrawave_v3,1091.98,607.65,0.0
256,3343,160,6144,18,0,23.2966,a8w8_blockscale_1x128x128_256x64x64x256_16x16_32x32_16x16x1_16x16x1_1x32x1x8_8_1x1_intrawave_v1,282.13,969.76,0.0
256,3189,3584,6144,0,0,120.2072,a8w8_blockscale_1x128x128_256x128x128x128_16x16_32x32_8x32x1_8x32x1_1x32x1x8_8_1x1_intrawave_v3,1168.35,536.34,0.0
256,3189,6144,3072,0,0,101.075,a8w8_blockscale_1x128x128_256x128x128x128_16x16_32x32_8x32x1_8x32x1_1x32x1x8_8_1x1_intrawave_v3,1191.0,671.36,0.0
256,3189,160,6144,18,0,23.2435,a8w8_blockscale_1x128x128_256x64x64x256_16x16_32x32_16x16x1_16x16x1_1x32x1x8_8_1x1_intrawave_v1,269.75,929.15,0.0
256,3489,3584,6144,0,0,139.8964,a8w8_blockscale_1x128x128_256x128x128x128_16x16_32x32_8x32x1_8x32x1_1x32x1x8_8_1x1_intrawave_v3,1098.36,489.4,0.0
256,3489,6144,3072,0,0,116.9447,a8w8_blockscale_1x128x128_256x128x128x128_16x16_32x32_8x32x1_8x32x1_1x32x1x8_8_1x1_intrawave_v3,1126.22,619.66,0.0
256,3489,160,6144,18,0,23.3275,a8w8_blockscale_1x128x128_256x64x64x256_16x16_32x32_16x16x1_16x16x1_1x32x1x8_8_1x1_intrawave_v1,294.06,1008.94,0.0
256,3157,3584,6144,0,0,118.724,a8w8_blockscale_1x128x128_256x128x128x128_16x16_32x32_8x32x1_8x32x1_1x32x1x8_8_1x1_intrawave_v3,1171.08,539.45,0.0
256,3157,6144,3072,0,0,102.3026,a8w8_blockscale_1x128x128_256x128x128x128_16x16_32x32_8x32x1_8x32x1_1x32x1x8_8_1x1_intrawave_v3,1164.9,658.5,0.0
256,3157,160,6144,18,0,23.2453,a8w8_blockscale_1x128x128_256x64x64x256_16x16_32x32_16x16x1_16x16x1_1x32x1x8_8_1x1_intrawave_v1,267.02,920.18,0.0
256,3286,3584,6144,0,0,121.4047,a8w8_blockscale_1x128x128_256x128x128x128_16x16_32x32_8x32x1_8x32x1_1x32x1x8_8_1x1_intrawave_v3,1192.01,541.69,0.0
256,3286,6144,3072,0,0,102.2362,a8w8_blockscale_1x128x128_256x128x128x128_16x16_32x32_8x32x1_8x32x1_1x32x1x8_8_1x1_intrawave_v3,1213.29,678.31,0.0
256,3286,160,6144,18,0,23.2877,a8w8_blockscale_1x128x128_256x64x64x256_16x16_32x32_16x16x1_16x16x1_1x32x1x8_8_1x1_intrawave_v1,277.42,954.31,0.0
256,3630,3584,6144,0,0,146.2357,a8w8_blockscale_1x128x128_256x128x128x128_16x16_32x32_8x32x1_8x32x1_1x32x1x8_8_1x1_intrawave_v3,1093.21,481.02,0.0
256,3630,6144,3072,0,0,116.7239,a8w8_blockscale_1x128x128_256x128x128x128_16x16_32x32_8x32x1_8x32x1_1x32x1x8_8_1x1_intrawave_v3,1173.95,639.38,0.0
256,3630,160,6144,18,0,23.3544,a8w8_blockscale_1x128x128_256x64x64x256_16x16_32x32_16x16x1_16x16x1_1x32x1x8_8_1x1_intrawave_v1,305.59,1046.8,0.0
256,6543,3584,6144,0,0,216.7895,a8w8_blockscale_1x128x128_256x128x128x128_16x16_32x32_8x32x1_8x32x1_1x32x1x8_8_1x1_intrawave_v3,1329.19,503.35,0.0
256,6543,6144,3072,0,0,190.6604,a8w8_blockscale_1x128x128_256x128x128x128_16x16_32x32_8x32x1_8x32x1_1x32x1x8_8_1x1_intrawave_v3,1295.44,626.11,0.0
256,6543,160,6144,18,0,30.8568,a8w8_blockscale_1x128x128_256x64x64x256_16x16_32x32_16x16x1_16x16x1_1x32x1x8_8_1x1_intrawave_v1,416.9,1402.51,0.0
256,3475,3584,6144,0,0,141.1701,a8w8_blockscale_1x128x128_256x128x128x128_16x16_32x32_8x32x1_8x32x1_1x32x1x8_8_1x1_intrawave_v3,1084.08,483.67,0.0
256,3475,6144,3072,0,0,117.0071,a8w8_blockscale_1x128x128_256x128x128x128_16x16_32x32_8x32x1_8x32x1_1x32x1x8_8_1x1_intrawave_v3,1121.1,617.49,0.0
256,3475,160,6144,18,0,23.3111,a8w8_blockscale_1x128x128_256x64x64x256_16x16_32x32_16x16x1_16x16x1_1x32x1x8_8_1x1_intrawave_v1,293.08,1005.76,0.0
256,6787,3584,6144,0,0,225.8615,a8w8_blockscale_1x128x128_256x128x128x128_16x16_32x32_8x32x1_8x32x1_1x32x1x8_8_1x1_intrawave_v3,1323.38,497.51,0.0
256,6787,6144,3072,0,0,200.4129,a8w8_blockscale_1x128x128_256x128x128x128_16x16_32x32_8x32x1_8x32x1_1x32x1x8_8_1x1_intrawave_v3,1278.36,614.35,0.0
256,6787,160,6144,18,0,30.9047,a8w8_blockscale_1x128x128_256x64x64x256_16x16_32x32_16x16x1_16x16x1_1x32x1x8_8_1x1_intrawave_v1,431.77,1451.37,0.0
256,3599,3584,6144,0,0,143.8105,a8w8_blockscale_1x128x128_256x128x128x128_16x16_32x32_8x32x1_8x32x1_1x32x1x8_8_1x1_intrawave_v3,1102.15,486.26,0.0
256,3599,6144,3072,0,0,116.8267,a8w8_blockscale_1x128x128_256x128x128x128_16x16_32x32_8x32x1_8x32x1_1x32x1x8_8_1x1_intrawave_v3,1162.9,634.74,0.0
256,3599,160,6144,18,0,23.3973,a8w8_blockscale_1x128x128_256x64x64x256_16x16_32x32_16x16x1_16x16x1_1x32x1x8_8_1x1_intrawave_v1,302.42,1036.32,0.0
256,6825,3584,6144,0,0,225.6678,a8w8_blockscale_1x128x128_256x128x128x128_16x16_32x32_8x32x1_8x32x1_1x32x1x8_8_1x1_intrawave_v3,1331.93,500.18,0.0
256,6825,6144,3072,0,0,205.5309,a8w8_blockscale_1x128x128_256x128x128x128_16x16_32x32_8x32x1_8x32x1_1x32x1x8_8_1x1_intrawave_v3,1253.51,601.89,0.0
256,6825,160,6144,18,0,31.2961,a8w8_blockscale_1x128x128_256x64x64x256_16x16_32x32_16x16x1_16x16x1_1x32x1x8_8_1x1_intrawave_v1,428.76,1441.07,0.0
256,6885,3584,6144,0,0,220.4276,a8w8_blockscale_1x128x128_256x128x128x128_16x16_32x32_8x32x1_8x32x1_1x32x1x8_8_1x1_intrawave_v3,1375.58,515.69,0.0
256,6885,6144,3072,0,0,203.7132,a8w8_blockscale_1x128x128_256x128x128x128_16x16_32x32_8x32x1_8x32x1_1x32x1x8_8_1x1_intrawave_v3,1275.81,611.78,0.0
256,6885,160,6144,18,0,30.989,a8w8_blockscale_1x128x128_256x64x64x256_16x16_32x32_16x16x1_16x16x1_1x32x1x8_8_1x1_intrawave_v1,436.82,1467.87,0.0
256,3155,3584,6144,0,0,117.8711,a8w8_blockscale_1x128x128_256x128x128x128_16x16_32x32_8x32x1_8x32x1_1x32x1x8_8_1x1_intrawave_v3,1178.8,543.13,0.0
256,3155,6144,3072,0,0,102.0818,a8w8_blockscale_1x128x128_256x128x128x128_16x16_32x32_8x32x1_8x32x1_1x32x1x8_8_1x1_intrawave_v3,1166.68,659.62,0.0
256,3155,160,6144,18,0,23.2997,a8w8_blockscale_1x128x128_256x64x64x256_16x16_32x32_16x16x1_16x16x1_1x32x1x8_8_1x1_intrawave_v1,266.23,917.48,0.0
256,3395,3584,6144,0,0,122.3124,a8w8_blockscale_1x128x128_256x128x128x128_16x16_32x32_8x32x1_8x32x1_1x32x1x8_8_1x1_intrawave_v3,1222.41,549.53,0.0
256,3395,6144,3072,0,0,118.2183,a8w8_blockscale_1x128x128_256x128x128x128_16x16_32x32_8x32x1_8x32x1_1x32x1x8_8_1x1_intrawave_v3,1084.07,600.77,0.0
256,3395,160,6144,18,0,23.3008,a8w8_blockscale_1x128x128_256x64x64x256_16x16_32x32_16x16x1_16x16x1_1x32x1x8_8_1x1_intrawave_v1,286.46,984.01,0.0
256,3381,3584,6144,0,0,123.9111,a8w8_blockscale_1x128x128_256x128x128x128_16x16_32x32_8x32x1_8x32x1_1x32x1x8_8_1x1_intrawave_v3,1201.67,540.94,0.0
256,3381,6144,3072,0,0,115.6097,a8w8_blockscale_1x128x128_256x128x128x128_16x16_32x32_8x32x1_8x32x1_1x32x1x8_8_1x1_intrawave_v3,1103.96,612.46,0.0
256,3381,160,6144,18,0,23.3879,a8w8_blockscale_1x128x128_256x64x64x256_16x16_32x32_16x16x1_16x16x1_1x32x1x8_8_1x1_intrawave_v1,284.22,976.48,0.0
256,3529,3584,6144,0,0,139.8879,a8w8_blockscale_1x128x128_256x128x128x128_16x16_32x32_8x32x1_8x32x1_1x32x1x8_8_1x1_intrawave_v3,1111.02,493.24,0.0
256,3529,6144,3072,0,0,117.0875,a8w8_blockscale_1x128x128_256x128x128x128_16x16_32x32_8x32x1_8x32x1_1x32x1x8_8_1x1_intrawave_v3,1137.74,624.15,0.0
256,3529,160,6144,18,0,23.4252,a8w8_blockscale_1x128x128_256x64x64x256_16x16_32x32_16x16x1_16x16x1_1x32x1x8_8_1x1_intrawave_v1,296.19,1015.76,0.0
256,3446,3584,6144,0,0,122.5003,a8w8_blockscale_1x128x128_256x128x128x128_16x16_32x32_8x32x1_8x32x1_1x32x1x8_8_1x1_intrawave_v3,1238.87,554.23,0.0
256,3446,6144,3072,0,0,113.2643,a8w8_blockscale_1x128x128_256x128x128x128_16x16_32x32_8x32x1_8x32x1_1x32x1x8_8_1x1_intrawave_v3,1148.48,633.96,0.0
256,3446,160,6144,18,0,23.4218,a8w8_blockscale_1x128x128_256x64x64x256_16x16_32x32_16x16x1_16x16x1_1x32x1x8_8_1x1_intrawave_v1,289.27,993.01,0.0
256,3256,3584,6144,0,0,120.7543,a8w8_blockscale_1x128x128_256x128x128x128_16x16_32x32_8x32x1_8x32x1_1x32x1x8_8_1x1_intrawave_v3,1187.49,541.3,0.0
256,3256,6144,3072,0,0,103.0874,a8w8_blockscale_1x128x128_256x128x128x128_16x16_32x32_8x32x1_8x32x1_1x32x1x8_8_1x1_intrawave_v3,1192.29,668.23,0.0
256,3256,160,6144,18,0,23.3269,a8w8_blockscale_1x128x128_256x64x64x256_16x16_32x32_16x16x1_16x16x1_1x32x1x8_8_1x1_intrawave_v1,274.43,944.4,0.0
256,3336,3584,6144,0,0,121.3007,a8w8_blockscale_1x128x128_256x128x128x128_16x16_32x32_8x32x1_8x32x1_1x32x1x8_8_1x1_intrawave_v3,1211.19,547.64,0.0
256,3336,6144,3072,0,0,115.9991,a8w8_blockscale_1x128x128_256x128x128x128_16x16_32x32_8x32x1_8x32x1_1x32x1x8_8_1x1_intrawave_v3,1085.61,604.45,0.0
256,3336,160,6144,18,0,23.4097,a8w8_blockscale_1x128x128_256x64x64x256_16x16_32x32_16x16x1_16x16x1_1x32x1x8_8_1x1_intrawave_v1,280.18,963.15,0.0
256,3393,3584,6144,0,0,121.3579,a8w8_blockscale_1x128x128_256x128x128x128_16x16_32x32_8x32x1_8x32x1_1x32x1x8_8_1x1_intrawave_v3,1231.3,553.63,0.0
256,3393,6144,3072,0,0,114.2488,a8w8_blockscale_1x128x128_256x128x128x128_16x16_32x32_8x32x1_8x32x1_1x32x1x8_8_1x1_intrawave_v3,1121.07,621.37,0.0
256,3393,160,6144,18,0,23.3549,a8w8_blockscale_1x128x128_256x64x64x256_16x16_32x32_16x16x1_16x16x1_1x32x1x8_8_1x1_intrawave_v1,285.63,981.18,0.0
256,6747,3584,6144,0,0,219.9493,a8w8_blockscale_1x128x128_256x128x128x128_16x16_32x32_8x32x1_8x32x1_1x32x1x8_8_1x1_intrawave_v3,1350.94,508.46,0.0
256,6747,6144,3072,0,0,194.5401,a8w8_blockscale_1x128x128_256x128x128x128_16x16_32x32_8x32x1_8x32x1_1x32x1x8_8_1x1_intrawave_v3,1309.19,629.73,0.0
256,6747,160,6144,18,0,31.217,a8w8_blockscale_1x128x128_256x64x64x256_16x16_32x32_16x16x1_16x16x1_1x32x1x8_8_1x1_intrawave_v1,424.93,1428.57,0.0
256,3252,3584,6144,0,0,122.1591,a8w8_blockscale_1x128x128_256x128x128x128_16x16_32x32_8x32x1_8x32x1_1x32x1x8_8_1x1_intrawave_v3,1172.39,534.64,0.0
256,3252,6144,3072,0,0,100.6274,a8w8_blockscale_1x128x128_256x128x128x128_16x16_32x32_8x32x1_8x32x1_1x32x1x8_8_1x1_intrawave_v3,1219.94,683.96,0.0
256,3252,160,6144,18,0,23.2282,a8w8_blockscale_1x128x128_256x64x64x256_16x16_32x32_16x16x1_16x16x1_1x32x1x8_8_1x1_intrawave_v1,275.26,947.3,0.0
256,3346,3584,6144,0,0,121.5163,a8w8_blockscale_1x128x128_256x128x128x128_16x16_32x32_8x32x1_8x32x1_1x32x1x8_8_1x1_intrawave_v3,1212.66,547.76,0.0
256,3346,6144,3072,0,0,115.1999,a8w8_blockscale_1x128x128_256x128x128x128_16x16_32x32_8x32x1_8x32x1_1x32x1x8_8_1x1_intrawave_v3,1096.42,609.97,0.0
256,3346,160,6144,18,0,23.311,a8w8_blockscale_1x128x128_256x64x64x256_16x16_32x32_16x16x1_16x16x1_1x32x1x8_8_1x1_intrawave_v1,282.21,970.0,0.0
256,3469,3584,6144,0,0,139.6541,a8w8_blockscale_1x128x128_256x128x128x128_16x16_32x32_8x32x1_8x32x1_1x32x1x8_8_1x1_intrawave_v3,1093.96,488.35,0.0
256,3469,6144,3072,0,0,115.6707,a8w8_blockscale_1x128x128_256x128x128x128_16x16_32x32_8x32x1_8x32x1_1x32x1x8_8_1x1_intrawave_v3,1132.1,623.82,0.0
256,3469,160,6144,18,0,23.3342,a8w8_blockscale_1x128x128_256x64x64x256_16x16_32x32_16x16x1_16x16x1_1x32x1x8_8_1x1_intrawave_v1,292.29,1003.11,0.0
256,6475,3584,6144,0,0,219.6127,a8w8_blockscale_1x128x128_256x128x128x128_16x16_32x32_8x32x1_8x32x1_1x32x1x8_8_1x1_intrawave_v3,1298.47,492.76,0.0
256,6475,6144,3072,0,0,191.385,a8w8_blockscale_1x128x128_256x128x128x128_16x16_32x32_8x32x1_8x32x1_1x32x1x8_8_1x1_intrawave_v3,1277.13,618.28,0.0
256,6475,160,6144,18,0,30.728,a8w8_blockscale_1x128x128_256x64x64x256_16x16_32x32_16x16x1_16x16x1_1x32x1x8_8_1x1_intrawave_v1,414.29,1394.08,0.0
256,9960,3584,6144,0,0,316.8762,a8w8_blockscale_1x128x128_256x128x128x128_16x16_32x32_8x32x1_8x32x1_1x32x1x8_8_1x1_intrawave_v3,1384.26,487.91,0.0
256,9960,6144,3072,0,0,275.2379,a8w8_blockscale_1x128x128_256x128x128x128_16x16_32x32_8x32x1_8x32x1_1x32x1x8_8_1x1_intrawave_v3,1366.01,624.41,0.0
256,9960,160,6144,18,0,33.7867,a8w8_blockscale_1x128x128_256x64x64x256_16x16_32x32_16x16x1_16x16x1_1x32x1x8_8_1x1_intrawave_v1,579.58,1934.62,0.0
256,3361,3584,6144,0,0,121.0603,a8w8_blockscale_1x128x128_256x128x128x128_16x16_32x32_8x32x1_8x32x1_1x32x1x8_8_1x1_intrawave_v3,1222.69,551.47,0.0
256,3361,6144,3072,0,0,112.308,a8w8_blockscale_1x128x128_256x128x128x128_16x16_32x32_8x32x1_8x32x1_1x32x1x8_8_1x1_intrawave_v3,1129.69,627.73,0.0
256,3361,160,6144,18,0,23.3964,a8w8_blockscale_1x128x128_256x64x64x256_16x16_32x32_16x16x1_16x16x1_1x32x1x8_8_1x1_intrawave_v1,282.44,970.6,0.0
256,3182,3584,6144,0,0,119.652,a8w8_blockscale_1x128x128_256x128x128x128_16x16_32x32_8x32x1_8x32x1_1x32x1x8_8_1x1_intrawave_v3,1171.2,538.05,0.0
256,3182,6144,3072,0,0,100.3463,a8w8_blockscale_1x128x128_256x128x128x128_16x16_32x32_8x32x1_8x32x1_1x32x1x8_8_1x1_intrawave_v3,1197.02,675.16,0.0
256,3182,160,6144,18,0,23.2041,a8w8_blockscale_1x128x128_256x64x64x256_16x16_32x32_16x16x1_16x16x1_1x32x1x8_8_1x1_intrawave_v1,269.61,928.78,0.0
256,3321,3584,6144,0,0,122.3235,a8w8_blockscale_1x128x128_256x128x128x128_16x16_32x32_8x32x1_8x32x1_1x32x1x8_8_1x1_intrawave_v3,1195.66,541.43,0.0
256,3321,6144,3072,0,0,102.893,a8w8_blockscale_1x128x128_256x128x128x128_16x16_32x32_8x32x1_8x32x1_1x32x1x8_8_1x1_intrawave_v3,1218.39,679.2,0.0
256,3321,160,6144,18,0,23.2131,a8w8_blockscale_1x128x128_256x64x64x256_16x16_32x32_16x16x1_16x16x1_1x32x1x8_8_1x1_intrawave_v1,281.28,967.13,0.0
256,6581,3584,6144,0,0,217.5246,a8w8_blockscale_1x128x128_256x128x128x128_16x16_32x32_8x32x1_8x32x1_1x32x1x8_8_1x1_intrawave_v3,1332.39,503.97,0.0
256,6581,6144,3072,0,0,189.3041,a8w8_blockscale_1x128x128_256x128x128x128_16x16_32x32_8x32x1_8x32x1_1x32x1x8_8_1x1_intrawave_v3,1312.3,633.68,0.0
256,6581,160,6144,18,0,31.0388,a8w8_blockscale_1x128x128_256x64x64x256_16x16_32x32_16x16x1_16x16x1_1x32x1x8_8_1x1_intrawave_v1,416.86,1402.2,0.0
256,10394,3584,6144,0,0,327.4415,a8w8_blockscale_1x128x128_256x128x128x128_16x16_32x32_8x32x1_8x32x1_1x32x1x8_8_1x1_intrawave_v3,1397.97,489.81,0.0
256,10394,6144,3072,0,0,275.7498,a8w8_blockscale_1x128x128_256x128x128x128_16x16_32x32_8x32x1_8x32x1_1x32x1x8_8_1x1_intrawave_v3,1422.89,647.42,0.0
256,10394,160,6144,18,0,34.3807,a8w8_blockscale_1x128x128_256x64x64x256_16x16_32x32_16x16x1_16x16x1_1x32x1x8_8_1x1_intrawave_v1,594.39,1982.79,0.0
256,3497,3584,6144,0,0,139.856,a8w8_blockscale_1x128x128_256x128x128x128_16x16_32x32_8x32x1_8x32x1_1x32x1x8_8_1x1_intrawave_v3,1101.19,490.31,0.0
256,3497,6144,3072,0,0,116.4607,a8w8_blockscale_1x128x128_256x128x128x128_16x16_32x32_8x32x1_8x32x1_1x32x1x8_8_1x1_intrawave_v3,1133.49,623.29,0.0
256,3497,160,6144,18,0,23.335,a8w8_blockscale_1x128x128_256x64x64x256_16x16_32x32_16x16x1_16x16x1_1x32x1x8_8_1x1_intrawave_v1,294.64,1010.83,0.0
256,3303,3584,6144,0,0,120.0387,a8w8_blockscale_1x128x128_256x128x128x128_16x16_32x32_8x32x1_8x32x1_1x32x1x8_8_1x1_intrawave_v3,1211.82,549.74,0.0
256,3303,6144,3072,0,0,103.7038,a8w8_blockscale_1x128x128_256x128x128x128_16x16_32x32_8x32x1_8x32x1_1x32x1x8_8_1x1_intrawave_v3,1202.31,671.22,0.0
256,3303,160,6144,18,0,23.3159,a8w8_blockscale_1x128x128_256x64x64x256_16x16_32x32_16x16x1_16x16x1_1x32x1x8_8_1x1_intrawave_v1,278.52,957.87,0.0
256,3335,3584,6144,0,0,122.1787,a8w8_blockscale_1x128x128_256x128x128x128_16x16_32x32_8x32x1_8x32x1_1x32x1x8_8_1x1_intrawave_v3,1202.12,543.59,0.0
256,3335,6144,3072,0,0,112.9791,a8w8_blockscale_1x128x128_256x128x128x128_16x16_32x32_8x32x1_8x32x1_1x32x1x8_8_1x1_intrawave_v3,1114.29,620.47,0.0
256,3335,160,6144,18,0,23.2208,a8w8_blockscale_1x128x128_256x64x64x256_16x16_32x32_16x16x1_16x16x1_1x32x1x8_8_1x1_intrawave_v1,282.37,970.7,0.0
256,6629,3584,6144,0,0,219.065,a8w8_blockscale_1x128x128_256x128x128x128_16x16_32x32_8x32x1_8x32x1_1x32x1x8_8_1x1_intrawave_v3,1332.67,503.35,0.0
256,6629,6144,3072,0,0,191.5854,a8w8_blockscale_1x128x128_256x128x128x128_16x16_32x32_8x32x1_8x32x1_1x32x1x8_8_1x1_intrawave_v3,1306.13,629.98,0.0
256,6629,160,6144,18,0,30.8679,a8w8_blockscale_1x128x128_256x64x64x256_16x16_32x32_16x16x1_16x16x1_1x32x1x8_8_1x1_intrawave_v1,422.22,1420.02,0.0
256,3145,3584,6144,0,0,118.2271,a8w8_blockscale_1x128x128_256x128x128x128_16x16_32x32_8x32x1_8x32x1_1x32x1x8_8_1x1_intrawave_v3,1171.53,540.37,0.0
256,3145,6144,3072,0,0,102.623,a8w8_blockscale_1x128x128_256x128x128x128_16x16_32x32_8x32x1_8x32x1_1x32x1x8_8_1x1_intrawave_v3,1156.85,654.64,0.0
256,3145,160,6144,18,0,23.2702,a8w8_blockscale_1x128x128_256x64x64x256_16x16_32x32_16x16x1_16x16x1_1x32x1x8_8_1x1_intrawave_v1,265.72,915.86,0.0
256,3570,3584,6144,0,0,143.1141,a8w8_blockscale_1x128x128_256x128x128x128_16x16_32x32_8x32x1_8x32x1_1x32x1x8_8_1x1_intrawave_v3,1098.59,485.93,0.0
256,3570,6144,3072,0,0,114.8687,a8w8_blockscale_1x128x128_256x128x128x128_16x16_32x32_8x32x1_8x32x1_1x32x1x8_8_1x1_intrawave_v3,1173.19,641.69,0.0
256,3570,160,6144,18,0,23.3211,a8w8_blockscale_1x128x128_256x64x64x256_16x16_32x32_16x16x1_16x16x1_1x32x1x8_8_1x1_intrawave_v1,300.97,1031.66,0.0
256,3560,3584,6144,0,0,141.9993,a8w8_blockscale_1x128x128_256x128x128x128_16x16_32x32_8x32x1_8x32x1_1x32x1x8_8_1x1_intrawave_v3,1104.11,488.81,0.0
256,3560,6144,3072,0,0,115.4973,a8w8_blockscale_1x128x128_256x128x128x128_16x16_32x32_8x32x1_8x32x1_1x32x1x8_8_1x1_intrawave_v3,1163.54,636.86,0.0
256,3560,160,6144,18,0,23.4069,a8w8_blockscale_1x128x128_256x64x64x256_16x16_32x32_16x16x1_16x16x1_1x32x1x8_8_1x1_intrawave_v1,299.02,1025.12,0.0
256,6352,3584,6144,0,0,218.0534,a8w8_blockscale_1x128x128_256x128x128x128_16x16_32x32_8x32x1_8x32x1_1x32x1x8_8_1x1_intrawave_v3,1282.91,488.77,0.0
256,6352,6144,3072,0,0,186.8396,a8w8_blockscale_1x128x128_256x128x128x128_16x16_32x32_8x32x1_8x32x1_1x32x1x8_8_1x1_intrawave_v3,1283.35,623.21,0.0
256,6352,160,6144,18,0,30.2967,a8w8_blockscale_1x128x128_256x64x64x256_16x16_32x32_16x16x1_16x16x1_1x32x1x8_8_1x1_intrawave_v1,412.21,1387.69,0.0
256,3310,3584,6144,0,0,121.3819,a8w8_blockscale_1x128x128_256x128x128x128_16x16_32x32_8x32x1_8x32x1_1x32x1x8_8_1x1_intrawave_v3,1200.95,544.42,0.0
256,3310,6144,3072,0,0,104.0114,a8w8_blockscale_1x128x128_256x128x128x128_16x16_32x32_8x32x1_8x32x1_1x32x1x8_8_1x1_intrawave_v3,1201.29,670.27,0.0
256,3310,160,6144,18,0,23.333,a8w8_blockscale_1x128x128_256x64x64x256_16x16_32x32_16x16x1_16x16x1_1x32x1x8_8_1x1_intrawave_v1,278.91,959.11,0.0
256,13472,3584,6144,0,0,412.8277,a8w8_blockscale_1x128x128_256x128x128x128_16x16_32x32_8x32x1_8x32x1_1x32x1x8_8_1x1_intrawave_v3,1437.18,487.76,0.0
256,13472,6144,3072,0,0,365.2924,a8w8_blockscale_1x128x128_256x128x128x128_16x16_32x32_8x32x1_8x32x1_1x32x1x8_8_1x1_intrawave_v3,1392.18,618.15,0.0
256,13472,160,6144,0,0,46.5412,a8w8_blockscale_1x128x128_256x128x128x128_16x16_32x32_8x32x1_8x32x1_1x32x1x8_8_1x1_intrawave_v3,569.11,1892.22,0.0
256,3287,3584,6144,0,0,119.4927,a8w8_blockscale_1x128x128_256x128x128x128_16x16_32x32_8x32x1_8x32x1_1x32x1x8_8_1x1_intrawave_v3,1211.46,550.47,0.0
256,3287,6144,3072,0,0,104.8998,a8w8_blockscale_1x128x128_256x128x128x128_16x16_32x32_8x32x1_8x32x1_1x32x1x8_8_1x1_intrawave_v3,1182.84,661.23,0.0
256,3287,160,6144,18,0,23.2853,a8w8_blockscale_1x128x128_256x64x64x256_16x16_32x32_16x16x1_16x16x1_1x32x1x8_8_1x1_intrawave_v1,277.54,954.69,0.0
256,3185,3584,6144,0,0,119.8952,a8w8_blockscale_1x128x128_256x128x128x128_16x16_32x32_8x32x1_8x32x1_1x32x1x8_8_1x1_intrawave_v3,1169.92,537.29,0.0
256,3185,6144,3072,0,0,103.3754,a8w8_blockscale_1x128x128_256x128x128x128_16x16_32x32_8x32x1_8x32x1_1x32x1x8_8_1x1_intrawave_v3,1163.04,655.82,0.0
256,3185,160,6144,18,0,23.1862,a8w8_blockscale_1x128x128_256x64x64x256_16x16_32x32_16x16x1_16x16x1_1x32x1x8_8_1x1_intrawave_v1,270.07,930.33,0.0
256,12889,3584,6144,0,0,406.4213,a8w8_blockscale_1x128x128_256x128x128x128_16x16_32x32_8x32x1_8x32x1_1x32x1x8_8_1x1_intrawave_v3,1396.66,476.35,0.0
256,12889,6144,3072,0,0,340.242,a8w8_blockscale_1x128x128_256x128x128x128_16x16_32x32_8x32x1_8x32x1_1x32x1x8_8_1x1_intrawave_v3,1429.99,637.34,0.0
256,12889,160,6144,0,0,46.5673,a8w8_blockscale_1x128x128_256x128x128x128_16x16_32x32_8x32x1_8x32x1_1x32x1x8_8_1x1_intrawave_v3,544.18,1810.23,0.0
256,3305,3584,6144,0,0,119.1531,a8w8_blockscale_1x128x128_256x128x128x128_16x16_32x32_8x32x1_8x32x1_1x32x1x8_8_1x1_intrawave_v3,1221.56,554.05,0.0
256,3305,6144,3072,0,0,103.0462,a8w8_blockscale_1x128x128_256x128x128x128_16x16_32x32_8x32x1_8x32x1_1x32x1x8_8_1x1_intrawave_v3,1210.71,675.81,0.0
256,3305,160,6144,18,0,23.3403,a8w8_blockscale_1x128x128_256x64x64x256_16x16_32x32_16x16x1_16x16x1_1x32x1x8_8_1x1_intrawave_v1,278.4,957.42,0.0
256,3389,3584,6144,0,0,122.0395,a8w8_blockscale_1x128x128_256x128x128x128_16x16_32x32_8x32x1_8x32x1_1x32x1x8_8_1x1_intrawave_v3,1222.98,550.1,0.0
256,3389,6144,3072,0,0,113.2343,a8w8_blockscale_1x128x128_256x128x128x128_16x16_32x32_8x32x1_8x32x1_1x32x1x8_8_1x1_intrawave_v3,1129.79,626.4,0.0
256,3389,160,6144,18,0,23.3822,a8w8_blockscale_1x128x128_256x64x64x256_16x16_32x32_16x16x1_16x16x1_1x32x1x8_8_1x1_intrawave_v1,284.96,978.93,0.0
256,3105,3584,6144,0,0,117.3509,a8w8_blockscale_1x128x128_256x128x128x128_16x16_32x32_8x32x1_8x32x1_1x32x1x8_8_1x1_intrawave_v3,1165.26,539.87,0.0
256,3105,6144,3072,0,0,102.195,a8w8_blockscale_1x128x128_256x128x128x128_16x16_32x32_8x32x1_8x32x1_1x32x1x8_8_1x1_intrawave_v3,1146.92,651.37,0.0
256,3105,160,6144,18,0,23.2135,a8w8_blockscale_1x128x128_256x64x64x256_16x16_32x32_16x16x1_16x16x1_1x32x1x8_8_1x1_intrawave_v1,262.98,906.96,0.0
256,3472,3584,6144,0,0,140.4181,a8w8_blockscale_1x128x128_256x128x128x128_16x16_32x32_8x32x1_8x32x1_1x32x1x8_8_1x1_intrawave_v3,1088.94,485.97,0.0
256,3472,6144,3072,0,0,116.6699,a8w8_blockscale_1x128x128_256x128x128x128_16x16_32x32_8x32x1_8x32x1_1x32x1x8_8_1x1_intrawave_v3,1123.37,618.88,0.0
256,3472,160,6144,18,0,23.4429,a8w8_blockscale_1x128x128_256x64x64x256_16x16_32x32_16x16x1_16x16x1_1x32x1x8_8_1x1_intrawave_v1,291.19,999.28,0.0
256,6661,3584,6144,0,0,221.1199,a8w8_blockscale_1x128x128_256x128x128x128_16x16_32x32_8x32x1_8x32x1_1x32x1x8_8_1x1_intrawave_v3,1326.66,500.59,0.0
256,6661,6144,3072,0,0,196.0345,a8w8_blockscale_1x128x128_256x128x128x128_16x16_32x32_8x32x1_8x32x1_1x32x1x8_8_1x1_intrawave_v3,1282.65,618.19,0.0
256,6661,160,6144,18,0,30.967,a8w8_blockscale_1x128x128_256x64x64x256_16x16_32x32_16x16x1_16x16x1_1x32x1x8_8_1x1_intrawave_v1,422.9,1422.15,0.0
256,3409,3584,6144,0,0,124.3807,a8w8_blockscale_1x128x128_256x128x128x128_16x16_32x32_8x32x1_8x32x1_1x32x1x8_8_1x1_intrawave_v3,1207.04,541.89,0.0
256,3409,6144,3072,0,0,114.9295,a8w8_blockscale_1x128x128_256x128x128x128_16x16_32x32_8x32x1_8x32x1_1x32x1x8_8_1x1_intrawave_v3,1119.69,619.83,0.0
256,3409,160,6144,18,0,23.2759,a8w8_blockscale_1x128x128_256x64x64x256_16x16_32x32_16x16x1_16x16x1_1x32x1x8_8_1x1_intrawave_v1,287.95,988.95,0.0
256,7044,3584,6144,0,0,243.4209,a8w8_blockscale_1x128x128_256x128x128x128_16x16_32x32_8x32x1_8x32x1_1x32x1x8_8_1x1_intrawave_v3,1274.41,475.68,0.0
256,7044,6144,3072,0,0,205.3229,a8w8_blockscale_1x128x128_256x128x128x128_16x16_32x32_8x32x1_8x32x1_1x32x1x8_8_1x1_intrawave_v3,1295.04,618.88,0.0
256,7044,160,6144,18,0,31.1579,a8w8_blockscale_1x128x128_256x64x64x256_16x16_32x32_16x16x1_16x16x1_1x32x1x8_8_1x1_intrawave_v1,444.48,1492.89,0.0
256,6655,3584,6144,0,0,220.705,a8w8_blockscale_1x128x128_256x128x128x128_16x16_32x32_8x32x1_8x32x1_1x32x1x8_8_1x1_intrawave_v3,1327.96,501.17,0.0
256,6655,6144,3072,0,0,191.9173,a8w8_blockscale_1x128x128_256x128x128x128_16x16_32x32_8x32x1_8x32x1_1x32x1x8_8_1x1_intrawave_v3,1308.99,630.98,0.0
256,6655,160,6144,18,0,30.9355,a8w8_blockscale_1x128x128_256x64x64x256_16x16_32x32_16x16x1_16x16x1_1x32x1x8_8_1x1_intrawave_v1,422.95,1422.35,0.0
256,3338,3584,6144,0,0,123.8244,a8w8_blockscale_1x128x128_256x128x128x128_16x16_32x32_8x32x1_8x32x1_1x32x1x8_8_1x1_intrawave_v3,1187.21,536.69,0.0
256,3338,6144,3072,0,0,114.3423,a8w8_blockscale_1x128x128_256x128x128x128_16x16_32x32_8x32x1_8x32x1_1x32x1x8_8_1x1_intrawave_v3,1102.0,613.47,0.0
256,3338,160,6144,18,0,23.2921,a8w8_blockscale_1x128x128_256x64x64x256_16x16_32x32_16x16x1_16x16x1_1x32x1x8_8_1x1_intrawave_v1,281.76,968.56,0.0
256,3379,3584,6144,0,0,121.2615,a8w8_blockscale_1x128x128_256x128x128x128_16x16_32x32_8x32x1_8x32x1_1x32x1x8_8_1x1_intrawave_v3,1227.2,552.54,0.0
256,3379,6144,3072,0,0,115.6199,a8w8_blockscale_1x128x128_256x128x128x128_16x16_32x32_8x32x1_8x32x1_1x32x1x8_8_1x1_intrawave_v3,1103.21,612.14,0.0
256,3379,160,6144,18,0,23.458,a8w8_blockscale_1x128x128_256x64x64x256_16x16_32x32_16x16x1_16x16x1_1x32x1x8_8_1x1_intrawave_v1,283.2,973.01,0.0
256,3550,3584,6144,0,0,141.1107,a8w8_blockscale_1x128x128_256x128x128x128_16x16_32x32_8x32x1_8x32x1_1x32x1x8_8_1x1_intrawave_v3,1107.94,490.95,0.0
256,3550,6144,3072,0,0,116.1137,a8w8_blockscale_1x128x128_256x128x128x128_16x16_32x32_8x32x1_8x32x1_1x32x1x8_8_1x1_intrawave_v3,1154.11,632.16,0.0
